[
    {
        "id": 1,
        "question": "针对肾功能衰竭患者插入透析导管时，根据患者的病史和血管情况，哪些静脉应该作为首选？",
        "answer": "由于提供的上下文内容为空，无法找到关于肾功能衰竭患者透析导管插入静脉选择的特定信息。因此，答案是不包含在上下文中的，输出 verdict 为 '-1'。",
        "contexts": [],
        "ground_truth": "首选：右锁骨下静脉；次选：股静脉；第三选择：左锁骨下静脉；最后选择：锁骨下静脉，优先选择占主导地位的一侧。",
        "metadata": [
            {
                "filename": "Sievert-2013-Antimicrobial-resistant pathogens.pdf"
            },
            {
                "filename": "Sievert-2013-Antimicrobial-resistant pathogens.pdf"
            }
        ],
        "evolution_type": "no_reference"
    },
    {
        "id": 2,
        "question": "How does hemodynamic instability affect the risk of contrast-induced nephropathy?",
        "answer": "The information about the effect of hemodynamic instability on the risk of contrast-induced nephropathy is not present in the context. Verdict: -1",
        "contexts": [],
        "ground_truth": "Hemodynamic instability increases the risk of contrast-induced nephropathy. It is recommended to delay the administration of contrast media in patients with circulatory collapse or congestive heart failure until their hemodynamic status is corrected. Repeated exposure to contrast media should also be delayed for 72 hours in patients with diabetes mellitus or pre-existing chronic renal dysfunction.",
        "metadata": [
            {
                "filename": "Sievert-2013-Antimicrobial-resistant pathogens.pdf"
            },
            {
                "filename": "Sievert-2013-Antimicrobial-resistant pathogens.pdf"
            }
        ],
        "evolution_type": "no_reference"
    },
    {
        "id": 3,
        "question": "How were the effects of fluids versus placebo in preventing CI-AKI evaluated in these studies?",
        "answer": "The context provided does not contain information on how the effects of fluids versus placebo were evaluated in these studies. Therefore, the verdict is '-1' as the answer is not present in the context.",
        "contexts": [],
        "ground_truth": "RCTs evaluated the role of fluids versus placebo in preventing CI-AKI. However, these trials compared different fluids and included other interventions. Additionally, not all risk factors for CI-AKI were consistently considered in every study.",
        "metadata": [
            {
                "filename": "Sievert-2013-Antimicrobial-resistant pathogens.pdf"
            },
            {
                "filename": "Sievert-2013-Antimicrobial-resistant pathogens.pdf"
            }
        ],
        "evolution_type": "no_reference"
    },
    {
        "id": 4,
        "question": "When should ischemic coronary artery red blood cell transfusion be administered, targeting a hemoglobin concentration of 7.0-9.0 g/dL in adults, in the absence of specific circumstances such as myocardial ischemia, severe hypoxemia, acute bleeding, or disease?",
        "answer": "The context does not provide a specific answer to when ischemic coronary artery red blood cell transfusion should be administered targeting a hemoglobin concentration of 7.0-9.0 g/dL. This decision would typically be made by a healthcare professional based on individual patient needs and medical circumstances, not stated in the given information.",
        "contexts": [],
        "ground_truth": "Ischemic coronary artery red blood cell transfusion should be administered when the hemoglobin concentration decreases to <7.0 g/dL to target a hemoglobin concentration of 7.0-9.0 g/dL in adults, in the absence of specific circumstances such as myocardial ischemia, severe hypoxemia, acute bleeding, or disease.",
        "metadata": [
            {
                "filename": "Dellinger-2013-Surviving Sepsis Cam.pdf"
            },
            {
                "filename": "Dellinger-2013-Surviving Sepsis Cam.pdf"
            }
        ],
        "evolution_type": "no_reference"
    },
    {
        "id": 5,
        "question": "为什么在少尿性急性肾功能衰竭的情况下限制体积管理可能会导致有限的营养支持和RRT允许？",
        "answer": "这个问题的答案不在提供的上下文中",
        "contexts": [],
        "ground_truth": "在少尿性急性肾功能衰竭的情况下限制体积管理可能会导致有限的营养支持和RRT允许，因为这样会增强药物的输送能力，而不用担心同时出现液体积聚的问题。",
        "metadata": [
            {
                "filename": "Sievert-2013-Antimicrobial-resistant pathogens.pdf"
            }
        ],
        "evolution_type": "no_reference"
    },
    {
        "id": 6,
        "question": "重症患者的应激性溃疡预防是否可以降低消化道出血风险？",
        "answer": "没有提供相关背景信息或内容来回答这个问题。",
        "contexts": [],
        "ground_truth": "应激性溃疡的预防可以降低重症患者的消化道出血风险。",
        "metadata": [],
        "evolution_type": "no_reference"
    },
    {
        "id": 7,
        "question": "在选择用于插入透析导管的静脉时，为何首选右锁骨下静脉？",
        "answer": "这个问题的信息在给定的上下文中没有提供",
        "contexts": [],
        "ground_truth": "尽管一般而言与最低感染并发症率相关，但CDC指南以及KDOOIf指南建议避免使用锁骨下静脉作为RRT通道的进入静脉，因为这可能导致中央静脉狭窄并危及随后的通路。这一建议主要源自ESRD患者的观察性数据，显示锁骨下静脉与锁骨静脉透析导管相比具有更高的中央静脉狭窄发生率。因此，当肾功能无法恢复的风险较大时，应将锁骨下静脉作为插入透析导管的最后选择，特别是在病人仅剩锁骨下静脉可用的情况下。",
        "metadata": [],
        "evolution_type": "no_reference"
    },
    {
        "id": 8,
        "question": "在中国，Sepsis 的发生率如何随着年龄和季节变化？",
        "answer": "没有相关信息",
        "contexts": [],
        "ground_truth": "在中国，Sepsis 的发生率随着年龄增加而增加，青春期后逐渐增加，成年期大部分时间内保持较高水平，并在老年人中达到峰值。严重脓毒症和感染性休克的发生率也表现出类似的季节变化，冬季最高，秋季最低。",
        "metadata": [],
        "evolution_type": "no_reference"
    },
    {
        "id": 9,
        "question": "如何预防心脏导管造影后患有慢性肾功能不全的患者出现造影剂诱发的肾病？",
        "answer": "抱歉，根据当前提供的信息无法找到预防措施。",
        "contexts": [],
        "ground_truth": "防止慢性肾功能不全患者在心脏导管造影后出现造影剂诱发的肾病的方法是进行预防性血液透析。",
        "metadata": [],
        "evolution_type": "no_reference"
    },
    {
        "id": 10,
        "question": "CI-AKI风险模型如何帮助评估接受冠状动脉介入治疗的患者的风险？",
        "answer": "这个问题的答案不在给定的上下文中。",
        "contexts": [],
        "ground_truth": "CI-AKI风险模型可帮助评估接受冠状动脉介入治疗的患者的风险。这些模型使用患者的病史、体格检查和程序性风险因素来评估患者患上CI-AKI的可能性。Mehran等人提供了一个示例，表明了CI-AKI的发生率呈指数增长，并且CI-AKI的风险评分与CI-AKI的风险程度显著相关。这些模型可以帮助指导患者选择预防性干预措施，并且可以用于表征CI-AKI患者的研究。",
        "metadata": [],
        "evolution_type": "no_reference"
    },
    {
        "id": 11,
        "question": "What are the advantages of using dual-plane imaging when assessing a patient's risk for Contrast-Induced Acute Kidney Injury (Cl-AK)?",
        "answer": "1. The context doesn't provide information on the advantages of using dual-plane imaging for assessing a patient's risk for Contrast-Induced Acute Kidney Injury (Cl-AK). Therefore, the answer is not present in the context.",
        "contexts": [
            "                                                                                                                                                                                                                                                                                                                                                                                                                                                                                                                                                                                                                                                                                                                                                                                                                                                                                                                                     | Use biplane when appropriate                                                                                              ",
            "                                                                                                                                                                                                                                                                                                                                                                                                                                                                                                                                                                                   | nan                                   |\n\nSome CT strategies in patients at risk of Cl-AK Perform CT, when possible, without contrast media: scrutinize the examination and discuss with the referral physician-surgeon before deciding or the need for contrast media Dosing per kiloaram body weight to reduce the amount of contrast media is needed in thin patients Adapt iniection duration to scan duration when performing CT-angiography, so that the injection is not still running when the scan is finished Use a saline chaser to decrease the amount of contrast media, by using the contrast medium that otherwise would remain in the dead space of the arm veins; this may save 10-20ml of contrast media Use 80kVp: contrast-medium dose may be reduced by a factor of 1 5-17 compared to the dose used at 120kVp since jodine attenuation increases and combine with increased tube loading (mAs) to maintain signal-to-noise ratio Further reduction of contrast media may be instituted in patients with known decreased cardiac output (not unusual in patients with rena impairment) undergoing CT-angiographic studies Some angiographic strategies in patients at risk of Cl-AK Use biplane when appropriate Avoid test iniections: the same amount may be enough for a diagnostic digital-subtraction angiography run Scrutinize each series before performing the next: avoid unnecessary proiections Decrease kilovoltage in a thin patient: a lower iodine concentration mav be used Assess the physiologic significance of a stenosis by measurement of translesional pressure gradient and fractional flow reserve, a technique wel accepted and validated for the coronary circulation, For different arterial beds, perform manometry of a guestionable stenosis instead of multiple projections Avoid ventriculography: echocardiography (and \"echo contrast\") is always a reasonable alternative Use plasma isotonic contrast-media concentrations for renal artery injections When renal artery stenosis is suspected, map"
        ],
        "ground_truth": "Use biplane when appropriate",
        "metadata": [
            {
                "filename": "Sievert-2013-Antimicrobial-resistant pathogens.pdf"
            },
            {
                "filename": "Sievert-2013-Antimicrobial-resistant pathogens.pdf"
            }
        ],
        "evolution_type": "simple"
    },
    {
        "id": 12,
        "question": "How do vasopressor drugs differ from dopamine in the treatment of severe septic shock?",
        "answer": "The context provided discusses the recommended vasopressor therapy for severe septic shock, specifically mentioning norepinephrine as the first-choice vasopressor and suggesting dopamine as an alternative in selected cases. However, the detailed comparison of their differences in treatment is not provided in the given context. The verdict is '-1' as the answer is not present in the context.",
        "contexts": [
            "55,53) for the pulse pressure variation and the stroke volume variation respectively. Utility of pulse pressure variation and stroke e of atrial fibril- volume variation is limited in the e presence lation, spontaneous breathing, and low  suppord pressure breathing. These techniques generally require sedation.\n\n1. We recommend that vasopressor therapy initially tar- get a MAP of 65 mmHg (grade 1C).\n\nRationale. Vasopressor therapy is required t to sustain life and maintain perfusion in the face of life-threatening hypotension, even when hypovolemia has 1 not yet been a threshold MAP. Below resolved.) autoregulation in be critical vascular beds lost. and can perfusion can become on pressure. Thus, some linearly dependent achieve may require patients therapy vasopressor minimal perfusion n adequate flow and maintain 1 pressure [133. 134]. The titration of norepinephrine to a MAP as 65 mmHg has been shown low as 1 to preserve tissue 1 of that the consensus definition perfusion [134]. Note\n\nfrom the evidence-based target of 65 mmHg used in this recommendation. In any case, the optimal MAP should be individualized as it may be higher in patients with ath- erosclerosis and/or previous hypertension than in young comorbidity, For exam- patients without cardiovascular ple, a MAP of 65 mmHg might be too low in a patient with severe uncontrolled hypertension; in young, pre viously normotensive patient, a lower MAP might be adequate. Supplementing endpoints. such as blood pres- with assessment of regional and global perfusion, sure.: such skin perfusion blood lactate concentrations. status, and urine output. is important. Adequate mental fuid resuscitation is a fundamental aspect of the hemo- dynamic management of patients with septic shock and should ideally be achieved before vasopressors and ino- tropes are used; however, using vasopressors early as an with severe shock is fre in patients emergency measure : quently necessary, as when diastolic blood pressure When that occurs, great effort should be directed to weaning vasopressors with continuing fuid resuscitation We recommend norepinephrine as the first-choice vasopressor (grade 1B) epinephrine (added potentially We suggest substituted for additiona norepinephrine) when agent is needed to maintain adequate blood pressure (grade 2B). to 0.03 U/min) can 1 be added to 1 (up Vasopressin with the intent of raisina MAP to target noreninenbrine:\n\nMAP be viously normotensive patient, a lower might adequate. Supplementing e endpoints such 1 as blood pres- sure, with assessment of regional : and global perfusion. such as blood lactate concentrations. skir perfusion mental status. and urine output. is important. Adequate a is a fundamental aspect of the hemo- fuid resuscitation of patients with septic c shock and lvnamic management and ino- should ideally be : achieved before vasopressors tropes are used: however, using vasopressors early as severe shock is fre- emergency measure in patients with s when diastolic blood pressure quently necessary. as: When that be effort should occurs, great directed to with continuing fuid weaning vasopressors resuscitation 2. We recommend norepinephrine as the first-choice vasopressor (grade 1B) 3. We : epinephrine (added to and potentially suggest substituted for additional norepinephrine) when needed to maintain adequate blood pressure agent isi grade 2B). 1 (up to 0.03 U/min) can be added to Vasopressin with the intent of raising MAP to target norepinephrine or decreasing norepinephrine dosage (UG) I as the 5. Low-dose is not :recommended vasopressin of for treatment single initial sepsis- vasopressor induced higher hypotension, and vasopressin doses than 0.03-0.04 U/min s should be reserved for salvage therapy (failure to achieve a adequate MAP with agents) (UG) other vasopressor alternative vasopressor e suggest dopamine an in highly selected agentt norepinephrine only patients (e.g., patients with low risk o of tachyarrhyth: mias and absolute or relative bradycardia) (grade 2C) 7. Phenylephrine is not recommended in the treatment of septic shock except in the following circumstances norepinephrine is associated with serious arthyth mias, (b) cardiac output is known to be high and blood low, or (c) as pressure persistently salvage therapy and low- when combined d inotrope/vasop",
            "ressor r drugs dose vasopressin have failed to achieve the MAP\n\nRationale. The physiologic effects vasopressor and combined inotrope/vasopressors selection in septic shock are set out in an extensive e number of literature eentries [135-147]. Table 7 depicts a GRADEpro ) Summary\n\nTable 7 Norepinephrine compared with dopamine in severe s s summary of evidence sepsis\n\n\n|    | 0                                                                                             | 1                                                                                             | 2                                                                                             | 3                                                                                             | 4                                                                                             | 5                                                                                             | 6        |\n|---:|:----------------------------------------------------------------------------------------------|:----------------------------------------------------------------------------------------------|:----------------------------------------------------------------------------------------------|:----------------------------------------------------------------------------------------------|:----------------------------------------------------------------------------------------------|:----------------------------------------------------------------------------------------------|:---------|\n|  0 | Norepinephrine                                                                                | Norepinephrine                                                                                | nan                                                                                           | nan                         "
        ],
        "ground_truth": "Vasopressor drugs differ from dopamine in the treatment of severe septic shock in several ways. Firstly, norepinephrine is recommended as the first-choice vasopressor, whereas dopamine is suggested only in highly selected patients. Additionally, low-dose vasopressin is not recommended for initial treatment but rather reserved for salvage therapy. Phenylephrine is not recommended except in specific circumstances, such as when norepinephrine is associated with serious arrhythmias or when combined inotrope/vasopressor drugs have failed to achieve the target mean arterial pressure (MAP). Overall, the choice of vasopressor depends on the patient's condition and response to initial therapy.",
        "metadata": [
            {
                "filename": "Dellinger-2013-Surviving Sepsis Cam.pdf"
            },
            {
                "filename": "Dellinger-2013-Surviving Sepsis Cam.pdf"
            }
        ],
        "evolution_type": "simple"
    },
    {
        "id": 13,
        "question": "免疫功能抑制在哪些情况下会导致患者被归类为高危人群？",
        "answer": "免疫功能抑制的患者，当出现体温>38℃或<36℃，且满足中性粒细胞缺乏、病史、治疗或长期糖皮质激素使用超过一定期限的条件时，会被归类为高危人群。",
        "contexts": [
            "�关性因素: I.各种侵人性操作:机械通气>48h、留置血管内导 管、留置尿管、气管插管/气管切开、包括腹膜透析在内的血 液净化治疗等。 Ⅱ.药物治疗:长时间使用3种或3种以上抗菌药物(尤 其是广谱抗生素)、多成分输血、全胃肠外营养、任何剂量的 糖皮质激素治疗等。 Ⅲ高危腹部外科手术:消化道穿孔>24h、反复穿孔, 存在消化道*痿、腹壁切口裂开、有可能导致肠壁完整性发生 破坏的手术及急诊再次腹腔手术等。 (2)存在免疫功能抑制的患者(如血液系统恶性肿瘤、 HIV感染、骨髓移植/异基因造血干细胞移植、存在移植物抗 宿主病等),当出现体温>38℃或<36℃,满足下述条件之- 的为高危人群。 ①存在免疫功能抑制的证据,具备下述情况之一: I.中性粒细胞缺乏(<0.5x10°/L)月持续10 d以上: Ⅱ.之前60d内出现过中性粒细胞缺乏并超过10d: 瓜.之前30d内接受过或正在接受免疫抑制治疗或放 疗(口服免疫抑制剂>2周或静脉化疗>2个疗程); Ⅳ.长期应用糖皮质激素(静脉或口服相当于泼尼松 0.5mg.kg体重.d-以上>2周)。 (②高危的实体器官移植受者: 1.肝移植伴有下列危险因素:再次移植、术中大量输 血、移植后早期(3d内)出现真菌定植、"
        ],
        "ground_truth": "免疫功能抑制的情况包括: 中性粒细胞缺乏(<0.5x10°/L)持续10天以上; 之前60天内出现过中性粒细胞缺乏并持续10天以上; 最近30天内接受过或正在接受免疫抑制治疗或放疗(口服免疫抑制剂>2周或静脉化疗>2个疗程); 长期应用糖皮质激素(静脉或口服相当于泼尼松0.5mg.kg体重.d-以上>2周)。",
        "metadata": [
            {
                "filename": "ICU 侵袭性真菌感染指南.pdf"
            }
        ],
        "evolution_type": "simple"
    },
    {
        "id": 14,
        "question": "ACE抑制剂在造影剂给药前应该如何管理？",
        "answer": "根据患者具体情况和医生建议进行管理",
        "contexts": [
            " intravascular  contrast present, 406,407 of media worldwide. being administered Most are 1 ambu- these radiological examinations are performed in do who not need preventive latory populations special measures. However, contrast media are also increasingly used in CKD elderly whom 1 have and an population, many c principal risk factors for CI-AKI. It is, thus diabetes--the of utmost importance population at risk for the to screen CI-AKI.\n\nthe for CI-AKI and, risk .2.1: Assess particular for of kidney impairment pre-existing screen function in who considered 1 for patients are requires intravascular (i.v. or i.a.) procedure that of iodinated administration medium. contrast (Not Graded)\n\n### RATIONALE\n\nScreening for pre-existing impairment of kidney functior Pre-existing renal functional impairment is the most important risk factor r above all for other risk factors developing CI-AK1408 screening for both and and acute chronic kidney disease is highly: recommended. There is nd which the risk for CI-AKI is sharp GFR threshold below clearly increasing. Both the KDOQI guideline and KDIGO that, in stable should be an eGER: patients, recommend 409 used. A CI-AKI Consensus Working Panel410 agreed that the risk clinically important when the baseline of CI-AKI becomes. SCr concentration is >1.3 mg/dl (>115 μmol/1) in men and ≥1.0 mg/dl (>88.4umol/1) in women, to an equivalent al, 390 <60 ml/min per 1.73 m2. However, eGER Bruce showed that the incidence of \"true\" AKI became significant between controls: a administerec and contrast-media patients from a baseline SCr concentration of > 1.8 mg/dl >159umol/1) c onward. The CI-AKI Consensus Working Panel410 recommended that precautions to reduce the risk with should baseline implemented i patients eGFR <60 ml/min per 1.73 m . In light of more recent information, this threshold could probably be lowered 45 ml/min per 1.73 m . In many institutions, point-of-care SCr testing is present and the results can be available quite fast. In places without point-of-care laboratories, the appropriate blood tests should\n\nbe requested but where emergent imaging/intervention, the risk of benefit early imaging very outweighs waiting, should not be delayed. only SCr is simplicity, For its s used relative at many candidate determine whether a hospitals patient the but for intravascular contrast-media administration, the and the thresholds used time between acceptable determined SCr value and administration of contrast media to the differs perform radiology examination among radiology departments.\n\n### Risk-factor questionnaire\n\nFor outpatient radiological studies where renal function data be unavailable, simple survey questionnaire may are outpatients at higher risk for AKI in whom used to identify precautions should be taken. appropriate Choyke et al 411 (Figure 13) used questionnaire and could identify a high proportion of patients with normal SCr s, and reduced by 67% the number of patients concentrations, whom SCr measurement before e imaging t was necessary studies. The European Society of Urogenital Radiology recom- the Choyke on mends a risk-factor based r analysis ques- tionnaire to identify patients with a higher risk of abnormal Pane1410 CI-AKI renal function. The Working IConsensus useful considered that a survey or questionnaire may be guide higher risk for CI-AK] for identifying patients compared to the general population.\n\n### Urinary protein screening\n\nThe the CI-AKI Consensus Working Panel also supported for urine protein as a rapid use of dipstick testing screen to identify patients who can undergo studies requiring contrast 410 media without SCr measurement. Of 310 patients with a no history of diseases negative urine protein test and poten- a SCr tially associated with renal impairment, none had a level only 1% had a level >2.0 mg/dl (>177 umol/1), and . >1.7 mg/dl (>150umol/1). the Thus, when a recent Work Group recommends that, SCr is dipstick available, a simple questionnaire not for be useful for testing urine identifying protein 1 may kidney disease. Risk  stratification hinges on age pre-existing baseline kidney function, other comorbidities, and other risk factors\n\nKidney International Supplements (2012) 2, 69-88\n\n\n![这是图片](all_figs/2CA355_Sievert-2013-Antimicrobial-resistant pathogens_p75_f0.png)\n\nFigure 13 Sample questionnaire",
            ", Asterisks denote questions with the highest association with abnormal renal function, Adapted from Choyke PL, Cady J, DePollar SL et al. Determination of serum creatinine prior to iodinated contrast media: is it necessary in all patients: Tech Urol 1998: 4: 65-69 with permission\n\n### Other risk factors of CI-AKI\n\nwith Besides kidneyo disease  function rena pre-existing 2 CI-AKI other risk factors for developing impairment, include diabetes, hypertension, CHF, advanced age, volume of depletion, hemodynamici instability, concurrent use nephrotoxic medications, and large volume or high osmol- 408,412 ality of the contrast agent. Although there is doubt that diabetes by itself is a an independent risk factor, in a patient with CKD it acts as a risk multiplier,398 Metabolic syndrome hyperuricemia have been identified as prediabetes, and new risk factors for CI-AKI, while the use of ACE-I and angiotensin-receptor blockers (ARB), renal transplantation diabetes mellitus with normal renal function, low-osmolar contrast media, multiple myeloma, female gender, and cirrhosis have been classified as conflicting risk factors for CI-AKI.413 There are conflicting data on the impact of ACE-I or ARB but, overall, there is currently insufficient evidence to recommend discontinuation of these medications prior to contrast-media administration When possible, the administration of contrast media should be delayed in patients with circulatory collapse or CHF until their hemodynamic status corrected. Repeated exposure should delayed for hours in patients without risk factors for CI-AKI, and for 72 hours i in those with diabetes mellitus or pre-existing chronic renal dysfunc- tion. If acute renal dysfunction develops after contrast-media should be preferably administration, repeated exposure 414 delaved until the SCr level has returned to baseline levels. in Concurrent medication-including, nephrotoxic particular, NSAIDs, aminoglycosides, amphotericin B, high\n\nTable 15 CI-AKI risk-scoring model for percutaneous coronary intervention\n\n\n|    | 0                             | 1                            | 2          |\n|---:|:------------------------------|:-----------------------------|:-----------|\n|  0 | Risk factors                  | (calculate                   | (calculate |\n|  1 | Hypotensior                   | Hypotensior                  | nan        |\n|  2 | IABP                          | 5                            | nan        |\n|  3 | CHP                           | 5                            | nan        |\n|  4 | >75 yearsAge                  | 4                            | nan        |\n|  5 | Anemia                        | 3                            | nan        |\n|  6 | nan                           | nan                          | nan        |\n"
        ],
        "ground_truth": "关于ACE抑制剂或ARB的影响存在数据上的分歧，但总体而言，目前尚无足够的证据建议在造影剂给药前停止使用这些药物。在可能的情况下，应推迟给予造影剂，直到循环衰竭或心力衰竭患者的血流动力学状况得到纠正。在没有CI-AKI风险因素的患者中，应推迟反复暴露的时间为几小时；在存在糖尿病或已存在慢性肾功能不全的患者中，推迟时间为72小时。如果在给药后出现急性肾功能不全，则应将反复暴露推迟，直到肌酐水平恢复到基线水平。",
        "metadata": [
            {
                "filename": "Sievert-2013-Antimicrobial-resistant pathogens.pdf"
            }
        ],
        "evolution_type": "simple"
    },
    {
        "id": 15,
        "question": "外周动脉置管的首次成功率如何计算？",
        "answer": "首次置管成功率 =首次置管成功例数/置管总例数x100%",
        "contexts": [
            "�人 动脉(图1B)或见回血时,超声探头逆时针旋转 90°(图1C),探头标志点朝向远心端,左右滑动探 头,见平面内(长轴)图像(图ID)。放平动脉针, 观察超声声像,继续送针,超声声像可见动脉针持续 向动脉内前行,将针体的2/3完全送人血管内,退针 芯并连接密闭式采血套装,回抽见回血目通畅为置管 成功。若穿刺不成功,拔除动脉针,按压至穿刺点不 再渗血,更换动脉针重新穿刺,穿刺大于3次仍不成 功者,考虑更换其他部位进行置管。\n\n### 评价指标 1.3\n\n1.3.1首次置管成功率:首次置管成功为第一针穿 刺即见回血,送人导管过程顺利,无受阻感,连接密 闭式采血装置后回抽见回血且通畅。首次置管成功率 =首次置管成功例数/置管总例数x100%\n\n### 1.3.3总穿刺成功率:总穿刺成功率=穿刺成功次\n\n\n![这是图片](all_figs/D954EE_三级防护下超声引导外周动脉置管在新型冠状病毒肺炎重症患者中的应用_p2_f0.png)\n\n图1超声引导下外周动脉置管 A.超声探头平面外(短轴)定位梳动脉:B.短轴下超声声像图,蓝色箭头所示为烧动脉,红色箭头所示为动脉针:C.超 声探头逆时针旋转90°后平面内(长轴)定位烧动脉:D.长轴下�"
        ],
        "ground_truth": "首次置管成功率的计算方法是将首次置管成功的例数除以置管总例数，然后乘以100%。首次置管成功指的是第一次穿刺即见回血，导管顺利送入，无受阻感，连接采血装置后回抽见回血且通畅。",
        "metadata": [
            {
                "filename": "三级防护下超声引导外周动脉置管在新型冠状病毒肺炎重症患者中的应用.pdf"
            }
        ],
        "evolution_type": "simple"
    },
    {
        "id": 16,
        "question": "在肾衰竭的少尿情况下限制液体给予可能会导致营养支持受限，为什么？",
        "answer": "因为这可能意味着有限的液体用于营养支持，使得在需要时的营养供给受到限制",
        "contexts": [
            "                                                                                                                                                                                               | Restricting volume administration in the setting of oliguric AKl may result in limited nutritional support and RRT allow.                                                                                                                                         | nan                                                                                                                                                                                                                                                               |\n| 18 | nan                           | Drug delivery                                                                                                                                                                                                                                                     | RRT support can enhances the ability to administer drugs without concerns about concurrent fluid accumulation                                                                                                 "
        ],
        "ground_truth": "在肾衰竭的少尿情况下限制液体给予可能会导致营养支持受限，但是通过RRT支持，可以增强给药的能力，而不必担心同时发生的液体积聚。",
        "metadata": [
            {
                "filename": "Sievert-2013-Antimicrobial-resistant pathogens.pdf"
            }
        ],
        "evolution_type": "simple"
    },
    {
        "id": 17,
        "question": "尿量在诊断和分期AKI中的作用是什么？",
        "answer": "尿量在诊断AKI中提供参考信息，尤其是在血清肌酐数据不足的情况下，但可能不如血清肌酐（SCr）作为主要指标，对诊断和分期AKI的影响有限。",
        "contexts": [
            ".0 mg/dl (88 umol/1) on day 7, it would be possible to restage him as having had Stage 3. Once he has recovered, there may be no difference between Stage 2 or 3 in of his care plan. On the other hand, terms accurately staging the severity of AKI may be important for intensity of follow- and future risk. 即 that and H. be staged if the Cases can only Note reference SCr can be inferred. Case G may be as mild as stage the nadir SCr on 1 if the baseline is equal to day 7. On the e were a 70-year-old white female with other hand, if this case SCr o known evidence the reference no or history of CKD, be would on estimated 0.8 mg/dl (71 umol/1) based an baseline day 1 would (Table 9). In this case, e severity already be stage 2.\n\n### Urine output vs. SCr\n\nBoth urine output and SCr are used as measures of an n acute change in GFR. The theoretical advantage of urine e output response. For example, if GFR over SCr is the speed of the rise in SCr not be to suddenly fall to would were detectable for several hours. On the other hand, urine output would be affected immediately. Less is known about the use compared to SCr. e output for diagnosis and staging of urine  administrative since e databases usually do urine not capture frequently measured. especially not t (and output even outside the ICU). However, studies using both SCr and urine diagnose AKI show increased incidence, suggesting output to of SCr alone that the use e may miss many patients. The use the urine o reduce criteria 1 (criterion also output criterion number where criterion and are cases discordant (cases and F in Table 7), B.C.D. as many of these cases will be picked up by urine output criteria.\n\n### Timeframe for diagnosis and staging\n\nThe purpose of setting a timeframe for diagnosis of AKI is to \"acute\". A disease clarify of the the meaninge word process over many weeks is not change in SCr that results in still be (though clinical entity: may important the of this AKI B). For Appendix guideline, purpose defined in terms of a process that results in a 50% increase in\n\nKidney International Supplements (2012) 2, 19-36\n\nSCr within 1 week or a 0.3 mg/dl (26.5 umol/D) increase within 48 hours (Recommendation 2.1.1). Importantly, there is no stipulation as to when the 1-week or 48-hour time periods can occur. It is stated unequivocally that it does no need to be the first week or 48 hours of a hospital or ICU stay Neither does the time window refer to duration of the inciting event. For example, a patient  may have a 2-weelk course of sepsis but only develop AKI in the second week Importantly, the 1-week 48-hour  fo timeframe diagnosis of AKI, not staging. A patient can be staged over the entire episode of AKI such that, if a patient develops a 50% increase in SCr in 5 days but ultimately has a three-folc increase over 3 weeks, he or she would be diagnosed with AK and ultimately staged as Stage 3 As with any clinical criteria, the timeframe for AK] arbitrary. For somewhat example, a disease process that results in a 50% increase in SCr over 2. weeks would not fulfl diagnostic criteria for AKI even if it ultimately resulted ir complete loss of kidney function. Similarly, a slow proces: that resulted in a steady rise in SCr over 2 weeks, and then a of 0.3 mg/dl (26.5 umol/1 in a 48-hout sudden increase period, would be classified as AKI. Such are the inevitable vagaries of any disease classification. However, one scenaric deserves specific mention, and that is the case of the patien: with an increased SCr at presentation. As already discussed diagnosis of AKI SCr the I requires a second r value This SCr could be I measured SC comparison. second obtained 48 hours, and it is ≥0.3 mg/d within e first SCr. ≥26.5 umol/1) greater than the can be diagnosed. Alternatively, the second SCr can be a baseline value that was obtained previously or estimated from the MDRD equation (see Table 9). However, this poses twd dilemmas. First, how far back a baseline e value :be can \"valid\"; second, how car retrieved and still expected to be we infer acuity when we are seeing the patient for the frs time? Both of f"
        ],
        "ground_truth": "在诊断和分期AKI中，尿量和血清肌酐（SCr）都被用作肾小球滤过率急性变化的测量。尿量响应的理论优势是速度的提高。例如，如果GFR突然下降到不可检测到的水平，则SCr的上升速度可能需要数小时才能检测到。另一方面，尿量会立即受到影响。对于诊断和分期AKI，尿量的使用相对于SCr的使用还了解得较少。然而，使用SCr和尿量诊断AKI的研究表明发生率增加，这表明仅使用SCr可能会错过许多患者。尿量的使用可以降低尿量标准1（标准也称为尿量标准号码，在表7中的不一致病例（病例B.C.D.F）中，许多这些病例将被尿量标准所捕获）",
        "metadata": [
            {
                "filename": "Sievert-2013-Antimicrobial-resistant pathogens.pdf"
            }
        ],
        "evolution_type": "simple"
    },
    {
        "id": 18,
        "question": "CRRT 流量对急性肾功能衰竭患者临床结局的影响如何？",
        "answer": "CRRT 流量对急性肾功能衰竭患者临床结局的影响可能与高流量无关，但低流量可能提供较好的血流动力学耐受性，但具体是否相关及最佳流量范围需要进一步研究验证。",
        "contexts": [
            "�对照研究报导了使用CRRT 对提高生存率具有非常显著的趋势，目前两项Meta 分析报导了接受 CRRT 和间歇性 RRT 的患者住院病死率差异无统计学意义，即使进行仅包 括 RCT 研究的亚组分析，仍未发现两组间患者病死率的差异；另有一项纳入 360 例患者的 大规模 RCT 研究结果显示， CRRT 组和间歇 RRT 组患者生存率差异无统计学意义。对于 血流动力学不稳定的脓毒症患者， 目前尚无 RCT 评估 CRRT 和间歇性 RRT 的血流动力学耐 受性。 其余证据中， 两项前瞻性试验报导 CRRT 有较好的血流动力学耐受性， 但对患者局部 灌注及生存率无改善。\nCRRT 流量： 在目前的文献综述中， 有两个研究报导了 CRRT 的流量对急性肾功能衰竭 患者临床结局的影响。结果并未显示与较高流量 RRT 相关病死率的任何差异。比较 RRT 流 量的两项大规模、 多中心随机试验也未能显示出患者接受高流量 RRT  的相关获益。对所有 相关 RCTs  (1505 例)结果进行 Meta 分析表明，RRT 流量和病死率之间没有任何显著的相 关性， 然而，点估计值支持 CRRT 流量＞30ml/ (kg · h)，由于偏倚、 一致性差等风险，估 计的置信度较低，应进行进一步研究。\nCRRT 时机：2022 年发布的两项相关 RCT s 结果表明，早期启动 R",
            "�囊有所提高达53%以上若患者肠道吸收功能 尚可时可考虑改为口服用药空腹服用可提高生物利用度 伏立康唑其赋形剂磺工-3-环糊精钠从肾脏代谢,故服肌 西清除率<50m/min时不推荐静脉给药☐服制剂生物 利用度达95%以上若患者肠道吸收功能尚可可考虑改头 口服用药。 卡泊芬净主要在肝脏代谢,肾功能障碍患者无需调整 药量。 3.器官功能障碍时两性霉素B的使用:延长两性霉素E 的输注时间可减少其肾毒性与相关的寒战高热等毒性尺 应。研究证实.24h持续静脉注射或延长两性霉素B脱氧服 酸盐的输注时间,可增加患者对其耐受性,减少低钾、镁血 症的发生,并降低肾毒性。另外,两性鑫素B脱氧服酸盐价 格便宜,故24h持续静脉注射性富素B脱氧胆酸盐仍\" 作为治疗IFI的手段。 推荐意见9:延长两性霉素B脱氧胆酸盐的输注时间可 增加患者对药物的耐受性,减少肾毒性(推荐级别为C级 应用两性霉素B时,应尽量避免合并应用有肝肾毒性的 药物。非留体类抗炎药、氨基糖普类抗生素造影剂、环孢素 A、他克莫司等具有明显的肾毒性,与其合用时,可增加肾损 害的危险性。另外,应尽量避免两性霉素B与可能影响肝功 能的",
            "利益冲突\n\n### 考 文 献 物\n\n[1]侯晓彤.无规矩不方圆--规范中国体外生命支持技术进 入倒计时Ⅲ,中华医学杂志,2020.100(7):481-483.DO1 10.3760/cma.jissn.0376-2491.2020.07.001. [2] Australia and New Zealand Extracorporeal Membrane Oxvgenation (ANZ ECMO) Influenza Investigators. Davies A. Jones D, et al. Extracorporeal membrane oxygenation for 2009 influenza A(H1N1) acute respiratory distress syndrome[]]. JAMA, 2009, 302(17): 1888-1895. DO1: 10.1001/jama.2009.1535 章晓华,庄建,中国体外膜肺氧合技术开展的现状及思考 Ⅲ,中国体外循环杂志,2017,15(2):68-71.91.DO1 10.13498/j.cnki.chin.j.ecc.2017.02.02 龙村.体外膜肺支持疗法在本世纪中国体外循环的机遇和 挑战[.中国体外循环杂志,2005,3(2):65.DO1:10.3969/j issn.1672-1403.2005,02.001. [5]中国生物医学工程学会体外循环分会,赵举,黑飞龙. 2015中国心脏外科和体外循环数据白皮书1.中国体外循 环杂志,2016,14(3):130-132.D01:10.13498/j.cnki.chin.j ecc.2016.03.02 Extracorporeal Life Support Organization. ECLS International of Statistics [EB/0L]. (2021-10-02) [2022-01-29] Summary https://www. elso.org/Registry/InternationalSummaryandReports) InternationalSummaryaspx [7] Support Organization. World Map of Extracorporeal Life\n\nmembrane oxygenatior for severe acute respiratory syndrome[ll. N 2018 378(21): distress Engl Med 1965-1975.DO1:10.1056/NEIMoa1800385 [19] Peek GI. Mugford M. Tiruvoipati R . et al. Efficacy  and economic assessment of conventional ventilatory support versus extracorporeal membrane oxvgenation for severe (CESAR) adult failure multicentry respiratory randomised controlled trial[ll. Lancet., 2009. 374(9698) 1351-1363D01:10.1016/S0140-6736009)61069-2 B. et al. Bleeding [20] AF O'Gara Ⅱ. Gosling and Nunez thrombotic events in adults s supported with o venovenous extracorporeal membrane oxvgenation: an ELSO registr Care Med 2022. 48(2): 213-224 analysis[Il. Intensive DO1:10.1007/s00134-021-06593-x 21] Vasques E. Romitti i E. Gattinoni . et al. How  wear patients from membrane veno-venous extra-corporeal oxvgenation[ll, Crit Care, 2019, 23(1):316, DO1: 10.1186. s13054-019-2592-5 [22] Schmidt Pham T. Arcadipane et al.  Mechanica during ventilation management extracorporeal for distress membrane oxygenation acute respiratory An syndrome",
            "��入 12 个 RCTs 共计 9044 例患者的 Meta 分析显示参附注射液可显著降 低患者 LAC 水平。我国一项 RCT 研究显示监测血乳酸浓度能够提高复苏效果， 降低脓毒性 休克患者的病死率。以 6h 内血乳酸＜2mmol/L 作为目标指导复苏可明显改善预后。\n推荐意见 5：初始液体复苏及随后的容量替代治疗中，推荐使用晶体液(强推荐，中等 证据质量) 。与晶体液相比，应用胶体液无任何显著获益，且可能导致肾损伤以及凝血机制 异常等不良事件，同时胶体液价格较高， 因此强力推荐脓毒症和脓毒性休克患者的液体复苏 使用晶体液。有研究表明平衡晶体液和生理盐水进行复苏， 晶体液能降低 30d主要肾脏不 良事件发生率；高肌酐和高氯人群使用平衡晶体液避免主要肾脏不良事件获益最大。有研究 表明与限氯策略相比，含氯策略治疗的患者急性肾损伤和肾脏替代治疗(RRT) 的风险增高， 故无论使用哪种液体溶液， 均建议监测血清氯化物水平以避免高氯血症。\n推荐意见 6：不推荐使用羟乙基淀粉进行容量替代治疗 (强推荐，高证据质量)。\n目前已有多项研究对羟乙基淀粉 (HES) 在脓毒症患者中的安全性问题",
            "�究表明， 脓毒性休 克多药联合治疗的早期降阶梯与更好的临床预后相关。此外，早期降阶梯可减少细菌耐药的 发生。另有研究表明， 每日评估抗菌药物降阶梯的可行性可能降低患者病死率， 因此推荐每 日对脓毒症和脓毒性休克患者的抗菌药物使用进行降阶梯评估。\n下列患者使用长时程 (＞10d ) 抗菌药物治疗是合理的， 包括临床改善缓慢、 感染源难 以控制、金黄色葡萄球菌相关的菌血症(特别是 MRSA〕)、某些真菌、病毒感染及免疫缺 陷患者。\n推荐意见 16：建议以测定降钙素原(PCT) 水平为辅助手段指导脓毒症患者抗菌药物 疗程 (弱推荐，低证据质量)。\n目前世界许多地区通过测定血清 PCT  水平辅助诊断急性感染及辅助确定抗菌药物疗 程。近期一项大型随机试验证明，以血清 PCT 水平指导重症感染患者抗菌药物使用可显著 缩短治疗持续时间，减小药物日剂量，降低患者病死率。以 PCT 作为辅助手段可缩短脓毒 症患者抗菌药物疗程且不增加病死率。 因此，PCT  或者其他生物标记物的检测可作为临床评 估的辅助手段，抗菌药物的起始及减停需结合临床具体情况判定。\n推荐意见 17�",
            "�持联合治疗的临床获益。\n已发表的 Meta 分析结果显示，在抗感染治疗的基础上联合使用血必净注射液，可降低 白细胞计数和过高的体温，控制炎症反应和多器官功能障碍综合征的发展，改善 APACHEⅡ 评分，降低脓毒症患者 28 d病死率。\n如有侵权请联系网站删除\n推荐意见 13：在病原学诊断及药敏结果明确或者临床症状充分改善后推荐进行降阶梯治 疗(BPS)。\n对绝大多数严重感染来说， 在确定致病菌的情况下， 应降阶梯至最窄谱抗菌药物治疗以 缩小覆盖范围。 Guo 等进行的一项纳入 99 项研究的 Meta 分析结果显示， 抗菌药物的降阶梯 治疗与持续应用广谱抗菌药物对患者的病死率差异无统计学意义。几项观察性研究结果显 示，抗菌药物的降阶梯治疗能降低病死率， 鉴于不必要的持续性抗菌药物的使用给社会和个 人带来的不良后果， 推荐抗菌药物降阶梯治疗。 当发现感染不存在时，应即将住手抗菌药物 的使用，以避免产生耐药及不良反应。\n推荐意见 14：在脓毒症或者脓毒性休克患者中，抗菌药物的剂量优化策略应基于目前 公认的药效学/药动学原则及药物的特性(BPS)。\n脓�"
        ],
        "ground_truth": "在目前的文献综述中，有两个研究报导了 CRRT 的流量对急性肾功能衰竭患者临床结局的影响。结果并未显示与较高流量 RRT 相关病死率的任何差异。比较 RRT 流量的两项大规模、多中心随机试验也未能显示出患者接受高流量 RRT 的相关获益。对所有相关 RCTs (1505 例)结果进行 Meta 分析表明，RRT 流量和病死率之间没有任何显著的相关性，然而，点估计值支持 CRRT 流量＞30ml/ (kg · h)，由于偏倚、一致性差等风险，估计的置信度较低，应进行进一步研究。",
        "metadata": [
            {
                "filename": "(Word版)中国脓毒症／脓毒性休克急诊治疗指南(2022)培训资料.docx"
            },
            {
                "filename": "ICU 侵袭性真菌感染指南.pdf"
            },
            {
                "filename": "中国体外膜肺氧合应用现状及问题.pdf"
            },
            {
                "filename": "(Word版)中国脓毒症／脓毒性休克急诊治疗指南(2022)培训资料.docx"
            },
            {
                "filename": "(Word版)中国脓毒症／脓毒性休克急诊治疗指南(2022)培训资料.docx"
            },
            {
                "filename": "(Word版)中国脓毒症／脓毒性休克急诊治疗指南(2022)培训资料.docx"
            }
        ],
        "evolution_type": "simple"
    },
    {
        "id": 19,
        "question": "基线值如何与诊断急性肾损伤相关？",
        "answer": "基线值是用于评估患者风险的初始指标，与诊断急性肾损伤（AKI）相关。在提供的表格中，基线值用于分类为'1.0 (88)'，而诊断AKI的记录与之相关联，例如'Yes'或'No'。具体到这个问题，基线值可以作为患者是否发展为AKI的一个指标，但具体如何相关以及如何进行评估，需要结合上下文和更多医学知识来判断，而本表格中并未直接说明基线值与诊断AKI的具体关系。因此，答案为'1'，但需要更多详细信息来确认。",
        "contexts": [
            "  | 3         | 4         | 5     | 6              | 7              | 8                                                      |\n|---:|:-----|:---------|:----------|:----------|:----------|:------|:---------------|:---------------|:-------------------------------------------------------|\n|  0 | nan  | nan      | Serum     | Serum     | nan       | nan   | Diagnosis AKI? | Diagnosis AKI? | Diagnosis AKI?                                         |\n|  1 | fase | Baseline | nan       | Day 2     | nan       | Day 3 | Criterion 1    | Criterion 1    | Criterion 2≥0.3 mg/dl (>26.5 μmol/l) rise in <48 hours |\n|  2 | nan  | 1.0 (88) | 1.3 (115) | 1.5 (133) | 2.0 (177) | nan   | 1.0 (88)       | Yes            | Yes                                                    |\n|  3 | nan  | 1.0 (88) | 1.1 (97)  | 1.2 (106) | 1.4 (124) | nan   | nan            | No             | Yes                                                    |\n|  4 | nan  | 0.4 (35) | 0.5 (44)  | 0.6 (53)  | 0.7 (62)  | nan   | 0.4 (35)       | Yes            | No                                                     |\n|  5 | nan  | 1.0 (88) | 1.1 (97)  | 1.2(106   | 1.3 (115) | nan   | 1.5 (133       | Yes            | No                                                     |\n|  6 | nan  | 1.0 (88) | 1.3(115   | 1.5 (133) | 1,8(159   | nan   | 2.2 (195)      | Yes            | Yes                                                    |\n|  7 | nan  | nan      | 3.0 (265  | 2.6 (230  | 2.2 (195  | nan   | nan            | Yes            | No      "
        ],
        "ground_truth": "基线值与急性肾损伤的诊断相关，如果在48小时内肌酐升高≥0.3毫克/分升（＞26.5微摩尔/升），则符合诊断标准之一。",
        "metadata": [
            {
                "filename": "Sievert-2013-Antimicrobial-resistant pathogens.pdf"
            }
        ],
        "evolution_type": "simple"
    },
    {
        "id": 20,
        "question": "How are outcomes of ICU patients in China associated with hospital and ICU structural factors, such as staffing levels and equipment availability, and what specific types of outcomes (e.g., mortality rates, recovery times) are impacted?",
        "answer": "1",
        "contexts": [
            "                                                                                                                                                                                                                    | Restricting volume administration in the setting of oliguric AKl may result in limited nutritional support and RRT allow.                                                                                                                                         | nan                                                                                                                                                                                                                                                               |\n| 18 | nan                           | Drug delivery                                                                                                                                                                                                                                                     | RRT support can enhances the ability to administer drugs without concerns about concurrent fluid accumulation                                                                            ",
            "                                                                         | nan                                                                                                                                                                                                                                                               |\n| 19 | nan                           | nan                                                                                                                                                                                                                                                               | Permissive hypercapnic acidosis in patients with lung iniury can be corrected with RRT, without inducing fluid overloadand hypernatremia                                                                                                                          | Permissive hypercapnic acidosis in patients with lung iniury can be corrected with RRT, without inducing fluid overloadand hypernatremia                                                                                                                          |\n| 20 | Requlation of acid-base       | Requlation of acid-base                                                      ",
            "### Association between hospital and ICU Ch up structural factors and patient outcomes in China: a secondary analysis of the National Clinical Improvement System Data in 2019\n\nZhen Lilfo,Xudong Ma2t . Sifa Gao2t Qi Li, Hongbo Luo , Jianhua Sun',Wei Du', Longxiang Su', Lu Wang Qing Zhang', Zunzhu Lil\"*, Xiang Zhou\" and Dawei Liu\" on behalf of China National Critical Care Quality Control Center Group\n\nBackground: Hospital and CU structural factors are key factors affecting the guality of care as well as CU patient outcomes. However, the data from China are scarce. This study was designed to investigate how differences in patient outcomes are associated with differences in hospital and ICU structure variables in China throughout 2019\n\nMethods: This was a multicenter observational study. Data from a total of 2820 hospitals were collected using the National Clinical lmprovement System Data that reports CU information in China. Data collection consisted of al information on the hospital and ICU structural factors, including the hospital type, number of beds, staffng, among others, and b) ICU patient outcomes, including the mortality rate as well as the incidence of ventilator-associated oneumonia (VAP). catheter-related bloodstream infections (CRBSls), and catheter-associated urinary tract infections (CAUTls), Generalized linear mixed models were used to analyse the association between hospital and ICU structura factors and patient outcomes Results: The median ICU patient mortality was 8.02%(3.78%, 14.35%), and the incidences of VAP CRBSL, and CAUT\n\npneumonia (VAP), catheter-related bloodstream infections (CRBSls), and catheter-associated urinary tract infections (CAUTls), Generalized linear mixed models were used to analyse the association between hospital and ICU structura factors and patient outcomes Results: The median ICU patient mortality was 8.02% (3.78%., 14.35%), and the incidences of VAP. CRBSL, and CAUT were 5.58 (1.55.11.67) per 1000 ventilator davs., 0.63 (0.2.01) per 1000 catheter davs,and 142 (0.37,3,40) per 1000 catheter davs, respectively. Mortality was sianificantly lower in public hospitals (B= -0.018(- 0031.- 0.005) p=0.006), hospitals with an ICU-to-hospital bed percentage of more than 2% (B= -0.027 (-0.034,-0.019)., p<0.001) and higber in hospitals with a bed-to-nurse ratio of more than 0 5:1 (B=0009 (0 001 0017) np=0 027) The incidence of VAP was lower in public hospitals (B= -0.036 (- 0.054.-0018), p<0.001). The incidence of CRBSls was lower in public hospitals (B= -0.008 (- 0.014,-0002), p=0.011) and hiaher in secondary hospitals (B=0.005 (0.001.,0.009) p= 0.010), while the incidence of CAUTls was higher in secondary hospitals (B=0.010 (0002. 0.018)., p= 0.015)\n\ndwliu98@163.com [Zhen Li, Xudong Ma and Sifa Gao contributed equally to this work 'Department of Critical Care Medicine. Peking Union Medical College Hospital, Pekina Union Medical College and Chinese Academy of Medica Sciences, Beijing 100730, China Full list of author information is available at the end of the article\n\n©The Author(s) 2022. corrected publication 2022 Open Access This article is licensed under a Creative Commons Attribution 40 Interational License, which permits use, sharing, adaptation, distribution and reproduction in any medium or format, as long as you give appropriate credit to the original author(s) and the source, provide a link to the Creative Commons licence, and indicate if changes were made The images or otber third party material in this article are indluded in the artice's Creative Commons llicence  unless indicated otherwise in a credit line to the material If material is not included in the article's Creative Commons licence and your intended use is not permitted by statutory requlation or exceeds the permitted use, you will need to obtain permission directly from the copyriaght holder. To view a copy of this licence visit http://creativecommonsora/licenses/by/40/ The Creative Commons Public Domain Dedication waive (http://creativecomm",
            "ons.org/publicdomain/zero/1.0/) applies to the data made available in this article,unless otherwise stated in a credit linetothe data\n\nConclusion: This study highlights the association between speciffic ICU structural factors and patient outcomes Modifying structural factors is a potential opportunity that could improve patient outcomes in ICUs\n\n### Background\n\ndelivery is challenging and I complex in the Healthcare intensive care unit. Several factors, including ICU struc ture, ICU organization and d the care process, can influ ence ICU 1 extensive performance 1-3]. Despite the ICUs, the the quality of care literature addressing impact of such factors remains controversial, and a dili. gent assessment of care components is required It is well known that ICU structural factors vary within and regions [4, 51. However, most different countries related conducted in Western studies have been coun- tries [6. 71. Little evidence regarding the structural factors of ICUs in China is available [81, China still faces chal lenges in providing optimal and equitable management strategies for ICU patients across the nation because its broad geography and unbalanced economic develop ment. A previous study described critical care resources in Guangdong Province 9. Another study evaluated the practices, outcomes, and costs related to mechanical ven: tilation within ICUs in Beijing [10]. Nonetheless, those studies were limited to the regions in which the surveys were administered and feature small e sizes: it is I sample also not clear whether those resources were e associated with ICU care provision, treatment patterns, and patient demands outcomes. Finally, increasing  and I rising costs significant challenges to the delivery of high-qual pose: ity and affordable critical care to a growing population of patients. Optimizing ICU organization is a potentia opportunity to improve patient outcomes and the use of resources. Therefore, the aim of this study was to investigate hos- pital and ICU structural factors and patient outcomes in China. Moreover, we aimed to identify the associa- tion between these variables and patient outcomes, with structural factors, including ICU a focus on potential structural resources and staffing levels. We hypothesized that patients admitted to hospitals that were government- funded, tertiary, well-equipped, and better-staffed woulc have a decreased risk of ICU mortality and occurrence of VAP, CRBSIs and CAUTIs after adjusting for region, dis ease severity, and other confounders.\n\nDesign This nationwide, database observational e study was a National Clinical 2019. The data the source was\n\nSystem (https://ncisdc.medidata.cn/login Improvement Qual- jsp), collected by the China-National Critical Care e (China-NCCQC), which is the official ity Control Centre regulates ICU quality control national department that China. The of Health of China Ministry approved that Peking Union Medical College Hospital establishes 2012. The China-NCCQC Quality Improvement China-NCCQC of Critical Care led by Program, was 2015. This initiated in study above pro- part obtained from the the data was gram. Permission to use China-NCCQC.\n\n### Study population and settings\n\nThe China-NCCOC. collected the relevant data regard. ing quality control indicators through the database the National Clinical Improvement System. Hospitals in China are classified in a 3-tier svstem (primary, second arvy or tertiary hospital) that recognizes a hospital's ability to provide medical care, medical education, and conduct medical research. Tertiary hospitals, similar to a tertiary referral hospital in the West, are usually comprehen- sive, referral, general hospitals responsible for provid- ing specialist health services, perform a larger role with 1 and scientific research regard to medical education and serve as medical hubs providing care to multiple regions Secondary hospitals, similar to : a regional hospital e district hospital in the West, tend to be affiliated with medium-sized city, county, or district and are responsible for providing comprehensive health services and medical education and conducting research on a regional basis. Ir contrast, primary hospitals are primary health care insti- tutions whose main function is to provide primary pre- vention directly to the population, however, they rarely admit and treat critically ill patients. Therefore, primary hospitals were not included in the scope of the study The enrolled tertiary and secondary hospitals voluntar- ily participated and were selected by the China-NCCOC The selection criteria were as follows. (1) The ICU had to have more than five beds. (2) The ICU had to have the ability to diagnose and treat the relevant medical dis- eases that were evaluated as quality control items (such catheter- ventilator-associated pneumonia (VAP), as related blood stream infections (CRBSIs), and catheter- associated urinary tract",
            " more advanced study. needed design and analytical approach examine the dynamic impact of nurse staffing on ICU patient outcomes There are some limitations to this study. First., the use of secondary data limited essential variables such as the patient-level characteristics or uncontrolled confound- ers (e.g., education level of the staff. ICU bed occu- pancy rate) needed to understand the predictive factors of the patients' outcomes. To reduce these methodo- logical problems, we applied multivariate analysis using s adjusted for generalized linear mixed models patient disease severity using the APACHE I score, which has been shown to be an important predictor of patient outcomes [29, 30]. Second, since only one year of data was reported, presented and summarized in this study of the structural factors and health the relationships. outcomes could: not be analysed continuously anc dynamically. Third, this was an observational study and therefore, prone to selection bias. Causal relationships cannot be drawn due to the cross-sectional nature of the study design. Fourth, listwise deletion was used to data, which may cause bias in the handle the missing of the parameters 31 . Despite these limi- estimates tations, the results of this study are highly meaning- ful in that they underscore the necessity of nonpatient factors, including hospital and ICU structural factors, addi- as a way to reduce : adverse patient outcomes. In : tion, we have improved the generalizability of the find- ings by using national administrative data, unlike most data previous studies, which were conducted using from only certain regions or hospitals. The results may have important implications for critical care develop ment in China and other countries with similar medica environments.\n\nIn conclusion, specific structural factors, includingl hos- pital ownership, hospital type, I ICU-hospital bed percent: with ICU and bed-to-nurse associated e ratio age, were 1 poli- These observations can patient 1 assist in toutcomes. the cies and interventions bridge current quality gap in the delivery of critical care in China well as other developing countries.\n\nVAP: Ventilator-associated pneumonia; CRBSls: Catheter-related blood stream infections; CAUTls: Catheter-associated urinary tract infections: APACHE I score: Acute Physiology and Chronic Health Evaluation score; IQR: Interquartile range;95% Cl: Confidence interval; ICU: Intensive care unit\n\n### Supplementary Information\n\nThe online version contains supplementary material available at https://doi. org/10.1186/s13054-022-03892-7.\n\nAdditional fle 1. Definition of ventilator-associated pneumonia, catheter- related bloodstream infections, and catheter-associated urinary tract infections.\n\n### Acknowledgements\n\nThe authors would like to thank all participants and staff. The China Nationa Critical Care Quality Control Center Group consists of the following persons Xue Wang, Xiangdong Guan, Yan Kang, Bin Xiong, Bingyu Qin, Kejian Qian, Chunting Wang, Mingyan Zhao, Xiaochun Ma, Xiangyou Yu, Jiandong Lin, Aijun Pan, Haibo Qiu, Feng Shen, Shusheng Li, Yuhang Ai, Xiaohong Xie, Jing Yan, Weidong Wu, Meili Duan, Linjun Wan,. Xiaojun Yang, Jian Liu, Hang Xu, Dongpo Jiang, Lei Xu, Zhuang Chen, Guoying Lin, Zhengping Yang, Zhenjie Hu,\n\n### Authors'contributions 77L X7 and DL conceivec\n\nZZL XZ and DL conceived, designed, and supervised the study;XM and SG collected and prepared the data: ZL. WD.LS. IW and OZ helped collect data and performed data curation. ZL. OLHl and IS interpreted the data All authors contributed to the critical reading of the text and its revision. Al authors read and approved the final manuscript\n\nThis study was supported by the National Key R&D Program of China (grant number 2020YFCO861000), the CAMS Innovation Fund for Medical Sciences (CIFMS) (No. 2020-12 M-CoV19-001), the CAMS Endowment Fund (No.2021- CAMS-JZ004), the China International Medical Exchange Foundation Specia Fund for Young and Middle-Aged Medical Research (No.Z-2018-35-1902), the Chinese Medical Information and Big Data Association(CHMIA) Special Fund for Emergency Project and Beijing Municipal Natural Science Foundation (M21019) and the 2020 CMB Open Competition Program (No. 20-381).\n\n### Availability of supporting data\n\nThe datasets analysed during the current study are available from the cor- responding author",
            ". Moreno BP The variability of critical care bed numbers in Europe. Intensive Care Med 2012:38(10):1647-53 Pastores SM. Halpern NA. Oropello JM. Kostelecky N. Kvetan V. Critical care organizations in academic medical centers in North America: a descrip- tive report. Crit Care Med. 2015:43(10):2239-44 China's Ministry of Health. Guidelines for the construction and manage: ment of critical care medicine 2009 [Available from: http://www.nhc.gov cn/wiw/afxw/201304/cc4ffaa8314e4ddab/6/88b3f/be8e/1.shtm Yin H. Wang S. Zhu Y. Zhang R. Ye X. WeiJ. et al. The Development of criti cal care medicine in China: from SARS to COVID-19 pandemic. Crit Care Res Pract. 2020;2020:3956732 Xie Y, Liang D, Huang J, Jin J. Hospital ownership and hospital institutiona change:a qualitative study in Guizhou province, China. Int J Environ Re Public Health. 2019;16(8) Jing R, Xu I, Lai X, Mahmoudi E, Fang H. Technical efficiency of public and private hospitals in Beijing, China: a comparative study. Int J Environ Res Public Health. 2019;17(1) 21. Salvatierra GG, Gulek BG, Erdik B, Bennett D, Daratha KB. In-hospital sepsis mortality rates comparing tertiary and non-tertiary hosoitals in Washinc ton state. J Emerg Med. 2018;54(6):785-92 Lee SH. Hona JH. Kim YS. Park EC. Lee SM. Han CH.Impact of intensivy: ist and nursing staff on criticallyill patient mortality: a retrospective analvsis of the Korean NHIS cohort data. 2011-2015. Yonsei Med 2021:62(1):50-8 23 Sasabuchi Y, Yasunaga H, Matsui H, Lefor AK, Horiquchi H, Fushimi K, et a\n\nWallace DI. Seymour CW. Kabn IM. Hospital-level changes in adult ICI bed supply in the United States.( Crit Care Med 2017:45(1)e67-76 25. Jung M, Park H, Kang D, Park E, Jeon K, Chung CR, et al. The effect of bed- to-nurse ratio on hospital mortality of critically ill children on mechanica ventilation: a nationwide population-based study. Ann Intensive Care 2020:10(1):159 26 Kelly DM, Kutney-Lee A, McHugh MD, Sloane DM, Aiken LH. Impact of critical care nursing on 30-day mortality of mechanically ventilated olde adults. Crit Care Med, 2014:42(5):1089-95 27. Assave AM, Wiechula R, Schultz TJ, Feo R. Impact of nurse staffing on patient and nurse workforce outcomes in acute care settings in low- and middle-income countries: a systematic review. JBl Evid Synth. 2021:19/4):751-93 Neuraz A. Guerin C. Pavet C. Polazzi S. Aubrun E. Dailler E. et al, Patient mortality is associated with staff resources and workload in the ICU: a multicenter observational study. Crit Care Med. 2015:43(8):1587-94 Zou X. Li S, Fang M, Hu M, Bian Y Y, Ling J, et al. Acute Physiology and chronic health Evaluation Il Score as a predictor of hospital mortality in patients of coronavirus disease 2019. Crit Care Med. 2020;:48(8):e657-65 Bahtouee M, Eghbali SS, Maleki N, Rastgou V, Motamed N. Acute Physiol ogy and Chronic Health Evaluation ll score for the assessment of mortal- ity prediction in the intensive care unit: a single-centre study from lran. Nurs Crit Care. 2019:24(6):375-80 31. Kang H. The prevention and handling of the missing data. Korean J Anes thesiol. 2013:64(5):402-6\n\n### Publisher's Note\n\nSpringer Nature remains neutral with regard to jurisdictional claims in pub lished maps and institutional affilliations.\n\nReady to submit your research? Choose BMC and benefit from:\n\nAt BMC, research is always in progress.\n\nLearn more biomedcentral.com/submission\n\n",
            " data the median normally i are presented e (IOR) and were and interquartile analysed using  range the test. To iden- Mann-Whitney nonparametric tify effects the adjusted on e structural variables multivariate con- patient analysis outcomes, was ducted using generalized linear mixed models with two of effects random intercept t models to demonstrate the The the region and location. model took into account the e fact that from the city region or patients same similar characteristics that may have unmeasured are the similar because patient would more outcomes that in patients from  the patients than in e region same different model regions. The mixed-effects are across 1 separately for each patient outcome. analyses were run\n\nto Covariates that be important considered were the the factors in based on patient impact outcomes prior literature and the taken univariate analysis were addition as candidates for inclusion in the models. In of ICU patients with patient variables (the proportion APACHE II score an e≥15 (%)) and factors processing (the 6-h SSC bundle and the micro- e compliance rate (%) before (%)) were biology  antibiotic detection rate use also included in the model. The results are expressed as a (B) with the 95% confidence inter- the p value e and beta val (CI). A conducted. analysis missing value was of missing values across the variables var- percentage . 2387 observations ied between 1 0 and 12.02%. In total, (84.65%). Listwise used deletion complete were was data. All handle statistica two- missing were tests tailed be and p<0.05  statistically considered was significant\n\nHospital structure characteristics total 2820 hospitals from provinces  were the included in data a analysis. All hospital structural in and characteristics are analysed presented were Table 1. The 1383 of tertiary number hospitals was to 1437 (50.96%) secondary (49.04%), compared hos- from pitals. A larger proportion of the hospitals were Western 1China (1083, 38.40%), were (2574) public\n\nTable 1 Characteristics of the hospitals\n\n\n|    | 0                              | 1                            | 2             | 3                      | 4                       |       5 | 6      |\n|---:|:-------------------------------|:-----------------------------|:--------------|:-----------------------|:------------------------|--------:|:-------|\n|  0 | Variables                      | Categories                   | Total n(%)    | Tertiary hospital n(%) | I Secondaryhospital n(% | nan     | p      |\n|  1 | Region                         | Eastern Ching                | 889(31.52)    | 399(28.85)             | 490(34.10)              |  84.441 | <0.001 |\n|  2 | nan                            | Central China                | 659(23.37)    | 270(19.52)             | 389(27.07)              | nan     | nan    |\n|  3 | Location                       | Western China                | 1083(38.40    | 570(41.21)             | 513(35.70)       "
        ],
        "ground_truth": "The outcomes of ICU patients in China are associated with hospital and ICU structural factors, such as staffing levels and equipment availability. Specific types of outcomes impacted include mortality rates, incidence of ventilator-associated pneumonia (VAP), catheter-related bloodstream infections (CRBSIs), and catheter-associated urinary tract infections (CAUTIs). For example, mortality was significantly lower in public hospitals, hospitals with an ICU-to-hospital bed percentage of more than 2%, and higher in hospitals with a bed-to-nurse ratio of more than 0.5:1. The incidence of VAP and CRBSIs was lower in public hospitals, while the incidence of CAUTIs was higher in secondary hospitals.",
        "metadata": [
            {
                "filename": "Sievert-2013-Antimicrobial-resistant pathogens.pdf"
            },
            {
                "filename": "Sievert-2013-Antimicrobial-resistant pathogens.pdf"
            },
            {
                "filename": "Association between hospital and ICU structural factors and patient outcomes in China a secondary analysis of the National Clinical Improvement System Data in 2019.pdf"
            },
            {
                "filename": "Association between hospital and ICU structural factors and patient outcomes in China a secondary analysis of the National Clinical Improvement System Data in 2019.pdf"
            },
            {
                "filename": "Association between hospital and ICU structural factors and patient outcomes in China a secondary analysis of the National Clinical Improvement System Data in 2019.pdf"
            },
            {
                "filename": "Association between hospital and ICU structural factors and patient outcomes in China a secondary analysis of the National Clinical Improvement System Data in 2019.pdf"
            },
            {
                "filename": "Association between hospital and ICU structural factors and patient outcomes in China a secondary analysis of the National Clinical Improvement System Data in 2019.pdf"
            }
        ],
        "evolution_type": "simple"
    },
    {
        "id": 21,
        "question": "心脏兴奋剂治疗在重症患儿中的推荐和证据是什么？",
        "answer": "心脏兴奋剂治疗在重症COVID-19患者中的推荐和证据没有在给定的文本中明确给出。",
        "contexts": [
            "的ECMO中 心: (VV-ECMO 24.5% 30 8% P-0.001:VA-ECMO. 28.0% 比 34.5%. P< 0.001)此现象可能是我国今后区域ECMO中心 形成前很长一段时间需要面临的现状,也是患者预 后与国外存在差距的重要原因之(3 随着医疗水平的提高,ELSO登记的ECMO中 数量越来越多,但高质量的中心仍然以欧美发达 国家为主ECMO的开展目前也以区域中心化为 注EOLJA研究中所有的ECMO患者均集中在2个 ECMO中心内治疗,法国大巴黎区的新冠救治也均 转移到专门的ECMO中心。 这需 粤要配备随时待命 的移动ECMO团队,进行穿刺置管和转运,充分评 估转运风险。在我国,将ECMO患者集中到几个大 的中心非常不现实,中国领土范围广、长途长时间 转运对医务人员和患者均存在较大挑战,虽然已有 长途长时间固定翼飞机和地面转运的道,但仅仪 局限在个例,大范围推广困难较大。根据发达国家 及我国台湾地区开展ECMO的经验,ECMO患者集 中管理是提高ECMO技术及患者安全性的重要保 证。目前,适合中国国情的ECMO发展应该为建立 以省份为多中心的区域中心,辐射周边区域,切实 提高ECMO患者的救治成功率。) 成立区域性的 ECMO中心还可保证ECMO技术的合理利用、避免 医疗资源的浪费及完整区域性的危重患者抢救 体系(1618] (三)ECMO中心建设问题 ECMO的开展如火如茶,尤其是2019年底",
            "形态以及有性孢子的形态等进行种的鉴定。培养条件应 标准化,常用的培养基为察氏琼脂或察氏酵母浸膏琼脂。 曲霉孢子2~5um大小,易在空气中悬浮。吸人孢子后 可引起曲霉病,肺和鼻窦最易受累,依据宿主的免疫状态司 产生多种不同的临床类型。对免疫功能正常的个体,曲霉可 成为过敏原或引起肺或鼻窦的限局性感染:对免疫功能严重 受损者,曲霉可在肺或鼻窦处大量生长,然后播散至身体其 他器官。 3.致病性隐球菌.隐球菌属中新生隐球菌是最常见的致 病菌,它包括两个变种,即新生隐球菌新生变种和格特变种 前者广泛分布于世界各地常存在于鸽等鸟类的排泄物 中.几平所有的AIDS患者并发的隐球菌威染均是由该变利 引起:后者主要分布于热带、亚热带地区,可从梅树中分 离到。 新生隐球菌培养产生奶油色醯母样菌落显微镜下可见 球形或椭圆形酵母细胞,直径2~5um.第一代培养物有时 可见小的莱膜。脑脊液直接涂片可见隐球菌的酸母细胞有 较宽的英膜。 健康人对该菌有免疫力,只有当机体抵抗力下降时,病 原菌才易侵人人体致病。该菌最常侵犯中枢神经系统,也可 引起严重的肺部病变,其主要感染途径为呼吸道。隐球菌病 好发干AIDS、�",
            "进行校正,报告的效应为未 校正的粗效应,结果可能存在一定偏倚。 综上,三级防护下,利用超声的可视化特性,采 用平面外(短轴)技术联合平面内(长轴)技术对 重症COVID-19患者进行外周动脉置管,可提高首次 置管成功率,减少穿刺次数,降低穿刺并发症的发 生率。\n\n作者贡献:赵明曦、李若祎负责研究设计、数据分 析、论文撰写:孙建华、苏龙翔、李奇、李尊柱、马 鸿鸣、崔文博和罗红波参与研究设计和结果分析:周 翔指导研究设计数据分析并修改论文 利益冲突:无\n\n### 考 献 文\n\n[1]国家中医药管理局办公室中华人民共和国国家卫生健康 委员会办公厅,新型冠状病毒肺炎诊疗方案(试行第八 版)[1],中国医药、2020.15:1494-1499 [11 General Office of National Health Commission of the People's Republic of China, Office of National Administration of Tra- of ditional Chinese Medicine, Diagnosis and treatment virus disease-19 (8th trial edition)[J. Zhongguo corona Yi Yao, 2020, 15: 1494-1499. [2]尹万红,康焰.新型冠状病毒肺炎急性呼吸窘迫综合征 的血流动力学治疗[J1.协和医学杂志,2020,11: 518-521. [2 Yin WH, Kang Y. Hemodynamic therapy for COVID-19 pa syndromeJ. Xie He tients with e respiratory distress acute Yi Xue Za Zhi, 2020, 11: 518-521. 1 LM. al. Ultrasound- [31 RH, Paulin Shiloh 1 AL. Savel et radial guided systematic catheterization artery: a review and meta-analysis of randomized controlled [J. Chest, 2011, 139; 524-529. 等.超声引导下税动脉置管 [4]孙建华,刘大为,王小亭, 的应用进展[J.中国实用护理杂志,2016,32: 1997-2000 Sun JH, Liu DW, Wang XT, et al. Development of applica- tior cannulation of ultrasound guided radia research",
            "�组在武 汉均通过集体授课与视频学习等形式再次接受常规动 脉穿刺与超声引导下动脉穿刺培训,保证操作的一致 性。(3)排班:由于COVID-19疫情的特殊性,临床 工作中共设7个护理组,采取轮班制按组别顺序循环 值班开展工作,每组在污染区工作4h。每个护理组 配备1~2名具有超声工作经验的护士。\n\n### 动脉穿刺方法 1.2.2\n\n(1)传统触诊法:患者手心朝上、手腕下部垫\n\n高,使手掌与手臂至少成45°角,碘伏消毒。穿刺 者左手寻找患者烧动脉搏动最强位置,右手持针, 30°角进针,见回血后将动脉针放平,退针芯并将 动脉留置针管送人血管,连接密闭式采血套装,回 抽见回血月通畅为置管成功。若穿刺不成功,拔除 动脉针,按压至穿刺点不再渗血,更换动脉针重新 穿刺,穿刺大于3次仍不成功者考虑更换其他部位 进行置管。 (2)超声引导下外周动脉置管:患者姿势同对 照组。应用Venueultrasound system超声仪(美国GE 公司),血管探头(探头频率5~10MH)用无菌手 套包裹,探头标志点朝向患者右侧。操作者左手用超 声探头平面外(短轴)定位税动脉(图1A),右手 30°角进针,随着进针深人,逐渐向后移动探头,使 针尖持续显示在超声声像中。 当超声声像示针尖�",
            "这充分显示了ECM0中和ECMO团队 在患者预后中的重要作用,当然这也与当时特定的 环境和医疗物资短缺密不可分,笔者发现在大批医 疗队驰援武汉之后,ECMO的开展人数、死亡率均 有了不同程度的改善[12-15 (二)ECMO开展存在巨大地域差异 笔者团队2018年的数据显示,除港澳台外的 中国大陆地区的31个省份中,除了海南、青海和西 藏外,28个省份均有开展ECMO治疗,但务省份开 展例数存在较大差异,最多的省份开展例数超过 300例,而少的省份年开展则不足5例,地域差异非 常明显。在经济发达的东南沿海2018年全年开展 超过1400例,内陆地区则仅400例左右:按照经济 水平划分,国民生产总值(GDP)高的地区年开展\n\n1441例,GDP低的地区则仅开展194例[12] CSECLS的统计数据显示,截至2020年底,国 内开展体外生命支持技术的中心总数为500家,数 量与目前国际ELSO登记单位总数大致相当,但完 成ECMO的数量仅为其1/3左右。其中有将近一半 的ECMO中心开展例数在5例以下(48.6%),开展 笔者团队对2017至 50例以上的中心仅占62% 2019年全国开展ECMO情况进行调查发现(未发 表),全国共有318家医院开展VV-ECMO.3年开展 例数超过50例的中心仅11家,共有342家医院开 展VA-ECMO.3年开展例数超过60例的中心仅 14家。笔者发现,较大的ECMO中心患者预后明 比 优干较小"
        ],
        "ground_truth": "心脏兴奋剂在重症患儿中的推荐是多巴酚丁胺，尤其在已进行充分液体复苏且左心室充盈压足够时。如果血压偏低，应结合血管活性药物治疗。",
        "metadata": [
            {
                "filename": "Dellinger-2013-Surviving Sepsis Cam.pdf"
            },
            {
                "filename": "Dellinger-2013-Surviving Sepsis Cam.pdf"
            },
            {
                "filename": "2004+SSC+严重脓毒症与脓毒性休克治疗国际指南.pdf"
            }
        ],
        "evolution_type": "negative_rejection"
    },
    {
        "id": 22,
        "question": "血糖管理在 ICU 脓毒症患者中的重要性是什么？",
        "answer": "血糖管理在 ICU 脓毒症患者中的重要性没有在给定的文本中提及。",
        "contexts": [
            "功率并不高。为了推动全球范围 内的ECMO技术交流与应用,在Bartlet教授推动 下国际体外生命支持组织(Extracorporeal Life Support Organization,ELSO)于1989年在密歇根大 学成立但直至2004年,全世界仅有100多家医院 开展此项工作,并且主要集中在西方发达国家。从 2008年ECMO用于成功救治甲型流感患者之后,全 球ECMO数量开始呈现快速增长趋势13 中国内地最早1例真正意义上的ECMO支持 病例始于2002年,但限于当时的经济水平、医疗条 件和医疗报销制度的限制,这一设备没有得到大范 围推广,到2015年全国ECMO中心的数量才突码 随着医疗水平的逐渐发展和医保政策的 100家。 整,中国的ECM0开始有了飞速发展。2019年底 新型冠状病毒肺炎(新冠肺炎)爆发ECMO被用干 重症新冠肺炎惠者的救治,开始进入大众视野;手) 目由于其在新冠疫情救治中起到的重要作用,国家 卫生健康委员会在《新型冠状病毒感染的肺炎诊疗 方案》中将ECMO列为危重症新冠肺炎患者的重要 救治技术,极大地促进了国内各医疗机构进一步开 展ECMO相关培训学习,成立ECMO中心(45 二、ECMO开展现状 近年ECMO临床应用突飞猛进。世界范围内 据ES0的统计数据显示,2019年全球共有488个 ECMO中心,实施ECMO的病例达到17078例,截¥ 2021年10月的统计数据显示2020年注册的ECMQ 中心数增至521个,全年开",
            "进行校正,报告的效应为未 校正的粗效应,结果可能存在一定偏倚。 综上,三级防护下,利用超声的可视化特性,采 用平面外(短轴)技术联合平面内(长轴)技术对 重症COVID-19患者进行外周动脉置管,可提高首次 置管成功率,减少穿刺次数,降低穿刺并发症的发 生率。\n\n作者贡献:赵明曦、李若祎负责研究设计、数据分 析、论文撰写:孙建华、苏龙翔、李奇、李尊柱、马 鸿鸣、崔文博和罗红波参与研究设计和结果分析:周 翔指导研究设计数据分析并修改论文 利益冲突:无\n\n### 考 献 文\n\n[1]国家中医药管理局办公室中华人民共和国国家卫生健康 委员会办公厅,新型冠状病毒肺炎诊疗方案(试行第八 版)[1],中国医药、2020.15:1494-1499 [11 General Office of National Health Commission of the People's Republic of China, Office of National Administration of Tra- of ditional Chinese Medicine, Diagnosis and treatment virus disease-19 (8th trial edition)[J. Zhongguo corona Yi Yao, 2020, 15: 1494-1499. [2]尹万红,康焰.新型冠状病毒肺炎急性呼吸窘迫综合征 的血流动力学治疗[J1.协和医学杂志,2020,11: 518-521. [2 Yin WH, Kang Y. Hemodynamic therapy for COVID-19 pa syndromeJ. Xie He tients with e respiratory distress acute Yi Xue Za Zhi, 2020, 11: 518-521. 1 LM. al. Ultrasound- [31 RH, Paulin Shiloh 1 AL. Savel et radial guided systematic catheterization artery: a review and meta-analysis of randomized controlled [J. Chest, 2011, 139; 524-529. 等.超声引导下税动脉置管 [4]孙建华,刘大为,王小亭, 的应用进展[J.中国实用护理杂志,2016,32: 1997-2000 Sun JH, Liu DW, Wang XT, et al. Development of applica- tior cannulation of ultrasound guided radia research",
            "这充分显示了ECM0中和ECMO团队 在患者预后中的重要作用,当然这也与当时特定的 环境和医疗物资短缺密不可分,笔者发现在大批医 疗队驰援武汉之后,ECMO的开展人数、死亡率均 有了不同程度的改善[12-15 (二)ECMO开展存在巨大地域差异 笔者团队2018年的数据显示,除港澳台外的 中国大陆地区的31个省份中,除了海南、青海和西 藏外,28个省份均有开展ECMO治疗,但务省份开 展例数存在较大差异,最多的省份开展例数超过 300例,而少的省份年开展则不足5例,地域差异非 常明显。在经济发达的东南沿海2018年全年开展 超过1400例,内陆地区则仅400例左右:按照经济 水平划分,国民生产总值(GDP)高的地区年开展\n\n1441例,GDP低的地区则仅开展194例[12] CSECLS的统计数据显示,截至2020年底,国 内开展体外生命支持技术的中心总数为500家,数 量与目前国际ELSO登记单位总数大致相当,但完 成ECMO的数量仅为其1/3左右。其中有将近一半 的ECMO中心开展例数在5例以下(48.6%),开展 笔者团队对2017至 50例以上的中心仅占62% 2019年全国开展ECMO情况进行调查发现(未发 表),全国共有318家医院开展VV-ECMO.3年开展 例数超过50例的中心仅11家,共有342家医院开 展VA-ECMO.3年开展例数超过60例的中心仅 14家。笔者发现,较大的ECMO中心患者预后明 比 优干较小",
            "�分析2018年在中国大 陆1700家三级医院住院治疗的79668156例患老 中共有2073例接受了ECMO治疗,其中静脉-动)局 ECMO(VA-ECMO)1359例,静脉-静脉ECMC (VV-ECMO)714例。ECMO支持患者中位年龄 50岁(31~63岁),住院时间17d(7~30d),住院总花 费中位数236400元。 。笔者发现,在中国大陆地 区.ECMO的开展存在很大的地域差异。在中国除 港澳台外的31个省份中,除了海南、青海和西 外,28个省份均开展了ECMO治疗,其中广东、北 京、浙江三个省市年开展例数超过300例,而甘肃、 内蒙古、宁夏和山西开展例数则不足5例。在经济 发达的东南沿海地区,ECMO开展例数明显较多 笔者还发现,不同地区ECMO患者的住院死亡率差 异也很大,为20%~70%,住院死亡率与ECMO开展 例数存在一定相关趋势,开展例数多的省份死亡率 较低。进一步的多因素分析发现,影响ECMO患者 住院死亡率的危险因素包括年龄>70岁、男性、不 发达地区患者、夏季发病以及存在先天畸形。既往 或治疗过程中出现中枢或血液系统异常也明显影 响患者预后(12 这是中国大陆地区首次基于临庆 *据对ECM马甘光死六行流行病学调杰\n\n的研究,反映了ECMO目前的使用和住院死亡率情 况。同样,也突显了国内ECMO开展面临的一系 问题。 三ECMO开展面临的挑战 (一)ECMO开展例数不足 笔者",
            "��相关技术问题 ECMO技术虽然近年来发展迅速,但仍存在- 此尚未突破的技术难题,例如(1)患者是否能从 ECMO支持中获益?对干VV-ECMO月前仅有两项 设计严格的随机对照研究,或存在明显的设计缺 陷,或未能得出ECMO支持显著的生存获益优势: 鉴于伦理问题,自前尚未有VA-ECMO相关的临床 对照研究发表(2.18-19] (2)抗凝策略和抗凝目标如付 选择?ECMO患者的高凝状态使患者及ECMO回 路易于形成血栓,ECMO患者进行持续、全身性抗 凝治疗,以防止ECMO回路血栓形成是重症医学的 共识,但最近-篇包括21项研究(7190例接受 VV-ECMO或VA-ECMO患者)的荟萃分析显示: ECM0运行期间出血事件的发生率为17%~51%。 尤其对于创伤、存在活动性或者高出血风险的患 者,通常存在抗凝禁总证,因此抗凝策略的选择无 疑面临着巨大风险和挑战 。(3)VV-ECMO支持期 间呼吸机参数如何设置?VV-ECMO支持期间,希 望患者自身肺脏得到充分休息,避免进一步肺损 伤,但恢复到什么程度让自身肺脏工作?各个时期 的呼吸机参数如何设置目前仍无定论[21-22 。(4)目 前VA-ECMO绝大多数情况下都是经股动脉插管进 行灌注体外血流与心脏射血方向相反,这样会增 室后负荷,导致左心扩大账满,不利于心功 二经VA-ECMO�"
        ],
        "ground_truth": "血糖管理在 ICU 脓毒症患者中的重要性在于推荐采用程序化血糖管理方案，以及监测血糖水平并在连续两次测定血糖＞10mmol/L 时启用胰岛素治疗。目标血糖为≤10mmol/L。这些措施有助于稳定血糖水平，从而改善患者的病情和预后。",
        "metadata": [
            {
                "filename": "(Word版)中国脓毒症／脓毒性休克急诊治疗指南(2022)培训资料.docx"
            }
        ],
        "evolution_type": "negative_rejection"
    },
    {
        "id": 23,
        "question": "外周动脉置管在重症COVID-19患者中的作用是什么？",
        "answer": "该问题的答案不在给定的任何上下文中。所以输出为 `-1`。",
        "contexts": [
            "ons.org/publicdomain/zero/1.0/) applies to the data made available in this article,unless otherwise stated in a credit linetothe data\n\nConclusion: This study highlights the association between speciffic ICU structural factors and patient outcomes Modifying structural factors is a potential opportunity that could improve patient outcomes in ICUs\n\n### Background\n\ndelivery is challenging and I complex in the Healthcare intensive care unit. Several factors, including ICU struc ture, ICU organization and d the care process, can influ ence ICU 1 extensive performance 1-3]. Despite the ICUs, the the quality of care literature addressing impact of such factors remains controversial, and a dili. gent assessment of care components is required It is well known that ICU structural factors vary within and regions [4, 51. However, most different countries related conducted in Western studies have been coun- tries [6. 71. Little evidence regarding the structural factors of ICUs in China is available [81, China still faces chal lenges in providing optimal and equitable management strategies for ICU patients across the nation because its broad geography and unbalanced economic develop ment. A previous study described critical care resources in Guangdong Province 9. Another study evaluated the practices, outcomes, and costs related to mechanical ven: tilation within ICUs in Beijing [10]. Nonetheless, those studies were limited to the regions in which the surveys were administered and feature small e sizes: it is I sample also not clear whether those resources were e associated with ICU care provision, treatment patterns, and patient demands outcomes. Finally, increasing  and I rising costs significant challenges to the delivery of high-qual pose: ity and affordable critical care to a growing population of patients. Optimizing ICU organization is a potentia opportunity to improve patient outcomes and the use of resources. Therefore, the aim of this study was to investigate hos- pital and ICU structural factors and patient outcomes in China. Moreover, we aimed to identify the associa- tion between these variables and patient outcomes, with structural factors, including ICU a focus on potential structural resources and staffing levels. We hypothesized that patients admitted to hospitals that were government- funded, tertiary, well-equipped, and better-staffed woulc have a decreased risk of ICU mortality and occurrence of VAP, CRBSIs and CAUTIs after adjusting for region, dis ease severity, and other confounders.\n\nDesign This nationwide, database observational e study was a National Clinical 2019. The data the source was\n\nSystem (https://ncisdc.medidata.cn/login Improvement Qual- jsp), collected by the China-National Critical Care e (China-NCCQC), which is the official ity Control Centre regulates ICU quality control national department that China. The of Health of China Ministry approved that Peking Union Medical College Hospital establishes 2012. The China-NCCQC Quality Improvement China-NCCQC of Critical Care led by Program, was 2015. This initiated in study above pro- part obtained from the the data was gram. Permission to use China-NCCQC.\n\n### Study population and settings\n\nThe China-NCCOC. collected the relevant data regard. ing quality control indicators through the database the National Clinical Improvement System. Hospitals in China are classified in a 3-tier svstem (primary, second arvy or tertiary hospital) that recognizes a hospital's ability to provide medical care, medical education, and conduct medical research. Tertiary hospitals, similar to a tertiary referral hospital in the West, are usually comprehen- sive, referral, general hospitals responsible for provid- ing specialist health services, perform a larger role with 1 and scientific research regard to medical education and serve as medical hubs providing care to multiple regions Secondary hospitals, similar to : a regional hospital e district hospital in the West, tend to be affiliated with medium-sized city, county, or district and are responsible for providing comprehensive health services and medical education and conducting research on a regional basis. Ir contrast, primary hospitals are primary health care insti- tutions whose main function is to provide primary pre- vention directly to the population, however, they rarely admit and treat critically ill patients. Therefore, primary hospitals were not included in the scope of the study The enrolled tertiary and secondary hospitals voluntar- ily participated and were selected by the China-NCCOC The selection criteria were as follows. (1) The ICU had to have more than five beds. (2) The ICU had to have the ability to diagnose and treat the relevant medical dis- eases that were evaluated as quality control items (such catheter- ventilator-associated pneumonia (VAP), as related blood stream infections (CRBSIs), and catheter- associated urinary tract",
            ". needed design and analytical approach examine the dynamic impact of nurse staffing on ICU patient outcomes There are some limitations to this study. First., the use of secondary data limited essential variables such as the patient-level characteristics or uncontrolled confound- ers (e.g., education level of the staff. ICU bed occu- pancy rate) needed to understand the predictive factors of the patients' outcomes. To reduce these methodo- logical problems, we applied multivariate analysis using s adjusted for generalized linear mixed models patient disease severity using the APACHE I score, which has been shown to be an important predictor of patient outcomes [29, 30]. Second, since only one year of data was reported, presented and summarized in this study of the structural factors and health the relationships. outcomes could: not be analysed continuously anc dynamically. Third, this was an observational study and therefore, prone to selection bias. Causal relationships cannot be drawn due to the cross-sectional nature of the study design. Fourth, listwise deletion was used to data, which may cause bias in the handle the missing of the parameters 31 . Despite these limi- estimates tations, the results of this study are highly meaning- ful in that they underscore the necessity of nonpatient factors, including hospital and ICU structural factors, addi- as a way to reduce : adverse patient outcomes. In : tion, we have improved the generalizability of the find- ings by using national administrative data, unlike most data previous studies, which were conducted using from only certain regions or hospitals. The results may have important implications for critical care develop ment in China and other countries with similar medica environments.\n\nIn conclusion, specific structural factors, includingl hos- pital ownership, hospital type, I ICU-hospital bed percent: with ICU and bed-to-nurse associated e ratio age, were 1 poli- These observations can patient 1 assist in toutcomes. the cies and interventions bridge current quality gap in the delivery of critical care in China well as other developing countries.\n\nVAP: Ventilator-associated pneumonia; CRBSls: Catheter-related blood stream infections; CAUTls: Catheter-associated urinary tract infections: APACHE I score: Acute Physiology and Chronic Health Evaluation score; IQR: Interquartile range;95% Cl: Confidence interval; ICU: Intensive care unit\n\n### Supplementary Information\n\nThe online version contains supplementary material available at https://doi. org/10.1186/s13054-022-03892-7.\n\nAdditional fle 1. Definition of ventilator-associated pneumonia, catheter- related bloodstream infections, and catheter-associated urinary tract infections.\n\n### Acknowledgements\n\nThe authors would like to thank all participants and staff. The China Nationa Critical Care Quality Control Center Group consists of the following persons Xue Wang, Xiangdong Guan, Yan Kang, Bin Xiong, Bingyu Qin, Kejian Qian, Chunting Wang, Mingyan Zhao, Xiaochun Ma, Xiangyou Yu, Jiandong Lin, Aijun Pan, Haibo Qiu, Feng Shen, Shusheng Li, Yuhang Ai, Xiaohong Xie, Jing Yan, Weidong Wu, Meili Duan, Linjun Wan,. Xiaojun Yang, Jian Liu, Hang Xu, Dongpo Jiang, Lei Xu, Zhuang Chen, Guoying Lin, Zhengping Yang, Zhenjie Hu,\n\n### Authors'contributions 77L X7 and DL conceivec\n\nZZL XZ and DL conceived, designed, and supervised the study;XM and SG collected and prepared the data: ZL. WD.LS. IW and OZ helped collect data and performed data curation. ZL. OLHl and IS interpreted the data All authors contributed to the critical reading of the text and its revision. Al authors read and approved the final manuscript\n\nThis study was supported by the National Key R&D Program of China (grant number 2020YFCO861000), the CAMS Innovation Fund for Medical Sciences (CIFMS) (No. 2020-12 M-CoV19-001), the CAMS Endowment Fund (No.2021- CAMS-JZ004), the China International Medical Exchange Foundation Specia Fund for Young and Middle-Aged Medical Research (No.Z-2018-35-1902), the Chinese Medical Information and Big Data Association(CHMIA) Special Fund for Emergency Project and Beijing Municipal Natural Science Foundation (M21019) and the 2020 CMB Open Competition Program (No. 20-381).\n\n### Availability of supporting data\n\nThe datasets analysed during the current study are available from the cor- responding author on reasonable request",
            "### Association between hospital and ICU Ch up structural factors and patient outcomes in China: a secondary analysis of the National Clinical Improvement System Data in 2019\n\nZhen Lilfo,Xudong Ma2t . Sifa Gao2t Qi Li, Hongbo Luo , Jianhua Sun',Wei Du', Longxiang Su', Lu Wang Qing Zhang', Zunzhu Lil\"*, Xiang Zhou\" and Dawei Liu\" on behalf of China National Critical Care Quality Control Center Group\n\nBackground: Hospital and CU structural factors are key factors affecting the guality of care as well as CU patient outcomes. However, the data from China are scarce. This study was designed to investigate how differences in patient outcomes are associated with differences in hospital and ICU structure variables in China throughout 2019\n\nMethods: This was a multicenter observational study. Data from a total of 2820 hospitals were collected using the National Clinical lmprovement System Data that reports CU information in China. Data collection consisted of al information on the hospital and ICU structural factors, including the hospital type, number of beds, staffng, among others, and b) ICU patient outcomes, including the mortality rate as well as the incidence of ventilator-associated oneumonia (VAP). catheter-related bloodstream infections (CRBSls), and catheter-associated urinary tract infections (CAUTls), Generalized linear mixed models were used to analyse the association between hospital and ICU structura factors and patient outcomes Results: The median ICU patient mortality was 8.02%(3.78%, 14.35%), and the incidences of VAP CRBSL, and CAUT\n\npneumonia (VAP), catheter-related bloodstream infections (CRBSls), and catheter-associated urinary tract infections (CAUTls), Generalized linear mixed models were used to analyse the association between hospital and ICU structura factors and patient outcomes Results: The median ICU patient mortality was 8.02% (3.78%., 14.35%), and the incidences of VAP. CRBSL, and CAUT were 5.58 (1.55.11.67) per 1000 ventilator davs., 0.63 (0.2.01) per 1000 catheter davs,and 142 (0.37,3,40) per 1000 catheter davs, respectively. Mortality was sianificantly lower in public hospitals (B= -0.018(- 0031.- 0.005) p=0.006), hospitals with an ICU-to-hospital bed percentage of more than 2% (B= -0.027 (-0.034,-0.019)., p<0.001) and higber in hospitals with a bed-to-nurse ratio of more than 0 5:1 (B=0009 (0 001 0017) np=0 027) The incidence of VAP was lower in public hospitals (B= -0.036 (- 0.054.-0018), p<0.001). The incidence of CRBSls was lower in public hospitals (B= -0.008 (- 0.014,-0002), p=0.011) and hiaher in secondary hospitals (B=0.005 (0.001.,0.009) p= 0.010), while the incidence of CAUTls was higher in secondary hospitals (B=0.010 (0002. 0.018)., p= 0.015)\n\ndwliu98@163.com [Zhen Li, Xudong Ma and Sifa Gao contributed equally to this work 'Department of Critical Care Medicine. Peking Union Medical College Hospital, Pekina Union Medical College and Chinese Academy of Medica Sciences, Beijing 100730, China Full list of author information is available at the end of the article\n\n©The Author(s) 2022. corrected publication 2022 Open Access This article is licensed under a Creative Commons Attribution 40 Interational License, which permits use, sharing, adaptation, distribution and reproduction in any medium or format, as long as you give appropriate credit to the original author(s) and the source, provide a link to the Creative Commons licence, and indicate if changes were made The images or otber third party material in this article are indluded in the artice's Creative Commons llicence  unless indicated otherwise in a credit line to the material If material is not included in the article's Creative Commons licence and your intended use is not permitted by statutory requlation or exceeds the permitted use, you will need to obtain permission directly from the copyriaght holder. To view a copy of this licence visit http://creativecommonsora/licenses/by/40/ The Creative Commons Public Domain Dedication waive (http://creativecomm",
            "  AKI imposes a heavy burden of illness (morbidity and mortality). The cost per person of managing AKI is high. AKI is amenable to early detection and potential prevention There is considerable variability in practice to prevent diagnosen and achieve outcomes of AKI. treat Clinical practice the potential 1 the field have guidelines in to reduce variations, improve and reduce costs outcomes Formal guidelines do not exist topic.\n\n### Su\n\nSmall changes in kidney function in hospitalized patients are with significant changes in short important and associated y and long-term outcomes. The shift of terminology from ATN AKI has been well received by t and ARE and the research uni- clinical o communities. RIFLE/AKIN criteria provide form definition of AKI, and have the standard for become diagnostic e criteria. AKI severity grades represent patient groups with increasing severity of illness as s illustrated by RRT, and with increasing patients treated proportion RIFLE by the defined mortality. Thus, AKI increasing as criteria is syndrome, recognized as important alongside other syndromes such 1as acute coronary syndrome,  shock. The and acute lung injury, and sepsis septic severe RIFLE/AKIN classification for AKI is quite analogous to the Kidney1  (KDOQI) for Disease Quality Outcomes / Initiative CKD which is wel disease known to correlate staging other with cardiovascular complications and severity mor bidities. specific As CKD linked have to  been stages recommendations, which have proved extremely treatment this usefu disease, have we developed managing of and evaluation recommendationsf management patients with AKI using this approach. stage-based\n\nKidney International Supplements (2012) 2, 13-18\n\n© 2012 KDIGO\n\n## Chapter 1.2: Methodology\n\nThis a very brief summary of the methods chapter provides a this develop methods to guideline. Detailed used are provided in Appendix F. The overall aim of the project was clinical practice guideline with to create recommendations for AKI using an evidence-based approach. After topics and the identified, clinical relevant pertinent questions were scientific literature those on topics systematically was summarized searched and\n\n### Group member selection and meeting process\n\nThe KDIGO Co-Chairs appointed the Co-Chairs of the Work then 1 assembled the Work Group to be responsible Group, who for the development of the guideline. The Work Group consisted with including individuals domain expertise experts, nephrology, critical care medicine, internal medicine, pediatrics, cardiology, radiology, infectious diseases  and epidemiology. For support in evidence review, expertise in methods, and guideline the with the Evidence Review NKE development, contracted the Tufts Center for Team (ERT) based at r Kidney primarily Tufts Guideline Disease Development Implementation 1 at t and ERT Medical USA. The Center in Boston, Massachusetts, expertise in nephrol- consisted of physician-methodologists with ogy and internal medicine,a and research associates and d assistants all advised Work Group The ERT instructed 1and members in and critical literature review, literature steps appraisal, ERT Work The guideline the < Group and development. Work Group collaborated closely throughout project KDIGO Co-Chairs, ERT, liaisons, and NKF support staff met for four 2-day meetings for training in the guideline e development topic discussion, and consensus development process,\n\n### Evidence selection, appraisal, and presentation\n\nWe first defined the topics and goals for the guideline e and clinical ERT identified key s for review. The questions article performed literature searches, organized abstract and screening, coordinated methodological and analytic processes of the report, defined and standardized the search methodol- the data and summarized ogy, performed extraction, e. The Work Group 1 all included members reviewed evidence articles. and evidence data extraction forms, summary tables, a profiles for accuracy and completeness. The four major topic for AKI included: i) definition and interest f areas classification; ii) prevention; iii) pharmacologic  treatment: e at risk for RRT. Populations of interest those were those after intravascular contrast-media (including and those aminoglycosides, and amphotericin) exposure, with or at risk for AKI with a focus on patients with sepsis or trauma, receiving critical care, or undergoing cardiothoracic\n\nsurgery. We excluded studies AKI from rhabdomyolysis, specific infections, and poisoning or drug overdose. Overall screened 18385 citations.\n\n### Outcome selection judgments, values, i and preferences\n\nWe limited outcomes to those important for decision making including development of AKI, need for or on dependence mortality. When RRT, and : all-cause 1 weighting the e evidence across different outcomes, we selected as the \"crucial\"( outcome which the heavily in that weighed most assessment overall quality of evidence. Values",
            "5\n\nAAMI American Association 1 of Medica Instrumentation ACCP American College of Chest Physicians ACD-A Anticoagulant dextrose solution A ACE-I Angiotensin-converting enzyme inhibitor(s ADQI Acute Dialysis Ouality Initiative AHCPR Agency for Health Care Policy and Research AKD Acute kidney diseases and disorders AKI Acute kidney iniury AKIN Acute Kidney Iniury Network ANP Atrial natriuretic peptide aPTT Activated partial thromboplastin time ARE Angiotensin-receptor blocker(s ARH Acute renal failure ARFTN Acute Renal Failure Trial Network ATN Acute tubular necrosis AUC Area under the curve BMI Body mass index BUN Blood urea nitrogen CDC Centers for Disease Contro CHF Congestive heart failure CI Confidence interva CI-AK Contrast-induced acute kidney injury 1888 Conventional insulin therapy Chronic kidney disease Creatinine clearance Chronic renal failure CRRT Continuous renal replacement therapy CT Computed tomography CVC Central venous catheters CVVH Continuous venovenous hemofiltration CVVHDE Continuous venovenous hemodiafltration eCrC) Estimated creatinine clearance EGDT Early goal-directed therapy eGFR Estimated glomerular filtration rate ERT Evidence Review Team ESRD End-stage renal disease FDA Food and Drug Administratior GFR Glomerular filtration rate HDF Hemodiafiltration HES Hudrovuothuctorcl\n\nKidney International Supplements (2012) 2, 5\n\nHF Hemofltration HIT Heparin-induced thrombocytopenia HR Hazard ratic ia Intraarterial ICU Intensive-care unit IGF-1 Insulin-like growth factor-1 earch IHD Intermittent hemodialvsis IT Intensive insulin therapy i.v Intravenous KDIGC Kidney Disease: Improving Global Outcomes KDOQI Kidney Disease Outcomes Quality Initiative LOS Length of stay MDRD Modification of Diet in Renal Disease M Myocardial infarction MIC Minimum inhibitory  concentratior MRI Magnetic resonance imaging MW Molecular weight NAC N-acetylcysteine NICE-SUGAR Normoglycemia in Intensive Care Evaluation and Survival Using Glucose Algorithm Regulation NKD No known kidney disease NKF National Kidney Foundatior NSP Nephrogenic Systemic Fibrosis OR Odds ratic PD Peritoneal dialysis PICARD Program to Improve Care in Acute Renal Disease RCT Randomized controlled tria RIFLE Risk, Injury, Failure; Loss, End-Stage Rena Disease RR ion Relative risk RRT Renal replacement therapy SAFE Saline vs. Albumin Fluid Evaluation SCr Serum creatinine ScVO2 Central venous oxygen saturation SLED Sustained low-efficiency dialysis TCC Tunneled cuffed catheter VISEP Efficacy of Volume Substitution and Insulin Therapy in Severe Sepsis\n\nKidney International Supplements (2012) 2, 6; doi:10.1038/kisup.2012.6\n\nThe 2011 Kidney Disease: Improving Global Outcomes (KDIGO) Clinical Practice Guideline for Acute Kidney Injury (AKI) aims to assist practitioners caring for adults and children at risk for or with AKI, including contrast-induced acute kidney injury (CI-AKI). Guideline development followed an explicit process of evidence review and appraisal. The guideline contains chapters on definition, risk assessment, evaluation, prevention, and treatment. Definition and staging of AK] are based on the Risk, Injury, Failure; Loss, End-Stage Renal Disease (RIFLE) and Acute Kidney Injury Network (AKIN) criteria and studies on risk relationships. The treatment chapters cover oharmacological approaches to prevent or treat AKI, and management of renal replacement for kidney failure from AKI. Guideline recommendations are based on svstematic reviews of relevant trials. Appraisal of the quality of the evidence and the strength of recommendations followed the GRADE: approach. Limitations of the evidence are discussed and specific suggestions are provided for future research,\n\nKeywords: Clinical Practice Guideline; KDIGO; acute kidney injury; contrast-induced nephropathy; renal replacement therapy; evidence-based recommendation\n\nIn citing this document, the following format should be used: Kidney Disease: Improving Globa Outcomes (KDIGO) Acute Kidney Injury Work Group. KDIGO Clinical Practice Guideline for Acute Kidney Injury. Kidney inter., Suppl. 2012; 2: 1-138.\n\nKidney International Supplements (2012"
        ],
        "ground_truth": "利用超声的可视化特性，采用平面外(短轴)技术联合平面内(长轴)技术对重症COVID-19患者进行外周动脉置管，可提高首次置管成功率，减少穿刺次数，降低穿刺并发症的发生率。",
        "metadata": [
            {
                "filename": "三级防护下超声引导外周动脉置管在新型冠状病毒肺炎重症患者中的应用.pdf"
            }
        ],
        "evolution_type": "negative_rejection"
    },
    {
        "id": 24,
        "question": "How effective is preventive medication, particularly sodium bicarbonate compared to saline solution, in the context of contrast-induced acute kidney injury (CI-AKI)?",
        "answer": "The context does not provide information on the effectiveness of preventive medication, specifically sodium bicarbonate compared to saline solution, in the context of contrast-induced acute kidney injury (CI-AKI).",
        "contexts": [
            " Buches wird gre a critical determinant of survival in patients with gastrointestinal perforation with associated septic als seine einzelnen Kapitel. Obwohl in der einfachen, ehrlichen und praktischer shock. Crit Care 18(3):R8) ein alltägliches Thema zu behandel Herangehensweise an das Thema ,Thorax: 15. ARDSNetwork (2000) Ventilation with lowel drainagen\", empfehle ich es jedem, der sich m tidal volumes as compared with traditiona tidal volumes for acute lung injury and the Das Buch stellt das Thema umfassend dar raxdrainagen in seiner klinischen T acute respiratory distress syndrome. The Acute Es umfasst die Themenfelder Anatomie, Phy beschäftigt, der seine Arbeit für det Respiratory Distress Syndrome Network. N Engl. siologie, Indikationen, Art der Drainagen, Le: ten durch Fokussierung auf die ein Med 342(18):1301-1308 16. Amato MB, Meade MO, Slutsky AS, Brochard L täglichen Routineabläufe erheblich gen einer Drainage, Komplikationen, Pflege Costa EL, Schoenfeld DA et al (2015) Driving Management des Pleuraspaltes, Schmerz sern mochte und der sich nicht nur pressure and survival in the acute respirator therapie, Physiotherapie und Entternen der 修glamourosen\"Themen konzentrie distress syndrome. NEnglJMed 372(8):747-75: 17. Ferquson ND, Cook DJ, Guyatt GH, Mehta S, HandL Drainage. Ich habe viel gelernt, und ich wette Austin P et al (2013) High-frequency oscillation in Frank C. Detterbeck MD, New h dass jeder Thoraxchirurg, egal wie ertahrer early acute respiratory distress syndrome. N Engl. Unite er sein mag, in diesem Buch viele Dinge fin- Med 368(9):795-805 18. Frat JP, Thille AW, Mercat A, Girault C, Ragot S den wird, die interessant, uberraschend unc Perbet S et al (2015) High-flow oxygen through hilfreich sind und die ihm helfen, seine Arbeit nasal cannula in acute hypoxemic respiratory für und mit den Patienten zu verbessern failure. N EnglJMed 372(23):2185-2196 Bloos F, Trips E, Nierhaus A, BriegelJ, Heyland Dk Einzigartig ist das Buch auch darin, sich Jaschinski U et al (2016) Effect of sodium selenite durchgängig auf das zu beziehen, was wil administration and Procalcitonin-quided therapy aufgrund wissenschaftlicher Arbeit wissen on mortalityin patients with severe sepsis or septii shock: Arandomized clinical trial.JAMAIntern Mee Ganz besonders im Umgang mit Thoraxdrai 176(9):1266-1276 nagen ist die Vorgehensweise der Kliniker\n\nseptic shock: The ARISE. ProCESS and ProMISe Investigators.IntensiveCare Med 41(9):1549-156 Investigators A. Group ACT. Peake SL. Delaney A Bailey M. Bellomo R et al (2014) Goal-directed resuscitation for patients with early septic shock. N EnglJ Med371(16):1496-1506 7. Mouncey PR. Osborn TM. Power GS. Harrison DA Sadique M7 Grieve RD et al (2015) Trial of early goal-directed resuscitation for septicshock. N Engd JMed 372(14):1301-1311) 8 Investigators TP (2014) A randomized trial o protocol-based careforearly sentic shock N Enal Med 370(18):1683-1693 9 Asfar P MezianiE. Hamel J-E. Grelon E. Megarbane B Anguel N et al (2014) Hiab versus low blood pressuretargetin patientswith septicshock.N Eng IMed 370(",
            "olo Biban, Alan Parker. / Ann 1 Duncan. Cristina 1 A. Car- Mangia, Niranjan Kissoon, and Joseph cillo (Head).\n\n### Appendix\n\nConflict of interest p process\n\n\n![这是图片](all_figs/5FF8AF_Dellinger-2013-Surviving Sepsis Cam_p43_f0.png)\n\n### Appendix\n\nARDSnet ventilator management\n\n\n|    | 0                                                                                                                                                                                                         | 1                                                                                                                                                                                                         | 2                                                                                                                                                                                                         | 3                                                                                                                                                                                                         | 4                                                                                   ",
            " ventilator-associated pneumonia (VAP) [54] but their diagnostic value remains unclear 155 The Gram stain can be usefuul in particular for respira- tory tract specimens, to determine if inflammatory cells are present (greater than five polymorhonuclear leukocvtes high-powered field and less than 10 squamous cells/low- powered field and if culture results will be informative of lower respiratory pathogens. Rapid influenza antigen testing during periods of increased influenza activity in the com- munity is also recommended A focused historv can provide vital information about potential risk factors for infectior and likely pathogens at specific tissue sites. The potentia role of biomarkers for diagnosis of infection in patients presenting with severe sepsis remains undefined. The utility of procalcitonin levels other biomarkers (such as C-reactive protein) to discriminate the acute inflammatory pattern of sepsis from other causes of generalized inflam- mation (e.g., postoperative, other forms of shock) has not been demonstrated. No recommendation can be given fo: the use of these markers to distinguish between 1 severe infection and other acute inffammatory states 56-58 In the near future. rapid, non-culture-based diagnostic methods (polymerase chain reaction, mass spectroscopy microarrays) might be helpful for a quicker identification of pathogens and major antimicrobial resistance determinants 59 . These methodologies could be particularly useful for difficult-to-culture pathogens or in clinical situations where empiric antimicrobial agents have been administered before been obtained. Clinical culture samples were experience remains limited, and more clinical studies are needed before recommending these non-culture molecular methods as replacement for standard blood culture methods 60. 61 2. We suggest the use of the 1,3 β-D-glucan assay (grade 2B), mannan and anti-mannan antibody assays (grade 2C), when invasive candidiasis is in the differentia diagnosis of infection\n\nFig. 1 Surviving sepsis campaign care bundles\n\ncnalengmg, and rapid dlagnostc methodooges, such antigen and antibody detection assays, can be helpful in detecting candidiasis in the ICU patient. These e suggested tests have earlier than shown positive results significantly methods [62-67]. but false-positive standard culture with 1 alone, and their reactions colonization occur diagnostic utility in managing fungal infection in the ICU needs additional study [65]. sbe studies that imaging e performed e recommend promptly in attempts to confirm a potential source infection. Potential sources of infection should be sam- pled as thev are identified and in consideration of patient risk for transport and invasive procedures (e.g., careful coordination and aggressive monitoring if the decision is to transport for a computed tomography-guided made needle aspiration). Bedside studies, such as ultrasound may avoid patient transport (UG).\n\nof studies may identify Rationale.. Diagnostic source infection that requires removal of a foreign body or draiage the likelihood of a satisfactory to maximize t response to therapy. Even in the well-staffed organized and most healthcare facilities, however, transport of patients can be dangerous, as can be placing patients in outside-unitimaging devices that are difficult to access and monitor. Balancing risk and benefit is therefore mandatory in those settings.\n\nD. Antimicrobial therapy\n\nSURVIVING SEPSIS CAMPAIGN CARE BUNDLES TO BE COMPLETED WITHIN 3 HOURS: 1 Measure lactate leve Obtain blood cultures prior to administration of antibiotics 3) Administer broad spectrum antibiotics 4) Administer 30 mL/kg crystalloid for hypotension or lactate ≥ 4 mmol/L TO BE COMPLETED WITHIN 6 HOURS: 5) Apply vasopressors (for hypotension that does not respond to initial fluid resuscitation) to maintain a mean arterial pressure (MAP) >65 mm Ho 6) In the event of persistent arterial hypotension despite volume resuscitation (septic shock) or initial lactate > 4 mmo//L (36 mg/dL) Measure central venous pressure (CVP) - Measure central venous oxygen saturation (ScyO.)* 7) Remeasure lactate if initial lactate was elevated Targets for quantitative resuscitation included in the quidelines are CVP of ≥>8 mm Hg ScvO₂ of ≥ 70%, and normalization of lactate.\n\nshock be the 1C) should (grade goal therapy. Remark: Although the weight of the evidence supports the antibiotics following administration prompt the : shock. recognition and septic sepsis severe with which clinicians may achieve this ideal feasibility: state has not been scientifically evaluated.\n\nRationale. Establishing vascular access and initiating the first priorities when aggressive fluid resuscitation are managing i patients with severe shock sepsis septic Prompt",
            "    |\n|  5 | Pulmonary edema               | RRT is often utilized to prevent the need for ventilatory support; however, it is equally important to manage pulmonaryedema in ventilated patients                                                                                                               | RRT is often utilized to prevent the need for ventilatory support; however, it is equally important to manage pulmonaryedema in ventilated patients                                                                                                               | RRT is often utilized to prevent the need for ventilatory support; however, it is equally important to manage pulmonaryedema in ventilated patients                                                                                                               |\n|  6 | Uremic complications          | Uremic complications                                                                                                                                                                                                                                              | nan                                                                                                                                                                                                                                                               | nan                               ",
            "superior vena cava) or mixed venous oxygen saturation ≥70%\n\nB\n\nRationale. Early goal-directed therapy has been shown to improve survival for emergency department patients presenting with septic shock in a randomized, controlled, single-- (5). Resuscitation directed to- center study ward the previously mentioned goals for the initial 6-hr period of the resuscitation was able to reduce 28-day mortality rate. The consen- and mixed panel judged central venous sus saturation to be equivalent oxvgen venous Either intermittent or continuous measure- ments o saturation are judged to be of oxygen acceptable. A Although lactate 1 measurement may be useful, it lacks precision as a1 measure of tissue metabolic status. In mechanically ventilated patients, a higher target central ve. of 12-15 mm Hg is pressure $ recom mended to account for the increased intratho: racic pressure. Similar consideration may be of increased ab warranted in circumstances dominal pressure. Although the cause in septic patients may be multi- tachycardia in elevated pulse with factorial, a decrease fluid resuscitation is often a useful marker of improving intravascular filling\n\n2. During the first 6 hrs of resuscitation of severe sepsis or septic shock, if central ve- mixed oxygen saturation venous nous oxygen saturation of 70% is not achieved with fluid resuscitation to a central venous of 8-12 Hg. t then transfuse mm pressure packed red blood cells to achieve a hemat ocrit of ≥30% and/or administer a dobut maximum of 20 amine infusion (up to μg-kg min ) to achieve this s goal.\n\nRationale, The protocol used in the study cited previously targeted an increase in mixed venous oxygen saturation to ≥70%. This was sequential institution of initial fluid achieved by resuscitation, then packed red blood cells, a and then dobutamine. This protocol was associated with an improvement in survival (5).\n\n### B. Diagnosis\n\n1. Appropriate cultures should always be ob- tained before antimicrobial therapy is ini- tiated. To optimize identification of caus- ative blood least two organisms, at cultures should be obtained with at least one drawn percutaneously and one drawn through each vascular access o device, un- the device was recently (<48 hrs less inserted. Cultures of other sites such 1as urine, cerebrospinal fluid, wounds, respi- fuids other body ratory secretions, or should be obtained before antibiotic ther-\n\napy is initiated as the clinical situation dictates.\n\nRationale. Two or more blood cultures are recommended (6), Ideally, at least blood one culture should be drawn through each lumen of each Obtaining vascular device. access blood cultures peripherally and through a vas- device is an important strategy. If cular access 1 both the same from organism is recovered cultures, the likelihood that the organism causing the severe sepsis is enhanced. In ad- dition, if the culture drawn through the e vas- earlier device is cular much positive access than the peripheral blood culture (i.e., >2 hrs earlier), it may offer support that the vascular device is the source of the infection (7). access Volume of blood may also be important (8).\n\n2. Diagnostic studies should be ) performed the source of the promptly t to determine infection and the causative organism.  of likely Imaging studies sampling and of infection should be per- sources formed: however, some patients may be too unstable to warrant certain invasive e of the outside procedures transport ICU. Bedside studies, such as ultrasound may be useful in these circumstances.\n\nRationale. Diagnostic studies may identify a source of infection that must be drained to max imize the likelihood of a satisfactory response to therapy. .However, even in the most organized and well-staffed healthcare facilities, transport of be patients dangerous, can placing pa- can tients in outside-unit imaging devices that are difficult to access and monitor.\n\n### C. Antibiotic Therapy\n\n1. Intravenous antibiotic therapy should be started within the first hour of rec- ognition of severe sepsis, after appropri- ate cultures have been obtained\n\nRationale. Establishing vascular access and the fluid initiating aggressive resuscitation first priority when managing patients with se- However, prompt septic shock. sepsis infusion of antimicrobial agents is also a logical strategy and may require additional vascular ac- ports. Establishing a supply of 1 premixed cess antibiotics in an emergency department or crit- for such ical care unit 1 urgent situations is an likeli- appropriate strategy for enhancing the s will be infused hood that antimicrobial agents promptly. Staff should be e cognizant that some time lengthy infusion"
        ],
        "ground_truth": "Preventive medication, particularly sodium bicarbonate, has shown varying degrees of effectiveness compared to saline solution in preventing contrast-induced acute kidney injury (CI-AKI). Several studies have been conducted to evaluate this effectiveness. One study by Ozcan et al. found that the incidence of CI-AKI was significantly lower in the bicarbonate group compared to the saline solution group. Another study by Recio-Mayoral et al. observed a lower incidence of CI-AKI in the bicarbonate group compared to the saline group, although mortality and the need for renal replacement therapy (RRT) did not significantly differ between the groups. Briguori et al. also found a lower incidence of CI-AKI in the bicarbonate/NAC group compared to the saline plus NAC group, but no significant difference was observed in mortality or the need for RRT among different treatment groups. However, a study by Maioli et al. did not find a significant difference in CI-AKI incidence between patients treated with sodium bicarbonate and those treated with saline. Overall, while some studies suggest that sodium bicarbonate may be more effective than saline, particularly when combined with NAC, others do not provide conclusive evidence, indicating that further research is needed to determine the optimal preventive medication for CI-AKI.",
        "metadata": [
            {
                "filename": "Sievert-2013-Antimicrobial-resistant pathogens.pdf"
            },
            {
                "filename": "Sievert-2013-Antimicrobial-resistant pathogens.pdf"
            },
            {
                "filename": "Sievert-2013-Antimicrobial-resistant pathogens.pdf"
            },
            {
                "filename": "Sievert-2013-Antimicrobial-resistant pathogens.pdf"
            }
        ],
        "evolution_type": "negative_rejection"
    },
    {
        "id": 25,
        "question": "什么是AKI严重等级，以及它们如何与患者的病情严重程度和治疗预后相关联？",
        "answer": "该问题与给定的文本内容无关。",
        "contexts": [
            "��相关技术问题 ECMO技术虽然近年来发展迅速,但仍存在- 此尚未突破的技术难题,例如(1)患者是否能从 ECMO支持中获益?对干VV-ECMO月前仅有两项 设计严格的随机对照研究,或存在明显的设计缺 陷,或未能得出ECMO支持显著的生存获益优势: 鉴于伦理问题,自前尚未有VA-ECMO相关的临床 对照研究发表(2.18-19] (2)抗凝策略和抗凝目标如付 选择?ECMO患者的高凝状态使患者及ECMO回 路易于形成血栓,ECMO患者进行持续、全身性抗 凝治疗,以防止ECMO回路血栓形成是重症医学的 共识,但最近-篇包括21项研究(7190例接受 VV-ECMO或VA-ECMO患者)的荟萃分析显示: ECM0运行期间出血事件的发生率为17%~51%。 尤其对于创伤、存在活动性或者高出血风险的患 者,通常存在抗凝禁总证,因此抗凝策略的选择无 疑面临着巨大风险和挑战 。(3)VV-ECMO支持期 间呼吸机参数如何设置?VV-ECMO支持期间,希 望患者自身肺脏得到充分休息,避免进一步肺损 伤,但恢复到什么程度让自身肺脏工作?各个时期 的呼吸机参数如何设置目前仍无定论[21-22 。(4)目 前VA-ECMO绝大多数情况下都是经股动脉插管进 行灌注体外血流与心脏射血方向相反,这样会增 室后负荷,导致左心扩大账满,不利于心功 二经VA-ECMO�",
            "功率并不高。为了推动全球范围 内的ECMO技术交流与应用,在Bartlet教授推动 下国际体外生命支持组织(Extracorporeal Life Support Organization,ELSO)于1989年在密歇根大 学成立但直至2004年,全世界仅有100多家医院 开展此项工作,并且主要集中在西方发达国家。从 2008年ECMO用于成功救治甲型流感患者之后,全 球ECMO数量开始呈现快速增长趋势13 中国内地最早1例真正意义上的ECMO支持 病例始于2002年,但限于当时的经济水平、医疗条 件和医疗报销制度的限制,这一设备没有得到大范 围推广,到2015年全国ECMO中心的数量才突码 随着医疗水平的逐渐发展和医保政策的 100家。 整,中国的ECM0开始有了飞速发展。2019年底 新型冠状病毒肺炎(新冠肺炎)爆发ECMO被用干 重症新冠肺炎惠者的救治,开始进入大众视野;手) 目由于其在新冠疫情救治中起到的重要作用,国家 卫生健康委员会在《新型冠状病毒感染的肺炎诊疗 方案》中将ECMO列为危重症新冠肺炎患者的重要 救治技术,极大地促进了国内各医疗机构进一步开 展ECMO相关培训学习,成立ECMO中心(45 二、ECMO开展现状 近年ECMO临床应用突飞猛进。世界范围内 据ES0的统计数据显示,2019年全球共有488个 ECMO中心,实施ECMO的病例达到17078例,截¥ 2021年10月的统计数据显示2020年注册的ECMQ 中心数增至521个,全年开",
            "利益冲突\n\n### 考 文 献 物\n\n[1]侯晓彤.无规矩不方圆--规范中国体外生命支持技术进 入倒计时Ⅲ,中华医学杂志,2020.100(7):481-483.DO1 10.3760/cma.jissn.0376-2491.2020.07.001. [2] Australia and New Zealand Extracorporeal Membrane Oxvgenation (ANZ ECMO) Influenza Investigators. Davies A. Jones D, et al. Extracorporeal membrane oxygenation for 2009 influenza A(H1N1) acute respiratory distress syndrome[]]. JAMA, 2009, 302(17): 1888-1895. DO1: 10.1001/jama.2009.1535 章晓华,庄建,中国体外膜肺氧合技术开展的现状及思考 Ⅲ,中国体外循环杂志,2017,15(2):68-71.91.DO1 10.13498/j.cnki.chin.j.ecc.2017.02.02 龙村.体外膜肺支持疗法在本世纪中国体外循环的机遇和 挑战[.中国体外循环杂志,2005,3(2):65.DO1:10.3969/j issn.1672-1403.2005,02.001. [5]中国生物医学工程学会体外循环分会,赵举,黑飞龙. 2015中国心脏外科和体外循环数据白皮书1.中国体外循 环杂志,2016,14(3):130-132.D01:10.13498/j.cnki.chin.j ecc.2016.03.02 Extracorporeal Life Support Organization. ECLS International of Statistics [EB/0L]. (2021-10-02) [2022-01-29] Summary https://www. elso.org/Registry/InternationalSummaryandReports) InternationalSummaryaspx [7] Support Organization. World Map of Extracorporeal Life\n\nmembrane oxygenatior for severe acute respiratory syndrome[ll. N 2018 378(21): distress Engl Med 1965-1975.DO1:10.1056/NEIMoa1800385 [19] Peek GI. Mugford M. Tiruvoipati R . et al. Efficacy  and economic assessment of conventional ventilatory support versus extracorporeal membrane oxvgenation for severe (CESAR) adult failure multicentry respiratory randomised controlled trial[ll. Lancet., 2009. 374(9698) 1351-1363D01:10.1016/S0140-6736009)61069-2 B. et al. Bleeding [20] AF O'Gara Ⅱ. Gosling and Nunez thrombotic events in adults s supported with o venovenous extracorporeal membrane oxvgenation: an ELSO registr Care Med 2022. 48(2): 213-224 analysis[Il. Intensive DO1:10.1007/s00134-021-06593-x 21] Vasques E. Romitti i E. Gattinoni . et al. How  wear patients from membrane veno-venous extra-corporeal oxvgenation[ll, Crit Care, 2019, 23(1):316, DO1: 10.1186. s13054-019-2592-5 [22] Schmidt Pham T. Arcadipane et al.  Mechanica during ventilation management extracorporeal for distress membrane oxygenation acute respiratory An syndrome",
            "这充分显示了ECM0中和ECMO团队 在患者预后中的重要作用,当然这也与当时特定的 环境和医疗物资短缺密不可分,笔者发现在大批医 疗队驰援武汉之后,ECMO的开展人数、死亡率均 有了不同程度的改善[12-15 (二)ECMO开展存在巨大地域差异 笔者团队2018年的数据显示,除港澳台外的 中国大陆地区的31个省份中,除了海南、青海和西 藏外,28个省份均有开展ECMO治疗,但务省份开 展例数存在较大差异,最多的省份开展例数超过 300例,而少的省份年开展则不足5例,地域差异非 常明显。在经济发达的东南沿海2018年全年开展 超过1400例,内陆地区则仅400例左右:按照经济 水平划分,国民生产总值(GDP)高的地区年开展\n\n1441例,GDP低的地区则仅开展194例[12] CSECLS的统计数据显示,截至2020年底,国 内开展体外生命支持技术的中心总数为500家,数 量与目前国际ELSO登记单位总数大致相当,但完 成ECMO的数量仅为其1/3左右。其中有将近一半 的ECMO中心开展例数在5例以下(48.6%),开展 笔者团队对2017至 50例以上的中心仅占62% 2019年全国开展ECMO情况进行调查发现(未发 表),全国共有318家医院开展VV-ECMO.3年开展 例数超过50例的中心仅11家,共有342家医院开 展VA-ECMO.3年开展例数超过60例的中心仅 14家。笔者发现,较大的ECMO中心患者预后明 比 优干较小",
            "形态以及有性孢子的形态等进行种的鉴定。培养条件应 标准化,常用的培养基为察氏琼脂或察氏酵母浸膏琼脂。 曲霉孢子2~5um大小,易在空气中悬浮。吸人孢子后 可引起曲霉病,肺和鼻窦最易受累,依据宿主的免疫状态司 产生多种不同的临床类型。对免疫功能正常的个体,曲霉可 成为过敏原或引起肺或鼻窦的限局性感染:对免疫功能严重 受损者,曲霉可在肺或鼻窦处大量生长,然后播散至身体其 他器官。 3.致病性隐球菌.隐球菌属中新生隐球菌是最常见的致 病菌,它包括两个变种,即新生隐球菌新生变种和格特变种 前者广泛分布于世界各地常存在于鸽等鸟类的排泄物 中.几平所有的AIDS患者并发的隐球菌威染均是由该变利 引起:后者主要分布于热带、亚热带地区,可从梅树中分 离到。 新生隐球菌培养产生奶油色醯母样菌落显微镜下可见 球形或椭圆形酵母细胞,直径2~5um.第一代培养物有时 可见小的莱膜。脑脊液直接涂片可见隐球菌的酸母细胞有 较宽的英膜。 健康人对该菌有免疫力,只有当机体抵抗力下降时,病 原菌才易侵人人体致病。该菌最常侵犯中枢神经系统,也可 引起严重的肺部病变,其主要感染途径为呼吸道。隐球菌病 好发干AIDS、�"
        ],
        "ground_truth": "AKI的严重等级代表患者疾病严重程度逐渐增加的患者群，如通过需要肾替代治疗 (RRT) 或定义的死亡率的比例增加来说明。因此，AKI的严重等级被视为重要的综合征，与其他综合征一样重要，如急性冠状动脉综合征、休克、急性肺损伤和脓毒症。严重的RIFLE/AKIN分类与慢性肾脏病质量结果/指标（KDOQI）相当类似，后者已被广泛认可为与心血管并发症和严重的心血管疾病相关，尤其是与慢性肾脏病阶段相关的指南。由于这种相似性，我们已经开发了基于阶段的AKI患者管理和评估推荐，这对于治疗和管理这种疾病非常有用。",
        "metadata": [
            {
                "filename": "Sievert-2013-Antimicrobial-resistant pathogens.pdf"
            }
        ],
        "evolution_type": "negative_rejection"
    },
    {
        "id": 26,
        "question": "急性肾损伤的诊断和治疗方面有哪些关键指导？",
        "answer": "没有提供急性肾损伤诊断和治疗的关键指导内容",
        "contexts": [
            "�组在武 汉均通过集体授课与视频学习等形式再次接受常规动 脉穿刺与超声引导下动脉穿刺培训,保证操作的一致 性。(3)排班:由于COVID-19疫情的特殊性,临床 工作中共设7个护理组,采取轮班制按组别顺序循环 值班开展工作,每组在污染区工作4h。每个护理组 配备1~2名具有超声工作经验的护士。\n\n### 动脉穿刺方法 1.2.2\n\n(1)传统触诊法:患者手心朝上、手腕下部垫\n\n高,使手掌与手臂至少成45°角,碘伏消毒。穿刺 者左手寻找患者烧动脉搏动最强位置,右手持针, 30°角进针,见回血后将动脉针放平,退针芯并将 动脉留置针管送人血管,连接密闭式采血套装,回 抽见回血月通畅为置管成功。若穿刺不成功,拔除 动脉针,按压至穿刺点不再渗血,更换动脉针重新 穿刺,穿刺大于3次仍不成功者考虑更换其他部位 进行置管。 (2)超声引导下外周动脉置管:患者姿势同对 照组。应用Venueultrasound system超声仪(美国GE 公司),血管探头(探头频率5~10MH)用无菌手 套包裹,探头标志点朝向患者右侧。操作者左手用超 声探头平面外(短轴)定位税动脉(图1A),右手 30°角进针,随着进针深人,逐渐向后移动探头,使 针尖持续显示在超声声像中。 当超声声像示针尖�",
            "形态以及有性孢子的形态等进行种的鉴定。培养条件应 标准化,常用的培养基为察氏琼脂或察氏酵母浸膏琼脂。 曲霉孢子2~5um大小,易在空气中悬浮。吸人孢子后 可引起曲霉病,肺和鼻窦最易受累,依据宿主的免疫状态司 产生多种不同的临床类型。对免疫功能正常的个体,曲霉可 成为过敏原或引起肺或鼻窦的限局性感染:对免疫功能严重 受损者,曲霉可在肺或鼻窦处大量生长,然后播散至身体其 他器官。 3.致病性隐球菌.隐球菌属中新生隐球菌是最常见的致 病菌,它包括两个变种,即新生隐球菌新生变种和格特变种 前者广泛分布于世界各地常存在于鸽等鸟类的排泄物 中.几平所有的AIDS患者并发的隐球菌威染均是由该变利 引起:后者主要分布于热带、亚热带地区,可从梅树中分 离到。 新生隐球菌培养产生奶油色醯母样菌落显微镜下可见 球形或椭圆形酵母细胞,直径2~5um.第一代培养物有时 可见小的莱膜。脑脊液直接涂片可见隐球菌的酸母细胞有 较宽的英膜。 健康人对该菌有免疫力,只有当机体抵抗力下降时,病 原菌才易侵人人体致病。该菌最常侵犯中枢神经系统,也可 引起严重的肺部病变,其主要感染途径为呼吸道。隐球菌病 好发干AIDS、�",
            "这充分显示了ECM0中和ECMO团队 在患者预后中的重要作用,当然这也与当时特定的 环境和医疗物资短缺密不可分,笔者发现在大批医 疗队驰援武汉之后,ECMO的开展人数、死亡率均 有了不同程度的改善[12-15 (二)ECMO开展存在巨大地域差异 笔者团队2018年的数据显示,除港澳台外的 中国大陆地区的31个省份中,除了海南、青海和西 藏外,28个省份均有开展ECMO治疗,但务省份开 展例数存在较大差异,最多的省份开展例数超过 300例,而少的省份年开展则不足5例,地域差异非 常明显。在经济发达的东南沿海2018年全年开展 超过1400例,内陆地区则仅400例左右:按照经济 水平划分,国民生产总值(GDP)高的地区年开展\n\n1441例,GDP低的地区则仅开展194例[12] CSECLS的统计数据显示,截至2020年底,国 内开展体外生命支持技术的中心总数为500家,数 量与目前国际ELSO登记单位总数大致相当,但完 成ECMO的数量仅为其1/3左右。其中有将近一半 的ECMO中心开展例数在5例以下(48.6%),开展 笔者团队对2017至 50例以上的中心仅占62% 2019年全国开展ECMO情况进行调查发现(未发 表),全国共有318家医院开展VV-ECMO.3年开展 例数超过50例的中心仅11家,共有342家医院开 展VA-ECMO.3年开展例数超过60例的中心仅 14家。笔者发现,较大的ECMO中心患者预后明 比 优干较小",
            "利益冲突\n\n### 考 文 献 物\n\n[1]侯晓彤.无规矩不方圆--规范中国体外生命支持技术进 入倒计时Ⅲ,中华医学杂志,2020.100(7):481-483.DO1 10.3760/cma.jissn.0376-2491.2020.07.001. [2] Australia and New Zealand Extracorporeal Membrane Oxvgenation (ANZ ECMO) Influenza Investigators. Davies A. Jones D, et al. Extracorporeal membrane oxygenation for 2009 influenza A(H1N1) acute respiratory distress syndrome[]]. JAMA, 2009, 302(17): 1888-1895. DO1: 10.1001/jama.2009.1535 章晓华,庄建,中国体外膜肺氧合技术开展的现状及思考 Ⅲ,中国体外循环杂志,2017,15(2):68-71.91.DO1 10.13498/j.cnki.chin.j.ecc.2017.02.02 龙村.体外膜肺支持疗法在本世纪中国体外循环的机遇和 挑战[.中国体外循环杂志,2005,3(2):65.DO1:10.3969/j issn.1672-1403.2005,02.001. [5]中国生物医学工程学会体外循环分会,赵举,黑飞龙. 2015中国心脏外科和体外循环数据白皮书1.中国体外循 环杂志,2016,14(3):130-132.D01:10.13498/j.cnki.chin.j ecc.2016.03.02 Extracorporeal Life Support Organization. ECLS International of Statistics [EB/0L]. (2021-10-02) [2022-01-29] Summary https://www. elso.org/Registry/InternationalSummaryandReports) InternationalSummaryaspx [7] Support Organization. World Map of Extracorporeal Life\n\nmembrane oxygenatior for severe acute respiratory syndrome[ll. N 2018 378(21): distress Engl Med 1965-1975.DO1:10.1056/NEIMoa1800385 [19] Peek GI. Mugford M. Tiruvoipati R . et al. Efficacy  and economic assessment of conventional ventilatory support versus extracorporeal membrane oxvgenation for severe (CESAR) adult failure multicentry respiratory randomised controlled trial[ll. Lancet., 2009. 374(9698) 1351-1363D01:10.1016/S0140-6736009)61069-2 B. et al. Bleeding [20] AF O'Gara Ⅱ. Gosling and Nunez thrombotic events in adults s supported with o venovenous extracorporeal membrane oxvgenation: an ELSO registr Care Med 2022. 48(2): 213-224 analysis[Il. Intensive DO1:10.1007/s00134-021-06593-x 21] Vasques E. Romitti i E. Gattinoni . et al. How  wear patients from membrane veno-venous extra-corporeal oxvgenation[ll, Crit Care, 2019, 23(1):316, DO1: 10.1186. s13054-019-2592-5 [22] Schmidt Pham T. Arcadipane et al.  Mechanica during ventilation management extracorporeal for distress membrane oxygenation acute respiratory An syndrome",
            "进行校正,报告的效应为未 校正的粗效应,结果可能存在一定偏倚。 综上,三级防护下,利用超声的可视化特性,采 用平面外(短轴)技术联合平面内(长轴)技术对 重症COVID-19患者进行外周动脉置管,可提高首次 置管成功率,减少穿刺次数,降低穿刺并发症的发 生率。\n\n作者贡献:赵明曦、李若祎负责研究设计、数据分 析、论文撰写:孙建华、苏龙翔、李奇、李尊柱、马 鸿鸣、崔文博和罗红波参与研究设计和结果分析:周 翔指导研究设计数据分析并修改论文 利益冲突:无\n\n### 考 献 文\n\n[1]国家中医药管理局办公室中华人民共和国国家卫生健康 委员会办公厅,新型冠状病毒肺炎诊疗方案(试行第八 版)[1],中国医药、2020.15:1494-1499 [11 General Office of National Health Commission of the People's Republic of China, Office of National Administration of Tra- of ditional Chinese Medicine, Diagnosis and treatment virus disease-19 (8th trial edition)[J. Zhongguo corona Yi Yao, 2020, 15: 1494-1499. [2]尹万红,康焰.新型冠状病毒肺炎急性呼吸窘迫综合征 的血流动力学治疗[J1.协和医学杂志,2020,11: 518-521. [2 Yin WH, Kang Y. Hemodynamic therapy for COVID-19 pa syndromeJ. Xie He tients with e respiratory distress acute Yi Xue Za Zhi, 2020, 11: 518-521. 1 LM. al. Ultrasound- [31 RH, Paulin Shiloh 1 AL. Savel et radial guided systematic catheterization artery: a review and meta-analysis of randomized controlled [J. Chest, 2011, 139; 524-529. 等.超声引导下税动脉置管 [4]孙建华,刘大为,王小亭, 的应用进展[J.中国实用护理杂志,2016,32: 1997-2000 Sun JH, Liu DW, Wang XT, et al. Development of applica- tior cannulation of ultrasound guided radia research"
        ],
        "ground_truth": "对于患有急性肾损伤的患者，关键指导包括：评估可能的可逆原因，监测患者的肌酐清除率、尿量和尿液的严重程度，根据推荐对患者进行分级，并根据病因进行治疗。在AKI解决后的几个月内评估新发病或加重的CKD，并根据情况管理这些患者。如果患者患有CKD，则应根据KDOQI CKD指南进行详细管理；如果患者没有CKD，则应将其视为患有CKD风险增加的患者，并根据KDOQI CKD指南为其提供详细护理。",
        "metadata": [
            {
                "filename": "Sievert-2013-Antimicrobial-resistant pathogens.pdf"
            },
            {
                "filename": "Sievert-2013-Antimicrobial-resistant pathogens.pdf"
            }
        ],
        "evolution_type": "negative_rejection"
    },
    {
        "id": 27,
        "question": "手术围手术期肾功能是如何量化的？",
        "answer": "Changes in solute burden should be anticipated (e.g., tumor lysis syndrome), but the exact method is unclear.",
        "contexts": [
            "                                                                                                            | nan |\n\nAdapted from [6]\n\nevidence from high (A)to very low (D) and to determine the strength of recommendations (Tables 3,4)[9-11. The SSC Steering Committee and individual authors collaborated with GRADE representatives to apply the system during the SSC of the guidelines revision process. The1 members GRADE group were directly involved, either in I person or via e-mail, in all discussions and deliberations among the guidelines committee members as to grading decisions.\n\n1. SBP systolic blood 1 <35 °C). tachycardia hypothermia (rectal temperature >38.5 or may be absent in hypothermic patients). and at least one of the ernational normalized ime following indications of altered organ function: altered mental sta tus, hypoxemia, increased serum lactate level, or bounding pulses population are signs tion with hyper-e Adapted from 6\n\nThe GRADE system is based on a sequential assess- ment of the quality o of evidence, followed by assessment of the balance between the benefits and risks., burden, and of a manage- cost. leading to development and grading of quality ment recommendation. Keeping the rating evidence and strength of recommendation explicitly sep- e of the constitutes a crucial and defining feature arate of evi- GRADE approach. This system classifies quality o dence as high (grade A), moderate (grade B), low (grade C), or very low (grade D). Randomized trials begin as high-quality evidence be downgraded due to e but may limitations in implementation, inconsistency, or impreci sion of t and the results, indirectness of the evidence, possible reporting bias (Table 3). Examples of indirect- the studied evidence include ness population interventions used. outcomes measured. and h how these relate to the question of interest. Well-done observational (nonrandomized) studies begin 1 as low-quality evidence. but the level may be upgraded on the basis of a quality effect. An example of this is s the large magnitude quality of evidence for early administration of antibiotics. References to supplemental digital content appendices of GRADEpro Summary of Evidence Tables appear through out this document\n\nTable 3 Determination of the quality of evidence\n\n\n|    | 0                                                                                                                                                                                                                                                                                                                                                                                  | 1                                              ",
            "e Stabilisierung, Volumen- und Katecholamintherapie, Blutprodukte\n\nUber viele Jahre der Algorith- bildete der die Grundlage Rivers-Studie mus füir die Empfehlungen zur hämodyna- mischen Stabilisierung beim septischen Schock. Die Ergebnisse drei grofer Studien, die das Prinzip einer ,early goal-directed therapy\" beim septischen Schock überprüift haben, haben sowohl als auch einzelne Ziel- das Konzept: werte relativiert [5-8]. Güiltig nach I ist dass bei der initialen 1 hämody wie vor,\n\nein mittlerer namischen Stabilisierung arterieller Blutdruck >65 mm Hg ange soll [91. Dies s soll durch strebt werden Volumentherapie kristalloi mit den Lösungen und durch Titration vor Noradrenalin erreicht werden. Erstmals werden schwache Empfehlungen den Einsatz balancierter Lösungen und gegen den Einsatz von kolloidaler Gela- ausgesprochen (niedrige Evidenz) tine Hydroxyäthylstärke bleibt in der Sepsis entsprechend der Zulassungsbeschrän- kung obsolet. Der zentrale Venendruck als statischer Vorlastparameter wurde aufgegeben. Empfohlen wird, dynami- sche Vorlastparameter zur r Beurteilung Volumeneffektes heranzuziehen Grundsätzlich werden eine ,fluid chal- lenge\" und eine wiederholte Evaluierung des Volumenstatus empfohlen, auch mit dem Ziel, eine Volumenüiberladung mit Kristalloiden möglichst zu vermeiden Hierbei orientiert man sich vorwiegend r》goal-directed therapy an Studien zur operativen Bereich. Verlassen aus dem c wurde auch der alte Transfusionstrig eines Hämatokriten von 30 % un ersetzt durch einen Trigger bei einem t von 7 g/dl, basierend Hämoglobinwert auf den Ergebnissen der TRISS-Studie [1o].\n\n### Screening und Qualitäts- management\n\nIn den neuen Leitlinien wird expli- mit Best-Practice-Statement- einer Performance Empfehlung( Improve- Programm empfohlen, welches ment multiprofessionell das standardisierte Hoch- von akut erkrankten Screening risikopatienten in Krankenhäusern ein-\n\nZusammenfassung der Empfehlungen nach klinischer Relevanz und Eividenzgrad\n\n\n|    | 0   | 1                                                                                      | 2                                                                                                                                                                      ",
            "                                                          | 3             |\n|---:|:----|:-----------------------------------|:-----------------------------------------------------------------------------------------------------------------------------------------------------------------------------------------|:--------------|\n|  0 | nan | Whatt should bee considered        | Recommended                                                                                                                                                                              | process       |\n|  1 | es  | High or moderate evidence (is      | The higher the quality ofevidence.tthe more likely athere high or moderate quality                                                                                                       | nan           |\n|  2 | nan | evidence?benefits versus harms and | The higher the quality ofevidence.tthe more likely athere high or moderate quality                                                                                                       | around that1a |\n|  3 | nan | Resource implications (are         | Certainty in or similar values (is The more certainty or similarityin values and preferences, themore likely aa strongrecommendatiorThe lower the cost of anintervention compared to the | nan           |\n|  4 | nan | Resource implications (are         | alternative and other costsfewer resources consumedthe more likely arecommendation                                                                                                       | nan           |\n\nintervention and that most clinicians should use it in most exist in which a strong situations.( Circumstances may recommendation cannot or should not be followed for ar individual because of that patient's preferences or clinical characteristics that make the recommendation less appli- cable. A strong recommendation does not automatically imply standard c of care. For example. the strong recom- mendation for administering antibiotics within 1 h of the diagnosis of severe sepsis, as well as the recommendation of central venous pressure achieving : 8 mmHg and a central venous oxvgen saturation (Scvo2> of 70 % in the first 6 h of resuscitation of sepsis-induced tissue hypoperfusion, although deemed desirable., are not vet standards of care as verified by practice data. Significant education of committee members on the GRADE approach built on the process conducted during 2008 efforts. Several members e of the committee were trained in the use of",
            "                                                                                                                                                                | Requlation of acid-base                                                                                                                                                                                                                                           | nan                                                                                                                                                                                                                                                               |\n| 21 | Solute modulatior             | Changes in solute burden should be anticipated (e.g., tumor lysis syndrome). Although current evidence is unclear                                                                                                                                                 | Changes in solute burden should be anticipated (e.g., tumor lysis syndrome). Although current evidence is unclear                                                                                                                                ",
            " 6) is based on many observa- tional studies that address different settings with 1 regards to the type, severity, duration, and multiplicity of insults. While this heterogeneity provides insight into some susceptibility s populations, the factors that 1 across various are common setting to the generalizability c of results from one particular next is uncertain The course and outcome of AKI are modified by other factors, but since these are manifested within the context of actual disease, they must as\"prognostic' be categorized rather than \"risk\" factors, hence being discussed separately in Appendix D. Lastly, the fact that some 30% of patients whc increased risk of CKD recover from AKI remain cardiovascular disease, and death calls for the identification of the risk factors that can identify such patients in the hopes 50-52 of providing them with timely preventive measures Finally, it screen patients who have is important to undergone an exposure (e.g., sepsis, trauma) and to continue monitor high-risk patients until the risk has subsided. Exact intervals for checking and in which individuals to monitor urine output remain matters of clinical judgment: however, as a general rule, high risk in-patients should have SCr measured at least daily and  more frequently after exposure, and critically ill patients should have urine output monitoring. This will necessitate urinary bladder catheteriza- tion in many cases, and the risks of infection should also be considered in the monitoring plan. A recent clinical practice assessment in the UK concluded that only 50% of patients with AKI were considered to have received a\"good\" overall standard of care. This figure fell to\n\nt over 30% if AKI developed during just hospital admission rather than being diagnosed before admission.53 The authors also felt that there n unacceptable delay in recognizing AKI in 43% that the those condition after developed that in a fifth of such n patients its develop admission, and ment was predictable and avoidable. Their recommendations for. of the initial AKI simple: risk were as assessment part evaluation of emergency admissions, along with appropriate biochemistry on admission and at frequent intervals serum thereafter.\n\n### RESEARCH RECOMMENDATIONS\n\n. Better delineation of risk for hospital- and community- acquired AKI is needed. Better delineation of the effects of age on the risk for AK] is needed.\n\nStudies are needed to develop and validate scoring systems for AKI risk prediction in various settings, ,in addition to cardiac material to radiocontrast and surgery a exposure e association studies are needed to deter- Genome-wide mine risk of AKI in different hospital settings with and respect to long-term outcomes. Studies are needed on risk factors for the development of. from, Ioutcomes ofc and long-term community- recovery AKI, including sepsis, tropical infec- acquired trauma. tions, snake bites, and ingestion of toxic plants, etc.\n\n### SUPPLEMENTARY MATERIAL Annendiv C. Risk Determinatio\n\nAppendix C: Risk Determination. Appendix D: Evaluation and General Management Guidelines for Patients with AKI Supplementary material is linked to the online version of the paper at http://www.kdigo.org/clinical_practice_quidelines/AKl.php\n\nKidney International Supplements (2012) 2, 19-36\n\n© 2012 KDIGO\n\n## general management of Chapter 2.3: Evaluation and c with and at risk for AK patients\n\nGiven that AKl is associated with significant morbidity and specific mortality, and because : treatment is available to : AKI. early and reverse recognition management is para- patients at risk for AKI, or Indeed. recognition of mount. with possible AKI but clinical manifestations, is prior likely to result in only better s than treating outcomes established. 2.2 introduced AKI. Chapter d the approach to risk assessment with further detail provided in Appendix C This with the chapter will itself evaluation concern with risk and general patients even management for, AKI. Further detail is Appendix provided at the highlight the importance of beginning management with earliest point in the development of AKI-in patients who suspected AKI e at increased risk o have even in those been exposed to the various factors discussed in Chapters 2.2 Appendix C much of the remaining chapters in this guide- Although line pertain aspects of AKI, there management of specific t principles that are common are management general be further these will and discussed and here patients expounded upon in Appendix D. Treatment goals in patients\n\n\n![这是图片](all_figs/2CA355_Sievert-2013-Antimicrobial-resistant pathogens_p27_f0.png)\n\nFigure 4 Stage-based management of AKl, Shading of boxes indicates priority of action-solid shading indicates actions that are equally appropriate"
        ],
        "ground_truth": "手术围手术期肾功能量化的指标包括三个肾脏主要终点：峰值血肌酐增加0.15 mg/dl（13.3 umol/1 placebo组0.34 mg/dl [30.1 umol/1]；P <0.001；eGFR减少-10.2 ml/min每1.73 m对照组-17.8 ml min每1.73 m，P = 0.001；初始24小时尿量2.9 ± 1.21 vs. 安慰剂组2.3 ± 11；P <0.001）",
        "metadata": [
            {
                "filename": "Sievert-2013-Antimicrobial-resistant pathogens.pdf"
            }
        ],
        "evolution_type": "negative_rejection"
    },
    {
        "id": 28,
        "question": "ICU患者的高危因素是什么？",
        "answer": "1",
        "contexts": [
            "-resistant pathogens_p75_f0.png)\n\nFigure 13 Sample questionnaire, Asterisks denote questions with the highest association with abnormal renal function, Adapted from Choyke PL, Cady J, DePollar SL et al. Determination of serum creatinine prior to iodinated contrast media: is it necessary in all patients: Tech Urol 1998: 4: 65-69 with permission\n\n### Other risk factors of CI-AKI\n\nwith Besides kidneyo disease  function rena pre-existing 2 CI-AKI other risk factors for developing impairment, include diabetes, hypertension, CHF, advanced age, volume of depletion, hemodynamici instability, concurrent use nephrotoxic medications, and large volume or high osmol- 408,412 ality of the contrast agent. Although there is doubt that diabetes by itself is a an independent risk factor, in a patient with CKD it acts as a risk multiplier,398 Metabolic syndrome hyperuricemia have been identified as prediabetes, and new risk factors for CI-AKI, while the use of ACE-I and angiotensin-receptor blockers (ARB), renal transplantation diabetes mellitus with normal renal function, low-osmolar contrast media, multiple myeloma, female gender, and cirrhosis have been classified as conflicting risk factors for CI-AKI.413 There are conflicting data on the impact of ACE-I or ARB but, overall, there is currently insufficient evidence to recommend discontinuation of these medications prior to contrast-media administration When possible, the administration of contrast media should be delayed in patients with circulatory collapse or CHF until their hemodynamic status corrected. Repeated exposure should delayed for hours in patients without risk factors for CI-AKI, and for 72 hours i in those with diabetes mellitus or pre-existing chronic renal dysfunc- tion. If acute renal dysfunction develops after contrast-media should be preferably administration, repeated exposure 414 delaved until the SCr level has returned to baseline levels. in Concurrent medication-including, nephrotoxic particular, NSAIDs, aminoglycosides, amphotericin B, high\n\nTable 15 CI-AKI risk-scoring model for percutaneous coronary intervention\n\n\n|    | 0                             | 1                            | 2          |\n|---:|:------------------------------|:-----------------------------|:-----------|\n|  0 | Risk factors                  | (calculate                   | (calculate |\n|  1 | Hypotensior                   | Hypotensior                  | nan        |\n|  2 | IABP                          | 5                            | nan        |\n|  3 | CHP                           | 5                            | nan        |\n|  4 | >75 yearsAge                  | 4                            | nan        |\n|  5 | Anemia                        | 3                            | nan        |\n|  6 | nan                           | nan                  ",
            "                    |\n|---:|:------------------------------------------|:--------------------------------------------------------|\n|  0 | Exposures                                 | Susceptibillities                                       |\n|  1 | SepsisCritical illness                    | Dehydration or volumedepletionAdvanced ageFemale gender |\n|  2 | nan                                       | nan                                                     |\n|  3 | Burns                                     | Black race                                              |\n|  4 | Trauma                                    | CKD                                                     |\n|  5 | Cardiac surgery (especiallywith CPB)      | Chronic diseases (heart, lung, liver)                   |\n|  6 | Major noncardiac surgeryNephrotoxic drugs | Cancer                                                  |\n|  7 | Radiocontrast agents                      | Anemia                                                  |\n|  8 | and                                       | nan                                                     |\n|  9 | nan                                       | nan                                                     |\n| 10 | nan                                       | nan                                                     |\n\nCKD, chronic kidney disease; CPB, cardiopulmonary bypass.\n\nHowever, the chances of developing AKI after exposure to the insult differ different individuals. This among same attributed to a number of susceptibility factors which vary widely from individual to individual.",
            "of iodinated associated with a significant incidence of contrast media CI-AKI be could that radiological expected procedures performed an would be with associated an emergency\n\nsummarized of CI-AKI 1 increased 1 but, recently the this published evidence premise is rather e to support 397 scarce.\n\n### Prognosis of CI-AKI\n\nPrognosis or Ci-An Many studies have now shown that patients who develor CI-AKT have a greater risk for death or prolonged hospitali zation, as well as for other adverse outcomes, including earl or late cardiovascular events. The latter r are e more. common after, for example, percutaneous coronary interventions (for review, see McCullough398) ). In a retrospective analysis including 27 608 patients underwent tcoronary angio graphy at the University of Pittsburgh Medical Center during Iodds models a 12-year period, discrete proportional were used to examine the association between increases in SCr ang 30-day in-hospital mortality and LOS, respectively. It appea- red that small absolute (0.25-0.5 mg/dl [22-44 umol/11) ) and relative (25-50%) increases in S SCr were associated with risk-adiusted OR for in-hospital mortality of 1.83 and 1.39 respectivelv: larger increases in SCr generally were associated outcomes 399 with greater risks for these e clinica Moreover when patients with CI-AKI require dialysis, the mortality is higher compared to those not requiring dialysis. For example in the study by McCullough et al 400, the hospital mortality in CI-AK1 was 7.1% Iand 1 35,7% in 1 patients s who o required dialysis, By 2 vears. the e mortality rate in patients whc required dialysis was 81.2%. The more Cardiac Renally recent Angiography Impaired Patients study40 a large, multicenter, prospective double-blind RCT of patients who had moderate to severe CKD and were undergoing cardiad angiography-alsc that the showed adiusted incidence : rate ratio for adverse twice as high 1 in those with CI-AKI. However events was these data demonstrating a temporal association between CI. AKI and t establish a short or long-term prognosis do not the causa relationship, since most in these patients g risk factors s that, in observational studies have 1 underlving  the patient's risk CI-AKI can addition to increasing for overall risk directly their the increase complications studied. Finally, many of the retrospective e studies may alsd have introduced selection bias for patients s who presumably had a clinical reason for having : their SCi concentratior followed Data on the association between risk of ESRD and CI-AK. scarce. In contemporary studies, Cl-AK requiring dialysis developed in almost 4% of patients with underlying renal impairment t and 1 3% of patients undergoing primary for coronary interventions coronary percutaneous acute syndrome. However, only a smal 1proportion of patients dialysis 402,403 continued chronic CI-AK on Although dialysis is 1 requiring relatively rare, the impact on patien is considerable, with high hospital and prognosis 1-yeal mortality rates (for a review, see McCullough398). Only yone study404 the incidence CKD Stage e 4-5 of reported new (eGFR <30 ml/min) following percutaneous coronary inter- ventions and found that this occurred in 0.3% of patient\n\nKidney International Supplements (2012) 2, 69-88\n\nwith an eGFR >30ml/min eand diagnosed 1 at baseline newly kidney disease procedure, and in within 6 months s after the of patients with 0.9% an eGFR>60 ml/min at baseline. These percentages are higher than the estimated annual incidence of CKD at 0.17% that was found in a British general population 405 Thus, careful cohort period of follow-up. tover a 5.5-year follow-up of SCr following contrast long-term f t exposure warranted.\n\nKidney International Supplements (2012) 2, 69-88\n\n### RESEARCH RECOMMENDATION\n\nRCTs examining the epidemiology of Large prospective CI-AKI needed, on long-term outcomes, are especially with attention to controlling for confounders.\n\n### SUPPLEMENTARY MATERIAL Annendiv E. Risks with Gadolir\n\nAppendix E: Risks with Gadolinium-Based Contrast Agents. online version of the paper at Supplementary material is linked to the c http://www.kdigo.org/clinical practice quidelines/AKl.php\n\n© 2012 KDIGO\n\n## at risk of",
            "2012.5\n\nAAMI American Association 1 of Medica Instrumentation ACCP American College of Chest Physicians ACD-A Anticoagulant dextrose solution A ACE-I Angiotensin-converting enzyme inhibitor(s ADQI Acute Dialysis Ouality Initiative AHCPR Agency for Health Care Policy and Research AKD Acute kidney diseases and disorders AKI Acute kidney iniury AKIN Acute Kidney Iniury Network ANP Atrial natriuretic peptide aPTT Activated partial thromboplastin time ARE Angiotensin-receptor blocker(s ARH Acute renal failure ARFTN Acute Renal Failure Trial Network ATN Acute tubular necrosis AUC Area under the curve BMI Body mass index BUN Blood urea nitrogen CDC Centers for Disease Contro CHF Congestive heart failure CI Confidence interva CI-AK Contrast-induced acute kidney injury 1888 Conventional insulin therapy Chronic kidney disease Creatinine clearance Chronic renal failure CRRT Continuous renal replacement therapy CT Computed tomography CVC Central venous catheters CVVH Continuous venovenous hemofiltration CVVHDE Continuous venovenous hemodiafltration eCrC) Estimated creatinine clearance EGDT Early goal-directed therapy eGFR Estimated glomerular filtration rate ERT Evidence Review Team ESRD End-stage renal disease FDA Food and Drug Administratior GFR Glomerular filtration rate HDF Hemodiafiltration HES Hudrovuothuctorcl\n\nKidney International Supplements (2012) 2, 5\n\nHF Hemofltration HIT Heparin-induced thrombocytopenia HR Hazard ratic ia Intraarterial ICU Intensive-care unit IGF-1 Insulin-like growth factor-1 earch IHD Intermittent hemodialvsis IT Intensive insulin therapy i.v Intravenous KDIGC Kidney Disease: Improving Global Outcomes KDOQI Kidney Disease Outcomes Quality Initiative LOS Length of stay MDRD Modification of Diet in Renal Disease M Myocardial infarction MIC Minimum inhibitory  concentratior MRI Magnetic resonance imaging MW Molecular weight NAC N-acetylcysteine NICE-SUGAR Normoglycemia in Intensive Care Evaluation and Survival Using Glucose Algorithm Regulation NKD No known kidney disease NKF National Kidney Foundatior NSP Nephrogenic Systemic Fibrosis OR Odds ratic PD Peritoneal dialysis PICARD Program to Improve Care in Acute Renal Disease RCT Randomized controlled tria RIFLE Risk, Injury, Failure; Loss, End-Stage Rena Disease RR ion Relative risk RRT Renal replacement therapy SAFE Saline vs. Albumin Fluid Evaluation SCr Serum creatinine ScVO2 Central venous oxygen saturation SLED Sustained low-efficiency dialysis TCC Tunneled cuffed catheter VISEP Efficacy of Volume Substitution and Insulin Therapy in Severe Sepsis\n\nKidney International Supplements (2012) 2, 6; doi:10.1038/kisup.2012.6\n\nThe 2011 Kidney Disease: Improving Global Outcomes (KDIGO) Clinical Practice Guideline for Acute Kidney Injury (AKI) aims to assist practitioners caring for adults and children at risk for or with AKI, including contrast-induced acute kidney injury (CI-AKI). Guideline development followed an explicit process of evidence review and appraisal. The guideline contains chapters on definition, risk assessment, evaluation, prevention, and treatment. Definition and staging of AK] are based on the Risk, Injury, Failure; Loss, End-Stage Renal Disease (RIFLE) and Acute Kidney Injury Network (AKIN) criteria and studies on risk relationships. The treatment chapters cover oharmacological approaches to prevent or treat AKI, and management of renal replacement for kidney failure from AKI. Guideline recommendations are based on svstematic reviews of relevant trials. Appraisal of the quality of the evidence and the strength of recommendations followed the GRADE: approach. Limitations of the evidence are discussed and specific suggestions are provided for future research,\n\nKeywords: Clinical Practice Guideline; KDIGO; acute kidney injury; contrast-induced nephropathy; renal replacement therapy; evidence-based recommendation\n\nIn citing this document, the following format should be used: Kidney Disease: Improving Globa Outcomes (KDIGO) Acute Kidney Injury Work Group. KDIGO Clinical Practice Guideline for Acute Kidney Injury. Kidney inter., Suppl. 2012; 2: 1-138.\n\nKidney International Supplements",
            "    | nan      | nan           |\n\nX indicates that the measures can contribute to the diagnosis indicated. AKD, acute kidney diseases and disorders; AKl, acute kidney iniury: CKD, chronic kidney disease,\n\nthe left the size side right side. Renal 10.9cm on and almost decreased with age, of parenchymal entirely because reduction. The lowest 10th length of the left percentiles for l 10.5 10.0cm right kidney and and approximately were respectively, at age 30 years, and 9.5 and 9.0 cm, respectively, :70 years. at age\n\n### AKI, AKD, and CKD Integrated d approach to\n\nwith Clinical for evaluation patients necessary alterations in kidney function or structure. The  expectation will of the the diagnostic Work that approach Group is usually 1 SCr. However, of GFR and begin with : assessment evaluation of kidney function and structure is not complete --including urinalysis, unless markers kidney damage- examination of the urinary sediment, t, and imaging g studies- of the have beer performed. Table 14 shows a summary for r kidney diagnostic using 1 function approach measures and Based on interpretation each structure.] 1 measure separately, the clinical diagnosis indicated by an \"X\" reached.\n\n### SPONSORSHIP\n\nKDIGO gratefully acknowledges the following sponsors that make possible: Abbott, Amgen, Belo Founda- our initiatives Dole Food Company, Genzyme, tion, Coca-Cola Company, Hoffmann-LaRoche, JC Penney, NATCO--The Organization for NKF--Board of Directors. Transplant Professionals, t and Jane Cizik Foundation, Shire, Trans- Novartis, Robert KDIGO Wyeth. Services, and Commercial western funding is supported by consortium of sponsors s and no accepted for the development of specific guidelines.\n\n### DISCLAIM\n\nWhile everye effort is made by the publishers, editorial board and ISN to see that no inaccurate or misleading data, opinion to make this) Iwish they appears in Journal or statement it clear that the data and articles opinions appearing in the of the advertisements herein and the responsibility are\n\nholder, copyright concerned. contributor, advertiser the publishers and the ISN, the editorial board Accordingly, office  and and their respective nd employers agents accept forn the such liability whatsoever any consequences While or misleading inaccurate data, opinion 1 or statement. other doses and that every effort is s made drug ensure advised that quantities are accurately, readers are presented drug and methods and techniques involving new usage, be within this described only followed Journal, should 1 with the drug published manufacturer's conjunction own literature.\n\nSUPPLEMENTARY MATERIAL t Guidelines for Appendix D: Evaluation and General Management Patients with AKI of the paper at Supplementary material is linked to the online version http://www.kdigo.org/clinical_practice_quidelines/AKl.php\n\nKidney International Supplements (2012) 2, 19-36\n\n© 2012 KDIGO\n\n## Section 3: Prevention and Treatment of AK\n\nKidney International Supplements (2012) 2, 37-68; doi:10.1038/kisup.2011.33\n\n## Chapter 3.1: Hemodynamic monitoring a and support and management of AKI for prevention\n\nAs discussed in Chapters 2.3 and Appendix D, patients with AKI and at increased risk for AKI require careful attention to I to their hemodynamic status. This is first because be paid hypotension results in decreased renal perfusion and, if severe or sustained, may result in kidney iniury, Second, the iniured kidney loses autoregulation of blood flow, a mechanism that constant flow despite changes in pressure maintains relatively. above a certain point (roughly, a mean of 65 mm Hg). blood pressure cardiac and Management output require careful titration of fluids and vasoactive medication. Vasopressors can further reduce blood flow to the tissues if there is insufficient circulating blood volume. Conversely patients with AKI are also at increased risk for fluid overload Chapter 3.2) and continued fluid resuscitation despite increased intravascular volume can cause harm. Fluids and should be managed carefully and in vasoactive medications monitoring. Hemodynamic hemodynamic g are discussed in evaluation and monitoring Appendix D In this chapter therapies aimed hemo- at correcting dynamic instability will be discussed. Available therapies to manage hypotension include fluids, vasopressors and proto- cols which integrate these therapies with hemodynamic goals There is an extensive body of literature in this field and for a broader as well as more in depth review the reader is directed to the various reviews and textbooks devoted to critical care and nephrology.70"
        ],
        "ground_truth": "在ICU中,IFI除了可发生于存在免疫抑制基础疾病或接受免疫抑制治疗的患者外,更多的则是发生于之前无免疫抑制基础疾病的重症患者,这与疾病本身或治疗等因素导致",
        "metadata": [
            {
                "filename": "Sievert-2013-Antimicrobial-resistant pathogens.pdf"
            },
            {
                "filename": "Sievert-2013-Antimicrobial-resistant pathogens.pdf"
            },
            {
                "filename": "Sievert-2013-Antimicrobial-resistant pathogens.pdf"
            },
            {
                "filename": "Sievert-2013-Antimicrobial-resistant pathogens.pdf"
            },
            {
                "filename": "Sievert-2013-Antimicrobial-resistant pathogens.pdf"
            }
        ],
        "evolution_type": "negative_rejection"
    },
    {
        "id": 29,
        "question": "什么是透析导管的正确位置，以及为什么正确放置是重要的？",
        "answer": "透析导管的正确位置是在动静脉连接点，确保血液能有效过滤。正确放置可以防止血液回流、感染、血栓形成和血流量问题，减少并发症。",
        "contexts": [
            "generation dialyzer membranes composed of unmodified cellulose were more bioincom- cuprophane or t patible and had the potential to cause a\"dialyzer membrane of reaction\", mediated activation, release complement markers, and oxidative stress, and mani- proinflammatory fested clinically by acute hypotension, vasodilatation, leuco 692-697 penia, hypoxia and fever. More recently, modified cellulosic membranes (with substitution of the hydroxyl groups) and synthetic membranes composed of polvacyl nitrile, polysulfone, or poly(methyl methacrylate) have been developed. These \"biocompatible membranes\" (or less bioincompatible membranes) produce less complement an 697,698 activation, and decrease cvtokine oxidative stress. studies suggest t that Recent platelet activation might alsc 698-701 be involved in the bioincompatibility phenomenon Another membrane characteristic that might have clinical importance is the flux property, with membranes generally being divided in low-flux a and high-flux, the latter having larger pores and thus the potential to clear larger solutes The question of whether membrane bioincompatibility or flux has clinical relevance in the setting of AKI has been the subject of many clinical trials. A recent meta-analysis of 10 randomized I or quasi-randomized controlled trials in 1100 patients could not establish any advantage for biocompatible Of note, the authors n or high-flux membranes. chose to include modified cellulose membranes in the bioincompa tible group, consider modified although other investigators o cellulosic membranes to be biocompatible. When comparing\n\nKidney International Supplements (2012) 2, 89-115\n\ns a trend the synthetic cuprophane, there was : membranes to. mortality with towards reduced the e synthetic membranes This also did the meta-analysis not assess side-effects different membrane compositions on proximal more or fever temporal associations, such as acute hypotension As a result, we agree with the authors' conclusion that the use of either a biocompatible or modified I cellulose acetate membrane appears to be appropriate side-effects Recent observations : revea specific c potential when dialvzer release using certain : membranes, Bradykinin of CRRT with the start syndrome has been observed 703 uncoated AN-69 membranes. release syn- Bradvkinin drome is characterized by acute hypotension and pulmonary vascular congestion, The syndrome is usually self-limited and is pH-dependent, and therefore more pronounced in patient: with severe acidosis, Also, priming of the circuit with banked blood (that is acidotic and contains a large amount of citrate inducing evoke release hypocalcemia) may bradykinin been have to syndrome. Numerous measures 1 published or mitigate this prevent syndrome, including  zero-balance or a HF to normalize the banked blood pH and calcium, given to the bypass: maneuver in which the blood prime is patient instead of the circuit, while the patient is bled on to the circuit with the saline prime discarded.705 Finally, a form of bradykinin release syndrome has been reported in patients 706-708 receiving ACE-I and IHD with AN-69 membranes the conversion and since ACE-I prevent of bradykinin n acidic blooc thereby prolong the hypotensive response when with the AN-69 comes contact membrane. However 704,705 this Nevertheless others interaction have disputed of the potential clinicians should be bradykinin  aware an AN-69 syndrome release uncoated membrane employed for RRT, especially in acidotic patients or in those the receiving ACE-I. Neutralizing the electronegativity of AN-69  with membrane coating polyethyleneimine sig nificantly reduces bradykinin generation. able to Whether dialysis membranes are conventional affect clinical outcomes in sepsis by removal of inflammatory mediators highly controversial. Until further remains dence becomes available, the use of RRT to treat sepsis should be considered experimental\n\n### RESEARCH RECOMMENDATIONS\n\nmiddle- should the Future research impact assess by and/or clearance molecule high-flux membranes adsorption on patient outcome in sepsis. membrane\n\nThe comparator group should be patients with sepsis that do t (if no AKI) or not receive extracorporeal treatment conventional RRT (if AKI).  The potential impact of dialyzer membrane composition patients with AKI (material, flux, on outcomes in etc.)e\n\nremains unsettled, due to the relatively small size of trials. would be useful to conduct larger trials comparing different and patient-centered membranes examining include survival, and outcomes 1 renal recovery,a resource utillization.\n\nKidney International Supplements (2012) 2, 89",
            ": 59: 47-55 Moore I. Bhat R. Hoenich NA. et microbiological survey bicarbonate-based replacement circuits in continuous veno-venous hemo fltration Crit Core Med 2009: 37: 496-500 Ward RA. Worldwide guidelines for the preparation and quality manage 762. of dialysis fluid theit Blood Purif 2009 and imnlementation ment 27 (Suppl 1): 2-4 763. Association for the Advancement of Medical Instrumentation Hemodialysis and Related Therapies, ANSIAAMIVISO 13959:2009. AAMI Arlington, VA. 2010 Association for the Advancement of Medical Instrumentation Concentrate Related Therapies. ANSUAAMI/ISC 13958-2009 for Hemodialysis AAMI- Arlington VA 2011 765. Association for the Advancement of Medical Instrumentation. Ouality of Dialysis Fluid for Hemodialysis and Related Theranies. ANSIUAAMIISC 11663:2009. AAMI: Arlington. VA. 2010 European best practice guidelines for haemodialysis (Part 1). Section I Dialysis fluid purity Nephrol Dial 1 Transplant 2002: 17 (Suppl: 45-62 766. Kolff WI. First clinical experience with the artificial kidney, Ann Intern Med 1965:62:608-619 767. Davenport A, Bouman C. Kirpalani A, et al. Delivery of renal replacemen therapy in acute kidney injurv: what the key issues? Clin I Am Soe are Nephrol 2008: 3: 869-875 Faulhaber-Walter R. Hafer C, Jahr N, et al. The Hannover Dialysis Outcome extended dialysis fo of standard intensified study: comparison versus treatment of patients with 1acute kidnev iniury in the intensive care unit Nephrol Dial Transplant 2009: 24: 2179-2186 769. Ronco C. Bellomo R, Homel P, et al. Effects of different doses in continuous failure: of renal veno-venous haemofiltratior outcomes acute on a prospective randomised trial. . Lancet 2000; 356: 26-30 770 Saudan P. Niederberger M, De Seigneux S, et al. Adding a dialvsis dos to continuous hemofltration increases survival in patients with acute rena failure. Kidney Int 2006; 70: 1312-1317 Schiff H, Lang SM, Fischer R. Daily hemodialysis and the outcome of acute renal failure. N Engl J Med 2002; 346: 305-310 Tolwani AI, Campbell RC, Stofan BS, et al. Standard versus high-dose CVVHDF for ICU-related acute renal failure.J Am Soc Nephrol 2008; 19 1233-1238 773 Paganini EP, Tapolyai M, Goormastic M Establishing a dialysis :link in therapy/patient outcome e unit acute dialysis care patients with acute renal failure. Am J Kidney Dis 1996; 28 (Suppl S81-S89 Ricci Z. Ronco C.D'Amico G, et al. Practice patterns in the management of acute renal failure in the e critically ill patient: an international survey Nephrol Dial Transplant 2006; 21: 690-696 775 Ikizler TA, Sezer MT, Flakoll PJ, et al. Urea space and total body water failure with measurements ; by stable isotopes 1 patient: acute rena Kidney Int 2004; 65: 725-732 Evanson JA, lkizler TA, Wingard R, et al. Measurement of the delivery of dialysis in acute renal failure. Kidney Int 1999; 55: 1501-1508 Evanson [A, Himmelfarb , Wingard R, et al. Prescribed versus delivered dialysis in acute renal failure patients. Am Kidney Dis 1998; 32: 731-738 Schiffl H. Disease severity adversely affects delivery of dialysis in acute rena failure. Nephron Clin Pract 2007; 107: c163-169 Gotch FA, Sargent JA. A mechanistic analysis of the National Cooperative Dialysis Study (NCDS). Kidney Int 1985; 28: 526-534 Held PJ, Port FK, Wolfe RA, et al. The dose of hemodialysis and patien mortality. Kidney Int 1996; 50: 550-556 781. of dialysis dose Eknoyan G, Beck G), Cheung AK al. Effect and hemodialysis. N Engl I Med 2002: 347 membrane flux in maintenance 2010-2019 782. Venkataraman R, Kellum JA, Palevsky P. D",
            "            |\n|  8 | Solute contro                 | BUN reflects factors not directly associated with kidney function, such as catabolic rate and volume statusSCr is influenced by age, race, muscle mass, and catabolic rate, and by changes in its volume of distribution due tofluid administration or withdrawal | BUN reflects factors not directly associated with kidney function, such as catabolic rate and volume statusSCr is influenced by age, race, muscle mass, and catabolic rate, and by changes in its volume of distribution due tofluid administration or withdrawal | BUN reflects factors not directly associated with kidney function, such as catabolic rate and volume statusSCr is influenced by age, race, muscle mass, and catabolic rate, and by changes in its volume of distribution due tofluid administration or withdrawal |\n|  9 | nan                           | Fluid removaFluid overload is an important determinant of the timing of RRT initiation                                                                                                                                                                            | nan                                                                                                                                                                                                                                                               | nan                                                                                                                                                                                                                                                               |\n| 10 | abnormalities                 | abnormalities                                               ",
            "induced The mechanisms 1 renal 1 injury incompletely understood, but I involve both direct may molecular effects and effects of elevated oncotic pressure These concerns have led to the widespread adoption of lower MW starches as iso-oncotic solution, as resuscitation fluids Theoretically, such solutions may have lower nephrotoxicity o appropriately powered however, prospective yet, randomized studies have reported the clinica benefit : and\n\nKidney International Supplements (2012) 2, 37-68\n\nsafety of such solutions in comparison with 1 crystalloids. A recent study by Magder et al. compared 10% 250/0.45 HES to isotonic c saline in 262 patients ; who underwent cardiac surgery.100 These investigators tested whether fewer patients required Icatecholamines the morning after cardiac surgery (a chief determinant of ICU discharge) with HES compared to saline, and found indeed this the case (10.9% was VS 28.8%: P= 0.001). Importantly, the study found no evidence of nephrotoxicity: no difference in the daily creatinine, deve. lopment of AKI by RIFLE criteria during hospital stay (16% in both groups), or need for RRT (1% in each group) Importantly, patients in the saline group received nearly 60% more volume for fluid resuscitation in the ICU compared to HES (887 ys. 1397 ml: P<0 0001) While overall volume were small, advocates for colloid resuscitation will note that this is exactly the reason colloids are preferred for patients requiring large-volume resuscitation The tonicity of colloid preparations may also vary by t meta-analysis described 11 randomized agent. A recent trials s with a total of 1220 patients: seven evaluating albumin and hyperoncotic four evaluating hyperoncotie starch. Hyperoncotic albumin decreased the odds of AKI by 76% while hyperoncotic starch increased those odds by 92% (odds ratio [OR] 1,92: CI 1.31-2.81: P= 0.0008). Paralle effects on mortality were observed. This meta-analysis con cluded that the renal effects of hyperoncotic colloid solution appear to be colloid-specific, with displaying  albumin renoprotection and hyperoncotic starch showing nephro- toxicity. A 7000-patient study comparing 6% HES 130/0.4 in saline with saline alone was scheduled to begin in Australia and New Zealand in 2010. This study will provide further high-quality data to help guide clinical practice 102 Thus, the use of isotonic saline as the standard of care for intravascular volume expansion to prevent or treat AKl is based upon the lack of clear evidence that colloids s are superior for this purpose, along  with some evidence that specifc colloids may cause Akl, in addition to hgher costs. T is acknowledged that colloids may be chosen in some patient: to aid in reaching resuscitation goals, or to avoid excessive fluid administration in patients requiring  volume g large resuscitation, or in specific patient subsets (e.g., a cirrhotic patient with spontaneous peritonitis, or in burns). Similarly although hypotonic or hypertonic crystalloids may be used in specific clinical the choice of crystalloic with scenarios, altered tonicity is generally dictated by: goals other than intravascular volume or expansion (e.g., hypernatremia nyponatremia). One of the concerns with isotonic saline is that this contains 154 mmol/l chloride and  that solution administration in large volumes s will result in relative 01 absolute hyperchloremia (for a review, see Kaplan et al.103) Although direct proof of harm arising from saline-induced hyperchloremia is lacking, buffered salt solutions approxi mate physiological chloride concentrations and their admin istration  less likely to acid-base disturbances cause Whether use of buffered solutions results in better outcome: is, however, uncertain\n\n### VASOPRESSORS\n\n3.1.2: We recommend the use of vasopressors in conjunc- tion with fluids in patients with vasomotor shock with, or at risk for, AKI. (1C\n\n### RATIC ONALE\n\nand factors to Sepsis septic shock are major contributing AKI and appears to be highly vasopressor requirement associated I with AKI in t this population. Despite the higl prevalence of AKI during critical illness in general, and severe sepsis specifically, success has been limited in improving the outcome of this complication Septic shock is the proto- of a high condition, although type output-ow resistance liver failure anaphylaxis, burns, and severe pancreatitis share similar physiologic alterations. Persistent",
            "\n\n### E Grade\n\nRationale. When a glycemic control strat- egy is initiated, hypoglycemia is minimized by providing a continuous supply of glucose sub- patient is Initially, unless the s already strate. profoundly hyperglycemia, this is accom- plished with 5% or 10% dextrose infusion and followed by initiation of feeding, preferably by the enteral route, if tolerated (97).\n\n### N. Renal Replacement\n\n1. In acute renal failure,: and in the absence of hemodynamic instability, continuous venovenous hemofiltration 1 and intermit tent hemodialysis are considered equiva- lent. Continuous hemofiltration offers eas-\n\nB Grade\n\nRationale. Studies support the equivalence of continuous and intermittent renal replace- ment therapies for the treatment of acute re nal failure in critically ill patients (98, 99).In hemodialysis termittent poorly may be hemodynamically tolerated  unstable pa- tients. There is no current evidence to support the use of continuous venovenous hemofiltra- tion for the treatment of sepsis independent of renal replacement needs.\n\n### O. Bicarbonate Therapy\n\n1. Bicarbonate of therapy for the purpose hemodynamics reducing improving vasopressor requirements is not recom- mended for treatment of hypoperfusion- induced lactic acidemia with pH ≥7.15. The effect of bicarbonate administration hemodynamics on and re- vasopressor pH as well s the at lower quirement effect on clinical outcome at any pH has not been studied\n\nRationale There is no evidence to support the use of bicarbonate the treat- therapy in hypoperfusion-induced acidemia as- ment sociated with sepsis. Two studies comparing pH saline and bicarbonate in patients with ≥7.13-7.15 failed to reveal any difference in hemodynamic variables or re- r vasopressor quirements between equimolar  concentra- e with tions of bicarbonate and normal saline either therapy (100, 101).\n\n### P. Deep Vein Thrombosis Prophylaxis\n\n1. Severe patients should sepsis recerve deep vein thrombosis (DVT) prophylaxis with either low-dose unfractionated hep- arin low-molecular r weight heparin For septic patients who have a contrain- dication for heparin I use (i.e., thrombo- active cvtopenia. coagulopathy, severe bleeding. intracerebral hemor: recent rhage), the use of a mechanical prophy- device (graduated lactic compression intermittent stockings compression device) is recommended (unless contra- indicated l the of peripheral presence disease).l vascular very high-risk In pa tients such those who o have severe sepsis and history of DVT, a combination of pharmacologic : and mechanical ther- apy is recommended.\n\n### Grade\n\nRationale. Although no study s been has performed specifically in patients with severe of benefit sepsis, large trials confirming the DVT1 prophvlaxis in general ICU populations have included significant septic numbers patients (102-104). This benefit should be ap-\n\nment of intravascular support (110). On the basis of a number of studies, it is accepted tha aggressive fluid resuscitation with crvstalloid colloids is of fundamental importance to survival of septic shock in children (111. 112) There is only one randomized, controlled tria comparing the use of colloid to crvstalloic resuscitation (dextran gelatin, lactated Ring er's solution, or saline) in children with den gue shock (111) All these children survived regardless of the fluid used but the longes time to recovery from shock occurred in chil dren who received lactated Ringer's solution Among patients with the narrowest pulse pres sure there was a suggestion that colloids wer effective than crvstalloids in restorins more normal pulse pressure Fluid infusion is bes initiated with boluses of 20 mL /ks over 5-10 mins titrated to clinical monitors of cardiae output including heart rate urine outnut capillary refill I and level of consciousness Children normally have a lower blood pressure than adults and prevent reduction in blood pressure by vasoconstrictior and in creasing heart rate Therefore blood pressu by itself is not a reliable end point for assess ing the adequacy of resuscitation, However once hvpotension occurs. cardiovascular col lanse may soon follow Henatomegaly occurs in children who are fluid overloaded and car be a helpful sign of the adequacy of fluic resuscitation."
        ],
        "ground_truth": "正确放置透析导管的位置是在上腔静脉与右心房的交界处，这样导管就能与上腔静脉的长轴平行运行。这样的位置有助于避免导管功能不良和血管血栓形成。放置正确的透析导管对于确保血流畅通非常重要，因为它能够确保血流的顺畅，降低并发症的风险，并确保透析治疗的有效进行。",
        "metadata": [
            {
                "filename": "Sievert-2013-Antimicrobial-resistant pathogens.pdf"
            },
            {
                "filename": "Sievert-2013-Antimicrobial-resistant pathogens.pdf"
            },
            {
                "filename": "Sievert-2013-Antimicrobial-resistant pathogens.pdf"
            },
            {
                "filename": "Sievert-2013-Antimicrobial-resistant pathogens.pdf"
            },
            {
                "filename": "2004+SSC+严重脓毒症与脓毒性休克治疗国际指南.pdf"
            }
        ],
        "evolution_type": "negative_rejection"
    },
    {
        "id": 30,
        "question": "超声引导外周动脉置管如何改善重症COVID-19患者的治疗效果？",
        "answer": "超声引导外周动脉置管的具体改善效果未在文本中提及",
        "contexts": [
            "��相关技术问题 ECMO技术虽然近年来发展迅速,但仍存在- 此尚未突破的技术难题,例如(1)患者是否能从 ECMO支持中获益?对干VV-ECMO月前仅有两项 设计严格的随机对照研究,或存在明显的设计缺 陷,或未能得出ECMO支持显著的生存获益优势: 鉴于伦理问题,自前尚未有VA-ECMO相关的临床 对照研究发表(2.18-19] (2)抗凝策略和抗凝目标如付 选择?ECMO患者的高凝状态使患者及ECMO回 路易于形成血栓,ECMO患者进行持续、全身性抗 凝治疗,以防止ECMO回路血栓形成是重症医学的 共识,但最近-篇包括21项研究(7190例接受 VV-ECMO或VA-ECMO患者)的荟萃分析显示: ECM0运行期间出血事件的发生率为17%~51%。 尤其对于创伤、存在活动性或者高出血风险的患 者,通常存在抗凝禁总证,因此抗凝策略的选择无 疑面临着巨大风险和挑战 。(3)VV-ECMO支持期 间呼吸机参数如何设置?VV-ECMO支持期间,希 望患者自身肺脏得到充分休息,避免进一步肺损 伤,但恢复到什么程度让自身肺脏工作?各个时期 的呼吸机参数如何设置目前仍无定论[21-22 。(4)目 前VA-ECMO绝大多数情况下都是经股动脉插管进 行灌注体外血流与心脏射血方向相反,这样会增 室后负荷,导致左心扩大账满,不利于心功 二经VA-ECMO�",
            "这充分显示了ECM0中和ECMO团队 在患者预后中的重要作用,当然这也与当时特定的 环境和医疗物资短缺密不可分,笔者发现在大批医 疗队驰援武汉之后,ECMO的开展人数、死亡率均 有了不同程度的改善[12-15 (二)ECMO开展存在巨大地域差异 笔者团队2018年的数据显示,除港澳台外的 中国大陆地区的31个省份中,除了海南、青海和西 藏外,28个省份均有开展ECMO治疗,但务省份开 展例数存在较大差异,最多的省份开展例数超过 300例,而少的省份年开展则不足5例,地域差异非 常明显。在经济发达的东南沿海2018年全年开展 超过1400例,内陆地区则仅400例左右:按照经济 水平划分,国民生产总值(GDP)高的地区年开展\n\n1441例,GDP低的地区则仅开展194例[12] CSECLS的统计数据显示,截至2020年底,国 内开展体外生命支持技术的中心总数为500家,数 量与目前国际ELSO登记单位总数大致相当,但完 成ECMO的数量仅为其1/3左右。其中有将近一半 的ECMO中心开展例数在5例以下(48.6%),开展 笔者团队对2017至 50例以上的中心仅占62% 2019年全国开展ECMO情况进行调查发现(未发 表),全国共有318家医院开展VV-ECMO.3年开展 例数超过50例的中心仅11家,共有342家医院开 展VA-ECMO.3年开展例数超过60例的中心仅 14家。笔者发现,较大的ECMO中心患者预后明 比 优干较小",
            "利益冲突\n\n### 考 文 献 物\n\n[1]侯晓彤.无规矩不方圆--规范中国体外生命支持技术进 入倒计时Ⅲ,中华医学杂志,2020.100(7):481-483.DO1 10.3760/cma.jissn.0376-2491.2020.07.001. [2] Australia and New Zealand Extracorporeal Membrane Oxvgenation (ANZ ECMO) Influenza Investigators. Davies A. Jones D, et al. Extracorporeal membrane oxygenation for 2009 influenza A(H1N1) acute respiratory distress syndrome[]]. JAMA, 2009, 302(17): 1888-1895. DO1: 10.1001/jama.2009.1535 章晓华,庄建,中国体外膜肺氧合技术开展的现状及思考 Ⅲ,中国体外循环杂志,2017,15(2):68-71.91.DO1 10.13498/j.cnki.chin.j.ecc.2017.02.02 龙村.体外膜肺支持疗法在本世纪中国体外循环的机遇和 挑战[.中国体外循环杂志,2005,3(2):65.DO1:10.3969/j issn.1672-1403.2005,02.001. [5]中国生物医学工程学会体外循环分会,赵举,黑飞龙. 2015中国心脏外科和体外循环数据白皮书1.中国体外循 环杂志,2016,14(3):130-132.D01:10.13498/j.cnki.chin.j ecc.2016.03.02 Extracorporeal Life Support Organization. ECLS International of Statistics [EB/0L]. (2021-10-02) [2022-01-29] Summary https://www. elso.org/Registry/InternationalSummaryandReports) InternationalSummaryaspx [7] Support Organization. World Map of Extracorporeal Life\n\nmembrane oxygenatior for severe acute respiratory syndrome[ll. N 2018 378(21): distress Engl Med 1965-1975.DO1:10.1056/NEIMoa1800385 [19] Peek GI. Mugford M. Tiruvoipati R . et al. Efficacy  and economic assessment of conventional ventilatory support versus extracorporeal membrane oxvgenation for severe (CESAR) adult failure multicentry respiratory randomised controlled trial[ll. Lancet., 2009. 374(9698) 1351-1363D01:10.1016/S0140-6736009)61069-2 B. et al. Bleeding [20] AF O'Gara Ⅱ. Gosling and Nunez thrombotic events in adults s supported with o venovenous extracorporeal membrane oxvgenation: an ELSO registr Care Med 2022. 48(2): 213-224 analysis[Il. Intensive DO1:10.1007/s00134-021-06593-x 21] Vasques E. Romitti i E. Gattinoni . et al. How  wear patients from membrane veno-venous extra-corporeal oxvgenation[ll, Crit Care, 2019, 23(1):316, DO1: 10.1186. s13054-019-2592-5 [22] Schmidt Pham T. Arcadipane et al.  Mechanica during ventilation management extracorporeal for distress membrane oxygenation acute respiratory An syndrome",
            "效应为未 校正的粗效应,结果可能存在一定偏倚。 综上,三级防护下,利用超声的可视化特性,采 用平面外(短轴)技术联合平面内(长轴)技术对 重症COVID-19患者进行外周动脉置管,可提高首次 置管成功率,减少穿刺次数,降低穿刺并发症的发 生率。\n\n作者贡献:赵明曦、李若祎负责研究设计、数据分 析、论文撰写:孙建华、苏龙翔、李奇、李尊柱、马 鸿鸣、崔文博和罗红波参与研究设计和结果分析:周 翔指导研究设计数据分析并修改论文 利益冲突:无\n\n### 考 献 文\n\n[1]国家中医药管理局办公室中华人民共和国国家卫生健康 委员会办公厅,新型冠状病毒肺炎诊疗方案(试行第八 版)[1],中国医药、2020.15:1494-1499 [11 General Office of National Health Commission of the People's Republic of China, Office of National Administration of Tra- of ditional Chinese Medicine, Diagnosis and treatment virus disease-19 (8th trial edition)[J. Zhongguo corona Yi Yao, 2020, 15: 1494-1499. [2]尹万红,康焰.新型冠状病毒肺炎急性呼吸窘迫综合征 的血流动力学治疗[J1.协和医学杂志,2020,11: 518-521. [2 Yin WH, Kang Y. Hemodynamic therapy for COVID-19 pa syndromeJ. Xie He tients with e respiratory distress acute Yi Xue Za Zhi, 2020, 11: 518-521. 1 LM. al. Ultrasound- [31 RH, Paulin Shiloh 1 AL. Savel et radial guided systematic catheterization artery: a review and meta-analysis of randomized controlled [J. Chest, 2011, 139; 524-529. 等.超声引导下税动脉置管 [4]孙建华,刘大为,王小亭, 的应用进展[J.中国实用护理杂志,2016,32: 1997-2000 Sun JH, Liu DW, Wang XT, et al. Development of applica- tior cannulation of ultrasound guided radia research artery\n\n[J]. Zhongguo Shi Yong Hu  Z",
            "果一致,提示超声引导外居 动脉置管可降低重症COVID-19患者穿刺并发症。传 统触诊法置管可出现仪导管尖端在动脉中,当患者体 位变化时易发生导管异位,移出动脉血失用的情况 血超声可视化技术可确认导管完全进人动脉。据报 道,税动脉起始位置或走形存在变异的比率为 9.6%~15.4% 9] 虽然传统触诊法留置外周动脉导 管通常是安全的,但血肿等并发症仍然不可避凭 (发生率约5%)[10] 对于重症COVID-19黑者多层 防护影响穿刺者操作,可导致穿刺并发症发生率显著 增加(本研究药为40%)。超声的可视化优点能充分 展示动脉与其他组织的位置关系(,有助于减少穿 刺过程中不必要的置管并发症\",对有解剖变异的 患者尤其重要。国际超声引导血管通路操作指南1 建议将超声引导重症患者进行动静脉置管技术列为常 规操作,且初学者练习超声引导税动脉穿刺置管约 14次即可掌握该项操作技能[2]本研究亦证实了重 症医疗工作者掌握该项操作技能的必要性 本研究存在以下局限性:第一,由于疫情的特殊\n\n性,本研究很难进行平行对照设计,对照组为历史对 照,可能存在未能平衡的混杂因素。第二,受限于样 本量,未对潜在混杂因素进行校正,报告的"
        ],
        "ground_truth": "超声引导外周动脉置管在重症COVID-19患者治疗中可以提高首次置管成功率、减少穿刺次数、降低并发症发生率。",
        "metadata": [
            {
                "filename": "中国体外膜肺氧合应用现状及问题.pdf"
            },
            {
                "filename": "中国体外膜肺氧合应用现状及问题.pdf"
            },
            {
                "filename": "中国体外膜肺氧合应用现状及问题.pdf"
            },
            {
                "filename": "三级防护下超声引导外周动脉置管在新型冠状病毒肺炎重症患者中的应用.pdf"
            },
            {
                "filename": "三级防护下超声引导外周动脉置管在新型冠状病毒肺炎重症患者中的应用.pdf"
            }
        ],
        "evolution_type": "negative_rejection"
    },
    {
        "id": 31,
        "question": "盐水追加剂的使用如何可以减少对比介质的使用量？",
        "answer": "通过使用生理盐水作为追加剂来填补静脉血管中的空隙，可以减少对比介质的使用量",
        "contexts": [
            "进行校正,报告的效应为未 校正的粗效应,结果可能存在一定偏倚。 综上,三级防护下,利用超声的可视化特性,采 用平面外(短轴)技术联合平面内(长轴)技术对 重症COVID-19患者进行外周动脉置管,可提高首次 置管成功率,减少穿刺次数,降低穿刺并发症的发 生率。\n\n作者贡献:赵明曦、李若祎负责研究设计、数据分 析、论文撰写:孙建华、苏龙翔、李奇、李尊柱、马 鸿鸣、崔文博和罗红波参与研究设计和结果分析:周 翔指导研究设计数据分析并修改论文 利益冲突:无\n\n### 考 献 文\n\n[1]国家中医药管理局办公室中华人民共和国国家卫生健康 委员会办公厅,新型冠状病毒肺炎诊疗方案(试行第八 版)[1],中国医药、2020.15:1494-1499 [11 General Office of National Health Commission of the People's Republic of China, Office of National Administration of Tra- of ditional Chinese Medicine, Diagnosis and treatment virus disease-19 (8th trial edition)[J. Zhongguo corona Yi Yao, 2020, 15: 1494-1499. [2]尹万红,康焰.新型冠状病毒肺炎急性呼吸窘迫综合征 的血流动力学治疗[J1.协和医学杂志,2020,11: 518-521. [2 Yin WH, Kang Y. Hemodynamic therapy for COVID-19 pa syndromeJ. Xie He tients with e respiratory distress acute Yi Xue Za Zhi, 2020, 11: 518-521. 1 LM. al. Ultrasound- [31 RH, Paulin Shiloh 1 AL. Savel et radial guided systematic catheterization artery: a review and meta-analysis of randomized controlled [J. Chest, 2011, 139; 524-529. 等.超声引导下税动脉置管 [4]孙建华,刘大为,王小亭, 的应用进展[J.中国实用护理杂志,2016,32: 1997-2000 Sun JH, Liu DW, Wang XT, et al. Development of applica- tior cannulation of ultrasound guided radia research",
            "��毒症与脓毒性休克治疗国际指南_p15_f2.png)\n\nPEEP, positive end-expiratory pressure: F/TV, frequency/tidal volume; SBP, ,systolic blood pressure: MV, mechanical ventilation \"Options include T-piece. continuous positive airway pressure 5 cm H-O. or low-level (5-10 cm H₂O typically based on endotracheal tube size) pressure support ventilation (78-80, 135)\n\n",
            "                                                                                                                                                                                                                                                                                                                                                                                                                                                                                                                                                                                   | nan                                   |\n\nSome CT strategies in patients at risk of Cl-AK Perform CT, when possible, without contrast media: scrutinize the examination and discuss with the referral physician-surgeon before deciding or the need for contrast media Dosing per kiloaram body weight to reduce the amount of contrast media is needed in thin patients Adapt iniection duration to scan duration when performing CT-angiography, so that the injection is not still running when the scan is finished Use a saline chaser to decrease the amount of contrast media, by using the contrast medium that otherwise would remain in the dead space of the arm veins; this may save 10-20ml of contrast media Use 80kVp: contrast-medium dose may be reduced by a factor of 1 5-17 compared to the dose used at 120kVp since jodine attenuation increases and combine with increased tube loading (mAs) to maintain signal-to-noise ratio Further reduction of contrast media may be instituted in patients with known decreased cardiac output (not unusual in patients with rena impairment) undergoing CT-angiographic studies Some angiographic strategies in patients at risk of Cl-AK Use biplane when appropriate Avoid test iniections: the same amount may be enough for a diagnostic digital-subtraction angiography run Scrutinize each series before performing the next: avoid unnecessary proiections Decrease kilovoltage in a thin patient: a lower iodine concentration mav be used Assess the physiologic significance of a stenosis by measurement of translesional pressure gradient and fractional flow reserve, a technique wel accepted and validated for the coronary circulation, For different arterial beds, perform manometry of a guestionable stenosis instead of multiple projections Avoid ventriculography: echocardiography (and \"echo contrast\") is always a reasonable alternative Use plasma isotonic contrast-media concentrations for renal artery injections When renal artery stenosis is suspected, map",
            "��入 12 个 RCTs 共计 9044 例患者的 Meta 分析显示参附注射液可显著降 低患者 LAC 水平。我国一项 RCT 研究显示监测血乳酸浓度能够提高复苏效果， 降低脓毒性 休克患者的病死率。以 6h 内血乳酸＜2mmol/L 作为目标指导复苏可明显改善预后。\n推荐意见 5：初始液体复苏及随后的容量替代治疗中，推荐使用晶体液(强推荐，中等 证据质量) 。与晶体液相比，应用胶体液无任何显著获益，且可能导致肾损伤以及凝血机制 异常等不良事件，同时胶体液价格较高， 因此强力推荐脓毒症和脓毒性休克患者的液体复苏 使用晶体液。有研究表明平衡晶体液和生理盐水进行复苏， 晶体液能降低 30d主要肾脏不 良事件发生率；高肌酐和高氯人群使用平衡晶体液避免主要肾脏不良事件获益最大。有研究 表明与限氯策略相比，含氯策略治疗的患者急性肾损伤和肾脏替代治疗(RRT) 的风险增高， 故无论使用哪种液体溶液， 均建议监测血清氯化物水平以避免高氯血症。\n推荐意见 6：不推荐使用羟乙基淀粉进行容量替代治疗 (强推荐，高证据质量)。\n目前已有多项研究对羟乙基淀粉 (HES) 在脓毒症患者中的安全性问题",
            "这充分显示了ECM0中和ECMO团队 在患者预后中的重要作用,当然这也与当时特定的 环境和医疗物资短缺密不可分,笔者发现在大批医 疗队驰援武汉之后,ECMO的开展人数、死亡率均 有了不同程度的改善[12-15 (二)ECMO开展存在巨大地域差异 笔者团队2018年的数据显示,除港澳台外的 中国大陆地区的31个省份中,除了海南、青海和西 藏外,28个省份均有开展ECMO治疗,但务省份开 展例数存在较大差异,最多的省份开展例数超过 300例,而少的省份年开展则不足5例,地域差异非 常明显。在经济发达的东南沿海2018年全年开展 超过1400例,内陆地区则仅400例左右:按照经济 水平划分,国民生产总值(GDP)高的地区年开展\n\n1441例,GDP低的地区则仅开展194例[12] CSECLS的统计数据显示,截至2020年底,国 内开展体外生命支持技术的中心总数为500家,数 量与目前国际ELSO登记单位总数大致相当,但完 成ECMO的数量仅为其1/3左右。其中有将近一半 的ECMO中心开展例数在5例以下(48.6%),开展 笔者团队对2017至 50例以上的中心仅占62% 2019年全国开展ECMO情况进行调查发现(未发 表),全国共有318家医院开展VV-ECMO.3年开展 例数超过50例的中心仅11家,共有342家医院开 展VA-ECMO.3年开展例数超过60例的中心仅 14家。笔者发现,较大的ECMO中心患者预后明 比 优干较小",
            "I患者的预后,但尚缺乏大规模随机对照研究。\n\n### (四)外科治疗\n\n有些IFI需要行外科手术治疗,如曲霉肿,外科摘除是 明确的治疗方法:对鼻窦感染的治疗应联合药物与外科方 法,外科清创术与引流在治疗中十分重要:对心内膜炎患者 应行心脏瓣膜置换手术,月术后要实施药物治疗。当然,对 IF患者需要实施外科治疗的情况还很多,如骨髓炎、心包 炎、中枢神经系统感染引起的颅内脓肿等。\n\n表1CVVH、CVVHD或CVVHDF及IHD时抗真菌药物的剂量调整\n\n\n|    | 0                                                                            | 1                                                         | 2                                                                      | 3                                     |\n|---:|:-----------------------------------------------------------------------------|:----------------------------------------------------------|:-----------------------------------------------------------------------|:--------------------------------------|\n|  0 | 药物名称                                                                     | CVVH                                                      | CVVHD或CVVHDF                                                          | IHD                                   |\n|  1 | 氟康唑伏立康唑伊曲康唑卡泊芬净两性霍素B两性"
        ],
        "ground_truth": "通过使用盐水追加剂，可以减少对比介质的使用量，因为盐水追加剂可以减少否则会留在臂静脉死腔中的对比介质量，从而节省10-20毫升的对比介质。",
        "metadata": [
            {
                "filename": "Sievert-2013-Antimicrobial-resistant pathogens.pdf"
            }
        ],
        "evolution_type": "noise_robustness"
    },
    {
        "id": 32,
        "question": "What is a fluid challenge, and how does it function in the management of acute sepsis?",
        "answer": "1. Fluid challenge is a term used to describe the initial volume expansion period in which the response of the patient to fluid administration is carefully evaluated. It involves administering a specific amount of fluids, typically in the form of crystalloids or colloids, over a short period, usually 30 minutes, to assess the patient's response and avoid the development of edema. The goal is to detect inadequate arterial circulation and guide fluid resuscitation accordingly.",
        "contexts": [
            " require agents more be rapidly infused whereas others can administered as a bolus.\n\nCrit Care Med 2004 Vol, 32. No. 3\n\nhave activity against the likely pathogens fungal) (bacterial and that penetrate The the into sepsis. presumed source  the drugs should be choice of c guided by susceptibility patterns of microorganisms in the community and in the hospital.\n\nRationale. The choice of empirical antibi- otics dependse on complex issues related to the patient's history (including drug intolerance), the clinical syndrome, underlying disease, and patient's com- patterns in the susceptibility munity and in the healthcare facility.\n\nThe initial selection of fan empirical anti- microbial regimen should be broad enough according to these criteria, covering all likely pathogens since there is little margin for error in critically ill patients. There is ample e evi- dence that failure to initiate appropriate ther- therapy that is promptly (i.e..t s active anv against the causative pathogen) has s adverse on outcome (9-12) consequencese Although restricting the use of antibiotics and particularly broad-spectrum antibiotics. is important for limiting superinfection and for antibiotic- the development of decreasingt resistant pathogens, patients with severe sep or r septic shock y warrant broad-spectrum until the causative. n and its therapyt organism antibiotic susceptibilities are defined. At that point, restriction of the number of antibiotics and narrowing the spectrum of antimicrobia therapy is an important and responsible strat- for minimizing the development of resis egv 1 tant pathogens and for containing costs All patients should receive a full loading dose of each antimicrobial. However, patients with sepsis or septic shock often have abnor- mal renal or hepatic function and may have abnormal volumes of distribution due to ag gressive fluid resuscitation. The ICU pharma- cist should be consulted to ensure that serum concentrations are attained that maximize ef- ficacy and minimize toxicity. (13-16).\n\nE\n\nDIauL Rationale. Use of antimicrobial agents with the and reducing a more spectrum narrow e the likelihood duration of therapy will reduce the that develop superinfection patient with or resistant organisms such pathogenic difficile, on Candida species, Clostridium Enterococcus faecium. vancomvcin-resistant However, the to minimize superinfec- desire tions and other complications should not take the need patient give the precedence over e course of potent antimicrobials. an adequate\n\n4. If the presenting clinical syndrome is be due determined to a noninfec tious cause, antimicrobial therapy should be stopped mini- promptly the of development mize resistant and superinfection with pathogens other pathogenic organisms.\n\n### E Grade\n\nRationale. Clinicians should be cognizant blood that be the cultures negative sepsis or septic shock majority cases Thus, the to continue, decision narrow. be made stop antimicrobial therapy must on the basis of clinician judgment and other cul- ture results.\n\n### D. Source Control\n\n1. Every presenting with patient 1severe sepsis should be evaluated for the pres- ence of a focus on infection amenable to measures, specifically control source the drainage of an abscess or local focus of in- debridement on infection, the fected necrotic tissue, the removal of a or the defin potentially infected device, itive control of a source of ongoing mi- crobial contamination (17). (See Appen- dix A for of potential sites examples needing source control.)\n\nE Grade\n\n### Grade\n\nRationale. Case series and e expert opinion support the principle that rapid correction of a source of microbial contamination is essentia survival of the severely septic maximize with acute physiologic patient deterioration.  fol- Intervention should only undertaken and lowing resuscitation. Timely adequate particularly impor- emergent intervention is tant for patients with necrotizing soft tissue intestinal ischemia (19). infection or 1\n\n4. If intravascular access devices are poten- tially the source of severe sepsis or septic shock, they should be promptly removed after establishing other vascular access.\n\n### E Grade\n\nRationale? Intravascular access o devices are be of the majority of thought to the source nosocomial bloodstream infections. When pa- develop sepsis tients unknown source, be to leave reasonable vascular may access of infection devices in place until the e source can be determined. However, when patients have severe sepsis or septic shock of unknown source, clinicians should consider remova and replacement of vascular access  devices to be a priority, even if the device is tunneled or surgically implanted (20, 21).\n\n### E. Fluid Therapy\n\n",
            "lichen Arbeit helfen, die für sich genommen jedoch nicht die grolse Aufmerksamkeit genie(βsen, können in ihre Addition einen signifikanten Einfluss auf da: Gelingen haben. Dieses Buch ist einzigartic in der einfachen, ehrlichen und praktischer Herangehensweise an das Thema,Thorax drainagen\" Das Buch stellt das Thema umfassend dar Es umfasst die Themenfelder Anatomie, Phy siologie, Indikationen, Art der Drainagen, Le gen einer Drainage, Komplikationen, Pflege Management des Pleuraspaltes, Schmerz therapie, Physiotherapie und Entfernen der Drainage. Ich habe viel gelernt, und ich wette dass jeder Thoraxchirurg, egal wie ertahrer er sein mag, in diesem Buch viele Dinge fn den wird, die interessant, uberraschend ung hilfreich sind und die ihm helten, seine Arbei für und mit den Patienten zu verbessern Einzigartig ist das Buch auch darin, sich durchgängig auf das zu beziehen, was wi aufarund wissenschaftlicher Arbeit wissen Ganz besonders im Umgang mit Thoraxdral nagen ist die Vorgehensweise der Klinike\n\nditionen, die vorhandene wissenschaftliche Evidenz tritt zumeist in der Hintergarunc Dieser Bereich illustriert sehr qut die Beob achtung von Stuart Chase, die er bereits 1888 gemacht hat: ,Für die, die glauben, brauch es keinen Beweis, für die, die nicht qlauben ist kein Beweis möglich\". Trotz der doama tischen Glaubensarundsätze und Lager di existieren, gibt es eine groBe Zahl seriöser Daten. Einige der wissenschaftlichen The men sind sicherlich noch nicht umfassend aufaearbeitet. aber Thomas Kiefer hat die existierenden wissenschaftlichen Frkennt nisse gründlich aufgearbeitet. Er hat diese Erkenntnisse an ieder Stelle in einer qut les baren, einfachen Art und Weise eingebracht immer offen und ehrlich betonend., was wi wissen und was wir nicht wissen. Dies führ dazu, dass er einige der häufig zitierten Dod men entlarvt-er tut dies in einer einfacher an Fakten orientieren und sachlichen Ar und Weise. Dieser autrichtige und sachliche Stil der Diskussion und das sich daraus er gebende Management, basierend auf der vorliegenden wissenschaftlichen Erkenntnis sen, zeichnen dieses Buch im Besonderer aus en Schlussendlich ist dieses Buch geschrieben um im klinischen Alltag zu unterstutzen und zu helfen. Es enthalt Aspekte der arztlicher wie der pflegerischen und der physiothe rapeutischen Arbeit, was sich auch in de Auswahl der Co-Autoren widerspiegelt. De Gesamteinfluss des Buches wird grolBser seir als seine einzelnen Kapitel, Obwohl das Buc ein alltagliches Thema zu behandeln scheint emptehle ich es jedem, der sich mit Tho raxdrainagen in seiner klinischen latigkei y beschäftigt, der seine Arbeit für den Patien 2- ten durch Fokussierung aut die eintachen täglichen Routineabläufe erheblich verbes sern m",
            "See initial resuscitation recommendations (A1-2) for timing of resuscitation.\n\n## E Grade\n\nGrade E\n\na. Some experts prefer combination therapy for 1 patients with Pseudomonas infections.\n\nE Grade\n\nb. Most experts would use combination ther- apy for neutropenic patients with severe sepsis or septic shock. For r neutropenic patients,\n\nCrit Care Med 2004 Vol. 32, No. 3\n\nott Williams Wilkins. Unauthorized of this article is prohibited.\n\nRationale. Healthcare professionals should engage specialists in other disciplines such as surgery, pulmonary medicine, and radiology, gastroenterology to obtain diagnostic samples and to drain, debride, e the infection or remove source as appropriate.\n\n2. The selection of optimal source control methods t weigh benefits and risks must of the specific intervention. Source con- trol interventions may further cause complications such as bleeding, fistulas, or inadvertent organ injury; in general, the intervention that accomplishes the with the e least control objective source be employed. upset should physiologic for example, consideration of percutane- ous rather than surgical drainage of fan abscess (18).\n\nRationale. Although prospective studies of of fluid resuscitation in choice patients with meta-analysis of septic shock only are lacking, clinical studies comparing crystalloid and col- loid resuscitation in general and surgical pa- tient populations indicate no clinical outcome difference between colloids and crystalloids and would appear to be generalizable to sepsis of distri- populations (22-24). As the volume bution is much larger for crystalloids than for colloids, with crystalloids re- resuscitation fluid to achieve the end : same quires more points and results in more edema.\n\n2. Fluid challenge in patients with sus- inade- hvpovolemia pected a (suspected given arterial circulation) mayl be quate at a rate of 500-1000 mL of crystalloids or 300-500 mL of colloids s over 30 mins and repeated based on response (increase in blood pressure: and urine output) and tolerance (evidence of intravascular vol- overload). ume\n\n### Grade\n\nRationale. Fluid challenge must be clearly separated from maintenance 1 an increase in fluid administration. Fluid challenge is a term used to describe the initial volume expansion period in which the response of the patient to fluid administration is carefully evaluated. amounts of fluids During t this process, large period of e administered over a short may be e the time under close monitoring to evaluate patient's response and avoid the development edema. The degree e of intravas- of pulmonary deficit in patients with severe cular volume With venodilation and ongoing sepsis varies. capillary leak, most patients require continu- fluid resuscitation during the ing aggressive first 24 hrs of management. Input is typically much greater than output, input/output and ratio is of no utility to judge fluid resuscitation needs during this time  period\n\n### F. Vasopressors\n\nRationale. Below a certain mean arterial autoregulation in various vascular pressure. and perfusion can become lin- beds can be lost, early dependent Thus. on some pa- pressure. to tients therapy t may require vasopressor achieve a minimal perfusion pressure and main flow. It is important tain adequate to supple blood pressure with ment goals such as 1 assess blood lactate ment of global perfusion such fluid resuscitation is a concentrations. Adequate f fundamental aspect of the hemodynamic : man : shock and of patients with septic agement should ideally be achievedl betore e vasopressors are used, but it is frequently necessary to employ vasopressors early as a an emergency measure in patients with severe shock (25, 26).\n\n2. Either norepinephrine dopamine (through a central catheter as soon as avail able) is the first-choice vasopressor agent to correct hypotension in septic shock.\n\nCopyrigt&肠角 ott Williams & Wilkins. Unauthorized reproduction of this article is prchibited\n\noiaue D Rationale. Although there e is no high quality primary evidence to recommend one catecholamine over another, human and an- of imal studies suggest some advantages norepinephrine and dopamine over epineph disad rine (potential tachvcardia. possibly ( eftects on splanchnic circula- vantageous tion) and phenvlephrine (decrease i 1 stroke is the adrenergic volume), Phenvlephrine agent least likelyt to produce tachycardia. Dopamine increases 1 arterial pressure mean and cardiac output,",
            "RT techniques as an adjunct to enhance kidney function, modify fluicbalance, and control solute levels                                                                                                              |\n| 12 | Volume contro                 | Volume contro                                                                                                                                                                                                                                                     | nan                                                                                                                                                                                                                                                               | nan                                                                                                                                                                                                                                                               |\n| 13 | nan                           | in AKI                                                     ",
            "heter-Related Infections MMWI 2002: 51:1-29 O'Grady NP. Alexander M. Dellinger EP. e al: Guidelines for the prevention of intra vascular catheter-related infections. Cli Infect Dis 2002: 35:1281-1307 Choi PTL, Yip G. Quinonez LG, et al: Crys talloids ys, colloids in fluid resuscitation: A systematic review. Crit Care Med 1999: 27 200-210 Cook D. Guyatt G: Colloid Iuse for fluic resuscitation: Evidence and spin. Ann In tern Med 2001: 135:205-208 Schierhout G. Roberts I: Fluid resuscitation with colloid or crystalloid solutions in crit ically ill patients: A svstematic review o randomized trials. BMJ 1998: 316:961-964 Hollenberg SM. Ahrens TS. Astiz ME, et al Practice parameters for hemodynamic sup port of sepsis in adult patients. Crit Care Med 1999:27:639-660 LeDoux D. Astiz ME. Carpati Effects of perfusion pressure on tissue per fusion in septic shock. Crit Care Med 2000 28:2729-2732 Regnier B, Rapin M, Gory G, et al: Haemo dynamic effects of dopamine septie shock. Intensive Care Med 1977; 3:47-53 Martin C, Papazian L, Perrin G, et al: Nor- epinephrine or dopamine for the treatment of hyperdynamic septic shock? Chest 1993 103:1826-1831 Martin C, Viviand X, Leone M, et al: Effect of norepinepnrine on the outcome of septie shock. Crit Care Med 2000; 28:2758-2765 De Backer D. Creteur J, Silva E, et al: Ef fects of dopamine, norepinephrine, and epi nephrine on the splanchnic circulation ir septic shock: Which is best? Crit Care Med 2003:31:1659-1667 Bellomo R, Chapman M, Finfer S, et al Low-dose donamine e in patients s with earl renal dysfunction: A placebo-controlled\n\nCrit Care Med 2004 Vol. 32, No. 3\n\nsis and septic shock. N Engl J Med 1987 317:653-658 Cronin L. Cook DJ. Carlet J. et al: Cortico steroid treatment for sepsis: A critical arn praisal and meta-analvsis of the literature Crit Care Med 1995: 23:1430-1439 The Veterans Administration Systemic Sep Cooperative Study Group: Effect t or high-dose glucocorticoid therapy on mor tality in patients with clinical signs of sep sis N Enal L Med 1987: 317:659--665 Bernard GR Vincent I Laterre PE et al Efficacy and safety of recombinant humar activated protein C for severe sepsis, N Eng J Med 2001:344:699-709 Hébert PC. Wells G. Blaichman MA., et al: A multicenter. randomized, controlled clini cal trial of in critica transfusion care N Enal J Med 1999: 340:409-417 Marik PE, Sibbald WJ: Effect of stored-blood transfusion on oxvgen delivery in patient: with sensis. JAMA 1993: 269:3024-3029 Lorente JA. Landín L De Pablo R. et al Effects of blood transfusion on oxvger transport variables in severe sepsis. Crit Care Med 1993: 21:1312-1318 Corwin HL, Gettinger A. Rodriguez RM, e al: Efficacy of recombinant human erythro poietin in the critically ill patient: A ran domized double-blind. placebo-controlled trial, Crit Care Med 1999: 27:2346-2350 Corwin HL. Gettinger A. Pearl RG, Efficacy of recombinant human erythropoi etin in critically ill patients. JAMA 2002 288:2827-2835 Practice parameter for the use of fresh frozen plasma. cryoprecipitate, and plate lets. Fresh-Frozen Plasma, Cryoprecipitate and Platelets Administration Practice Guidelines Development Task Force of the College of American Pathologists IAM/ 1994:271:777-781 Guidelines for red blood cell and plasma transfusion for adults and children. Report of the Working CMAJ Group. 1997 156(Suppl):S1-S24 Practice guidelines for blood componen therapy. A report by the American Society of Anaesthesiologists Task Force on Blood Component Therapy. Anesthesioloqy 1996 84:732-",
            "                                                                                                                                                                                                                                                                                                                                                                                                                                                                                                                                                                                   | nan                                   |\n\nSome CT strategies in patients at risk of Cl-AK Perform CT, when possible, without contrast media: scrutinize the examination and discuss with the referral physician-surgeon before deciding or the need for contrast media Dosing per kiloaram body weight to reduce the amount of contrast media is needed in thin patients Adapt iniection duration to scan duration when performing CT-angiography, so that the injection is not still running when the scan is finished Use a saline chaser to decrease the amount of contrast media, by using the contrast medium that otherwise would remain in the dead space of the arm veins; this may save 10-20ml of contrast media Use 80kVp: contrast-medium dose may be reduced by a factor of 1 5-17 compared to the dose used at 120kVp since jodine attenuation increases and combine with increased tube loading (mAs) to maintain signal-to-noise ratio Further reduction of contrast media may be instituted in patients with known decreased cardiac output (not unusual in patients with rena impairment) undergoing CT-angiographic studies Some angiographic strategies in patients at risk of Cl-AK Use biplane when appropriate Avoid test iniections: the same amount may be enough for a diagnostic digital-subtraction angiography run Scrutinize each series before performing the next: avoid unnecessary proiections Decrease kilovoltage in a thin patient: a lower iodine concentration mav be used Assess the physiologic significance of a stenosis by measurement of translesional pressure gradient and fractional flow reserve, a technique wel accepted and validated for the coronary circulation, For different arterial beds, perform manometry of a guestionable stenosis instead of multiple projections Avoid ventriculography: echocardiography (and \"echo contrast\") is always a reasonable alternative Use plasma isotonic contrast-media concentrations for renal artery injections When renal artery stenosis is suspected, map",
            "��毒症与脓毒性休克治疗国际指南_p15_f2.png)\n\nPEEP, positive end-expiratory pressure: F/TV, frequency/tidal volume; SBP, ,systolic blood pressure: MV, mechanical ventilation \"Options include T-piece. continuous positive airway pressure 5 cm H-O. or low-level (5-10 cm H₂O typically based on endotracheal tube size) pressure support ventilation (78-80, 135)\n\n"
        ],
        "ground_truth": "A fluid challenge is an initial volume expansion period where the response of the patient to fluid administration is carefully evaluated. During this process, large amounts of fluids may be administered over a short period under close monitoring to evaluate the patient's response and avoid the development of edema. In the management of acute sepsis, fluid challenge helps in assessing the patient's response to fluid administration and guides further fluid resuscitation. It is crucial for evaluating the patient's hemodynamic status and ensuring adequate perfusion, especially during the first 24 hours of management when aggressive fluid resuscitation is often necessary. Input/output ratios are not useful during this period. Instead, the focus is on closely monitoring the patient's response to fluid administration to maintain adequate perfusion and prevent complications such as pulmonary edema.",
        "metadata": [
            {
                "filename": "2004+SSC+严重脓毒症与脓毒性休克治疗国际指南.pdf"
            }
        ],
        "evolution_type": "noise_robustness"
    },
    {
        "id": 33,
        "question": "在严重脓毒症患者中，为什么建议使用持续输注而不是重复 bolus 注射？",
        "answer": "从研究中了解到，使用低剂量氢化可的松时，重复 bolus 注射会导致血糖显著增加，而连续输注则能检测到并避免这些副作用。因此，连续输注被认为是在实践中有良好避免和/或检测这些副作用的策略，所以建议使用连续输注而不是重复 bolus 注射（grade 1D）。",
        "contexts": [
            "\n\n### E Grade\n\nRationale. When a glycemic control strat- egy is initiated, hypoglycemia is minimized by providing a continuous supply of glucose sub- patient is Initially, unless the s already strate. profoundly hyperglycemia, this is accom- plished with 5% or 10% dextrose infusion and followed by initiation of feeding, preferably by the enteral route, if tolerated (97).\n\n### N. Renal Replacement\n\n1. In acute renal failure,: and in the absence of hemodynamic instability, continuous venovenous hemofiltration 1 and intermit tent hemodialysis are considered equiva- lent. Continuous hemofiltration offers eas-\n\nB Grade\n\nRationale. Studies support the equivalence of continuous and intermittent renal replace- ment therapies for the treatment of acute re nal failure in critically ill patients (98, 99).In hemodialysis termittent poorly may be hemodynamically tolerated  unstable pa- tients. There is no current evidence to support the use of continuous venovenous hemofiltra- tion for the treatment of sepsis independent of renal replacement needs.\n\n### O. Bicarbonate Therapy\n\n1. Bicarbonate of therapy for the purpose hemodynamics reducing improving vasopressor requirements is not recom- mended for treatment of hypoperfusion- induced lactic acidemia with pH ≥7.15. The effect of bicarbonate administration hemodynamics on and re- vasopressor pH as well s the at lower quirement effect on clinical outcome at any pH has not been studied\n\nRationale There is no evidence to support the use of bicarbonate the treat- therapy in hypoperfusion-induced acidemia as- ment sociated with sepsis. Two studies comparing pH saline and bicarbonate in patients with ≥7.13-7.15 failed to reveal any difference in hemodynamic variables or re- r vasopressor quirements between equimolar  concentra- e with tions of bicarbonate and normal saline either therapy (100, 101).\n\n### P. Deep Vein Thrombosis Prophylaxis\n\n1. Severe patients should sepsis recerve deep vein thrombosis (DVT) prophylaxis with either low-dose unfractionated hep- arin low-molecular r weight heparin For septic patients who have a contrain- dication for heparin I use (i.e., thrombo- active cvtopenia. coagulopathy, severe bleeding. intracerebral hemor: recent rhage), the use of a mechanical prophy- device (graduated lactic compression intermittent stockings compression device) is recommended (unless contra- indicated l the of peripheral presence disease).l vascular very high-risk In pa tients such those who o have severe sepsis and history of DVT, a combination of pharmacologic : and mechanical ther- apy is recommended.\n\n### Grade\n\nRationale. Although no study s been has performed specifically in patients with severe of benefit sepsis, large trials confirming the DVT1 prophvlaxis in general ICU populations have included significant septic numbers patients (102-104). This benefit should be ap-\n\nment of intravascular support (110). On the basis of a number of studies, it is accepted tha aggressive fluid resuscitation with crvstalloid colloids is of fundamental importance to survival of septic shock in children (111. 112) There is only one randomized, controlled tria comparing the use of colloid to crvstalloic resuscitation (dextran gelatin, lactated Ring er's solution, or saline) in children with den gue shock (111) All these children survived regardless of the fluid used but the longes time to recovery from shock occurred in chil dren who received lactated Ringer's solution Among patients with the narrowest pulse pres sure there was a suggestion that colloids wer effective than crvstalloids in restorins more normal pulse pressure Fluid infusion is bes initiated with boluses of 20 mL /ks over 5-10 mins titrated to clinical monitors of cardiae output including heart rate urine outnut capillary refill I and level of consciousness Children normally have a lower blood pressure than adults and prevent reduction in blood pressure by vasoconstrictior and in creasing heart rate Therefore blood pressu by itself is not a reliable end point for assess ing the adequacy of resuscitation, However once hvpotension occurs. cardiovascular col lanse may soon follow Henatomegaly occurs in children who are fluid overloaded and car be a helpful sign of the adequacy of fluic resuscitation.",
            "eiros DM et al (1998) Effect of a protective ventilation strategy on mortality in the acute respiratory distress syndrome N Engl J Med 338:347-354 236. Brochard L, Roudot-Thoraval F Roupie E et al (1998) Tidal volume reduction for prevention of ventilator induced lung injury in acute respiratory distress syndrome: the multicenter trail group on tidal volume reduction in ARDS. Am J Respir Cri Care Med 158:1831-1838 237. Brower RG. Shanholtz CB, Fessler HE et al (1999) Prospective, randomized controlled clinical trial comparing traditional versus reduced tidal volume ventilation in acute respiratory distres: 'rit Care Med syndrome patients. 27:1492-1498\n\n216. Rodriguez A. Rello J, Neira J et a (2005) Effects of high-dose intravenous immunoglobulin and antibiotics on survival for severe sepsis undergoing surgery, Shock 23:298-304 217, Pildal J. Gotzsche PC (2004 Polvclonal immunoglobulin for treatment of bacterial sepsis: a systematic review Clin Infect Dis 39:38-46 218. Laupland KB. Kirkpatrick AW Delaney A (2007) Polyclonal intravenous immunoglobulin for the treatment of severe sepsis and septic shock in critically ill adults: a svstematic review and meta-analysis Crit Care Med 35:2686-2692 219 Kreymann KG de Heer G Nierhaus A (2007) Use of polyclonal immunoglobulins as adiunctive therapy for sepsis or septic shock. Cr Care Med 35:2677-2685 220. Turgeon AE. Hutton B. Fergusson DA et al (2007) Meta-analysis intravenous immunoglobulin in critically il adult patients with sepsis Ann Intern Med 146:193-203 221. Angstwurm MW. Engelmann I Zimmermann T et al (2007) Seleniun in intensive care (SIC): results of a prospective randomized. placebo controlled. multiple-center study in patients with severe systemic inflammatory response syndrome sepsis. and septic shock. Crit Care Med 35:118-126 222. Forceville X. Laviolle B. Annane I et al (2007) Effects of high doses of selenium, a sodium selenite, in septie shock: a placebo-controlled randomized, double-blind, phase 1 study. Crit Care 11:R73 223. Manzanares W. Biestro A. Torre MH et al (2011) High-dose selenium reduces ventilator-associated pneumonia and illness severity in critically ill patients with systemid inflammation. Intensive Care Med 37:1120-1127 224. Berger MM. Eggimann P, Heyland DK et al (2006) Reduction of nosocomial pneumonia after majo burns by trace element supplementation: aggregation of twd randomized trials. Crit Care 10:R15. 225. Mishra V. Baines M. Perry SE et a (2007) Effect of selenium supplementation on biochemical markers and outcome in critically il patients. Clin Nutr 26:41-50 226. Andrews PJ, Avenell A. Noble DW et al (2011) Randomised trial of glutamine, selenium, or both, to supplemental parenteral nutrition for critically ill patients. BMJ 342:d1542\n\n238. Stewart TE, Meade MO. Cook DJ et al (1998) Evaluation of a ventilatior strategy to prevent barotrauma in patients at high risk for acute respiratory distress syndrome. N Eng J Med 338:355-361 239 Eichacker PC Gerstenberger EF Banks SM et al (2002) Meta-analysis of acute lung iniury and acute resniratory distress svndrome trial: testing low tidal volumes. Am J Respit Crit Care Med 166:1510-15124 240. Putensen C Theuerkauf N. Zinserlins Let al (2009) Meta-analysis ventilation strategies and outcomes of the acute respiratory distress svndrome and acute lung iniury. Ann Intern Med 151:566-576 241. Burns KE. Adhikari NK. Slutsky AS et al (2011) Pressure and volume limited ventilation for the ventilatory management of patients with acute lung iniury: a systematic review and PIos ONE. 6:e1462: meta-analvsis 242. Tobin MJ (2000) Culmination of ar era in research on the acute respiratory distress syndrome. N Engl I Med 342:1360-1361 243. Marini J. Gattinoni L (2004 Ventilatory management of acute respiratory distress syndrome: a Care Med consensus",
            " Evidence Table.\n\nIn one study, the observation of a potential Rationale. interaction between steroid use and ACTH test was not statistically significant [1751. Furthermore, no evidence of this distinction was observed between responders and nonresponders in a recent multicenter trial [178]. Random still be cortisol levels useful for absolute e adrenal may for who insufficiency; however, shock septic patients suffer from relative e adrenal insufficiency (no o adequate e not been stress response), random 1 cortisol levels have demonstrated to be useful. Cortisol immunoassays may actual cortisol level, affecting over- or underestimate the assignment of patients to responders or nonresponders\n\n[184]. Although the clinical significance is not clear, it is now recognized that etomidate, when used for induction for intubation, will suppress the hypothalamic-pituitary- adrenal axis [185. 186]. Moreover, a  subanalysis of the CORTICUS trial [178] revealed that the use of etomidate before application of low-dose steroids was associated with an increased 28-day [187]. An inap- mortality rate propriately low random cortisol level (<18 ug/dL) in patient with shock would be considered an indication for traditional adrenal insufficiency steroid therapy a along guidelines.\n\nRationale. There has been e study comparative between a fixed-duration and clinically guided regimen or between tapering and abrupt cessation of steroids. Three RCTs used a fixed-duration protocol for treatment [175. 177, 178], and therapy decreased after shock reso- was  RCTs [176. 1821. In four studies, steroids lution in two were tapered over several days [176-178. 182], and ste- roids withdrawn abruptly in two RCTs [175. 183]. were crossover study showed hemodynamic and immu- One of after rebound effects nologic cessation abrupt corticosteroids [188]. Furthermore, a study revealed that there is1 no difference in outcome of septic shock patients if low-dose hydrocortisone is used for 3 or 7 days; hence. the be with regard given to no recommendation can optimal duration of hydrocortisone therapy [189]. 4. We recommend that corticosteroids not t be adminis-\n\nRationale. Steroids may be indicated in the presence of steroid therapy or adrenal dysfunction, but a history whether low-dose steroids have preventive potency in reducing the incidence of severe sepsis and septic shock in critically ill patients cannot be answered. A preliminary study of stress-dose level steroids in community-acquired pneumonia showed improved  measures in outcome ✓ RCT population [190], and a recent confirmatory small1 revealed reduced hospital length of stay without affecting mortality [191]. 5. When low-dose hydrocortisone is given, we suggest using continuous infusion rather than repetitive e bolus 2D). injections (grade\n\nRationale. Several randomized trials on the use of low-n patients revealed a dose hydrocortisone in septic shock significant increase of hyperglycemia and hypernatremia [1751 as side effects, A small prospective e study demon- strated that repetitive bolus application of hydrocortisone leads to a significant increase in blood glucose; this peak\n\neffect was g continuous infusion. during detectable Furthermore, considerable inter-individual variability was seen in this blood g peak after the hydrocortisone glucose bolus [192]. Although an association of hyperglycemia and hypernatremia with n patient outcome measures could be not shown. for s strategies practice includes good avoidance and/or detection of these side effects.\n\n### Supportive therapy of severe sepsis (Table 8)\n\nthe 1 and in Once tissue 1 has resolved hypoperfusion absence of extenuating circumstances, such as myocar- dial ischemia, severe hypoxemia, acute hemorrhage, or disease, we recommend that ischemic coronary artery o red blood cell transfusion occur when the hemoglobin concentration decreases to <7.0 g/dL to target a hemo- globin concentration of 7.0-9.0 g/dL in n adults (grade 1B).\n\nRationale. Although  the optimum hemoglobin concen- tration for with sepsis has not been patients severe specifically investigated, the Transfusion Requirements in Critical C Care trial suggested that a hemoglobin level of 7-9 g/dL, compared with 10-12 g/dL, was not associated with increased mortality: in critically ill adults [1931. No differences in 30-day mortality rates significant were observed between treatment groups in the subgroup of patients with severe infections and septic shock (22.8 and 29.7 %, respectively; P = 0.",
            "thropoietin in the primary prevention of AKI in ICU patients at risk for AKI (Supp Table 14). As a guide for choosing the patients for treatment the urinary levels of two biomarkers, the proximal tubula brush border enzymes c-glutamyl transpeptidase and alkaline either were measured. Randomization to phosphatase placebo or two doses of erythropoietin was triggered by an increase j the biomarker concentration product to levels above 46.3. The primary outcome was the relative a average SCr1 increase 1 from baseline over 4-7 days. The triggering with concentration product selected I patients biomarker. illness and at greater risk of AKI, dialysis severe more death; however, the1 urinary marker elevations were transient. The use of the biomarkers allowed randomization within an average of 3.5 hours of a positive sample. There was no difference in the incidence of erythropoietin-specifi no difference adverse events; however, there in the primary outcome between the placebo and treatment groups\n\n### RESEARCH RECOMMENDATION\n\na potential clinical benefit . Recent animal studies suggest a of erythropoietin in AKI. In various models rodent AKI consistently improved functiona erythropoietin The action recovery. renoprotective erythropoietin be s including related to may pleomorphic properties antiapoptotic and antioxidative effects, stimulation of cell\n\nAlthough proliferation, and mobilization. stem-cell AKI the RCT in 1 of human prevention was recent one the negative usefulness of erythropoietin in human AKI should be further tested in RCTs.\n\n### SUPPLEMENTARY MATERIAL\n\nSupplementary Table 14: Summary table of RCTs examining the effect of erythropoietin vs. placebo for the prevention of AKI. Supplementary material is linked to the online version of the paper at http://www.kdigo.org/clinical_practice_quidelines/AKl.php\n\nKidney International Supplements (2012) 2, 37-68\n\n© 2012 KDIGO\n\n## Chapter 3.7: Adenosine receptor antagonists\n\nThe activation of tubuloglomerular feedback in response to elevated luminal chloride concentrations in the distal renal tubules is event in ischemic AKI. Adenosine released an early the binds to feedback loop tubuloglomerular: as part glomerular adenosine vasoconstriction receptor, causing of the afferent arteriole, decreased renal blood flow and GFR n role of sodium water retention. This well-known and and this of adenosine in body phenomenon has stimulated AKI with adenosine seeking or research treat prevent e clinical syndromes primarily three receptor antagonists, with increased risk of AKI: perinatal asphyxia, radiocontrast cardiorenal syndrome. Theophylline is a and exposure, e adenosine receptor antagonist. nonselective\n\n3.7.1: We of theophylline dose single that suggest may be given in neonates with severe perinatal asphyxia at high risk of AKI. (2B) who are\n\n### RATIO ONALE\n\nAKI occurs 60% from perinatal neonates suffering asphyxia. 257 important role studies i indicated Experimental of adenosine-mediated vasoconstriction in neonatal kidneys exposed to normocapnic hypoxemia 258 A potential renoprotec- tive effect of theophylline in perinatal asphyxia has been assessed placebo-controlled clinical trials 259-261 randomized, r including : a total of 171 term 1neonates, Theophylline administered in the first hour of life as a single i.y uniformly bolus at a dose of 5 mg/kg259,261 or 8 mg/kg.260 The three studies all observed significantly higher GFR, higher urine output with more negative fluid balance, and lower urinary β32-microglobu- lin excretion, with theophylline as compared to placebo during the first 3-5 days of life. In each study, theophylline treatment was associated with a significantly reduced risk of severe renal RR vs. 55-60% in placebo 0(17-25% dysfunction group, 0.3-0.41). The beneficial effect was selective for kidney function of central nervous system, cardiac whereas the incidence and gastrointestinal complications was unaltered. pulmonary, Patient survival was not affected by treatment. In line with these a similar improvement of GFR and studies in mature neonates, a urine output was observed during the first 2 days of life by administration of 1 mg/kg theophylline vs. placebo in 50 The syndrome. pre",
            " (shock reversal secondary (days primary ventilation, ICU mortality) endpoints [222] mechanical VAPin the selenium Another small RCT revealed less early P = 0.04). but no difference in late VA group? outcomes s such as ICU or hospital mortality  223 ondary This is in accordance with 2 RCTs that resulted in reduced number of infectious episodes 224 or increase in gluta- thione peroxidase concentrations [225]; neither study, however, showed a beneficial effect on secondary outcome measures (renal replacement. ICU mortality) [224. 225] A more recent large RCT tried to determine if the addition of relatively low doses of supplemental selenium\n\n(glutamine was also tested in a two-factorial design) to o in critically nutrition reduces parentera patients outcome [226]. Selenium supple- infections and improves e mentation did not significantly affect the development of a % CI. 0.57-1.15). new infection (OR. 0.81: 95 o and the 6-month mortality rate was not unaffected (OR. 0.89: 95 % CI, 0.62-1.29). In addition, length of stay, days of antibiotic Failure and modified Sequential Organ >Assessment use. were not significantly affected by selenium 227]. score of In addition to the lack evidence, the questions optimal dosing and application mode remain unanswered Reported high-dose regimens have involved a loading dose followed by an infusion, while  animal trials suggest that bolus dosing could be more effective [227]; this, however. has not been tested in humans. These unsolved problems require additional trials, and we encourage conducting large multicenter studies to further evaluate the effectiveness of sepsis. This intravenous selenium in patients with severe does of low-dose recommendation not exclude the use of the standard minerals and oligo-ele. selenium as part ments used during t total parenteral nutrition (TPN).\n\nN. History of recommendations regarding use of recombinant activated protein C\n\nprotein C (rhAPC) was Recombinant human activated p approved for use in adult patients in a number of countries in 2001 following the Recombinant Human Activated Worldwide Evaluation Protein e Sepsis Severe (PROWESS) trial, which enrolled 1.690 severe sepsis patients and showed: a significant reduction in mortality compared with placebo (30.8 % with rhAPC (24.7 %) P = 0.005)  2004 SSC [2281 guidelines recom- of rhAPC in line with the product labeling mended use required by the US and European regulatory instructions r 8 authorities with a grade B quality of evidence [7, By the time of publication of the 2008 SSC guidelines additional studies of rhAPC in severe sepsis (as required by regulatory agencies) had shown it ineffective in less severely ill as in sepsis as well with severe patients 2301. The 2008 SSC children recommendations reflected these findings, and the strength of the rhAPC recommendation was downgraded to a suggestion for use in adult patients with a clinical assessment of high risk of death, most of whom will have Acute Physiology and Chronic Health Evaluation (APACHE) II scores >250 multiple organ failure (grade 2C: quality of evidence was C [7. The 2008 downgraded from 2004. from B to also also recommended against use of rhAPC in guidelines low-risk adult patients, most of whom will have APACHE I scores (grade 1A), and <20 or single organ failures in all pediatric patients (grade 1B). against use: SHOCK trial (1.696 the PROwESS S The results of t patients) were released in late 2011, showing no benefit of rhAPC in patients with septic shock (mortality 26.4 % for\n\nrhAPC. 24.2 % placebo) with a relative risk of 1.09 and a P value of 0.31 [231]. The drug was withdrawn from the market and is no longer available, negating need for an SSC recommendation regarding its use.\n\nO. Mechanical ventilation of sepsis-induced acute respiratory distress syndrome 1.We recommend that clinicians target a tidal volume of 6 mL/kg predicted body weight in patients with sepsis- distress syndrome (ARDS) induced acute respiratory (grade 1A vs. 12 mL/kg). 2. We recommend that plateau pressures be measured in with ARDS and that the initial upper limit patients 1 goal for plateau pressures in a passively inflated lung be 30 cmH,O (grade 1B).\n\nRationale. note, studies used to determine recom mendations in this section enrolled patients using criteria from the American-European Consensus Criteria Defini tion for Acute Lung Iniury",
            "utamine is the first choice inotrope for Rationale. patients with measured or suspected low cardiac output in of adequate left ventricular filling pressure the presence e (or clinical assessment of adequate fluid resuscitation) and adequate MAP. Septic patients who remain hypotensive or after fluid resuscitation may have low. 1 normal. t with a increased cardiac outputs. Therefore, treatment combined inotrope/vasopressor, such as norepinephrine on is recommended if cardiac output is not epinephrine, When the capability exists for monitoring measured. cardiac output in addition to blood pressure, a vasopres- sor, such norepinephrine, may be used separately to asj of MAP and cardiac output. Large target specific levelso prospective clinical trials, which included critically ill (CU patients who had severe sepsis, failed to demonstrate benefit from increasing oxygen delivery to supranormal targets by use of dobutamine [173, 174]. These studies did t specifically target patients with severe sepsis and did not evidence of not target the first 6 h of resuscitation. Ife hypoperfusion persists despite adequate intravas- tissuel MAP, a viable alternative cular volume and adequate (other than reversing underlying insult) is to add inotropic therapy.\n\n1.We suggest not using intravenous hydrocortisone as a treatment of adult septic shock patients if a adequate fluid resuscitation and y able to vasopressor therapy are Initial for hemodynamic stability (see goals restore Resuscitation). If this is not t achievable. we suggest intravenous hydrocortisone alone at a dose of 200 mg 2C). per day (grade 2\n\ne shock patients to fluid Rationale. The response of septic seems to be important factor and vasopressor therapy s in selection of patients for optional hydrocortisone ther- of RCT e French apy. One multicenter patients shock (hypotension vasopressor-unresponsive septic despite fluid resuscitation and vasopressors for more than 60 min) showed significant shock reversal a and reduction patients with relative adrenal insuffi- of mortality rate in as ciency Idefined hormone postadrenocorticotropic (ACTH) cortisol increase <9 ug/dL [1751. Two smaller RCTs also showed significant effects on shock reversa with steroid therapy [176, 177]. In 1 contrast. a 1 large,\n\n trial  enrolled European multicenter (CORTICUS) that shock and had a lower risk of patients without sustained : death than the French trial failed to : show a mortality benefit with steroid therapy [178]. Unlike the French trial patients with blood enrolled shock that only pressure to vasopressor therapy. the CORTICUS unresponsivei included patients with study septic shock regardless the blood how responded to vasopressors: the oressure study baseline (placebo) 28-day mortality rate was 61 and 31 %, respectively, The use of the ACTH test (responders and nonresponders) did not predict the faster resolution of shock. In: recent years, several systematic reviews have of low-dose h examined the use hydrocortisone in septic with contradictory shock al. [1797 results: Annane et analyzed the results o of 12 studies and calculated a sig 1in 28-day mortality with nificant reduction prolonged ow-dose steroid treatment in adult septic shock patients RR. 0.84: 95 % CI. 0.72-0.97: P 0.02). In parallel Sligl: and colleagues [180 used a similar technique, but only identified eight studies for their meta-analysis, six of which had a high-level RCT design with low risk of bias [181l. In contrast I review. this to the aforementioned analysis revealed no: statistically: significant difference in mortality (RR, 1.00: 95 % CI. 0.84-1.18). Both reviews however, confirmed the improved shock reversal by using ow-dose hvdrocortisone l80.18IL. A recent review on the use of steroids in underlined the 1 adult septic shock r importance of selection of studies for systematic analysis [181] and identified only 6 high-level RCTs as adequate 78. 182, 183 . When or systematic review onl these six studies are analyzed, we found that in \"low risk patients from three studies ( with a placebo (ie.. those mortality rate of less than 50 %, which represents the all patients), hydrocortisone failed to show majority any benefit on outcome (RR 1.06). The minority of patients from the remaining three studies, who had a placebo mor- talitv of greater than 60 %,showed a nonsignificant trend to lower mortality by using hydrocortisone. See Supplementa Digital Content 4. Summary of",
            "利益冲突\n\n### 考 文 献 物\n\n[1]侯晓彤.无规矩不方圆--规范中国体外生命支持技术进 入倒计时Ⅲ,中华医学杂志,2020.100(7):481-483.DO1 10.3760/cma.jissn.0376-2491.2020.07.001. [2] Australia and New Zealand Extracorporeal Membrane Oxvgenation (ANZ ECMO) Influenza Investigators. Davies A. Jones D, et al. Extracorporeal membrane oxygenation for 2009 influenza A(H1N1) acute respiratory distress syndrome[]]. JAMA, 2009, 302(17): 1888-1895. DO1: 10.1001/jama.2009.1535 章晓华,庄建,中国体外膜肺氧合技术开展的现状及思考 Ⅲ,中国体外循环杂志,2017,15(2):68-71.91.DO1 10.13498/j.cnki.chin.j.ecc.2017.02.02 龙村.体外膜肺支持疗法在本世纪中国体外循环的机遇和 挑战[.中国体外循环杂志,2005,3(2):65.DO1:10.3969/j issn.1672-1403.2005,02.001. [5]中国生物医学工程学会体外循环分会,赵举,黑飞龙. 2015中国心脏外科和体外循环数据白皮书1.中国体外循 环杂志,2016,14(3):130-132.D01:10.13498/j.cnki.chin.j ecc.2016.03.02 Extracorporeal Life Support Organization. ECLS International of Statistics [EB/0L]. (2021-10-02) [2022-01-29] Summary https://www. elso.org/Registry/InternationalSummaryandReports) InternationalSummaryaspx [7] Support Organization. World Map of Extracorporeal Life\n\nmembrane oxygenatior for severe acute respiratory syndrome[ll. N 2018 378(21): distress Engl Med 1965-1975.DO1:10.1056/NEIMoa1800385 [19] Peek GI. Mugford M. Tiruvoipati R . et al. Efficacy  and economic assessment of conventional ventilatory support versus extracorporeal membrane oxvgenation for severe (CESAR) adult failure multicentry respiratory randomised controlled trial[ll. Lancet., 2009. 374(9698) 1351-1363D01:10.1016/S0140-6736009)61069-2 B. et al. Bleeding [20] AF O'Gara Ⅱ. Gosling and Nunez thrombotic events in adults s supported with o venovenous extracorporeal membrane oxvgenation: an ELSO registr Care Med 2022. 48(2): 213-224 analysis[Il. Intensive DO1:10.1007/s00134-021-06593-x 21] Vasques E. Romitti i E. Gattinoni . et al. How  wear patients from membrane veno-venous extra-corporeal oxvgenation[ll, Crit Care, 2019, 23(1):316, DO1: 10.1186. s13054-019-2592-5 [22] Schmidt Pham T. Arcadipane et al.  Mechanica during ventilation management extracorporeal for distress membrane oxygenation acute respiratory An syndrome"
        ],
        "ground_truth": "为避免低剂量氢化可的松使用的不利副作用，建议使用持续输注而不是重复 bolus 注射，因为多项随机试验显示，在脓毒症休克患者中使用低剂量氢化可的松会显著增加高血糖和高钠血症的发生率作为副作用。一项小型前瞻性研究表明，重复 bolus 注射氢化可的松会导致血糖显著升高；这种高峰效应在持续输注期间无法检测到。此外，观察到这种血糖峰值与高血糖和高钠血症对患者结果措施的相关性未能显示。因此，对这些副作用的避免和/或检测包括实践策略是至关重要的。",
        "metadata": [
            {
                "filename": "Dellinger-2013-Surviving Sepsis Cam.pdf"
            },
            {
                "filename": "Dellinger-2013-Surviving Sepsis Cam.pdf"
            }
        ],
        "evolution_type": "noise_robustness"
    },
    {
        "id": 34,
        "question": "What is the role of platform pressure limits in mechanical ventilation for patients with acute respiratory distress syndrome (ARDS) induced by sepsis, particularly regarding their impact on patient outcomes or relevance to ventilator settings?",
        "answer": "The platform pressure limits are crucial in managing ARDS patients with sepsis, but the exact effects on patient outcomes or its relevance to ventilator settings are not mentioned in the context. (Weakly supported)",
        "contexts": [
            " data the median normally i are presented e (IOR) and were and interquartile analysed using  range the test. To iden- Mann-Whitney nonparametric tify effects the adjusted on e structural variables multivariate con- patient analysis outcomes, was ducted using generalized linear mixed models with two of effects random intercept t models to demonstrate the The the region and location. model took into account the e fact that from the city region or patients same similar characteristics that may have unmeasured are the similar because patient would more outcomes that in patients from  the patients than in e region same different model regions. The mixed-effects are across 1 separately for each patient outcome. analyses were run\n\nto Covariates that be important considered were the the factors in based on patient impact outcomes prior literature and the taken univariate analysis were addition as candidates for inclusion in the models. In of ICU patients with patient variables (the proportion APACHE II score an e≥15 (%)) and factors processing (the 6-h SSC bundle and the micro- e compliance rate (%) before (%)) were biology  antibiotic detection rate use also included in the model. The results are expressed as a (B) with the 95% confidence inter- the p value e and beta val (CI). A conducted. analysis missing value was of missing values across the variables var- percentage . 2387 observations ied between 1 0 and 12.02%. In total, (84.65%). Listwise used deletion complete were was data. All handle statistica two- missing were tests tailed be and p<0.05  statistically considered was significant\n\nHospital structure characteristics total 2820 hospitals from provinces  were the included in data a analysis. All hospital structural in and characteristics are analysed presented were Table 1. The 1383 of tertiary number hospitals was to 1437 (50.96%) secondary (49.04%), compared hos- from pitals. A larger proportion of the hospitals were Western 1China (1083, 38.40%), were (2574) public\n\nTable 1 Characteristics of the hospitals\n\n\n|    | 0                              | 1                            | 2             | 3                      | 4                       |       5 | 6      |\n|---:|:-------------------------------|:-----------------------------|:--------------|:-----------------------|:------------------------|--------:|:-------|\n|  0 | Variables                      | Categories                   | Total n(%)    | Tertiary hospital n(%) | I Secondaryhospital n(% | nan     | p      |\n|  1 | Region                         | Eastern Ching                | 889(31.52)    | 399(28.85)             | 490(34.10)              |  84.441 | <0.001 |\n|  2 | nan                            | Central China                | 659(23.37)    | 270(19.52)             | 389(27.07)              | nan     | nan    |\n|  3 | Location                       | Western China                | 1083(38.40    | 570(41.21)             | 513(35.70)       ",
            "ons.org/publicdomain/zero/1.0/) applies to the data made available in this article,unless otherwise stated in a credit linetothe data\n\nConclusion: This study highlights the association between speciffic ICU structural factors and patient outcomes Modifying structural factors is a potential opportunity that could improve patient outcomes in ICUs\n\n### Background\n\ndelivery is challenging and I complex in the Healthcare intensive care unit. Several factors, including ICU struc ture, ICU organization and d the care process, can influ ence ICU 1 extensive performance 1-3]. Despite the ICUs, the the quality of care literature addressing impact of such factors remains controversial, and a dili. gent assessment of care components is required It is well known that ICU structural factors vary within and regions [4, 51. However, most different countries related conducted in Western studies have been coun- tries [6. 71. Little evidence regarding the structural factors of ICUs in China is available [81, China still faces chal lenges in providing optimal and equitable management strategies for ICU patients across the nation because its broad geography and unbalanced economic develop ment. A previous study described critical care resources in Guangdong Province 9. Another study evaluated the practices, outcomes, and costs related to mechanical ven: tilation within ICUs in Beijing [10]. Nonetheless, those studies were limited to the regions in which the surveys were administered and feature small e sizes: it is I sample also not clear whether those resources were e associated with ICU care provision, treatment patterns, and patient demands outcomes. Finally, increasing  and I rising costs significant challenges to the delivery of high-qual pose: ity and affordable critical care to a growing population of patients. Optimizing ICU organization is a potentia opportunity to improve patient outcomes and the use of resources. Therefore, the aim of this study was to investigate hos- pital and ICU structural factors and patient outcomes in China. Moreover, we aimed to identify the associa- tion between these variables and patient outcomes, with structural factors, including ICU a focus on potential structural resources and staffing levels. We hypothesized that patients admitted to hospitals that were government- funded, tertiary, well-equipped, and better-staffed woulc have a decreased risk of ICU mortality and occurrence of VAP, CRBSIs and CAUTIs after adjusting for region, dis ease severity, and other confounders.\n\nDesign This nationwide, database observational e study was a National Clinical 2019. The data the source was\n\nSystem (https://ncisdc.medidata.cn/login Improvement Qual- jsp), collected by the China-National Critical Care e (China-NCCQC), which is the official ity Control Centre regulates ICU quality control national department that China. The of Health of China Ministry approved that Peking Union Medical College Hospital establishes 2012. The China-NCCQC Quality Improvement China-NCCQC of Critical Care led by Program, was 2015. This initiated in study above pro- part obtained from the the data was gram. Permission to use China-NCCQC.\n\n### Study population and settings\n\nThe China-NCCOC. collected the relevant data regard. ing quality control indicators through the database the National Clinical Improvement System. Hospitals in China are classified in a 3-tier svstem (primary, second arvy or tertiary hospital) that recognizes a hospital's ability to provide medical care, medical education, and conduct medical research. Tertiary hospitals, similar to a tertiary referral hospital in the West, are usually comprehen- sive, referral, general hospitals responsible for provid- ing specialist health services, perform a larger role with 1 and scientific research regard to medical education and serve as medical hubs providing care to multiple regions Secondary hospitals, similar to : a regional hospital e district hospital in the West, tend to be affiliated with medium-sized city, county, or district and are responsible for providing comprehensive health services and medical education and conducting research on a regional basis. Ir contrast, primary hospitals are primary health care insti- tutions whose main function is to provide primary pre- vention directly to the population, however, they rarely admit and treat critically ill patients. Therefore, primary hospitals were not included in the scope of the study The enrolled tertiary and secondary hospitals voluntar- ily participated and were selected by the China-NCCOC The selection criteria were as follows. (1) The ICU had to have more than five beds. (2) The ICU had to have the ability to diagnose and treat the relevant medical dis- eases that were evaluated as quality control items (such catheter- ventilator-associated pneumonia (VAP), as related blood stream infections (CRBSIs), and catheter- associated urinary tract",
            "RT 对病死率、透析 的需求及中枢感染方面的获益及风险不确定。 由于两项试验的入选标准和启动 RRT 的时机\n如有侵权请联系网站删除\n不同，且基于方法的间接性(许多非脓毒症患者)，试验结果的准确性较低。\n推荐意见 25：对于脓毒症合并 AKI 的患者，如果仅有肌酐升高或者少尿而无其他透析指 征时，不建议进行 RRT  (弱推荐，低证据质量)。\n近期一项相关 RCT 结果表明，早期开始 RRT 对于合并 AKI 的重症患者的病死率无显 著影响，但可增加患者透析次数及血液感染的发生，风险和成本超过收益。 因此， 在没有其 他明确的透析指征的情况下，不推荐在仅肌酐增加或者少尿的脓毒症合并 AKI  患者中进行 RRT。\n7.7   机械通气\n推荐意见 27：对脓毒症诱发急性呼吸窘迫综合征 (ARDS) 的患者进行机械通气时推荐 设定潮气量为6 ml/kg  (强推荐，高证据质量)。推荐设定平台压上限为 30cmH2O  (强推荐， 中等证据质量)。对脓毒症导致的中到重度 ARDS (PaO2/FiO2 ≤200mmHg)患者，建议使用 较高的 PEEP  (弱推荐， 中等证据质量)。\n目前 ARDS 患者使用低潮气量肺保护策略是被广泛接受的。几项 Meta 分析表明，ARDS 的压力和体积限制策略可降低患者的病死",
            "�对照研究报导了使用CRRT 对提高生存率具有非常显著的趋势，目前两项Meta 分析报导了接受 CRRT 和间歇性 RRT 的患者住院病死率差异无统计学意义，即使进行仅包 括 RCT 研究的亚组分析，仍未发现两组间患者病死率的差异；另有一项纳入 360 例患者的 大规模 RCT 研究结果显示， CRRT 组和间歇 RRT 组患者生存率差异无统计学意义。对于 血流动力学不稳定的脓毒症患者， 目前尚无 RCT 评估 CRRT 和间歇性 RRT 的血流动力学耐 受性。 其余证据中， 两项前瞻性试验报导 CRRT 有较好的血流动力学耐受性， 但对患者局部 灌注及生存率无改善。\nCRRT 流量： 在目前的文献综述中， 有两个研究报导了 CRRT 的流量对急性肾功能衰竭 患者临床结局的影响。结果并未显示与较高流量 RRT 相关病死率的任何差异。比较 RRT 流 量的两项大规模、 多中心随机试验也未能显示出患者接受高流量 RRT  的相关获益。对所有 相关 RCTs  (1505 例)结果进行 Meta 分析表明，RRT 流量和病死率之间没有任何显著的相 关性， 然而，点估计值支持 CRRT 流量＞30ml/ (kg · h)，由于偏倚、 一致性差等风险，估 计的置信度较低，应进行进一步研究。\nCRRT 时机：2022 年发布的两项相关 RCT s 结果表明，早期启动 R",
            "                                                                                                                                                                | Requlation of acid-base                                                                                                                                                                                                                                           | nan                                                                                                                                                                                                                                                               |\n| 21 | Solute modulatior             | Changes in solute burden should be anticipated (e.g., tumor lysis syndrome). Although current evidence is unclear                                                                                                                                                 | Changes in solute burden should be anticipated (e.g., tumor lysis syndrome). Although current evidence is unclear                                                                                                                                ",
            " wissenschaftlich zu schaffen, das einzigartig ist. Das Buch Med 370(18):1683-1693 9 Asfar P MezianiE. Hamel L-E. Grelon E. Megarbane Thoraxdrainggen iedoch, herausgegeber men sind sicherlich noch nicht um B Anquel N et al (2014) Hiab versus low blood- von Thomas Kiefer erfiillt ganz klar diese aufgearbeitet, aber Thomas Kiefer pressuretargetin patientswith senticshock NEng Definition, Und dies gleich aus mehrerer existierenden wissenschaftlichen E JMed 370(17):1583-1593 10 Holst IB Haase N Wettersley I Wernerman Gründen. nisse gründlich aufgearbeitet. Er ha Aneman A. Guttormsen AB etal (2013) Transfusior Zu allererst ist dies Erkenntnisse an ieder Stelle in eine reauirements in septic shock (TRIsS) trial. ein enorm praxisori- baren, einfachen Art und Weise ein comparing the effects and safety of liberal versus restrictivered blood cell transfusion in senticshoc entiertes Buch Die immer offen und ehrlich betonend patients in the ICU: protocol for a randomises Drainage des Pleu- wissen und was wir nicht wissen. D controlledtrial. Trials 14:150 Thorax raspaltes und das dazu. dass er einige der häufig zitie Damiani E. Donati A. Serafini G. Rinaldi L, Adraric drainagen E Pelaia P et al (2015) Effect of performance Management vor men entlarvt -er tut dies in einere improvement programson compliance with sepsi Thoraxdrainager an Fakten orientieren und sachlich bundles and mortality: a svstematic review and sind fundamentaler und Weise. Dieser aufrichtige und s meta-analysis of observational studies. PLOS ONP 10(5):e012582) Bestandteil der tho- Stil der Diskussion und das sich dar Scheer CS, Fuchs C, Kuhn SO, Vollmer M, Rehberc raxchirurgischen Arbeit. Die Tatsache., dass gebende Management, basierend a S. Friesecke S et al (2017) Ouality improvemen vorliegenden wissenschaftlichen Eir diese Themen in dem Buch mit grofBer Ernst initiative for severe sepsis and septicshockreduce: 90-dav mortality: A 7.5-year observational study haftigkeit besprochen werden, zeugen vor sen, zeichnen dieses Buch im Besc Crit Care Med 45(2):241-25: seiner Intention: es will praxisorientiert sein aus Bloos E. Thomas-Ruddel D, Ruddel H, Enge Das Buch will in einer einfachen, praktischer Schlussendlich ist dieses Buch gese C. Schwarzkopf D. Marshall JC et al (2014 Impact of compliance with infection management Weise hilfreich sein, Einzelne einfache De um im klinischen Alltag zu untersti quidelines on outcome in patients with severe tails, die bei der täglichen Arbeit helfen, die zu helfen, Es enthält Aspekte der ä sepsis: A prospective observational multi-centel für sich genommen jedoch nicht die grole wie der pflegerischen und der phy study, Crit Care 18(2):R42 Azuhata I. Kinoshita K. Kawano D. Komatsu Aufmerksamkeit genieBen, können in ihre rapeutischen Arbeit, was sich auch SakuraiA. Chiba Yetal (2014) Time from admissior Addition einen signifikanten Einfluss auf das Auswahl der Co-Autoren widerspie to initiation of surgery for source control i Gelingen haben. Dieses Buch ist einzigartic Gesamteinfluss des",
            "### Association between hospital and ICU Ch up structural factors and patient outcomes in China: a secondary analysis of the National Clinical Improvement System Data in 2019\n\nZhen Lilfo,Xudong Ma2t . Sifa Gao2t Qi Li, Hongbo Luo , Jianhua Sun',Wei Du', Longxiang Su', Lu Wang Qing Zhang', Zunzhu Lil\"*, Xiang Zhou\" and Dawei Liu\" on behalf of China National Critical Care Quality Control Center Group\n\nBackground: Hospital and CU structural factors are key factors affecting the guality of care as well as CU patient outcomes. However, the data from China are scarce. This study was designed to investigate how differences in patient outcomes are associated with differences in hospital and ICU structure variables in China throughout 2019\n\nMethods: This was a multicenter observational study. Data from a total of 2820 hospitals were collected using the National Clinical lmprovement System Data that reports CU information in China. Data collection consisted of al information on the hospital and ICU structural factors, including the hospital type, number of beds, staffng, among others, and b) ICU patient outcomes, including the mortality rate as well as the incidence of ventilator-associated oneumonia (VAP). catheter-related bloodstream infections (CRBSls), and catheter-associated urinary tract infections (CAUTls), Generalized linear mixed models were used to analyse the association between hospital and ICU structura factors and patient outcomes Results: The median ICU patient mortality was 8.02%(3.78%, 14.35%), and the incidences of VAP CRBSL, and CAUT\n\npneumonia (VAP), catheter-related bloodstream infections (CRBSls), and catheter-associated urinary tract infections (CAUTls), Generalized linear mixed models were used to analyse the association between hospital and ICU structura factors and patient outcomes Results: The median ICU patient mortality was 8.02% (3.78%., 14.35%), and the incidences of VAP. CRBSL, and CAUT were 5.58 (1.55.11.67) per 1000 ventilator davs., 0.63 (0.2.01) per 1000 catheter davs,and 142 (0.37,3,40) per 1000 catheter davs, respectively. Mortality was sianificantly lower in public hospitals (B= -0.018(- 0031.- 0.005) p=0.006), hospitals with an ICU-to-hospital bed percentage of more than 2% (B= -0.027 (-0.034,-0.019)., p<0.001) and higber in hospitals with a bed-to-nurse ratio of more than 0 5:1 (B=0009 (0 001 0017) np=0 027) The incidence of VAP was lower in public hospitals (B= -0.036 (- 0.054.-0018), p<0.001). The incidence of CRBSls was lower in public hospitals (B= -0.008 (- 0.014,-0002), p=0.011) and hiaher in secondary hospitals (B=0.005 (0.001.,0.009) p= 0.010), while the incidence of CAUTls was higher in secondary hospitals (B=0.010 (0002. 0.018)., p= 0.015)\n\ndwliu98@163.com [Zhen Li, Xudong Ma and Sifa Gao contributed equally to this work 'Department of Critical Care Medicine. Peking Union Medical College Hospital, Pekina Union Medical College and Chinese Academy of Medica Sciences, Beijing 100730, China Full list of author information is available at the end of the article\n\n©The Author(s) 2022. corrected publication 2022 Open Access This article is licensed under a Creative Commons Attribution 40 Interational License, which permits use, sharing, adaptation, distribution and reproduction in any medium or format, as long as you give appropriate credit to the original author(s) and the source, provide a link to the Creative Commons licence, and indicate if changes were made The images or otber third party material in this article are indluded in the artice's Creative Commons llicence  unless indicated otherwise in a credit line to the material If material is not included in the article's Creative Commons licence and your intended use is not permitted by statutory requlation or exceeds the permitted use, you will need to obtain permission directly from the copyriaght holder. To view a copy of this licence visit http://creativecommonsora/licenses/by/40/ The Creative Commons Public Domain Dedication waive (http://creativecomm"
        ],
        "ground_truth": "Platform pressure limits play a crucial role in mechanical ventilation for patients with acute respiratory distress syndrome (ARDS) induced by sepsis. It is strongly recommended to set the platform pressure upper limit at 30cmH2O, which is based on moderate-quality evidence. This recommendation aims to prevent barotrauma and minimize lung injury in ARDS patients. Additionally, for patients with moderate to severe ARDS (PaO2/FiO2 ≤200mmHg), it is suggested to use higher levels of positive end-expiratory pressure (PEEP), albeit weakly recommended and supported by moderate-quality evidence. These ventilator settings are part of lung protective strategies widely accepted for ARDS management.",
        "metadata": [
            {
                "filename": "(Word版)中国脓毒症／脓毒性休克急诊治疗指南(2022)培训资料.docx"
            }
        ],
        "evolution_type": "noise_robustness"
    },
    {
        "id": 35,
        "question": "肝肾功能损害时应如何选择抗真菌药物？",
        "answer": "在肝肾功能损害时，抗真菌药物的选择应充分考虑基础肝肾功能状态以及药物对肝肾功能的影响。推荐级别为E级。",
        "contexts": [
            "�副作用,单药使 用易出现耐药,故不推荐其作为预防药物使用。\n\n### 六、重症患者IFI的治疗\n\n### (一)抗真菌治疗原则\n\n由于真菌感染的复杂性,自前多提倡分层治疗,包括予预 防性治疗、经验性治疗、抢先治疗及目标性治疗。 1.经验性治疗:针对的是拟诊I 的患者,在未获得病 原学结果之前,可考虑进行经验性治疗。药物的选择应综合 考虑可能的感染部位、病原真菌、患者预防用药的种类及药 物的广谱、有效、安全性和效价比等因素。 关干经验性治疗的研究目前主要集中在持续发热的中 性粒细胞减少症患者。对于这类患者应用唑类、棘白菌素类 及多烯类药物,临床症状改善明显 推荐意见5.对于拟诊JF重症患者,应进行经验性抗真 菌治疗(推荐级别为E级) 2.抢先治疗:针对的是临床诊断JE的患者。对有高负 因素的患者开展连续监测,包括每周2次胸部摄片CT扫 描、真菌培养及直菌抗原检测等。如发现阳性结果立即于 始抗真菌治疗,即枪先治疗。其重要意义在于尽可能降低不 拾当的经验性治疗所致的抗真菌药物的不必要使用,降低真 菊耐药及医疗花费增加的可能性。现有的关于抢先治疗与 经验性治疗�",
            "�究表明， 脓毒性休 克多药联合治疗的早期降阶梯与更好的临床预后相关。此外，早期降阶梯可减少细菌耐药的 发生。另有研究表明， 每日评估抗菌药物降阶梯的可行性可能降低患者病死率， 因此推荐每 日对脓毒症和脓毒性休克患者的抗菌药物使用进行降阶梯评估。\n下列患者使用长时程 (＞10d ) 抗菌药物治疗是合理的， 包括临床改善缓慢、 感染源难 以控制、金黄色葡萄球菌相关的菌血症(特别是 MRSA〕)、某些真菌、病毒感染及免疫缺 陷患者。\n推荐意见 16：建议以测定降钙素原(PCT) 水平为辅助手段指导脓毒症患者抗菌药物 疗程 (弱推荐，低证据质量)。\n目前世界许多地区通过测定血清 PCT  水平辅助诊断急性感染及辅助确定抗菌药物疗 程。近期一项大型随机试验证明，以血清 PCT 水平指导重症感染患者抗菌药物使用可显著 缩短治疗持续时间，减小药物日剂量，降低患者病死率。以 PCT 作为辅助手段可缩短脓毒 症患者抗菌药物疗程且不增加病死率。 因此，PCT  或者其他生物标记物的检测可作为临床评 估的辅助手段，抗菌药物的起始及减停需结合临床具体情况判定。\n推荐意见 17�",
            "        |\n| 21 | nan   | nan                                                           | Keine Gabe von FFP ohne klinisch manifeste Blutung, ohne bevorstehende Operatiorklinischer Blutung, >50.000/ul bei Blutung oder Eingriffer                                   | Schwache EmpfehlungEvidenz sehr niedrid Schwache EmpfehlungEvidenz sehr niedrig |\n| 22 | nan   | ImmunglobulineHämofiltration/g                                | Keine Gabe von lmmunglobuliner                                                                                                                                               | nan                                                                             |\n| 23 | K     | Antikoaqulanzien                                              | Keine spezifische Empfehlund                                                                                                                                                 | Evidenz sehr niedric                                                            |\n| 24 | nan   | Antikoaqulanzien                                              | Keine spezifische Empfehlund                                                                                                                                                 | nan                   ",
            "�持联合治疗的临床获益。\n已发表的 Meta 分析结果显示，在抗感染治疗的基础上联合使用血必净注射液，可降低 白细胞计数和过高的体温，控制炎症反应和多器官功能障碍综合征的发展，改善 APACHEⅡ 评分，降低脓毒症患者 28 d病死率。\n如有侵权请联系网站删除\n推荐意见 13：在病原学诊断及药敏结果明确或者临床症状充分改善后推荐进行降阶梯治 疗(BPS)。\n对绝大多数严重感染来说， 在确定致病菌的情况下， 应降阶梯至最窄谱抗菌药物治疗以 缩小覆盖范围。 Guo 等进行的一项纳入 99 项研究的 Meta 分析结果显示， 抗菌药物的降阶梯 治疗与持续应用广谱抗菌药物对患者的病死率差异无统计学意义。几项观察性研究结果显 示，抗菌药物的降阶梯治疗能降低病死率， 鉴于不必要的持续性抗菌药物的使用给社会和个 人带来的不良后果， 推荐抗菌药物降阶梯治疗。 当发现感染不存在时，应即将住手抗菌药物 的使用，以避免产生耐药及不良反应。\n推荐意见 14：在脓毒症或者脓毒性休克患者中，抗菌药物的剂量优化策略应基于目前 公认的药效学/药动学原则及药物的特性(BPS)。\n脓�",
            "onic contrast-media concentrations for renal artery injections When renal artery stenosis is suspected, map the origin of major renal arteries with noninvasive procedures (e.g., CT without contrast media) for proper initial renal angiographic projections to avoid unnecessary runs, or pertform primary manometry D- may be used as contrast medium in venous examinations and below the diaphragm for arterial examinations or alternatively use jiodinated contrast media with the same contrast effect, i.e., about 40 mg iodine per milliliter. Since the contrast effect of 0.5 M Gd-contrast media has been regarded as diagnostic by many investigators (coronary, renal, aortofemora arteriography, etc). iodinated contrast media may be diluted to the same density, ie.. about 75 mg jiodine per millilliter Use selective or superselective catheterizations when appropriate, e.g., \"single leg run-off\" Reduce aortic flow and amount of contrast medium by temporal occlusion of femoral arteries with Gd, gadolinium; kVp, peak kilovoltage\n\nGd. gadolinium; kVp, ,peak kilovoltage.\n\nbe when applied however, optimistic 1 to critically i too 395 patients undergoing emergency CT scans. The covering CI-AKI of the literature I and its majority prevention involves i.a. iodinated contrast-medium admin- 445,446 The higher risk o of CI-AKI after i.a. admin- istration of the istration is probably due to the direct exposure more 447 fact kidneys to contrast media t that, in 1 general i.a. contrast-media examinations are performed in 1 patients who carry a higher risk.\n\n### RESEARCH RECOMMENDATIONS\n\ne whether there is need Randomized trials should explore for discontinuation of ACE-I and/or ARBs in n patients at risk for CI-AKI. the Additional r determine needed to better studies : are exact relationship between the dose of contrast media and the risk for CI-AKI.\n\n### SELECTION OF A CONTRAST AGENT\n\n4.3.2: We using either iso-osmolar low- than osmolar iodinated media, rather contrast patients high-osmolar iodinated t media in contrast at increased risk of CI-AKI. (1B\n\n### RATIO IALE\n\nThis recommendation is supported by the summary tables of the different RCTs s and on the evidence profile tables (Supp: Tables 19-21),\n\nKidney International Supplements (2012) 2, 69-88\n\nHigh-osmolar vs. iso-osmolar or low-osmolar contrast media The recommendation to avoid high-osmolar contrast media RCTs older literature, based on since recent comparing high- vs. low- and iso-osmolar iodine-based contrast media available. In addition, high-osmolar contrast media are not have virtually been abandoned in modern radiological units. 448 Both the review of Goldfarb et al. and the meta-analysis of studies449 Barrett and Carlisle combining g 24 randomized that the risk of CI-AKI is similarly with high- low suggest stable osmolar low-osmolar otherwise r agents among patients with normal renal function but that in i contrast to media media high-osmolar low-osmolar r contrast contrast in s with g kidney less nephrotoxic patients pre-existing function impairment.\n\n### t media Low-osmolar vs. iso-osmolar c T1\n\nThe present hotly debated question is whether iso-osmolar safer than low-osmolar contrast media in contrast media are This has been the high-risk patients. subiect question number well of randomized trials as as systematic reviews and meta-analyses (Suppl Tables 19-21). We separated studies meeting our inclusion criteria (see administering Chapter 1.2) into those i.v. contrast media. We used the general definitions of CI-AKI provided ir in SCr >25% the e studies 0.5 mg/d or (an increase 72 hours within s after 44.2 umol/1]) occurring contrast- medium administration, in the absence of an alternative etiology for the decrease in kidney function.\n\n\n![这是图片](all_figs/9EE71E_Sievert-2013-Antimicrobial-resistant pathogens_p80_f0.png)\n\nFigure 14 Risk for contrast-induced nephropathy. (a) lodixanol vs. iohexol and risk for contrast-induced nephropathy; (b) jodixanol vs nonionic low-",
            " Biban, Alan Parker. / Ann 1 Duncan. Cristina 1 A. Car- Mangia, Niranjan Kissoon, and Joseph cillo (Head).\n\n### Appendix\n\nConflict of interest p process\n\n\n![这是图片](all_figs/077510_Dellinger-2013-Surviving Sepsis Cam_p43_f0.png)\n\n### Appendix\n\nARDSnet ventilator management\n\n\n|    | 0                                                                                                                                                                                                         | 1                                                                                                                                                                                                         | 2                                                                                                                                                                                                         | 3                                                                                                                                                                                                         | 4                                                                                     ",
            ". Caspani ML, et al Constant mean airway pressure with differ ent patterns of positive pressure breathing during the adult respiratory distress syn- drome. Bull Eur Physiopathol Respir 1985 21:275-279 Pesenti A, Marcolin R. Prato P. et al: Mear airway pressure vs. positive end-expiratory pressure during mechanical ventilation Crit Care Med 1985: 13:34-3 Stocker R. Neff T, Stein  S, et al: Prone positioning and low-volume pressure limited ventilation improve survival in pa- tients with severe ARDS. Chest 1997; 111 1008-1017 Lamm WJ, Graham MM, Albert RK: Mech- anism by which  prone position improve: oxygenation in acute lung injury. Am J Re spir Crit Care Med 1994; 150:184-193 Jolliet P, Bulpa P, Chevrolet JC: Effects of the  position on gas exchange and e prone hemodynamics in severe acute respiratory distress syndrome. Crit Care Med 1998: 26 1977-1985 Gattinoni L, Tognoni G, Pesenti A, et al Effect of prone positioning on the surviva of patients with acute respiratory failure N Engl J Med 2001; 345:568-573\n\nprofiles of vecuronium and recovery cisatracurium 51W89 in intensive care uni patients, Anesth Analg 1995: 81:3-12 Brandom BW, Yellon FF. Lloyd ME, et al Recovery from doxacurium infusion admin istered I to produce immobility for more than four days in pediatric patients in the intensive care unit. Anesth Anala 1997: 84 307-314 Rudis MI. Sikora CA. Angus E. et al: / prospective, randomized., controlled evalua tion of peripheral nerve stimulation versu standard clinical dosing of neuromusculal blocking agents in critically ill patients Cr Core Med 1997: 25-25575-2558'3 Frankel H. Jeng J. Tilly E. et al: The impac of implementation of neuromuscular block ade monitoring standards in a surgical in tensive care unit Am Suro 1996: 62 503-506 van den Berohe G Wouters P Weekers F e al: Intensive insulin therapy in the critically ill patients. N Enal J Med 2001: 345 1359-1367 Finney SJ, Zekveld C. Elia A., et al: Glucose control and mortality in critically ill pa tients, JAMA 2003: 2041-2047 Van den Berohe G Wouters PI Bouillon F et al: Outcome benefit of intensive insulir therapy in the critically ill: Insulin dose Crit Care Med glvcemic control. versus 2003:31:359-366 Klein S. Kinney J. Jeeieebhoy K. et al: Nu trition support in clinical practice: Reviev of published data and recommendations fo future research directions. A summary of a conference sponsored by the National Insti tutes of Health. American Society for Par enteral and Enteral Nutrition, and Ameri can Society for Clinical Nutrition. Am J Cli Nutr 1997: 66:683-706 Mehta RL, McDonald B, Gabbai FB, et al: A randomized clinical trial of continuous ver sus intermittent dialysis for acute renal fail ure. Kidney Int 2001; 60:1154-1163 al Kellum J. Angus DC. Johnson JP et Continuous  versus intermittent renal re placement therapy: A meta-analysis. Inten sive Care Med 2002: 28:29-37 Cooper DJ, Walley KR. Wiggs BR, et al Bicarbonate does not improve hemody namics in critically ill patients who have lactic acidosis: A prospective, controlled clinical study. Ann Intern Med 1990; 112 492-498 Mathieu D. Neviere R. Billard V. et al: Ef fects of bicarbonate therapy on hemody namics and tissue oxygenation in patient with lactic : acidosis: A prospective, con trolled clinical study. Crit Care Med 1991 19:1352-1356 102. Cade JF: High risk of the critically ill fo: Crit Care Mes venous thromboembolism. 1982:10:448-450 103. Belch JJ, Lowe GD, Ward AG, et al: Preven tion of deep vein thrombosis in medica patients by low-dose heparin. Scott Med. 1981:26:115-117\n\nCrit Care Med 2004 Vol. 32, No. 3\n\n104. Samama MM, Cohen AT, Darmon JY, et al A comparison of enoxaparin with",
            "�� 等注射相关并发症的发生率也高于两性霉素B脂质体。 儿平所有的唑类抗真菌药均有肝脏毒性,但目前尚缺乏 ICU患者使用唑类药物发生肝功能损害的大规模临床调查。 氟康唑对肝肾功能的影响相对较小,是目前临床最常用的抗 直菌药。伊曲康唑对肝肾等器官的功能有一定影响,但肾毒 性明显低于两性霉素B脱氧胆酸盐,其引起肝损害多表现为 胆汁淤积。对充血性心力衰竭或在伊曲康唑治疗中出现心 力衰竭或症状加重的患者,应重新评价使用该药的必要性。 与两性霉素B脱氧胆酸盐相比,伏立康唑的肝肾毒性明显减 少,其肝毒性具有剂量依赖性。另外,应用伏立康唑可出现 短暂视觉障碍与幻觉,一般停药后多可恢复。 以卡泊芬净、米卡芬净为代表的棘白菌素类药物主要在 肝脏代谢,可引起肝功能异常,但肾毒性明显低于两性霉素 B脱氧胆酸盐。米卡芬净的不良反应与卡泊芬净类似,可导 致血胆红素增高.但几平不影响肾功能。 推荐意见8:杭真菌药物治疗应充分考虑基础肝肾功能 状态以及药物对肝肾功能的影响(推荐级别为E级)\n\n### 2.肝肾功能损害时抗真菌药物的选择:\n\n(1)肝功能不全时药物的选择与剂量整:�",
            "效应为未 校正的粗效应,结果可能存在一定偏倚。 综上,三级防护下,利用超声的可视化特性,采 用平面外(短轴)技术联合平面内(长轴)技术对 重症COVID-19患者进行外周动脉置管,可提高首次 置管成功率,减少穿刺次数,降低穿刺并发症的发 生率。\n\n作者贡献:赵明曦、李若祎负责研究设计、数据分 析、论文撰写:孙建华、苏龙翔、李奇、李尊柱、马 鸿鸣、崔文博和罗红波参与研究设计和结果分析:周 翔指导研究设计数据分析并修改论文 利益冲突:无\n\n### 考 献 文\n\n[1]国家中医药管理局办公室中华人民共和国国家卫生健康 委员会办公厅,新型冠状病毒肺炎诊疗方案(试行第八 版)[1],中国医药、2020.15:1494-1499 [11 General Office of National Health Commission of the People's Republic of China, Office of National Administration of Tra- of ditional Chinese Medicine, Diagnosis and treatment virus disease-19 (8th trial edition)[J. Zhongguo corona Yi Yao, 2020, 15: 1494-1499. [2]尹万红,康焰.新型冠状病毒肺炎急性呼吸窘迫综合征 的血流动力学治疗[J1.协和医学杂志,2020,11: 518-521. [2 Yin WH, Kang Y. Hemodynamic therapy for COVID-19 pa syndromeJ. Xie He tients with e respiratory distress acute Yi Xue Za Zhi, 2020, 11: 518-521. 1 LM. al. Ultrasound- [31 RH, Paulin Shiloh 1 AL. Savel et radial guided systematic catheterization artery: a review and meta-analysis of randomized controlled [J. Chest, 2011, 139; 524-529. 等.超声引导下税动脉置管 [4]孙建华,刘大为,王小亭, 的应用进展[J.中国实用护理杂志,2016,32: 1997-2000 Sun JH, Liu DW, Wang XT, et al. Development of applica- tior cannulation of ultrasound guided radia research artery\n\n[J]. Zhongguo Shi Yong Hu  Z",
            "如有侵权请联系网站删除\n中国脓毒症/脓毒性休克急诊治疗指南(2022)\n脓毒症和脓毒性休克是急危重症医学面临的重要临床问题， 全球每年脓毒症患病人数超 过 1900 万，其中有 600 万患者死亡，病死率超过1/4，存活的患者中约有 300 万人存在认 知功能障碍。 早期识别与恰当处理可改善脓毒症患者的预后。 近年来， 国内外对脓毒症领域 的研究不断深入， 临床实践及证据不断增加， 2022 年美国重症医学会 (SCCM)与欧洲重症 医学会(ESICM 联合发布脓毒症3 .定义及诊断标准，新定义的浮现及临床证据的积累都会 对临床决策产生重要影响。为了更好地指导我国急诊与危重症医学工作者对脓毒症和脓毒性 休克的治疗， 中国医师协会急诊医师分会和中国研究型医院学会休克与脓毒症专业委员会组 织专家基于循证医学的方法制定了《中国脓毒症／脓毒性休克急诊治疗指南 (2022)》(以下 简称为“本指南”)。\n1   检索策略 (略)\n2   推荐等级 (略)\n3   投票过程 (略)\n4   定义\n脓毒症是指因感染引起的宿主反应失调导致的危及生命的器官功能障碍。脓毒性休克定 义为脓毒症合并严重的循环、细胞和代谢紊乱，其死亡风险较",
            ". internationa multicenter prospective cohortill. Am Respir Crit Care Med, 2019, 200(8) 1002-1012.DO1:10.1164/rccm.201806-109400 [23] Schrage B. Becher PM. Bernhardt A. et al. Left ventricula unloading is associated with lower mortality in patients with shocl treated with cardiogenid venoarteria extracorporeal membrane oxvgenation: : results from an international Circulation multicenter cohor studyll DO1: 142(22) 2095-2106 10.1161/ CIRCULATIONAHA.120.048792 24 WH, et al. Venoarterial Ling RR. Ramanathan K. Poor extracorporea oxygenation as mechanical membrane circulatory support in adult septic shock: a systematic review and meta-analysis with individual participant data analysis[]. Crit Care, 2021, 25(1): 246 meta-regressionr D01:10.1186/s13054-021-03668-5 [25] D, Kimmoun A. et al. Venoarteria Brechot t N, Hajage extracorporea to membrane oxygenation rescue sepsis-induced shock: cardiogenic retrospective multicentre, international cohort study ] . Lancet, 2020 396(10250):545-552. DO1 10.1016/S0140-6736(20 30733-9 [26] Ong CS, Etchill E, Dong J, et al. Neuromonitoring detects brain injury 1n patients receiving extracorporea membrane oxygenation support]]. Thorac Cardiovasd Surg, 2021 2022-02-04].  published online ahead of print October 29.2021l. DO1: 10.1016/iitcvs.2021.09.063 ([27] Hunt MF. Clark KT. Whitman G. et al. The use of cerebra NIRS monitoring to identify acute brain injury in patients with VA-ECMOIIl.I Intensive Care Med. 2021. 36(12) 1403-1409.D01:10.1177/0885066620966962\n\nELSO Member Centers EB/OL (2021-11-23 [2022-01-29] https://www elso org/Membership/ CenterMap.aspx El Sibai R. Bachir R., El Saved M. ECMO use and mortalit in adult patients with cardiogenic shock: a retrospective observational study in U.S. hospitals[ll. BMC Emerg Med 2018,18(1):20.D01:10.1186/s12873-018-0171-8 [9] Park M, Mendes PV, Zampieri FG. G et al The economic effect extracornorea membrane oxvgenation support adults with severe respiratory failure in Brazil: a  2014 hypothetica analysis[Il. Rey Bras ; Ter Intensiva 26(3):253-262.D01:10.5935/0103-507x.20140036 I J 10] Ouweneel DM Limpens Schotborgh et al. life cardiac and Extracorporeal support during arrest cardiogenic shock: a systematic review and meta-analysis [11. Intensive Care > Med 2016 42(12): 1922-1934 DO1 10.1007/s00134-016-4536-8 11] Natt BS. Desai H. Singh N, et al. Extracorporeal membrane oxygenation for ards: national trends in the United States 2008-2012Ⅲ. Respir Care. 2016. 61(10):1293-1298. DO1 10.4187/respcare.04760 [12] Cheng W. Ma XD. Su LX, et al. Cross-sectional study for the of clinical application extracorporeal membrane oxvgenation in Mainland China. 2018[ll. Crit Care. 2020 24(1):554.D01:10.1186/s13054-020-03270-1 [13] Barbaro RP, Odetola FO, Kidwell KM, et al. Association of hospital-level volume extracorporea membrane and of the cases mortality Analysis oxygenation extracorporeal life support organization registry[. Am 2015. 191(8): 894-901. DOL Respir Crit Care Med 10.1164/rccm.201409-16340C [14] C, Hou X, Tong Z et al. Extracorporeal membrane oxygenation programs for COVID-19 in China[]. Crit Care 2020.24(1):317.D01:10.11"
        ],
        "ground_truth": "推荐意见8:抗真菌药物治疗应充分考虑基础肝肾功能状态以及药物对肝肾功能的影响。",
        "metadata": [
            {
                "filename": "ICU 侵袭性真菌感染指南.pdf"
            },
            {
                "filename": "(Word版)中国脓毒症／脓毒性休克急诊治疗指南(2022)培训资料.docx"
            },
            {
                "filename": "Briegel-2017-[International guidelines from th.pdf"
            },
            {
                "filename": "(Word版)中国脓毒症／脓毒性休克急诊治疗指南(2022)培训资料.docx"
            },
            {
                "filename": "Sievert-2013-Antimicrobial-resistant pathogens.pdf"
            },
            {
                "filename": "Dellinger-2013-Surviving Sepsis Cam.pdf"
            },
            {
                "filename": "2004+SSC+严重脓毒症与脓毒性休克治疗国际指南.pdf"
            },
            {
                "filename": "ICU 侵袭性真菌感染指南.pdf"
            },
            {
                "filename": "三级防护下超声引导外周动脉置管在新型冠状病毒肺炎重症患者中的应用.pdf"
            },
            {
                "filename": "(Word版)中国脓毒症／脓毒性休克急诊治疗指南(2022)培训资料.docx"
            },
            {
                "filename": "中国体外膜肺氧合应用现状及问题.pdf"
            }
        ],
        "evolution_type": "noise_robustness"
    },
    {
        "id": 36,
        "question": "超声引导技术在重症新型冠状病毒肺炎患者外周动脉置管中的应用效果如何？",
        "answer": "超声引导技术在重症COVID-19患者外周动脉置管中能提高置管成功率，减少穿刺次数，降低并发症发生率，具有显著的应用效果。",
        "contexts": [
            " more advanced study. needed design and analytical approach examine the dynamic impact of nurse staffing on ICU patient outcomes There are some limitations to this study. First., the use of secondary data limited essential variables such as the patient-level characteristics or uncontrolled confound- ers (e.g., education level of the staff. ICU bed occu- pancy rate) needed to understand the predictive factors of the patients' outcomes. To reduce these methodo- logical problems, we applied multivariate analysis using s adjusted for generalized linear mixed models patient disease severity using the APACHE I score, which has been shown to be an important predictor of patient outcomes [29, 30]. Second, since only one year of data was reported, presented and summarized in this study of the structural factors and health the relationships. outcomes could: not be analysed continuously anc dynamically. Third, this was an observational study and therefore, prone to selection bias. Causal relationships cannot be drawn due to the cross-sectional nature of the study design. Fourth, listwise deletion was used to data, which may cause bias in the handle the missing of the parameters 31 . Despite these limi- estimates tations, the results of this study are highly meaning- ful in that they underscore the necessity of nonpatient factors, including hospital and ICU structural factors, addi- as a way to reduce : adverse patient outcomes. In : tion, we have improved the generalizability of the find- ings by using national administrative data, unlike most data previous studies, which were conducted using from only certain regions or hospitals. The results may have important implications for critical care develop ment in China and other countries with similar medica environments.\n\nIn conclusion, specific structural factors, includingl hos- pital ownership, hospital type, I ICU-hospital bed percent: with ICU and bed-to-nurse associated e ratio age, were 1 poli- These observations can patient 1 assist in toutcomes. the cies and interventions bridge current quality gap in the delivery of critical care in China well as other developing countries.\n\nVAP: Ventilator-associated pneumonia; CRBSls: Catheter-related blood stream infections; CAUTls: Catheter-associated urinary tract infections: APACHE I score: Acute Physiology and Chronic Health Evaluation score; IQR: Interquartile range;95% Cl: Confidence interval; ICU: Intensive care unit\n\n### Supplementary Information\n\nThe online version contains supplementary material available at https://doi. org/10.1186/s13054-022-03892-7.\n\nAdditional fle 1. Definition of ventilator-associated pneumonia, catheter- related bloodstream infections, and catheter-associated urinary tract infections.\n\n### Acknowledgements\n\nThe authors would like to thank all participants and staff. The China Nationa Critical Care Quality Control Center Group consists of the following persons Xue Wang, Xiangdong Guan, Yan Kang, Bin Xiong, Bingyu Qin, Kejian Qian, Chunting Wang, Mingyan Zhao, Xiaochun Ma, Xiangyou Yu, Jiandong Lin, Aijun Pan, Haibo Qiu, Feng Shen, Shusheng Li, Yuhang Ai, Xiaohong Xie, Jing Yan, Weidong Wu, Meili Duan, Linjun Wan,. Xiaojun Yang, Jian Liu, Hang Xu, Dongpo Jiang, Lei Xu, Zhuang Chen, Guoying Lin, Zhengping Yang, Zhenjie Hu,\n\n### Authors'contributions 77L X7 and DL conceivec\n\nZZL XZ and DL conceived, designed, and supervised the study;XM and SG collected and prepared the data: ZL. WD.LS. IW and OZ helped collect data and performed data curation. ZL. OLHl and IS interpreted the data All authors contributed to the critical reading of the text and its revision. Al authors read and approved the final manuscript\n\nThis study was supported by the National Key R&D Program of China (grant number 2020YFCO861000), the CAMS Innovation Fund for Medical Sciences (CIFMS) (No. 2020-12 M-CoV19-001), the CAMS Endowment Fund (No.2021- CAMS-JZ004), the China International Medical Exchange Foundation Specia Fund for Young and Middle-Aged Medical Research (No.Z-2018-35-1902), the Chinese Medical Information and Big Data Association(CHMIA) Special Fund for Emergency Project and Beijing Municipal Natural Science Foundation (M21019) and the 2020 CMB Open Competition Program (No. 20-381).\n\n### Availability of supporting data\n\nThe datasets analysed during the current study are available from the cor- responding author",
            " DM et al (1998) Effect of a protective ventilation strategy on mortality in the acute respiratory distress syndrome N Engl J Med 338:347-354 236. Brochard L, Roudot-Thoraval F Roupie E et al (1998) Tidal volume reduction for prevention of ventilator induced lung injury in acute respiratory distress syndrome: the multicenter trail group on tidal volume reduction in ARDS. Am J Respir Cri Care Med 158:1831-1838 237. Brower RG. Shanholtz CB, Fessler HE et al (1999) Prospective, randomized controlled clinical trial comparing traditional versus reduced tidal volume ventilation in acute respiratory distres: 'rit Care Med syndrome patients. 27:1492-1498\n\n216. Rodriguez A. Rello J, Neira J et a (2005) Effects of high-dose intravenous immunoglobulin and antibiotics on survival for severe sepsis undergoing surgery, Shock 23:298-304 217, Pildal J. Gotzsche PC (2004 Polvclonal immunoglobulin for treatment of bacterial sepsis: a systematic review Clin Infect Dis 39:38-46 218. Laupland KB. Kirkpatrick AW Delaney A (2007) Polyclonal intravenous immunoglobulin for the treatment of severe sepsis and septic shock in critically ill adults: a svstematic review and meta-analysis Crit Care Med 35:2686-2692 219 Kreymann KG de Heer G Nierhaus A (2007) Use of polyclonal immunoglobulins as adiunctive therapy for sepsis or septic shock. Cr Care Med 35:2677-2685 220. Turgeon AE. Hutton B. Fergusson DA et al (2007) Meta-analysis intravenous immunoglobulin in critically il adult patients with sepsis Ann Intern Med 146:193-203 221. Angstwurm MW. Engelmann I Zimmermann T et al (2007) Seleniun in intensive care (SIC): results of a prospective randomized. placebo controlled. multiple-center study in patients with severe systemic inflammatory response syndrome sepsis. and septic shock. Crit Care Med 35:118-126 222. Forceville X. Laviolle B. Annane I et al (2007) Effects of high doses of selenium, a sodium selenite, in septie shock: a placebo-controlled randomized, double-blind, phase 1 study. Crit Care 11:R73 223. Manzanares W. Biestro A. Torre MH et al (2011) High-dose selenium reduces ventilator-associated pneumonia and illness severity in critically ill patients with systemid inflammation. Intensive Care Med 37:1120-1127 224. Berger MM. Eggimann P, Heyland DK et al (2006) Reduction of nosocomial pneumonia after majo burns by trace element supplementation: aggregation of twd randomized trials. Crit Care 10:R15. 225. Mishra V. Baines M. Perry SE et a (2007) Effect of selenium supplementation on biochemical markers and outcome in critically il patients. Clin Nutr 26:41-50 226. Andrews PJ, Avenell A. Noble DW et al (2011) Randomised trial of glutamine, selenium, or both, to supplemental parenteral nutrition for critically ill patients. BMJ 342:d1542\n\n238. Stewart TE, Meade MO. Cook DJ et al (1998) Evaluation of a ventilatior strategy to prevent barotrauma in patients at high risk for acute respiratory distress syndrome. N Eng J Med 338:355-361 239 Eichacker PC Gerstenberger EF Banks SM et al (2002) Meta-analysis of acute lung iniury and acute resniratory distress svndrome trial: testing low tidal volumes. Am J Respit Crit Care Med 166:1510-15124 240. Putensen C Theuerkauf N. Zinserlins Let al (2009) Meta-analysis ventilation strategies and outcomes of the acute respiratory distress svndrome and acute lung iniury. Ann Intern Med 151:566-576 241. Burns KE. Adhikari NK. Slutsky AS et al (2011) Pressure and volume limited ventilation for the ventilatory management of patients with acute lung iniury: a systematic review and PIos ONE. 6:e1462: meta-analvsis 242. Tobin MJ (2000) Culmination of ar era in research on the acute respiratory distress syndrome. N Engl I Med 342:1360-1361 243. Marini J. Gattinoni L (2004 Ventilatory management of acute respiratory distress syndrome: a Care Med consensus of wo",
            ". Moreno BP The variability of critical care bed numbers in Europe. Intensive Care Med 2012:38(10):1647-53 Pastores SM. Halpern NA. Oropello JM. Kostelecky N. Kvetan V. Critical care organizations in academic medical centers in North America: a descrip- tive report. Crit Care Med. 2015:43(10):2239-44 China's Ministry of Health. Guidelines for the construction and manage: ment of critical care medicine 2009 [Available from: http://www.nhc.gov cn/wiw/afxw/201304/cc4ffaa8314e4ddab/6/88b3f/be8e/1.shtm Yin H. Wang S. Zhu Y. Zhang R. Ye X. WeiJ. et al. The Development of criti cal care medicine in China: from SARS to COVID-19 pandemic. Crit Care Res Pract. 2020;2020:3956732 Xie Y, Liang D, Huang J, Jin J. Hospital ownership and hospital institutiona change:a qualitative study in Guizhou province, China. Int J Environ Re Public Health. 2019;16(8) Jing R, Xu I, Lai X, Mahmoudi E, Fang H. Technical efficiency of public and private hospitals in Beijing, China: a comparative study. Int J Environ Res Public Health. 2019;17(1) 21. Salvatierra GG, Gulek BG, Erdik B, Bennett D, Daratha KB. In-hospital sepsis mortality rates comparing tertiary and non-tertiary hosoitals in Washinc ton state. J Emerg Med. 2018;54(6):785-92 Lee SH. Hona JH. Kim YS. Park EC. Lee SM. Han CH.Impact of intensivy: ist and nursing staff on criticallyill patient mortality: a retrospective analvsis of the Korean NHIS cohort data. 2011-2015. Yonsei Med 2021:62(1):50-8 23 Sasabuchi Y, Yasunaga H, Matsui H, Lefor AK, Horiquchi H, Fushimi K, et a\n\nWallace DI. Seymour CW. Kabn IM. Hospital-level changes in adult ICI bed supply in the United States.( Crit Care Med 2017:45(1)e67-76 25. Jung M, Park H, Kang D, Park E, Jeon K, Chung CR, et al. The effect of bed- to-nurse ratio on hospital mortality of critically ill children on mechanica ventilation: a nationwide population-based study. Ann Intensive Care 2020:10(1):159 26 Kelly DM, Kutney-Lee A, McHugh MD, Sloane DM, Aiken LH. Impact of critical care nursing on 30-day mortality of mechanically ventilated olde adults. Crit Care Med, 2014:42(5):1089-95 27. Assave AM, Wiechula R, Schultz TJ, Feo R. Impact of nurse staffing on patient and nurse workforce outcomes in acute care settings in low- and middle-income countries: a systematic review. JBl Evid Synth. 2021:19/4):751-93 Neuraz A. Guerin C. Pavet C. Polazzi S. Aubrun E. Dailler E. et al, Patient mortality is associated with staff resources and workload in the ICU: a multicenter observational study. Crit Care Med. 2015:43(8):1587-94 Zou X. Li S, Fang M, Hu M, Bian Y Y, Ling J, et al. Acute Physiology and chronic health Evaluation Il Score as a predictor of hospital mortality in patients of coronavirus disease 2019. Crit Care Med. 2020;:48(8):e657-65 Bahtouee M, Eghbali SS, Maleki N, Rastgou V, Motamed N. Acute Physiol ogy and Chronic Health Evaluation ll score for the assessment of mortal- ity prediction in the intensive care unit: a single-centre study from lran. Nurs Crit Care. 2019:24(6):375-80 31. Kang H. The prevention and handling of the missing data. Korean J Anes thesiol. 2013:64(5):402-6\n\n### Publisher's Note\n\nSpringer Nature remains neutral with regard to jurisdictional claims in pub lished maps and institutional affilliations.\n\nReady to submit your research? Choose BMC and benefit from:\n\nAt BMC, research is always in progress.\n\nLearn more biomedcentral.com/submission\n\n",
            "ons.org/publicdomain/zero/1.0/) applies to the data made available in this article,unless otherwise stated in a credit linetothe data\n\nConclusion: This study highlights the association between speciffic ICU structural factors and patient outcomes Modifying structural factors is a potential opportunity that could improve patient outcomes in ICUs\n\n### Background\n\ndelivery is challenging and I complex in the Healthcare intensive care unit. Several factors, including ICU struc ture, ICU organization and d the care process, can influ ence ICU 1 extensive performance 1-3]. Despite the ICUs, the the quality of care literature addressing impact of such factors remains controversial, and a dili. gent assessment of care components is required It is well known that ICU structural factors vary within and regions [4, 51. However, most different countries related conducted in Western studies have been coun- tries [6. 71. Little evidence regarding the structural factors of ICUs in China is available [81, China still faces chal lenges in providing optimal and equitable management strategies for ICU patients across the nation because its broad geography and unbalanced economic develop ment. A previous study described critical care resources in Guangdong Province 9. Another study evaluated the practices, outcomes, and costs related to mechanical ven: tilation within ICUs in Beijing [10]. Nonetheless, those studies were limited to the regions in which the surveys were administered and feature small e sizes: it is I sample also not clear whether those resources were e associated with ICU care provision, treatment patterns, and patient demands outcomes. Finally, increasing  and I rising costs significant challenges to the delivery of high-qual pose: ity and affordable critical care to a growing population of patients. Optimizing ICU organization is a potentia opportunity to improve patient outcomes and the use of resources. Therefore, the aim of this study was to investigate hos- pital and ICU structural factors and patient outcomes in China. Moreover, we aimed to identify the associa- tion between these variables and patient outcomes, with structural factors, including ICU a focus on potential structural resources and staffing levels. We hypothesized that patients admitted to hospitals that were government- funded, tertiary, well-equipped, and better-staffed woulc have a decreased risk of ICU mortality and occurrence of VAP, CRBSIs and CAUTIs after adjusting for region, dis ease severity, and other confounders.\n\nDesign This nationwide, database observational e study was a National Clinical 2019. The data the source was\n\nSystem (https://ncisdc.medidata.cn/login Improvement Qual- jsp), collected by the China-National Critical Care e (China-NCCQC), which is the official ity Control Centre regulates ICU quality control national department that China. The of Health of China Ministry approved that Peking Union Medical College Hospital establishes 2012. The China-NCCQC Quality Improvement China-NCCQC of Critical Care led by Program, was 2015. This initiated in study above pro- part obtained from the the data was gram. Permission to use China-NCCQC.\n\n### Study population and settings\n\nThe China-NCCOC. collected the relevant data regard. ing quality control indicators through the database the National Clinical Improvement System. Hospitals in China are classified in a 3-tier svstem (primary, second arvy or tertiary hospital) that recognizes a hospital's ability to provide medical care, medical education, and conduct medical research. Tertiary hospitals, similar to a tertiary referral hospital in the West, are usually comprehen- sive, referral, general hospitals responsible for provid- ing specialist health services, perform a larger role with 1 and scientific research regard to medical education and serve as medical hubs providing care to multiple regions Secondary hospitals, similar to : a regional hospital e district hospital in the West, tend to be affiliated with medium-sized city, county, or district and are responsible for providing comprehensive health services and medical education and conducting research on a regional basis. Ir contrast, primary hospitals are primary health care insti- tutions whose main function is to provide primary pre- vention directly to the population, however, they rarely admit and treat critically ill patients. Therefore, primary hospitals were not included in the scope of the study The enrolled tertiary and secondary hospitals voluntar- ily participated and were selected by the China-NCCOC The selection criteria were as follows. (1) The ICU had to have more than five beds. (2) The ICU had to have the ability to diagnose and treat the relevant medical dis- eases that were evaluated as quality control items (such catheter- ventilator-associated pneumonia (VAP), as related blood stream infections (CRBSIs), and catheter- associated urinary tract",
            "果一致,提示超声引导外居 动脉置管可降低重症COVID-19患者穿刺并发症。传 统触诊法置管可出现仪导管尖端在动脉中,当患者体 位变化时易发生导管异位,移出动脉血失用的情况 血超声可视化技术可确认导管完全进人动脉。据报 道,税动脉起始位置或走形存在变异的比率为 9.6%~15.4% 9] 虽然传统触诊法留置外周动脉导 管通常是安全的,但血肿等并发症仍然不可避凭 (发生率约5%)[10] 对于重症COVID-19黑者多层 防护影响穿刺者操作,可导致穿刺并发症发生率显著 增加(本研究药为40%)。超声的可视化优点能充分 展示动脉与其他组织的位置关系(,有助于减少穿 刺过程中不必要的置管并发症\",对有解剖变异的 患者尤其重要。国际超声引导血管通路操作指南1 建议将超声引导重症患者进行动静脉置管技术列为常 规操作,且初学者练习超声引导税动脉穿刺置管约 14次即可掌握该项操作技能[2]本研究亦证实了重 症医疗工作者掌握该项操作技能的必要性 本研究存在以下局限性:第一,由于疫情的特殊\n\n性,本研究很难进行平行对照设计,对照组为历史对 照,可能存在未能平衡的混杂因素。第二,受限于样 本量,未对潜在混杂因素进行校正,报告的",
            "效应为未 校正的粗效应,结果可能存在一定偏倚。 综上,三级防护下,利用超声的可视化特性,采 用平面外(短轴)技术联合平面内(长轴)技术对 重症COVID-19患者进行外周动脉置管,可提高首次 置管成功率,减少穿刺次数,降低穿刺并发症的发 生率。\n\n作者贡献:赵明曦、李若祎负责研究设计、数据分 析、论文撰写:孙建华、苏龙翔、李奇、李尊柱、马 鸿鸣、崔文博和罗红波参与研究设计和结果分析:周 翔指导研究设计数据分析并修改论文 利益冲突:无\n\n### 考 献 文\n\n[1]国家中医药管理局办公室中华人民共和国国家卫生健康 委员会办公厅,新型冠状病毒肺炎诊疗方案(试行第八 版)[1],中国医药、2020.15:1494-1499 [11 General Office of National Health Commission of the People's Republic of China, Office of National Administration of Tra- of ditional Chinese Medicine, Diagnosis and treatment virus disease-19 (8th trial edition)[J. Zhongguo corona Yi Yao, 2020, 15: 1494-1499. [2]尹万红,康焰.新型冠状病毒肺炎急性呼吸窘迫综合征 的血流动力学治疗[J1.协和医学杂志,2020,11: 518-521. [2 Yin WH, Kang Y. Hemodynamic therapy for COVID-19 pa syndromeJ. Xie He tients with e respiratory distress acute Yi Xue Za Zhi, 2020, 11: 518-521. 1 LM. al. Ultrasound- [31 RH, Paulin Shiloh 1 AL. Savel et radial guided systematic catheterization artery: a review and meta-analysis of randomized controlled [J. Chest, 2011, 139; 524-529. 等.超声引导下税动脉置管 [4]孙建华,刘大为,王小亭, 的应用进展[J.中国实用护理杂志,2016,32: 1997-2000 Sun JH, Liu DW, Wang XT, et al. Development of applica- tior cannulation of ultrasound guided radia research artery\n\n[J]. Zhongguo Shi Yong Hu  Z",
            "osing patterns for continuous renal replacement therapy at a large academic medical center in the United States. I Crit Care 2002; 17: 246-250 Boussekey N, Chiche A, Faure K, et al. A pilot randomized study comparing high and low volume hemofiltration on :in septic shock 1vasopressor use Intensive Care Med 2008; 34: 1646-1653\n\nKidney International Supplements (2012) 2, 124-138\n\n",
            "1中国医学科学院北京协和医学院北京协和医院重症医学科,北京100730 2中国医学科学院北京协和医学院护理学院,北京100041 Tt tr4 --\n\n通信作者:周翔电话:010-6915 [摘要]目的探讨超声引导技术在重症新型冠状病毒肺 管留置中的应用效果。方法 回顾性收集并分析2020年2月 的重症COVID-19患者临床资料。采用超声引导外周动脉置管 比较两组患者动脉导管留置情况和并发症发生率结果 究。其中研究组30例、对照组30例研究组外周动脉首次量 25.79)%比(53.07+30.21)%]均高于对照组(P均<0.05) 研究组外周动脉导管留置的241失用率 对照组(P<0.05)。) 阳寨曲折发生率(3.3%比40.0%)均低于对照组(P均< COVID-19患者进行外周动脉置管,可提高首次置管成功率,2 [关键词]新型冠状病毒肺炎:外周动脉:重症:超声: [文献标志码]A [文章 [中图分类号]R563.1 DO1: 10. 12290/xhyxzz. 20200209 Application of Ultrasound-guided Periphe with Coronavirus Disease 2019 ZHAO Ming-xi , LI Ruo-vi2, SUN Jian-hual, SU Lo CUI Wen-bo , LUO Hor Department of Critical Care Medicine, Peking Union Medical Medical Colleg Peking Union 2 School of Nursing, Chinese Academy of Medical Sciences Corresponding author: ZHOU Xiang Tel: 86- (Abstract Objective To explore the application patients with COVID-19. Methods From February to the clinical data of critical patients with COVID-19 with medical team of Peking Union Medical College Hospital 基金项目:国家重点研发计划\"公共安全风险防控与应急技术装备\"重点 工程(2020-12M-CoV19-001\n\n### disease 2019,COVID-19)患者外周动脉导 (摘要]目的 ☐探讨超声引导技术在重症新�",
            "�冠状病毒肺炎(coronavirus 管留置中的应用效果。方法回顾性收集并分析2020年2月至4月北京协和医院援鄂医疗队诊治的留置外周动脉导管 的重症COVID-19患者临床资料,采用超声引导外周动脉置管的患者为研空组采用传统触诊法置管的患者为对照组。 比较两组患者动脉导管留置情况和并发症发生率。结果共60例符合纳人和排除标准的重症COVID-19患者人选本研 究。其中研究组30例,对照组30例。研究组外周动脉首次置管成功率(63.3%比26.7%)总穿刺成功率[(79.43+ 25.79)%比(53.07+30.21)%]均高于对照组(P均<0.05)穿刺次数[(143+0.56)次比(2.50+1.28)次]少于 对照组(P<0.05)。研究组外周动脉导管留置的24h失用率(6.7%比30.0%)局部血肿发生率(10.0%比36.7%), 阳塞曲折发生率(3.3%比40.0%)均低于对照组(P均<0.05)。结论三级防护下,应用超声引导技术对重症 COVID-19患者进行外周动脉置管,可提高首次置管成功率,减少穿刺次数,降低并发症发生率 [关键词]新型冠状病毒陆炎:外周动脉:重症:超声:三级防护 (文献标志码]A [中图分类号]R563.1 [文章编号]1674-9081(2021)01-0044-05 DOL: 10.12290/xhyxzz.2020020° Application of Ultrasound-guided Peripheral Arterial Puncture in Severe Patients with Coronavirus Disease 2019 Under Three-level Protection\n\nElin1omimg-xl,L1tuo-y1,oO"
        ],
        "ground_truth": "超声引导技术在重症新型冠状病毒肺炎患者外周动脉置管中的应用效果是提高首次置管成功率，减少穿刺次数，降低并发症发生率。",
        "metadata": [
            {
                "filename": "Association between hospital and ICU structural factors and patient outcomes in China a secondary analysis of the National Clinical Improvement System Data in 2019.pdf"
            },
            {
                "filename": "Dellinger-2013-Surviving Sepsis Cam.pdf"
            },
            {
                "filename": "Association between hospital and ICU structural factors and patient outcomes in China a secondary analysis of the National Clinical Improvement System Data in 2019.pdf"
            },
            {
                "filename": "Association between hospital and ICU structural factors and patient outcomes in China a secondary analysis of the National Clinical Improvement System Data in 2019.pdf"
            },
            {
                "filename": "三级防护下超声引导外周动脉置管在新型冠状病毒肺炎重症患者中的应用.pdf"
            },
            {
                "filename": "三级防护下超声引导外周动脉置管在新型冠状病毒肺炎重症患者中的应用.pdf"
            },
            {
                "filename": "Sievert-2013-Antimicrobial-resistant pathogens.pdf"
            },
            {
                "filename": "三级防护下超声引导外周动脉置管在新型冠状病毒肺炎重症患者中的应用.pdf"
            },
            {
                "filename": "三级防护下超声引导外周动脉置管在新型冠状病毒肺炎重症患者中的应用.pdf"
            }
        ],
        "evolution_type": "noise_robustness"
    },
    {
        "id": 37,
        "question": "血管活性药物在脓毒性休克治疗中的作用是什么？",
        "answer": "血管活性药物在脓毒性休克治疗中起着关键作用。它们被推荐用于补充去甲肾上腺素，以达到目标的平均动脉压（MAPP）或者降低去甲肾上腺素的用量（弱推荐，中等证据质量）。血管活性药物，如多巴胺和血管加压素，通过提高血压来改善组织灌注和氧输送，这对于休克患者尤其重要。多巴胺常用于增加心率和每搏输出量来升高MAP，而血管加压素则通过缩血管作用来升高MAP，并且对心率和每搏输出的影响较小。一项研究显示，与多巴胺相比，去甲肾上腺素可以降低患者病死率和心律失常的风险。在某些情况下，小剂量血管加压素用于治疗无效的患者可以提高MAPP或减少去甲肾上腺素的用量。此外，使用血管活性药物的同时加用参附注射液也被推荐以增加血压、稳定血压并减少血管活性药物的用量，这被认为对患者有积极影响。然而，血管加压素的常规使用并未得到一项包括1710例患者的系统评价和Meta分析的支持，其对",
        "contexts": [
            "HD, SLED, and PD 112 Table 23. Microbiological quality standards of different regulatory agencies\n\n## FIGURES\n\n14 Figure 1. The RIFLE criteria for AK 20 Overview of AKI, CKD, and AKD Figure 2. 20 Fiqure 3. Conceptual model for AK 25 Fiqure 4. Stage-based management of AK 26 Fiqure 5. Evaluation of AKI according to the stage and cause 34 Fiqure 6. Chronic Kidney Disease Epidemiology Collaboration cohort changes in eGFR and final eGFR corresponding KDIGO definition and stages of AK 34 Fiqure 7. GFR/SCr algorithm 38 Fiqure 8. Conceptual model for development and clinical course of AK 48 Figure 9. Effect of furosemide ys. control on all-cause mortality 48 Figure 10. Effect of furosemide ys. control on need for RR7 51 Fiqure 11. Effect of low-dose dopamine on mortality 52 Figure 12. Effect of low-dose dopamine on need for RR7 73 Fiqure 13. Sample questionnaire 78 Fiqure 14. Risk for contrast-induced nephropathy Figure 15. Bicarbonate vs, saline and risk of Cl-AK 85 Figure 16. NAC and bicarbonate vs. NAC for risk of CI-AK 96 Fiqure 17. Flow-chart summary of recommendations\n\nAdditional information at http://www.kdigo.org/clinical_practice guidelines/AKl.php\n\nKidney International Supplements (2012) 2, iv\n\n© 2012 KDIGO\n\nKidney International Supplements (2012) 2, 1; doi:10.1038/kisup.2012.1\n\n### SECTION I: USE OF THE CLINICAL PRACTICE GUIDELINE\n\nSECTIONI: USE OF THE CLINICAL PRACTICE GUIDELINE This Clinical Practice Guideline document is based I upon the best information available February 2011, It is designed to provide information and 1 assist decision-making, It is not intended to define a standard of care, and should not be construed I as one, nor should it be wil 1 exclusive course of management. Variations s in practice interpreted as prescribing r an I appropriately occur when clinicians take into account the needs of individual inevitably and patients, available resources, and limitations unique to an institution or type of practice. Every health-care professional making use of these recommendations is responsible for evaluating the in the settingC of any particular clinical situation. The applying them appropriateness recommendations for research contained within this document are general and do not imply a specific protocol\n\n## SECTION II: DISCLOSURE\n\nKidney Disease: Improving Global Outcomes (KDIGO) makes every effort to avoid any actual or reasonably perceived conflicts of interest that may arise as a result of an outside relationship or a personal, professional, or business interest of a member of the Work Group. All members of the Work Group are required to complete, sign, and 1 submit a disclosure e and attestation form all such relationships that might be perceived or c actual conflicts of interest. This showing : document is.1 updated annually and information is adiusted accordingly, All reported information the end of this document tin the Work Group members is published in its entirety Biographical and Disclosure Information section, and is kept on file at the National Kidney Foundation (NKF), Managing Agent for KDIGO.\n\nKidney International Supplements (2012) 2, 1\n\n### Work Group Membership\n\nKidney International Supplements (2012) 2, 2; doi:10.1038/kisup.2012.2\n\nJohn A Kellum, MD, FCCM, FACP University of Pittsburgh School of Medicine Pittsburgh, PA\n\nWORK GROUP Peter Aspelin, MD, PhD Karolinska University Hospita Stockholm, Sweden Rashad S Barsoum, MD, FRCP, FRCPE Cairo University Cairo, Egypt Emmanuel A Burdmann, MD, PhD University of Sāo Paulo Medical Schoo Sāo Paulo, Brazi Stuart L Goldstein, MD Cincinnati Children's Hospital & Medical Cincinnati, OH Charles A Herzog, MD Hennepin County Medical Center Minneapolis, MN Michael Joannidis, MD Medical University of Innsbruck Innsbruck, Austria Andreas Kribben, MI University Duisburg-Essen Essen, Germany MD Andrew S Levey,. Tufts Medical Center Boston, MA\n\nufts Center for Kidney Disease Guideline Development and Implementation, Tufts Medical Center, Boston, MA, USA:\n\nAlison M MacLeod, MBChB, MD, FRCP University of Aberdeen Aberdeen, United Kingdom\n\nAberdeen, United Kingdom Ravindra L Meht",
            " more advanced study. needed design and analytical approach examine the dynamic impact of nurse staffing on ICU patient outcomes There are some limitations to this study. First., the use of secondary data limited essential variables such as the patient-level characteristics or uncontrolled confound- ers (e.g., education level of the staff. ICU bed occu- pancy rate) needed to understand the predictive factors of the patients' outcomes. To reduce these methodo- logical problems, we applied multivariate analysis using s adjusted for generalized linear mixed models patient disease severity using the APACHE I score, which has been shown to be an important predictor of patient outcomes [29, 30]. Second, since only one year of data was reported, presented and summarized in this study of the structural factors and health the relationships. outcomes could: not be analysed continuously anc dynamically. Third, this was an observational study and therefore, prone to selection bias. Causal relationships cannot be drawn due to the cross-sectional nature of the study design. Fourth, listwise deletion was used to data, which may cause bias in the handle the missing of the parameters 31 . Despite these limi- estimates tations, the results of this study are highly meaning- ful in that they underscore the necessity of nonpatient factors, including hospital and ICU structural factors, addi- as a way to reduce : adverse patient outcomes. In : tion, we have improved the generalizability of the find- ings by using national administrative data, unlike most data previous studies, which were conducted using from only certain regions or hospitals. The results may have important implications for critical care develop ment in China and other countries with similar medica environments.\n\nIn conclusion, specific structural factors, includingl hos- pital ownership, hospital type, I ICU-hospital bed percent: with ICU and bed-to-nurse associated e ratio age, were 1 poli- These observations can patient 1 assist in toutcomes. the cies and interventions bridge current quality gap in the delivery of critical care in China well as other developing countries.\n\nVAP: Ventilator-associated pneumonia; CRBSls: Catheter-related blood stream infections; CAUTls: Catheter-associated urinary tract infections: APACHE I score: Acute Physiology and Chronic Health Evaluation score; IQR: Interquartile range;95% Cl: Confidence interval; ICU: Intensive care unit\n\n### Supplementary Information\n\nThe online version contains supplementary material available at https://doi. org/10.1186/s13054-022-03892-7.\n\nAdditional fle 1. Definition of ventilator-associated pneumonia, catheter- related bloodstream infections, and catheter-associated urinary tract infections.\n\n### Acknowledgements\n\nThe authors would like to thank all participants and staff. The China Nationa Critical Care Quality Control Center Group consists of the following persons Xue Wang, Xiangdong Guan, Yan Kang, Bin Xiong, Bingyu Qin, Kejian Qian, Chunting Wang, Mingyan Zhao, Xiaochun Ma, Xiangyou Yu, Jiandong Lin, Aijun Pan, Haibo Qiu, Feng Shen, Shusheng Li, Yuhang Ai, Xiaohong Xie, Jing Yan, Weidong Wu, Meili Duan, Linjun Wan,. Xiaojun Yang, Jian Liu, Hang Xu, Dongpo Jiang, Lei Xu, Zhuang Chen, Guoying Lin, Zhengping Yang, Zhenjie Hu,\n\n### Authors'contributions 77L X7 and DL conceivec\n\nZZL XZ and DL conceived, designed, and supervised the study;XM and SG collected and prepared the data: ZL. WD.LS. IW and OZ helped collect data and performed data curation. ZL. OLHl and IS interpreted the data All authors contributed to the critical reading of the text and its revision. Al authors read and approved the final manuscript\n\nThis study was supported by the National Key R&D Program of China (grant number 2020YFCO861000), the CAMS Innovation Fund for Medical Sciences (CIFMS) (No. 2020-12 M-CoV19-001), the CAMS Endowment Fund (No.2021- CAMS-JZ004), the China International Medical Exchange Foundation Specia Fund for Young and Middle-Aged Medical Research (No.Z-2018-35-1902), the Chinese Medical Information and Big Data Association(CHMIA) Special Fund for Emergency Project and Beijing Municipal Natural Science Foundation (M21019) and the 2020 CMB Open Competition Program (No. 20-381).\n\n### Availability of supporting data\n\nThe datasets analysed during the current study are available from the cor- responding author",
            "ons.org/publicdomain/zero/1.0/) applies to the data made available in this article,unless otherwise stated in a credit linetothe data\n\nConclusion: This study highlights the association between speciffic ICU structural factors and patient outcomes Modifying structural factors is a potential opportunity that could improve patient outcomes in ICUs\n\n### Background\n\ndelivery is challenging and I complex in the Healthcare intensive care unit. Several factors, including ICU struc ture, ICU organization and d the care process, can influ ence ICU 1 extensive performance 1-3]. Despite the ICUs, the the quality of care literature addressing impact of such factors remains controversial, and a dili. gent assessment of care components is required It is well known that ICU structural factors vary within and regions [4, 51. However, most different countries related conducted in Western studies have been coun- tries [6. 71. Little evidence regarding the structural factors of ICUs in China is available [81, China still faces chal lenges in providing optimal and equitable management strategies for ICU patients across the nation because its broad geography and unbalanced economic develop ment. A previous study described critical care resources in Guangdong Province 9. Another study evaluated the practices, outcomes, and costs related to mechanical ven: tilation within ICUs in Beijing [10]. Nonetheless, those studies were limited to the regions in which the surveys were administered and feature small e sizes: it is I sample also not clear whether those resources were e associated with ICU care provision, treatment patterns, and patient demands outcomes. Finally, increasing  and I rising costs significant challenges to the delivery of high-qual pose: ity and affordable critical care to a growing population of patients. Optimizing ICU organization is a potentia opportunity to improve patient outcomes and the use of resources. Therefore, the aim of this study was to investigate hos- pital and ICU structural factors and patient outcomes in China. Moreover, we aimed to identify the associa- tion between these variables and patient outcomes, with structural factors, including ICU a focus on potential structural resources and staffing levels. We hypothesized that patients admitted to hospitals that were government- funded, tertiary, well-equipped, and better-staffed woulc have a decreased risk of ICU mortality and occurrence of VAP, CRBSIs and CAUTIs after adjusting for region, dis ease severity, and other confounders.\n\nDesign This nationwide, database observational e study was a National Clinical 2019. The data the source was\n\nSystem (https://ncisdc.medidata.cn/login Improvement Qual- jsp), collected by the China-National Critical Care e (China-NCCQC), which is the official ity Control Centre regulates ICU quality control national department that China. The of Health of China Ministry approved that Peking Union Medical College Hospital establishes 2012. The China-NCCQC Quality Improvement China-NCCQC of Critical Care led by Program, was 2015. This initiated in study above pro- part obtained from the the data was gram. Permission to use China-NCCQC.\n\n### Study population and settings\n\nThe China-NCCOC. collected the relevant data regard. ing quality control indicators through the database the National Clinical Improvement System. Hospitals in China are classified in a 3-tier svstem (primary, second arvy or tertiary hospital) that recognizes a hospital's ability to provide medical care, medical education, and conduct medical research. Tertiary hospitals, similar to a tertiary referral hospital in the West, are usually comprehen- sive, referral, general hospitals responsible for provid- ing specialist health services, perform a larger role with 1 and scientific research regard to medical education and serve as medical hubs providing care to multiple regions Secondary hospitals, similar to : a regional hospital e district hospital in the West, tend to be affiliated with medium-sized city, county, or district and are responsible for providing comprehensive health services and medical education and conducting research on a regional basis. Ir contrast, primary hospitals are primary health care insti- tutions whose main function is to provide primary pre- vention directly to the population, however, they rarely admit and treat critically ill patients. Therefore, primary hospitals were not included in the scope of the study The enrolled tertiary and secondary hospitals voluntar- ily participated and were selected by the China-NCCOC The selection criteria were as follows. (1) The ICU had to have more than five beds. (2) The ICU had to have the ability to diagnose and treat the relevant medical dis- eases that were evaluated as quality control items (such catheter- ventilator-associated pneumonia (VAP), as related blood stream infections (CRBSIs), and catheter- associated urinary tract",
            "��素与多巴胺的系统评价和 Meta 分析 (1710\n例) 不支持常规使用多巴胺治疗脓毒性休克， 研究显示，与多巴胺相比，去甲肾上腺素可降 低患者病死率并可显著降低心律失常的风险。我国一项去甲肾上腺素与多巴胺治疗脓毒性休 克的 Meta 分析显示与多巴胺相比，去甲肾上腺素可以改善脓毒性休克患者的血流动力学，\n降低患者的病死率。\n推荐意见 19：建议在去甲肾上腺素基础上加用血管加压素(最大剂量 0 .3U／min) 以 达到目标 MAPP 或者降低去甲肾上腺素的用量(弱推荐，中等证据质量)。对于脓毒性休克患 者，推荐在血管活性药物使用的基础上加用参附注射液以增加提升血压的效果、稳定血压和 减少血管活性药物用量(强推荐，中等证据质量)。\n脓毒性休克患者体内血管加压素水平低于休克状态的预期水平。小剂量血管加压素     (0.03U／min)用于其他升压药治疗无效的脓毒性休克患者，可提高 MAPP 或者减少去甲肾 上腺素的用量。 VASTT 研究结果显示，单用去甲肾上腺素组与联用血管加压素 (0.03U/min) 组患者 28 d、 90d病死率及严重不良事件发生率差异无统计学意义，亚组分析显示，病情 较轻 (随机时接受＜15μg/min 去甲",
            "RT 需求、 尿量、生存期、住院时间、 心律失常发生率等疗效指标均无显著改善。 我国相关研究表明， LDD 不能降低脓毒症急性肾衰竭患者 RRT 需求及病死率。\n推荐意见 21 ：经过充分的液体复苏以及使用血管活性药物后，如果仍持续低灌注，建 议使用多巴酚丁胺(弱推荐，低证据质量)。\n多巴酚丁胺作为一线正性肌力药，为 EGDT 临床试验标准治疗的一部份，在其使用中 未发现对病死率的不良影响。 两项 ICU 脓毒症患者的大型前瞻性临床试验显示，使用多巴 酚丁胺将患者心输出量提高至高于正常水平不会改善临床结局。然而， 一些患者可能通过正 性肌力药物改善组织灌注，增加氧气输送。我国一项评价多巴酚丁胺联用去甲肾上腺素治疗 脓毒性休克伴顽强性低血压的研究表明，多巴酚丁胺可有效升高血压， 改善循环与灌注，提 高救治成功率。\n推荐意见 22：建议所有需要血管活性药物的患者置入动脉导管进行连续性血压测定(弱 推荐， 极低证据质量)。\n在休克状态， 使用动脉导管监测血压比袖带血压计测量更准确，可进行连续监测且允许\n如有侵权请联系网站删除\n每搏分析，有助于医务人员更准确",
            "��推荐对可能有特定感染源的脓毒症患者，应尽快明确其感染源，并尽快 采取适当的控制措施 (BPS)。\n脓毒症和脓毒性休克的感染源控制原则是感染部位的快速诊断和及时处理。对易于清除 的感染灶，包括腹腔内脓肿、胃肠道穿孔、胆管炎、胆囊炎、肾盂肾炎伴梗阻或者脓肿、肠缺 血、坏死性软组织感染和其他深部间隙感染(如脓胸或者严重的关节内感染)，应在初始复苏 后尽快控制感染灶，普通诊断后不超过 6-12 h 。当血管内植入装置为疑似感染源时，拔除 导管可能是有益的。\n7.3 血管活性药物\n如有侵权请联系网站删除\n推荐意见 18：推荐去甲肾上腺素作为首选血管加压药(强推荐，中等证据质量)；对于 快速性心律失常风险低或者心动过缓的患者，可将多巴胺作为替代药物(弱推荐，低证据质量)。\n去甲肾上腺素通过其缩血管作用而升高 MAP，对心率和每搏输出量的影响小，可有效 改善脓毒性休克患者的低血压状态。多巴胺主要通过增加心率和每搏输出量升高 MAP，可 能对心脏收缩功能受损的患者疗效更好，但可能引起心动过速，增加患者心律失常的风险。\n一项纳入11项随机试验的比较去甲肾上�",
            "��素与多巴胺的系统评价和 Meta 分析 (1710\n例) 不支持常规使用多巴胺治疗脓毒性休克， 研究显示，与多巴胺相比，去甲肾上腺素可降 低患者病死率并可显著降低心律失常的风险。我国一项去甲肾上腺素与多巴胺治疗脓毒性休 克的 Meta 分析显示与多巴胺相比，去甲肾上腺素可以改善脓毒性休克患者的血流动力学，\n降低患者的病死率。\n推荐意见 19：建议在去甲肾上腺素基础上加用血管加压素(最大剂量 0 .3U／min) 以 达到目标 MAPP 或者降低去甲肾上腺素的用量(弱推荐，中等证据质量)。对于脓毒性休克患 者，推荐在血管活性药物使用的基础上加用参附注射液以增加提升血压的效果、稳定血压和 减少血管活性药物用量(强推荐，中等证据质量)。\n脓毒性休克患者体内血管加压素水平低于休克状态的预期水平。小剂量血管加压素     (0.03U／min)用于其他升压药治疗无效的脓毒性休克患者，可提高 MAPP 或者减少去甲肾 上腺素的用量。 VASTT 研究结果显示，单用去甲肾上腺素组与联用血管加压素 (0.03U/min) 组患者 28 d、 90d病死率及严重不良事件发生率差异无统计学意义，亚组分析显示，病情 较轻 (随机时接受＜15μg/min 去甲",
            "2012.5\n\nAAMI American Association 1 of Medica Instrumentation ACCP American College of Chest Physicians ACD-A Anticoagulant dextrose solution A ACE-I Angiotensin-converting enzyme inhibitor(s ADQI Acute Dialysis Ouality Initiative AHCPR Agency for Health Care Policy and Research AKD Acute kidney diseases and disorders AKI Acute kidney iniury AKIN Acute Kidney Iniury Network ANP Atrial natriuretic peptide aPTT Activated partial thromboplastin time ARE Angiotensin-receptor blocker(s ARH Acute renal failure ARFTN Acute Renal Failure Trial Network ATN Acute tubular necrosis AUC Area under the curve BMI Body mass index BUN Blood urea nitrogen CDC Centers for Disease Contro CHF Congestive heart failure CI Confidence interva CI-AK Contrast-induced acute kidney injury 1888 Conventional insulin therapy Chronic kidney disease Creatinine clearance Chronic renal failure CRRT Continuous renal replacement therapy CT Computed tomography CVC Central venous catheters CVVH Continuous venovenous hemofiltration CVVHDE Continuous venovenous hemodiafltration eCrC) Estimated creatinine clearance EGDT Early goal-directed therapy eGFR Estimated glomerular filtration rate ERT Evidence Review Team ESRD End-stage renal disease FDA Food and Drug Administratior GFR Glomerular filtration rate HDF Hemodiafiltration HES Hudrovuothuctorcl\n\nKidney International Supplements (2012) 2, 5\n\nHF Hemofltration HIT Heparin-induced thrombocytopenia HR Hazard ratic ia Intraarterial ICU Intensive-care unit IGF-1 Insulin-like growth factor-1 earch IHD Intermittent hemodialvsis IT Intensive insulin therapy i.v Intravenous KDIGC Kidney Disease: Improving Global Outcomes KDOQI Kidney Disease Outcomes Quality Initiative LOS Length of stay MDRD Modification of Diet in Renal Disease M Myocardial infarction MIC Minimum inhibitory  concentratior MRI Magnetic resonance imaging MW Molecular weight NAC N-acetylcysteine NICE-SUGAR Normoglycemia in Intensive Care Evaluation and Survival Using Glucose Algorithm Regulation NKD No known kidney disease NKF National Kidney Foundatior NSP Nephrogenic Systemic Fibrosis OR Odds ratic PD Peritoneal dialysis PICARD Program to Improve Care in Acute Renal Disease RCT Randomized controlled tria RIFLE Risk, Injury, Failure; Loss, End-Stage Rena Disease RR ion Relative risk RRT Renal replacement therapy SAFE Saline vs. Albumin Fluid Evaluation SCr Serum creatinine ScVO2 Central venous oxygen saturation SLED Sustained low-efficiency dialysis TCC Tunneled cuffed catheter VISEP Efficacy of Volume Substitution and Insulin Therapy in Severe Sepsis\n\nKidney International Supplements (2012) 2, 6; doi:10.1038/kisup.2012.6\n\nThe 2011 Kidney Disease: Improving Global Outcomes (KDIGO) Clinical Practice Guideline for Acute Kidney Injury (AKI) aims to assist practitioners caring for adults and children at risk for or with AKI, including contrast-induced acute kidney injury (CI-AKI). Guideline development followed an explicit process of evidence review and appraisal. The guideline contains chapters on definition, risk assessment, evaluation, prevention, and treatment. Definition and staging of AK] are based on the Risk, Injury, Failure; Loss, End-Stage Renal Disease (RIFLE) and Acute Kidney Injury Network (AKIN) criteria and studies on risk relationships. The treatment chapters cover oharmacological approaches to prevent or treat AKI, and management of renal replacement for kidney failure from AKI. Guideline recommendations are based on svstematic reviews of relevant trials. Appraisal of the quality of the evidence and the strength of recommendations followed the GRADE: approach. Limitations of the evidence are discussed and specific suggestions are provided for future research,\n\nKeywords: Clinical Practice Guideline; KDIGO; acute kidney injury; contrast-induced nephropathy; renal replacement therapy; evidence-based recommendation\n\nIn citing this document, the following format should be used: Kidney Disease: Improving Globa Outcomes (KDIGO) Acute Kidney Injury Work Group. KDIGO Clinical Practice Guideline for Acute Kidney Injury. Kidney inter., Suppl. 2012; 2: 1-138.\n\nKidney International Supplements",
            "肾上腺素与血管加压素联合)的患者 28d病死率更低。 后续试验表明，对于急性肾衰竭的脓毒性休克患者， 联用小剂量血管加压素较单用去甲肾上 腺素获益更多。 特利加压素与血管加压素具有相似的效应。研究表明，小剂量特利加压素与 去甲肾上腺素联用可通过改善组织血供、保护器官功能等显著改善临床效果。\n关于血管加压素与去甲肾上腺素的比较， 对 9 项临床研究 (共 1324 例脓毒性休克患者) 进行 Meta 分析显示，使用血管加压素(或者特利加压素)与使用去甲肾上腺素患者病死率差 异无统计学意义。基于血管加压素对病死率影响的不确定性，不推荐使用血管加压素作为一 线血管加压药用于改善 MAPP。\n我国相关 RCT 及 Meta 分析研究显示，在常规治疗和使用血管活性药物的基础上，联合 应用参附注射液，可升高脓毒性休克患者的 MAP ，降低病死率。 在改善临床症状、加强脏 器功能保护上具有积极作用， 并且可以减少血管活性药物的剂量从而减轻相关不良反应。\n推荐意见 20：不推荐使用低剂量多巴胺用于肾脏保护 (强推荐，高证据质量)。\nRCT 和相关 Meta 分析显示，与安慰剂相比，低剂量多巴胺(LDD)对患者 R",
            "### Association between hospital and ICU Ch up structural factors and patient outcomes in China: a secondary analysis of the National Clinical Improvement System Data in 2019\n\nZhen Lilfo,Xudong Ma2t . Sifa Gao2t Qi Li, Hongbo Luo , Jianhua Sun',Wei Du', Longxiang Su', Lu Wang Qing Zhang', Zunzhu Lil\"*, Xiang Zhou\" and Dawei Liu\" on behalf of China National Critical Care Quality Control Center Group\n\nBackground: Hospital and CU structural factors are key factors affecting the guality of care as well as CU patient outcomes. However, the data from China are scarce. This study was designed to investigate how differences in patient outcomes are associated with differences in hospital and ICU structure variables in China throughout 2019\n\nMethods: This was a multicenter observational study. Data from a total of 2820 hospitals were collected using the National Clinical lmprovement System Data that reports CU information in China. Data collection consisted of al information on the hospital and ICU structural factors, including the hospital type, number of beds, staffng, among others, and b) ICU patient outcomes, including the mortality rate as well as the incidence of ventilator-associated oneumonia (VAP). catheter-related bloodstream infections (CRBSls), and catheter-associated urinary tract infections (CAUTls), Generalized linear mixed models were used to analyse the association between hospital and ICU structura factors and patient outcomes Results: The median ICU patient mortality was 8.02%(3.78%, 14.35%), and the incidences of VAP CRBSL, and CAUT\n\npneumonia (VAP), catheter-related bloodstream infections (CRBSls), and catheter-associated urinary tract infections (CAUTls), Generalized linear mixed models were used to analyse the association between hospital and ICU structura factors and patient outcomes Results: The median ICU patient mortality was 8.02% (3.78%., 14.35%), and the incidences of VAP. CRBSL, and CAUT were 5.58 (1.55.11.67) per 1000 ventilator davs., 0.63 (0.2.01) per 1000 catheter davs,and 142 (0.37,3,40) per 1000 catheter davs, respectively. Mortality was sianificantly lower in public hospitals (B= -0.018(- 0031.- 0.005) p=0.006), hospitals with an ICU-to-hospital bed percentage of more than 2% (B= -0.027 (-0.034,-0.019)., p<0.001) and higber in hospitals with a bed-to-nurse ratio of more than 0 5:1 (B=0009 (0 001 0017) np=0 027) The incidence of VAP was lower in public hospitals (B= -0.036 (- 0.054.-0018), p<0.001). The incidence of CRBSls was lower in public hospitals (B= -0.008 (- 0.014,-0002), p=0.011) and hiaher in secondary hospitals (B=0.005 (0.001.,0.009) p= 0.010), while the incidence of CAUTls was higher in secondary hospitals (B=0.010 (0002. 0.018)., p= 0.015)\n\ndwliu98@163.com [Zhen Li, Xudong Ma and Sifa Gao contributed equally to this work 'Department of Critical Care Medicine. Peking Union Medical College Hospital, Pekina Union Medical College and Chinese Academy of Medica Sciences, Beijing 100730, China Full list of author information is available at the end of the article\n\n©The Author(s) 2022. corrected publication 2022 Open Access This article is licensed under a Creative Commons Attribution 40 Interational License, which permits use, sharing, adaptation, distribution and reproduction in any medium or format, as long as you give appropriate credit to the original author(s) and the source, provide a link to the Creative Commons licence, and indicate if changes were made The images or otber third party material in this article are indluded in the artice's Creative Commons llicence  unless indicated otherwise in a credit line to the material If material is not included in the article's Creative Commons licence and your intended use is not permitted by statutory requlation or exceeds the permitted use, you will need to obtain permission directly from the copyriaght holder. To view a copy of this licence visit http://creativecommonsora/licenses/by/40/ The Creative Commons Public Domain Dedication waive (http://creativecomm"
        ],
        "ground_truth": "血管活性药物在脓毒性休克治疗中的作用是通过调节血管收缩和扩张，以维持血压和组织灌注，改善患者的低血压状态。",
        "metadata": [
            {
                "filename": "Sievert-2013-Antimicrobial-resistant pathogens.pdf"
            },
            {
                "filename": "Association between hospital and ICU structural factors and patient outcomes in China a secondary analysis of the National Clinical Improvement System Data in 2019.pdf"
            },
            {
                "filename": "Association between hospital and ICU structural factors and patient outcomes in China a secondary analysis of the National Clinical Improvement System Data in 2019.pdf"
            },
            {
                "filename": "(Word版)中国脓毒症／脓毒性休克急诊治疗指南(2022)培训资料.docx"
            },
            {
                "filename": "(Word版)中国脓毒症／脓毒性休克急诊治疗指南(2022)培训资料.docx"
            },
            {
                "filename": "(Word版)中国脓毒症／脓毒性休克急诊治疗指南(2022)培训资料.docx"
            },
            {
                "filename": "(Word版)中国脓毒症／脓毒性休克急诊治疗指南(2022)培训资料.docx"
            },
            {
                "filename": "Sievert-2013-Antimicrobial-resistant pathogens.pdf"
            },
            {
                "filename": "(Word版)中国脓毒症／脓毒性休克急诊治疗指南(2022)培训资料.docx"
            },
            {
                "filename": "Association between hospital and ICU structural factors and patient outcomes in China a secondary analysis of the National Clinical Improvement System Data in 2019.pdf"
            }
        ],
        "evolution_type": "noise_robustness"
    },
    {
        "id": 38,
        "question": "血液透析对于什么药物剂量需要调整？",
        "answer": "血液透析通常不需要调整伊曲康唑的药物剂量,因为血液透析可以清除伊曲康唑。然而，伏立康唑和卡泊芬净的给药剂量在血液透析时可能需要根据药物的清除率来调整，因为它们主要在肝脏代谢。",
        "contexts": [
            "专家论: 坛:\n\n## 中国体外膜肺氧合应用现状及问题\n\n中国医学科学院北京协和医学院北京协和医院重症医学科疑难重症及罕见病国家 重点实验室国家重症医学质控中心中国ECM0质量提升行动研究组,北京100710: 中国医学科学院北京协和医学院北京协和医院信息处疑难重症及罕见病国家重点 实验室,北京100710 Email:zx pumc@163.com\n\n(摘要]体外膜肺氧合(ECMO)技术经历了从无到有,从死广率高的高精尖技术发展到大家敦 知的最后的生命支持利器,目前ECMO技术蓬勃发展,广泛用于重度呼吸衰竭和心源性休克患者的救 治。近年来,国内ECMO的应用也有着长足的发展.但在ECMO中心建设和ECMO相关技术方面均存 在一些问题,本文就中国ECMO开展现状和面临的问题进行论述,如开展例数不足、地域差异、中心建 设和相关技术问题等 (关键词]体外膜氧合作用:中国:现状:问题 基金项目:北京自然科学基金面上项目(M21019):美国中华医学基金会胜任力培养项目 [20-381):中国卫生信息与健康医疗大数据学会应急项目专项基金:中国医学科学院捐赠项目 (2021-CAMS-IZ004):中华国际医学交流基金会研究基金(Z-2016-23-2001-08\n\n## Current situation and problems of extracorporeal membrane oxvgenation use in China Zhou Xiang\n\nchou xtuny  Department of Critical Care Medicine, State Key Laboratory of Complex Severe and Rare Diseases Ching a National Critical Care Ouglity Control Center ECMO Ouglity",
            "��,血液滤过时无需调 整药量。氟康唑蛋白结合率低.血液透析与血液滤过时能够 清除,故于每次透析后常规剂量给药1次。伊曲康唑的蛋白 结合率为99%.血液透析不影响静脉或口服的半衰期与清 除率,但B-环糊精可经血液透析清除,故血液透析时伊曲康 唑给药剂量不变,只需在血液透析前给药,以便清除B-环糊 精。伏立康唑主要在肝脏代谢,血液透析与血液滤过时无需 调整药量。卡泊芬净主要在肝脏代谢,血液滤过与血液透析 时亦无需调整药量(表1)。 推荐意见10:接受血液净化的重症患者进行抗真菌治 疗时,应根据药物的清除率来调整药物剂量(推荐级别为 D级)\n\n### (三)免疫调节治疗\n\n对IFI的治疗还包括免疫调节治疗,主要包括胸腺肽o1 (thymosino1)、I、粒细胞集落刺激因子(C-CSF)、粒-巨喷细 胞集落刺激因子(CM-CSF)和巨嘴细胞集落刺激因子(M- CSF)、粒细胞输注等。免疫调节治疗的目的是增加中性粒 细胞、吞噬细胞的数量,激活中性粒细胞、吞噬细胞和树突状 细胞的杀真菌活性,增强细胞免疫,缩短中性粒细胞减少症 的持续时间等。有研究表明,免疫治疗可改善中性粒细胞减 少症IF",
            "�组在武 汉均通过集体授课与视频学习等形式再次接受常规动 脉穿刺与超声引导下动脉穿刺培训,保证操作的一致 性。(3)排班:由于COVID-19疫情的特殊性,临床 工作中共设7个护理组,采取轮班制按组别顺序循环 值班开展工作,每组在污染区工作4h。每个护理组 配备1~2名具有超声工作经验的护士。\n\n### 动脉穿刺方法 1.2.2\n\n(1)传统触诊法:患者手心朝上、手腕下部垫\n\n高,使手掌与手臂至少成45°角,碘伏消毒。穿刺 者左手寻找患者烧动脉搏动最强位置,右手持针, 30°角进针,见回血后将动脉针放平,退针芯并将 动脉留置针管送人血管,连接密闭式采血套装,回 抽见回血月通畅为置管成功。若穿刺不成功,拔除 动脉针,按压至穿刺点不再渗血,更换动脉针重新 穿刺,穿刺大于3次仍不成功者考虑更换其他部位 进行置管。 (2)超声引导下外周动脉置管:患者姿势同对 照组。应用Venueultrasound system超声仪(美国GE 公司),血管探头(探头频率5~10MH)用无菌手 套包裹,探头标志点朝向患者右侧。操作者左手用超 声探头平面外(短轴)定位税动脉(图1A),右手 30°角进针,随着进针深人,逐渐向后移动探头,使 针尖持续显示在超声声像中。 当超声声像示针尖�",
            "��相关技术问题 ECMO技术虽然近年来发展迅速,但仍存在- 此尚未突破的技术难题,例如(1)患者是否能从 ECMO支持中获益?对干VV-ECMO月前仅有两项 设计严格的随机对照研究,或存在明显的设计缺 陷,或未能得出ECMO支持显著的生存获益优势: 鉴于伦理问题,自前尚未有VA-ECMO相关的临床 对照研究发表(2.18-19] (2)抗凝策略和抗凝目标如付 选择?ECMO患者的高凝状态使患者及ECMO回 路易于形成血栓,ECMO患者进行持续、全身性抗 凝治疗,以防止ECMO回路血栓形成是重症医学的 共识,但最近-篇包括21项研究(7190例接受 VV-ECMO或VA-ECMO患者)的荟萃分析显示: ECM0运行期间出血事件的发生率为17%~51%。 尤其对于创伤、存在活动性或者高出血风险的患 者,通常存在抗凝禁总证,因此抗凝策略的选择无 疑面临着巨大风险和挑战 。(3)VV-ECMO支持期 间呼吸机参数如何设置?VV-ECMO支持期间,希 望患者自身肺脏得到充分休息,避免进一步肺损 伤,但恢复到什么程度让自身肺脏工作?各个时期 的呼吸机参数如何设置目前仍无定论[21-22 。(4)目 前VA-ECMO绝大多数情况下都是经股动脉插管进 行灌注体外血流与心脏射血方向相反,这样会增 室后负荷,导致左心扩大账满,不利于心功 二经VA-ECMO�",
            "2018年的统计数据显示,中国人ECMO 的使用率为0148/10万居民年而其他国家的数据 显示在资源充足情况下ECMO使用率应为(0.3- 05)/10万居民年。与此相比,中国仍有很大的发 展空间。一方面,这与ECMO设备保有量不足相 关随着2019年底新冠疫情县发重症病例逐浙增 多可用的ECMO设备体现出了明显的不足. 据不 金统计当时金国ECMO存量仅约400台远 不能满足临床需: 要但今人欣喜的是,以此为契 机在国家政策的鼓励下国产重医疗器村自主 化研制如火如茶展开,很快有望打破该设备长期以 来依赖进口价格高昂的局面另方面ECMO 专业技术人员的短缺也是ECMO开展例数过少的 重要原因:根据CSECIS的统计武汉新冠脑炎是 发期间共有79个ECMO团队对重症新冠肺炎惠者 进行ECMO支持治疗,但其中51个EMCO团队是为 了应对新冠危机临时组建的,并且21个团队在此 之前从未开展过ECMO支持。由于ECMO是一科 复杂目高风险的治疗方法,充分的培训和大量的经 验是必不可少的。 、武汉新冠疫情暴发初期血的教 训充分说明了缺乏经验的ECMO项目必定会导致 不利后果。笔者团队对武汉初期在11家定点医院 的79个ECMO团队进行ECMO支持的新冠肺炎惠 者的回顾性分析发现,患者的死亡率高达71.6% 血2018年全国的数据显示VV-ECMO的死亡率仅 为29.1%.",
            "进行校正,报告的效应为未 校正的粗效应,结果可能存在一定偏倚。 综上,三级防护下,利用超声的可视化特性,采 用平面外(短轴)技术联合平面内(长轴)技术对 重症COVID-19患者进行外周动脉置管,可提高首次 置管成功率,减少穿刺次数,降低穿刺并发症的发 生率。\n\n作者贡献:赵明曦、李若祎负责研究设计、数据分 析、论文撰写:孙建华、苏龙翔、李奇、李尊柱、马 鸿鸣、崔文博和罗红波参与研究设计和结果分析:周 翔指导研究设计数据分析并修改论文 利益冲突:无\n\n### 考 献 文\n\n[1]国家中医药管理局办公室中华人民共和国国家卫生健康 委员会办公厅,新型冠状病毒肺炎诊疗方案(试行第八 版)[1],中国医药、2020.15:1494-1499 [11 General Office of National Health Commission of the People's Republic of China, Office of National Administration of Tra- of ditional Chinese Medicine, Diagnosis and treatment virus disease-19 (8th trial edition)[J. Zhongguo corona Yi Yao, 2020, 15: 1494-1499. [2]尹万红,康焰.新型冠状病毒肺炎急性呼吸窘迫综合征 的血流动力学治疗[J1.协和医学杂志,2020,11: 518-521. [2 Yin WH, Kang Y. Hemodynamic therapy for COVID-19 pa syndromeJ. Xie He tients with e respiratory distress acute Yi Xue Za Zhi, 2020, 11: 518-521. 1 LM. al. Ultrasound- [31 RH, Paulin Shiloh 1 AL. Savel et radial guided systematic catheterization artery: a review and meta-analysis of randomized controlled [J. Chest, 2011, 139; 524-529. 等.超声引导下税动脉置管 [4]孙建华,刘大为,王小亭, 的应用进展[J.中国实用护理杂志,2016,32: 1997-2000 Sun JH, Liu DW, Wang XT, et al. Development of applica- tior cannulation of ultrasound guided radia research"
        ],
        "ground_truth": "血液透析对于伊曲康唑的给药剂量不需要调整，只需在血液透析前给药以清除B-环糊精。对于其他药物如氟康唑、伏立康唑、卡泊芬净，血液透析或血液滤过时均无需调整药量。",
        "metadata": [
            {
                "filename": "中国体外膜肺氧合应用现状及问题.pdf"
            },
            {
                "filename": "ICU 侵袭性真菌感染指南.pdf"
            },
            {
                "filename": "三级防护下超声引导外周动脉置管在新型冠状病毒肺炎重症患者中的应用.pdf"
            },
            {
                "filename": "中国体外膜肺氧合应用现状及问题.pdf"
            },
            {
                "filename": "中国体外膜肺氧合应用现状及问题.pdf"
            },
            {
                "filename": "三级防护下超声引导外周动脉置管在新型冠状病毒肺炎重症患者中的应用.pdf"
            }
        ],
        "evolution_type": "noise_robustness"
    },
    {
        "id": 39,
        "question": "埃托米达特（etomidate）用于插管诱导的临床效果及其对患者预后的影响有何研究结果？",
        "answer": "研究表明etomidate用于插管诱导可能抑制下丘脑-垂体-肾上腺轴，但对患者预后的影响不明确，可能与较高随机皮质醇水平有关，但具体影响需要通过临床试验来评估。",
        "contexts": [
            "功率并不高。为了推动全球范围 内的ECMO技术交流与应用,在Bartlet教授推动 下国际体外生命支持组织(Extracorporeal Life Support Organization,ELSO)于1989年在密歇根大 学成立但直至2004年,全世界仅有100多家医院 开展此项工作,并且主要集中在西方发达国家。从 2008年ECMO用于成功救治甲型流感患者之后,全 球ECMO数量开始呈现快速增长趋势13 中国内地最早1例真正意义上的ECMO支持 病例始于2002年,但限于当时的经济水平、医疗条 件和医疗报销制度的限制,这一设备没有得到大范 围推广,到2015年全国ECMO中心的数量才突码 随着医疗水平的逐渐发展和医保政策的 100家。 整,中国的ECM0开始有了飞速发展。2019年底 新型冠状病毒肺炎(新冠肺炎)爆发ECMO被用干 重症新冠肺炎惠者的救治,开始进入大众视野;手) 目由于其在新冠疫情救治中起到的重要作用,国家 卫生健康委员会在《新型冠状病毒感染的肺炎诊疗 方案》中将ECMO列为危重症新冠肺炎患者的重要 救治技术,极大地促进了国内各医疗机构进一步开 展ECMO相关培训学习,成立ECMO中心(45 二、ECMO开展现状 近年ECMO临床应用突飞猛进。世界范围内 据ES0的统计数据显示,2019年全球共有488个 ECMO中心,实施ECMO的病例达到17078例,截¥ 2021年10月的统计数据显示2020年注册的ECMQ 中心数增至521个,全年开",
            "�对照研究报导了使用CRRT 对提高生存率具有非常显著的趋势，目前两项Meta 分析报导了接受 CRRT 和间歇性 RRT 的患者住院病死率差异无统计学意义，即使进行仅包 括 RCT 研究的亚组分析，仍未发现两组间患者病死率的差异；另有一项纳入 360 例患者的 大规模 RCT 研究结果显示， CRRT 组和间歇 RRT 组患者生存率差异无统计学意义。对于 血流动力学不稳定的脓毒症患者， 目前尚无 RCT 评估 CRRT 和间歇性 RRT 的血流动力学耐 受性。 其余证据中， 两项前瞻性试验报导 CRRT 有较好的血流动力学耐受性， 但对患者局部 灌注及生存率无改善。\nCRRT 流量： 在目前的文献综述中， 有两个研究报导了 CRRT 的流量对急性肾功能衰竭 患者临床结局的影响。结果并未显示与较高流量 RRT 相关病死率的任何差异。比较 RRT 流 量的两项大规模、 多中心随机试验也未能显示出患者接受高流量 RRT  的相关获益。对所有 相关 RCTs  (1505 例)结果进行 Meta 分析表明，RRT 流量和病死率之间没有任何显著的相 关性， 然而，点估计值支持 CRRT 流量＞30ml/ (kg · h)，由于偏倚、 一致性差等风险，估 计的置信度较低，应进行进一步研究。\nCRRT 时机：2022 年发布的两项相关 RCT s 结果表明，早期启动 R",
            "��疗的心源性休克\n\n患者的左心室减压与较低的死亡率相关。 而 VA-ECMO期间左心室减压的时机、最佳减压方式 如何选择[23]?(5)最近的研究表明,对于脓毒症合并 脓毒症心肌病,存在严重心功能障碍、心源性休克 惠者,使用VA-ECMO可降低病死率,然而该研究为 回顾性、观察性研究,且多聚焦于脓毒症引起的左 心收缩功能障碍。 对于脓毒症相关的右心 小全心功 能障碍,是否可应用ECMO支持?对于心输出量正 常或相对偏高,但存在严重血管张力不足的患者可 [24-25] )。(6)神经 否应用VA-ECMO支持目前尚无定论 统并发症严重影响ECMO患者的短期和长期预 后,尤其是ECPR患者,ECMO运行过程中如何进行 脑功能监测?如何及早识别神经系统预后不佳的 患者以免不必要的长期ECMO支持,避免增加不义 要的医疗花费和患者痛苦(26-27]?关于ECMO技术还 有更多未知值得进一步探索 索研究 综上,ECMO技术目前在中国蓬勃发展,但与 发达国家相比仍存在巨大差距,自面临着区域发展 不均、区域化ECMO中心不完善以及ECMO学科建 设等方面的诸多问题,但随着对该技术认识的不断 进步和国家行政部门对未来发展方向的把控,相信 ECMO在中国一定能够得到长足发展,切实改善患 者预后 利益冲突作者声明不存在",
            "�持联合治疗的临床获益。\n已发表的 Meta 分析结果显示，在抗感染治疗的基础上联合使用血必净注射液，可降低 白细胞计数和过高的体温，控制炎症反应和多器官功能障碍综合征的发展，改善 APACHEⅡ 评分，降低脓毒症患者 28 d病死率。\n如有侵权请联系网站删除\n推荐意见 13：在病原学诊断及药敏结果明确或者临床症状充分改善后推荐进行降阶梯治 疗(BPS)。\n对绝大多数严重感染来说， 在确定致病菌的情况下， 应降阶梯至最窄谱抗菌药物治疗以 缩小覆盖范围。 Guo 等进行的一项纳入 99 项研究的 Meta 分析结果显示， 抗菌药物的降阶梯 治疗与持续应用广谱抗菌药物对患者的病死率差异无统计学意义。几项观察性研究结果显 示，抗菌药物的降阶梯治疗能降低病死率， 鉴于不必要的持续性抗菌药物的使用给社会和个 人带来的不良后果， 推荐抗菌药物降阶梯治疗。 当发现感染不存在时，应即将住手抗菌药物 的使用，以避免产生耐药及不良反应。\n推荐意见 14：在脓毒症或者脓毒性休克患者中，抗菌药物的剂量优化策略应基于目前 公认的药效学/药动学原则及药物的特性(BPS)。\n脓�",
            "��相关技术问题 ECMO技术虽然近年来发展迅速,但仍存在- 此尚未突破的技术难题,例如(1)患者是否能从 ECMO支持中获益?对干VV-ECMO月前仅有两项 设计严格的随机对照研究,或存在明显的设计缺 陷,或未能得出ECMO支持显著的生存获益优势: 鉴于伦理问题,自前尚未有VA-ECMO相关的临床 对照研究发表(2.18-19] (2)抗凝策略和抗凝目标如付 选择?ECMO患者的高凝状态使患者及ECMO回 路易于形成血栓,ECMO患者进行持续、全身性抗 凝治疗,以防止ECMO回路血栓形成是重症医学的 共识,但最近-篇包括21项研究(7190例接受 VV-ECMO或VA-ECMO患者)的荟萃分析显示: ECM0运行期间出血事件的发生率为17%~51%。 尤其对于创伤、存在活动性或者高出血风险的患 者,通常存在抗凝禁总证,因此抗凝策略的选择无 疑面临着巨大风险和挑战 。(3)VV-ECMO支持期 间呼吸机参数如何设置?VV-ECMO支持期间,希 望患者自身肺脏得到充分休息,避免进一步肺损 伤,但恢复到什么程度让自身肺脏工作?各个时期 的呼吸机参数如何设置目前仍无定论[21-22 。(4)目 前VA-ECMO绝大多数情况下都是经股动脉插管进 行灌注体外血流与心脏射血方向相反,这样会增 室后负荷,导致左心扩大账满,不利于心功 二经VA-ECMO�",
            " Evidence Table.\n\nIn one study, the observation of a potential Rationale. interaction between steroid use and ACTH test was not statistically significant [1751. Furthermore, no evidence of this distinction was observed between responders and nonresponders in a recent multicenter trial [178]. Random still be cortisol levels useful for absolute e adrenal may for who insufficiency; however, shock septic patients suffer from relative e adrenal insufficiency (no o adequate e not been stress response), random 1 cortisol levels have demonstrated to be useful. Cortisol immunoassays may actual cortisol level, affecting over- or underestimate the assignment of patients to responders or nonresponders\n\n[184]. Although the clinical significance is not clear, it is now recognized that etomidate, when used for induction for intubation, will suppress the hypothalamic-pituitary- adrenal axis [185. 186]. Moreover, a  subanalysis of the CORTICUS trial [178] revealed that the use of etomidate before application of low-dose steroids was associated with an increased 28-day [187]. An inap- mortality rate propriately low random cortisol level (<18 ug/dL) in patient with shock would be considered an indication for traditional adrenal insufficiency steroid therapy a along guidelines.\n\nRationale. There has been e study comparative between a fixed-duration and clinically guided regimen or between tapering and abrupt cessation of steroids. Three RCTs used a fixed-duration protocol for treatment [175. 177, 178], and therapy decreased after shock reso- was  RCTs [176. 1821. In four studies, steroids lution in two were tapered over several days [176-178. 182], and ste- roids withdrawn abruptly in two RCTs [175. 183]. were crossover study showed hemodynamic and immu- One of after rebound effects nologic cessation abrupt corticosteroids [188]. Furthermore, a study revealed that there is1 no difference in outcome of septic shock patients if low-dose hydrocortisone is used for 3 or 7 days; hence. the be with regard given to no recommendation can optimal duration of hydrocortisone therapy [189]. 4. We recommend that corticosteroids not t be adminis-\n\nRationale. Steroids may be indicated in the presence of steroid therapy or adrenal dysfunction, but a history whether low-dose steroids have preventive potency in reducing the incidence of severe sepsis and septic shock in critically ill patients cannot be answered. A preliminary study of stress-dose level steroids in community-acquired pneumonia showed improved  measures in outcome ✓ RCT population [190], and a recent confirmatory small1 revealed reduced hospital length of stay without affecting mortality [191]. 5. When low-dose hydrocortisone is given, we suggest using continuous infusion rather than repetitive e bolus 2D). injections (grade\n\nRationale. Several randomized trials on the use of low-n patients revealed a dose hydrocortisone in septic shock significant increase of hyperglycemia and hypernatremia [1751 as side effects, A small prospective e study demon- strated that repetitive bolus application of hydrocortisone leads to a significant increase in blood glucose; this peak\n\neffect was g continuous infusion. during detectable Furthermore, considerable inter-individual variability was seen in this blood g peak after the hydrocortisone glucose bolus [192]. Although an association of hyperglycemia and hypernatremia with n patient outcome measures could be not shown. for s strategies practice includes good avoidance and/or detection of these side effects.\n\n### Supportive therapy of severe sepsis (Table 8)\n\nthe 1 and in Once tissue 1 has resolved hypoperfusion absence of extenuating circumstances, such as myocar- dial ischemia, severe hypoxemia, acute hemorrhage, or disease, we recommend that ischemic coronary artery o red blood cell transfusion occur when the hemoglobin concentration decreases to <7.0 g/dL to target a hemo- globin concentration of 7.0-9.0 g/dL in n adults (grade 1B).\n\nRationale. Although  the optimum hemoglobin concen- tration for with sepsis has not been patients severe specifically investigated, the Transfusion Requirements in Critical C Care trial suggested that a hemoglobin level of 7-9 g/dL, compared with 10-12 g/dL, was not associated with increased mortality: in critically ill adults [1931. No differences in 30-day mortality rates significant were observed between treatment groups in the subgroup of patients with severe infections and septic shock (22.8 and 29.7 %, respectively; P = 0."
        ],
        "ground_truth": "使用埃托米达特（etomidate）用于插管诱导会抑制下丘脑-垂体-肾上腺轴，并且CORTICUS试验的子分析显示，在应用低剂量类固醇之前使用埃托米达特与增加的28天死亡率相关联。一个不恰当地低的随机皮质醇水平（<18 ug/dL）在休克患者中会被认为是传统肾上腺功能不全类固醇治疗的指征，遵循指南。",
        "metadata": [
            {
                "filename": "中国体外膜肺氧合应用现状及问题.pdf"
            },
            {
                "filename": "(Word版)中国脓毒症／脓毒性休克急诊治疗指南(2022)培训资料.docx"
            },
            {
                "filename": "中国体外膜肺氧合应用现状及问题.pdf"
            },
            {
                "filename": "(Word版)中国脓毒症／脓毒性休克急诊治疗指南(2022)培训资料.docx"
            },
            {
                "filename": "中国体外膜肺氧合应用现状及问题.pdf"
            },
            {
                "filename": "Dellinger-2013-Surviving Sepsis Cam.pdf"
            }
        ],
        "evolution_type": "noise_robustness"
    },
    {
        "id": 40,
        "question": "血流动力学不稳定的脓毒症患者的CRRT和间歇性RRT的血流动力学耐受性是否有RCT评估的研究？",
        "answer": "从给定的上下文中，我们找不到关于血流动力学不稳定的脓毒症患者使用CRRT和间歇性RRT的血流动力学耐受性是否通过RCT评估的具体研究信息。因此，答案是`-1`。",
        "contexts": [
            "�囊有所提高达53%以上若患者肠道吸收功能 尚可时可考虑改为口服用药空腹服用可提高生物利用度 伏立康唑其赋形剂磺工-3-环糊精钠从肾脏代谢,故服肌 西清除率<50m/min时不推荐静脉给药☐服制剂生物 利用度达95%以上若患者肠道吸收功能尚可可考虑改头 口服用药。 卡泊芬净主要在肝脏代谢,肾功能障碍患者无需调整 药量。 3.器官功能障碍时两性霉素B的使用:延长两性霉素E 的输注时间可减少其肾毒性与相关的寒战高热等毒性尺 应。研究证实.24h持续静脉注射或延长两性霉素B脱氧服 酸盐的输注时间,可增加患者对其耐受性,减少低钾、镁血 症的发生,并降低肾毒性。另外,两性鑫素B脱氧服酸盐价 格便宜,故24h持续静脉注射性富素B脱氧胆酸盐仍\" 作为治疗IFI的手段。 推荐意见9:延长两性霉素B脱氧胆酸盐的输注时间可 增加患者对药物的耐受性,减少肾毒性(推荐级别为C级 应用两性霉素B时,应尽量避免合并应用有肝肾毒性的 药物。非留体类抗炎药、氨基糖普类抗生素造影剂、环孢素 A、他克莫司等具有明显的肾毒性,与其合用时,可增加肾损 害的危险性。另外,应尽量避免两性霉素B与可能影响肝功 能的",
            "�究表明， 脓毒性休 克多药联合治疗的早期降阶梯与更好的临床预后相关。此外，早期降阶梯可减少细菌耐药的 发生。另有研究表明， 每日评估抗菌药物降阶梯的可行性可能降低患者病死率， 因此推荐每 日对脓毒症和脓毒性休克患者的抗菌药物使用进行降阶梯评估。\n下列患者使用长时程 (＞10d ) 抗菌药物治疗是合理的， 包括临床改善缓慢、 感染源难 以控制、金黄色葡萄球菌相关的菌血症(特别是 MRSA〕)、某些真菌、病毒感染及免疫缺 陷患者。\n推荐意见 16：建议以测定降钙素原(PCT) 水平为辅助手段指导脓毒症患者抗菌药物 疗程 (弱推荐，低证据质量)。\n目前世界许多地区通过测定血清 PCT  水平辅助诊断急性感染及辅助确定抗菌药物疗 程。近期一项大型随机试验证明，以血清 PCT 水平指导重症感染患者抗菌药物使用可显著 缩短治疗持续时间，减小药物日剂量，降低患者病死率。以 PCT 作为辅助手段可缩短脓毒 症患者抗菌药物疗程且不增加病死率。 因此，PCT  或者其他生物标记物的检测可作为临床评 估的辅助手段，抗菌药物的起始及减停需结合临床具体情况判定。\n推荐意见 17�",
            "�对照研究报导了使用CRRT 对提高生存率具有非常显著的趋势，目前两项Meta 分析报导了接受 CRRT 和间歇性 RRT 的患者住院病死率差异无统计学意义，即使进行仅包 括 RCT 研究的亚组分析，仍未发现两组间患者病死率的差异；另有一项纳入 360 例患者的 大规模 RCT 研究结果显示， CRRT 组和间歇 RRT 组患者生存率差异无统计学意义。对于 血流动力学不稳定的脓毒症患者， 目前尚无 RCT 评估 CRRT 和间歇性 RRT 的血流动力学耐 受性。 其余证据中， 两项前瞻性试验报导 CRRT 有较好的血流动力学耐受性， 但对患者局部 灌注及生存率无改善。\nCRRT 流量： 在目前的文献综述中， 有两个研究报导了 CRRT 的流量对急性肾功能衰竭 患者临床结局的影响。结果并未显示与较高流量 RRT 相关病死率的任何差异。比较 RRT 流 量的两项大规模、 多中心随机试验也未能显示出患者接受高流量 RRT  的相关获益。对所有 相关 RCTs  (1505 例)结果进行 Meta 分析表明，RRT 流量和病死率之间没有任何显著的相 关性， 然而，点估计值支持 CRRT 流量＞30ml/ (kg · h)，由于偏倚、 一致性差等风险，估 计的置信度较低，应进行进一步研究。\nCRRT 时机：2022 年发布的两项相关 RCT s 结果表明，早期启动 R",
            "��入 12 个 RCTs 共计 9044 例患者的 Meta 分析显示参附注射液可显著降 低患者 LAC 水平。我国一项 RCT 研究显示监测血乳酸浓度能够提高复苏效果， 降低脓毒性 休克患者的病死率。以 6h 内血乳酸＜2mmol/L 作为目标指导复苏可明显改善预后。\n推荐意见 5：初始液体复苏及随后的容量替代治疗中，推荐使用晶体液(强推荐，中等 证据质量) 。与晶体液相比，应用胶体液无任何显著获益，且可能导致肾损伤以及凝血机制 异常等不良事件，同时胶体液价格较高， 因此强力推荐脓毒症和脓毒性休克患者的液体复苏 使用晶体液。有研究表明平衡晶体液和生理盐水进行复苏， 晶体液能降低 30d主要肾脏不 良事件发生率；高肌酐和高氯人群使用平衡晶体液避免主要肾脏不良事件获益最大。有研究 表明与限氯策略相比，含氯策略治疗的患者急性肾损伤和肾脏替代治疗(RRT) 的风险增高， 故无论使用哪种液体溶液， 均建议监测血清氯化物水平以避免高氯血症。\n推荐意见 6：不推荐使用羟乙基淀粉进行容量替代治疗 (强推荐，高证据质量)。\n目前已有多项研究对羟乙基淀粉 (HES) 在脓毒症患者中的安全性问题",
            "利益冲突\n\n### 考 文 献 物\n\n[1]侯晓彤.无规矩不方圆--规范中国体外生命支持技术进 入倒计时Ⅲ,中华医学杂志,2020.100(7):481-483.DO1 10.3760/cma.jissn.0376-2491.2020.07.001. [2] Australia and New Zealand Extracorporeal Membrane Oxvgenation (ANZ ECMO) Influenza Investigators. Davies A. Jones D, et al. Extracorporeal membrane oxygenation for 2009 influenza A(H1N1) acute respiratory distress syndrome[]]. JAMA, 2009, 302(17): 1888-1895. DO1: 10.1001/jama.2009.1535 章晓华,庄建,中国体外膜肺氧合技术开展的现状及思考 Ⅲ,中国体外循环杂志,2017,15(2):68-71.91.DO1 10.13498/j.cnki.chin.j.ecc.2017.02.02 龙村.体外膜肺支持疗法在本世纪中国体外循环的机遇和 挑战[.中国体外循环杂志,2005,3(2):65.DO1:10.3969/j issn.1672-1403.2005,02.001. [5]中国生物医学工程学会体外循环分会,赵举,黑飞龙. 2015中国心脏外科和体外循环数据白皮书1.中国体外循 环杂志,2016,14(3):130-132.D01:10.13498/j.cnki.chin.j ecc.2016.03.02 Extracorporeal Life Support Organization. ECLS International of Statistics [EB/0L]. (2021-10-02) [2022-01-29] Summary https://www. elso.org/Registry/InternationalSummaryandReports) InternationalSummaryaspx [7] Support Organization. World Map of Extracorporeal Life\n\nmembrane oxygenatior for severe acute respiratory syndrome[ll. N 2018 378(21): distress Engl Med 1965-1975.DO1:10.1056/NEIMoa1800385 [19] Peek GI. Mugford M. Tiruvoipati R . et al. Efficacy  and economic assessment of conventional ventilatory support versus extracorporeal membrane oxvgenation for severe (CESAR) adult failure multicentry respiratory randomised controlled trial[ll. Lancet., 2009. 374(9698) 1351-1363D01:10.1016/S0140-6736009)61069-2 B. et al. Bleeding [20] AF O'Gara Ⅱ. Gosling and Nunez thrombotic events in adults s supported with o venovenous extracorporeal membrane oxvgenation: an ELSO registr Care Med 2022. 48(2): 213-224 analysis[Il. Intensive DO1:10.1007/s00134-021-06593-x 21] Vasques E. Romitti i E. Gattinoni . et al. How  wear patients from membrane veno-venous extra-corporeal oxvgenation[ll, Crit Care, 2019, 23(1):316, DO1: 10.1186. s13054-019-2592-5 [22] Schmidt Pham T. Arcadipane et al.  Mechanica during ventilation management extracorporeal for distress membrane oxygenation acute respiratory An syndrome",
            "�持联合治疗的临床获益。\n已发表的 Meta 分析结果显示，在抗感染治疗的基础上联合使用血必净注射液，可降低 白细胞计数和过高的体温，控制炎症反应和多器官功能障碍综合征的发展，改善 APACHEⅡ 评分，降低脓毒症患者 28 d病死率。\n如有侵权请联系网站删除\n推荐意见 13：在病原学诊断及药敏结果明确或者临床症状充分改善后推荐进行降阶梯治 疗(BPS)。\n对绝大多数严重感染来说， 在确定致病菌的情况下， 应降阶梯至最窄谱抗菌药物治疗以 缩小覆盖范围。 Guo 等进行的一项纳入 99 项研究的 Meta 分析结果显示， 抗菌药物的降阶梯 治疗与持续应用广谱抗菌药物对患者的病死率差异无统计学意义。几项观察性研究结果显 示，抗菌药物的降阶梯治疗能降低病死率， 鉴于不必要的持续性抗菌药物的使用给社会和个 人带来的不良后果， 推荐抗菌药物降阶梯治疗。 当发现感染不存在时，应即将住手抗菌药物 的使用，以避免产生耐药及不良反应。\n推荐意见 14：在脓毒症或者脓毒性休克患者中，抗菌药物的剂量优化策略应基于目前 公认的药效学/药动学原则及药物的特性(BPS)。\n脓�"
        ],
        "ground_truth": "目前尚无 RCT 评估 CRRT 和间歇性 RRT 的血流动力学耐受性。",
        "metadata": [
            {
                "filename": "ICU 侵袭性真菌感染指南.pdf"
            },
            {
                "filename": "(Word版)中国脓毒症／脓毒性休克急诊治疗指南(2022)培训资料.docx"
            },
            {
                "filename": "(Word版)中国脓毒症／脓毒性休克急诊治疗指南(2022)培训资料.docx"
            },
            {
                "filename": "(Word版)中国脓毒症／脓毒性休克急诊治疗指南(2022)培训资料.docx"
            },
            {
                "filename": "中国体外膜肺氧合应用现状及问题.pdf"
            },
            {
                "filename": "(Word版)中国脓毒症／脓毒性休克急诊治疗指南(2022)培训资料.docx"
            }
        ],
        "evolution_type": "noise_robustness"
    },
    {
        "id": 41,
        "question": "What's the incidence rate of cerebrovascular diseases in patients over 90, factoring in prevalence among those without infection, with nonseptic infection, and with sepsis?",
        "answer": "The context does not provide the incidence rate of cerebrovascular diseases specifically for patients over 90 years old, factoring in infection, nonseptic infection, and sepsis. It only mentions the overall prevalence of cerebrovascular disease among the entire patient population in context 1.",
        "contexts": [
            "7% in those more than 90 years old (Fig.2).\n\nTABLE 1. Characteristics of Patients Without Infection, Patients With Nonseptic Infection, and Patients With Sepsis\n\n\n|    | 0                                           | 1             | 2            | 3            | 4                  |\n|---:|:--------------------------------------------|:--------------|:-------------|:-------------|:-------------------|\n|  0 | Characteristics                             | nan           | nan          | Infection    | nan                |\n|  1 | Characteristics                             | nan           | nan          | nan          | nan                |\n|  2 | nan                                         | 63 (49-78)    | 79(64-85)    | 79 (62-84)   | 80 (66-85)©        |\n|  3 | Male sex, n (%)                             | 7,545 (42.5)  | 1,886 (54.7) | 898 (51.8)   | 988 (57.6)         |\n|  4 | Smoking, n (%                               | 3,270 (18.4)  | 940 (273)    | 440 (25.4)   | 500 (29.1)         |\n|  5 | Alcoholism, n (%                            | 1,334 (7.5)   | 268 (78)     | 122 (7.0)    | 146 (8.5)          |\n|  6 | Tvpe of hospital admission. n (%            | nan           | nan          | nan          | nan                |\n|  7 | Medica                                      | 10.235 (577)  | 3,069 (89.0) | 1,516 (875)  | 1,553 (90.5)       |\n|  8 | Medica                                      | 7,269 (41.0)  | 314 (9.1)    | 186 (10.7)   | 128 (7.5)          |\n|  9 | Emergency surgery                           | 238 (1.3)     | 66 (1.9)     | 31 (1.8)  ",
            "   | 35 (2.0)           |\n| 10 | Comorbidities. n (%                         | nan           | nan          | nan          | nan                |\n| 11 | None                                        | 4,581 (25.8)  | 371 (10.8)   | 199 (11.5)   | 172 (10.0)         |\n| 12 | nan                                         | nan           | 1,979 (57.4) | 1,029 (59.4) | 950 (55.3)         |\n| 13 | Hypertension                                | 7,891 (44.5)  | 1,979 (57.4) | 1,029 (59.4) | nan                |\n| 14 | Diabetes                                    | 3,995 (22.5)  | 936 (27.1)   | 482 (27.8)   | 454 (26.5)         |\n| 15 | Malignancy                                  | 3,311 (18.7)  | nan          | nan          | 274 (16.0)         |\n| 16 | Cerebrovascular disease                     | 2,720 (15.3)  | 1,173 (34.0) | 540 (31.2)   | 631 (36.8)         |\n| 17 | Coronary heart disease                      | 3,347 (18.9)  | 1,099 (31.9) | 549 (31.7)   | 550 (32.1)         |\n| 18 | Chronic lung disease                        | 1,165 (6.6)   | 784 (22.7)   | 400 (23.1)   | 385 (22.4)148(8.6) |\n| 19 | Peptic ulcer                                | 597 (3.4)     | 254 (7.4)    | 106 (6.1)    | nan                |\n| 20 | Rheumatic disease                           | 375 (2.1)     | 118 (3.4)    | 52 (3.0)     | 66 (3.8)           |\n| 21 | Hematologic malignancy                      | 170 (1.0)     | 48 (1.4)     | 16"
        ],
        "ground_truth": "Cerebrovascular disease has an incidence rate of 15.3% among patients in this study.",
        "metadata": [
            {
                "filename": "Zhou-Critical Care Medicine-2017.pdf"
            }
        ],
        "evolution_type": "reasoning"
    },
    {
        "id": 42,
        "question": "How does off-pump coronary artery bypass surgery affect mortality and AKI risk vs. on-pump surgery, considering evidence from studies on renal perfusion, physiological preservation, and procedural outcomes?",
        "answer": "1",
        "contexts": [
            " be assumed. (1A)\n\n### RATIONALE\n\nKATIONALE Another approach to prevent amphotericin B nephrotoxicity is to avoid polyene antifungal agents entirely and use alte- 351-355 rnative agents, such 1 as the azoles and e echinocandins. Azole antifungal agents inhibit sterol synthesis in fungal cell by blocking the activity c of the 14-demethylase membranes  essential for ergosterol synthesis. Nephrotoxicity nzyme event following the use of azole compounds an unusual The echinocandins are beta-glucan inhibitors that inter- fere with cell-wall synthesis of fungal elements, and have an of action from that entirely different mechanism amphotericin B. Both the azole compounds (voriconazole fluconazole, itraconazole, and posaconazole) and the echi- micafungin) nocandins (caspofungin, anidulafungin, and compare favorably to amphotericin B with respect to their efficacy a of the systemic mycoses. Both against a variety of antifungal agents have the advantage of lacking classes the intrinsic nephrotoxicity associated I with amphotericin B deoxycholate. Both the azole compounds and echinocandins 1 to be less nephrotoxic than conventiona have proven B deoxycholate amphotericin in observational I studies historical control studies, and in small comparative trials,355 An important consideration in using these antifunga their relative efficacy) with respect to the likely agents ist pathogen that is targeted for treatment. Candida krusei is intrinsically resistant to the azoles and Candida parapsilosis is to the echinocandins. Amphotericir frequently resistant B-resistant s of selected Aspergillus spp. and Pseudal- t strains lescheria are well described and require alternative boydii therapies.\n\nKidney International Supplements (2012) 2, 37-68\n\nThere is currently insufficient evidence as to whether the of echinocandins, the the lipid formulations azoles, or with B differ significantly from amphotericin each other the No risk to adequately nephrotoxicity. respect been reported to controlled, large, randomized studies have date comparing the relative risk of nephrotoxicity amphoter- icin B lipid formulations with either azole or echinocandin antifungal agents. Such studies face the difficulty of recruiting of patients with similar baseline risk for sufficient numbers drug-induced AKI. other balance of exposure Until these such time potentially nephrotoxic as agents. studies are  no evidence-based completed, recommendations be AKI attributable the relative risk can given about directly to these e antifungal agents.\n\n### RESEARCH RECOMMENDATIONS\n\nindicate that t the liposomal form e studies Some amphotericin B is less nephrotoxic than amphotericin E lipid complex  or amphotericin B colloidal dispersion RCTs in patients with systemic mycosis, with the rate of AKI as a end-point, should be secondary primarye conducted to answer this question. to formulate amphotericin B in Innovative strategiest microvesicles, nanoparticles, or micelles should be under- taken to limit nephrotoxicity in treating fungal infections Clinical trials should c compare existing formulations to these novel formulations, and could generate cost-effective yet non-nephrotoxic derivatives of amphotericin B Carefully selected combinations of antifungal therapies to enhance efficacy and shorten duration of therapy may limit toxicity and reduce costs in the treatment of funga infections. Investigations need to be carried out in the laboratory and in clinical studies to improve the care of patients with severe fungal infections. The costs and complication rates of AKI, and other toxicities of short course combination treatment, should be compared to standard dosing regimens of antifungal therapy Markers of early nephrotoxicity and mechanisms to avoid with amphotericin B formulations need nephrotoxicity be studied furtheri in clinical investigations. These antifungal given for prolonged periods, and I agents allow ample opportunity to test the validity of should novel biomarkers drug-induced nephrotoxicity. group monitored with novel AKI biomarkers should be of AKI, to compared to conventional 1 monitoring determine if one  of kidney or more early biomarkers injury add to standard clinical care in the prevention of drug-induced AKI\n\n© 2012 KDIGO\n\n## of AKI Chapter 3 3.9: Other methods of prevention in the critically ill\n\nThe type of cardiac surgery is important in the discussion on for kidney problems associated 1 with this surgery Valvular procedures or aort",
            "a surgery are associated with higher risk. One of the most controversial risk factors is off-pump coronary artery bypass surgery. on-pump Off-pump obviously removes the artery bypass coronary : associated with oypassc greater hemo- dvnamic instability secondary to ventricular ( compression as 356 the heart is manipulated to access the coronary a arteries. It is possible, with standard operative techniques, to perform bypass surgery (but not valve surgery) coronary artery without using cardiopulmonary bypass. This technique is known as \"off-pump\" coronary artery bypass surgery It has been hypothesized that preservation of physiologic by avoidance of cardiopulmonary bypass renal perfusion would partially nullify the risk of AKI in patients receiving 1. Potential benefits that have coronary artery bypass surgery. been posited for off-pump coronary artery bypass (compared to on-pump procedures) are reduced mortality, reduction of AKI risk (and in particular, acute dialysis, which is associated in the Society of with a perioperative mortality of 42% cerebral Thoracic Surgeons database), reduced risk dysfunction (due to stroke and neurocognitive dysfunction the latter sometimes referred to as\"pump head), reduction reduction in atrial in ICU stay and days in hospital, and fibrillation. As in other areas covered by these guidelines only I as end- mortality, risk for RRT, and AKI risk are addressed point measures. It must, however, be remembered that the potential benefits of off-pump coronary artery bypass might be predominantly outside these areas of focus.\n\n3.9.1: We that off-pump suggest artery coronary bypass e selected solely for the purpose graft surgery of reducing perioperative AKI or need for RRT. (2C)\n\n### RATIO\n\nAs detailed in: 1 Tables which Suppl 1 summarize RCTs, of the the harms is balance potential benefit and off and the that quality of the evidence is weak uncertain pump surgery is associated with better outcomes of the three end-points used in these guidelines: incidence of AKI, need for RRT, or mortality. RCT357 2203 performed in good-quality recent was ~8% of with SCr >1.5mg/d patients patients (only\n\nsignificant >133 umol/11) (Suppl Table 16), There was nd difference between off-pump and on-pump o coronary artery graft in the rate of the 30-day composite outcome bypass: The rate of the 1-vear composite outcome was higher for off-pump than for on-pump o bypass graft coronary artery the patients in the e maiority Follow-ur angiograms revealed that the overall rate of graft patency was lower in the off-pump group than in the on-pump group (82.6% vs 87,8%. P<0.01) A. RCTs. and meta-analvsis including comprehensive abstracts from the proceedings of scientific meetings throug February 2010, was recently published, 358 AKI was defined a mixture of criteria, includins biochemical parameter urine output, and dialysis requirement. Mortality was the evaluated s that kidney-related among studies reported o with the more outcomes, This analysis compared off-pumu traditional on-pump t technique. Off-pump coronary artery graft t was associated with a bypass statistically significant 40% lower odds of postoperative AKI and a nonsignificant 33% lower odds for the dialysis requirement. Within selected trials, off-pump coronary artery bypass graft surgery not associated with a significant decrease e in mortality was trials It from this that the is apparent meta-analysis clinically heterogeneous, particularly in to were regards of their definitions of kidney outcomes, and mostly were poor to fair quality (based on the Jadad 1 score). The very low event 0- e the estimates rates (often patients) make of s also suspect and highly imprecise. There 1 question e trials publication bias. There I large are several progress definitive data. In chronic that are likely to: generate more Data dialysis observational US Rena patients, there are of off-pump data to weakly the use Systems support lower with technique (slightly mortality). .However, any that in certain centers technical introduced advance institutional familiarity with the technique, operator experi- to referred of the ence, and characteristics population the center are likely to be modulators of out- important of the RCTs conclusion, based comes. In the analysis on and found the recent meta-analysis, the Work Group that there was not enough evidence to recommend r reducing AKI or the need pump coronary artery bypass for RRT\n\n### RESEARCH RECOMMENDATION\n\ns are needed to clarify Further studies the role of off-pump with increased risk bypass"
        ],
        "ground_truth": "Off-pump coronary artery bypass surgery has been hypothesized to potentially reduce mortality rates compared to on-pump procedures. However, recent research suggests that there is not enough evidence to support a significant decrease in mortality with off-pump coronary artery bypass surgery.",
        "metadata": [
            {
                "filename": "Sievert-2013-Antimicrobial-resistant pathogens.pdf"
            },
            {
                "filename": "Sievert-2013-Antimicrobial-resistant pathogens.pdf"
            }
        ],
        "evolution_type": "reasoning"
    },
    {
        "id": 43,
        "question": "在液体比较随机对照试验中，对于预防造影剂相关肾损伤，最佳体积扩张方法是什么？",
        "answer": "The context does not specify the optimal volume expansion method for preventing contrast-induced acute kidney injury (CI-AKI) in randomized controlled trials.",
        "contexts": [
            "ascular potentially attenuating effects of important to note that these and the precise mechan- volume e expansion speculative, which CI-AK isms volume expansion against protects remain unknown.\n\neither expansion with 4.4.1: We recommend i.v. volume chloride sodium isotonic sodium bicarbonate volume expansion, in solutions, rather than no i.v. patients at increased risk for CI-AKI. (1A)\n\n### RATIONALE\n\nDespite the recognition of volume depletion important e directly risk factor for AKI. RCTs that there have no are evaluated the role of fluids vs.1 placebo in the  prevention of AKI. However, RCTs have compared different fluids and have 191 with combined fluids other interventions. Furthermore, these trials191 and outcomes seen in between comparisons 466 historical untreated control subjects suggest a large benefit from fluids. In particular, volume expansion and treatment of dehydration are well-established interventions in preven- tion of CI-AKI. A recent propensity analysis, however, noted that strategies to prevent CI-AKI rather implemented nonuniformly. post-contrast-media 1 administra- Pre- and tion i.v. fluids were 264 of 660 study patients e given to only 2 (40.0%), more with coronary: / than commonly angiography with CT (91.2% vs. 16.6%). Other preventive measures, such as administration of NAC 1 of NSAIDs, discontinuation e equally rarely applied. Only 39.2% o of patients received were NAC, to while only 6.8% patients instructed were of NSAIDs. In a the discontinue analysis, use a propensity s was associated with a reduced rate of CI-AKI. The i.v. fluids\n\nincidence of CI-AK.I  following CT (range lowest 0.0-10.9%) and was highest following noncoronary angio graphy (range, 1.9-34,0%) The fluids that have been tested in the prevention of CI-AKI are hypotonic saline (0.45%), isotonic saline (0.9% 1 of al and isotonic c sodium bicarbonate, The interpretation these studies is hampered by the fact that not all other risk factors (susceptibilities) for CI-AK were excluded or considered in every g study (i.e., age of the patient, presence of CKD and/or diabetes prior to contrast-media administra tion, type and dose of contrast agent, associated therapy with NAC, and other risk factors [see Chapter 2.21) There is no clear evidence from the literature to guide the choice of the optimal rate and duration of fluid infusion in CI-AKI prevention, but most studies suggest that the fluids should be started 1 at least 1h before and continued for 3-6 hours after contrast-media administration, A \"good\" urine output (>150 ml/h) in the 6 hours after the radiologica been associated with reduced rates of AKI in procedure has one study.468 all Since not of i.v. administered isotonid crvstalloid remains in the vascular space, in order to achieve a urine flow rate of at least 150 ml/h, 1.0-1.5 ml/kg/h of i.v. fluid has to be administered for 3-12 hours before and 6-12 hours after contrast-media exposure et al 469 Mueller found that i.v. 0.9% saline solution 0.45% saline solution in dextrose, in 1620 compared to patients undergoing angiography significanth coronary CI-AKI. The reduced sustained administration of isotonid saline before and I after radiocontrast injectior 1 seems, thus to be more protective than equivalent volumes of hypotonic 464 saline. Although the which mechanism sodiun effects, migh bicarbonate, beyond its volume-expanding further reduce CI-AKI remains poorly defined, it has beer postulated that sodium bicarbonate infusion may decrease of the Haber-Weiss generation free radicals mediated by reaction by increasing tubular pH. The Haber-Weiss reactior : pH levels. Sodium bicarbonate most active at lower infusion may also scavenge the potent oxidant peroxynitrate 1 pathway.471 produced via a nitric Reactive : oxide-mediated species activate cytokine-induced inflammatory oxygen proximal tubular cells,47 mediators, resulting in damage to 1 and it is likely that the activation is these mediators influenced tissue intracellular medullary :hypoxia ang 47 acidosis. It is worth noting that, compared to i.v. bicarbonate, the of ora inducing an alkaline combination azetazolamide urine, plus iv saline was more effective for the nprevention of\n\n"
        ],
        "ground_truth": "虽然有液体与安慰剂在预防 CI-AKI 方面的随机对照试验，但是这些试验比较了不同的液体，并且与历史对照组的结果表明，液体有很大的益处。特别是，体积扩张和脱水治疗是预防 CI-AKI 的成熟干预措施之一。然而，最近的倾向性分析注意到预防 CI-AKI 的策略实施不一致。i.v. fluids 在 CT 后的 CI-AKI 发生率最低为 0.0-10.9%，在非冠状动脉造影后最高为 1.9-34.0%。已经在预防 CI-AKI 中测试的液体包括低渗盐水（0.45%）、等渗盐水（0.9%）和等渗碳酸氢钠。这些研究的解释受到一个事实的阻碍，即并非所有与 CI-AK 有关的风险因素都在每项研究中被排除或考虑到（即患者的年龄、在造影前是否有 CKD 和/或糖尿病、对比剂的类型和剂量、与 NAC 的联合治疗以及其他风险因素[参见第 2.21 章]）。从文献中没有清晰的证据来指导液体输注速率和持续时间的选择，但大多数研究表明，液体应该在对比剂注射前至少 1 小时开始，并在注射后持续 3-6 小时。在放射学程序后 6 小时内有“良好”的尿量（>150 毫升/小时）已与较低的 AKI 发生率有关。由于静脉给药的等渗晶体液留在血管空间，为了实现至少 150 毫升/小时的尿流速率，必须在对比剂暴露前 3-12 小时和后 6-12 小时静脉给予 1.0-1.5 毫升/千克/小时的静脉液。穆勒发现，与接受冠状动脉造影的患者相比，使用 0.9% 生理盐水溶液的患者与使用 0.45% 葡萄糖酸盐溶液的患者相比，在冠状动脉造影后显著减少了 CI-AKI。因此，持续给予等渗生理盐水在对比剂注射前后似乎比相等体积的低渗生理盐水更具保护作用。尽管碳酸氢钠的机制，除了其体积扩张作用外，可能会进一步减少 CI-AKI，但这个机制尚未明确定义，有人提出碳酸氢钠输注可能通过增加肾小管 pH 来减少由 Haber-Weiss 反应介导的自由基生成，从而减少 CI-AKI。碳酸氢钠在较低的 pH 水平下最活跃，还可能清除通过一氧化氮介导的强氧化剂过硝酸盐途径产生的有氧氧化性物质。活性氧介导的细胞间介质通过促进氧化应激和细胞外介质，可能影响组织内中枢酸中毒。值得注意的是，与 i.v. 碳酸氢钠相比，尿碱化剂阿扎唑胺与 iv 生理盐水联合应用对预防CI-AKI更为有效。",
        "metadata": [
            {
                "filename": "Sievert-2013-Antimicrobial-resistant pathogens.pdf"
            }
        ],
        "evolution_type": "reasoning"
    },
    {
        "id": 44,
        "question": "What distinguish patients without infection, those with non-pyogenic infections, and those with pyogenic infections in terms of gender, smoking, alcoholism, and hospital admission?",
        "answer": "1",
        "contexts": [
            " respiratory the most common infection site, followed by geni- tract was tourinary system and abdominal cavity (Table 2). A total of 988 pathogens were isolated from 646 patients (37.6%) with sepsis, including 765 Gram-negative bacilli a and 178 Gram- positive cocci. Pseudomonas aeruginosa (n= 237) was the most common isolated pathogen, followed by Acinetobacter bau- i (n = 183), Klebsiella pneumoniae (n = 91), Escherichia mannii coli (n = 86), and methicillin-resistant Staphylococcus aureus n = 70) (Supplemental Table 1, Supplemental Digital Content 1, http://links.lww.com/CCM/C542).\n\nAmong patients, with sepsis, 265 (15.4%) were diagnosed sepsis, whereas 233 patients (13.6%) met criteria for as severe c shock, The median SOFA score at the diagnosis of sep- septic was 2 (IOR, 0-3), 4 (IOR and septic shock severe sepsis, 3-6), and 9 (IQR, 7-11), respectively. However, only 237 patients (13.8%) were admitted into ICU, compared septic with 20.0% (n = 53) in patients with severe sepsis and 59,2% (n = 138) in patients with septic shock. The overall hospital mortality rate was 20.6% (353/1,716), and withholding life-sustaining including withdrawing g ther- apy in 109 and 83 patients, respectively. In comparison, hospi tal mortality for severe sepsis and septic shock was 26.0% and 84.5%, respectively.\n\n### Occurrence Rate of Sepsis\n\nThe crude occurrence rate of sepsis, severe sepsis, and septic shock was 667, 103, and 91 cases per 100,000 population per year, respectively (Table3), corresponding to 8.1 (95% CI,7.7- 8.5), 1.3 (95% CI, 1.1--1.4),and 1.1 (95% CI, 1.0-1.2) cases per 100 hospital admissions, respectively After we adiusted for : age and gender, the standardized occurrence rate was 461, 68, and 52 cases per 100,000 popu lation for sepsis, severe e sepsis, and septic shock, respectively Assuming that the above standardized occurrence rates were representative of those of China, this produced a national esti mate of 4,856,532 cases of sepsis, 713,553 cases of severe sepsis and 551,454 cases of septic shock per year The occurrence rate of sepsis s and its complications (i.e shock) in and severe septic sepsis men significantly was higher than that in women (Fig. 1 and Table 3). Women were more likely to have genitourinary infections (11.4% vs 7.1% b = 0.002) and less likely to have lower respiratory tract infec- tions (70.1% ys 72.7%: p = 0.032) but otherwise had a similar distribution of infection sites, In comparison, distribution of infection sites did not show seasonal variations The occurrence rate exhibited a slow but steady increase since adolescence (98 per 100,000 population < 50 vr old), and increased sharply through most of the adulthood (1,330.8 per 100,000 population 71-75 yr old), and peaked in the elderly (15,200 per 100,000 population > 90 yr old) The occurrence rate ofsepsis exhibited significant seasonal vari- ation, being highest in winter (December, January, and February and lowest in 1 (September, October, and November autumn (Supplemental Table 2, Supplemental Digital Content 2, http:/) links.lww.com/CCM/C543). The occurrence rate of severe sepsis and septic shock demonstrated similar seasonal variation The crude population mortality rates of sepsis, severe sepsis and septic shock were 137, 27, and 77 cases per 100,000 popu- lation per year, respectively. This represented 831,674 deaths with sepsis, 156,057 deaths with severe 1 447,219 sepsis, and deaths with septic shock nationally, although this s extrapola tion was only speculative. Mortality was significantly higher in men than women for sepsis and septic shock, but not severe sepsis (Table 3). Mortality for sepsis increased with age from 2.4% in adults less than 50 years old to 30.",
            "7% in those more than 90 years old (Fig.2).\n\nTABLE 1. Characteristics of Patients Without Infection, Patients With Nonseptic Infection, and Patients With Sepsis\n\n\n|    | 0                                           | 1             | 2            | 3            | 4                  |\n|---:|:--------------------------------------------|:--------------|:-------------|:-------------|:-------------------|\n|  0 | Characteristics                             | nan           | nan          | Infection    | nan                |\n|  1 | Characteristics                             | nan           | nan          | nan          | nan                |\n|  2 | nan                                         | 63 (49-78)    | 79(64-85)    | 79 (62-84)   | 80 (66-85)©        |\n|  3 | Male sex, n (%)                             | 7,545 (42.5)  | 1,886 (54.7) | 898 (51.8)   | 988 (57.6)         |\n|  4 | Smoking, n (%                               | 3,270 (18.4)  | 940 (273)    | 440 (25.4)   | 500 (29.1)         |\n|  5 | Alcoholism, n (%                            | 1,334 (7.5)   | 268 (78)     | 122 (7.0)    | 146 (8.5)          |\n|  6 | Tvpe of hospital admission. n (%            | nan           | nan          | nan          | nan                |\n|  7 | Medica                                      | 10.235 (577)  | 3,069 (89.0) | 1,516 (875)  | 1,553 (90.5)       |\n|  8 | Medica                                      | 7,269 (41.0)  | 314 (9.1)    | 186 (10.7)   | 128 (7.5)          |\n|  9 | Emergency surgery                           | 238 (1.3)     | 66 (1.9)     | 31 (1.8)  "
        ],
        "ground_truth": "The specific characteristics that differ among patients without infection, those with non-pyogenic infections, and those with pyogenic infections include male sex, smoking, and alcoholism. For example, among patients with pyogenic infections, 57.6% were male, while among patients without infection, this percentage was 42.5%. Similarly, the percentage of smokers was higher among patients with pyogenic infections (29.1%) compared to those without infection (18.4%). Additionally, alcoholism was more prevalent among patients with pyogenic infections (8.5%) compared to those without infection (7.5%).",
        "metadata": [
            {
                "filename": "Zhou-Critical Care Medicine-2017.pdf"
            },
            {
                "filename": "Zhou-Critical Care Medicine-2017.pdf"
            }
        ],
        "evolution_type": "reasoning"
    },
    {
        "id": 45,
        "question": "What impacts renal function recovery in shock patients?",
        "answer": "1",
        "contexts": [
            "itation in the management of hypotensive with patients shock has standard t ; been septic treatment 93,113,114 for decades. What clear, has paradigm not been fluid to give, for how long, or what however, is how much f type of fluid therapy is optimal in the physiologic support of\n\nIn 2001, Rivers et al 115 septic shock. the published results . of a small (n=263), open-label, single-center r study that compared a treatment protocol that the authors referred to as EGDT in the emergency y management of septic shock EGDT the premise that early predicated an upon protocolized resuscitation program with predefined physio- logic end-points will prevent organ failure and improve the outcome of patients presenting with septic shock with infection Hypotensive severe rapidly patients are for assessed evidence e of tissue and micro- hypoperfusion by circulatory dysfunction blood mean arterial pressure measurement and plasma lactate levels 1151 Blood lactate level: neither  nor specific but e readily available sensitive are of and do measures tissue hypoperfusion correlate  with 116,117 Early recognition of septic adverse  outcomes in sepsis shock then initiates a protocol of resuscitation with the goa of reestablishing tissue perfusion in patients within 6 hours of diagnosis. The e physiologic mean goals are: i return blood Hg: ii) centra venous arterial pressure to ≥65 mm pressure between 8-12 mm Hg; iii) improvement tin blood lactate levels; iv) central venous oxygen saturation (ScvO₂ >70%; and v) a urine output of >0.5ml/kg/h In the study by Rivers et al. the protocol-driven resulted in more rapid use of fluids, more blood transfusions and in a small number of patients, earlier use of dobutamine than standard over the 6-hou time period I emergency care The in-hospita mortality  rate the e contro group was 46.5% vs. 30.5% in the EGDT group (P <0.01).115 Follow-up dra- predominantly observational studies, have found less 118-122 though not without matic but generally similar effects. exception. The Rivers did I out- s study < at AKI not specifically look comes, but function-scoring  systems (i.e.. multiple-organ APACHE II and SAPS 2) both showed I significant improve- s with EGDT. In a subsequent of ments study, prevention AKI was significantly improved in patients randomized modified ) f ScvO2.3 EGDT I strategy (without of t measurement 119 of the compared to a standard-care group Criticisms Rivers study include: i) a complex multistep protocol for which individual i interventions have e not been validated; ii the use  of a treatment team in the active-therapy arm, thus risking a Hawthorn effect; iii) high mortality in the standard- care arm; and iv) the study was a small single-center study Three large multicenter clinical trials in the USA, UK, and Australia are currently underway to definitively evaluate this promising therapy\n\nGoal-directed therapy for hemodynamic support during period in high-risk surgical patients the  perioperative Efforts 1 delivery improve1 tissue optimizing oxygen to hemodynamic high-risk surgical patients support and other adverse e been have prevent patient outcomes 124-126 A recent meta-analysis of investigated for many years e studies by Brienza et al. t protocolized these concluded that of the s (regardless with specific physio- therapies protocol) AKI goals can significantly reduce logical postoperative\n\nKidney International Supplements (2012) 2, 37-68\n\nestudies is the lack of A major problem t these 1 in interpreting hemodynamic standardized  and tissue oxygenation targets and management strategies used to verify the efficacy of these e care. A heterogeneous over standard perioperative measures collection of study populations, types of surgical procedures e this monitoring g methods, and treatment strategies comprise 127 The basic strategy of goal-directed meta-analysis. recent t AKI in the period is based therapy to prevent perioperative avoid protocols that hypotension, optimize oxygen delivery, and include careful fluid management, vasopressors when indicated and inotropic agents and blood products needed. 127 The relative merits and risk:benefit ratio of each discrete the element of EGDT in successful resuscitation of patients with the limita- septic shock s further study. Given requires the tions lack and studies current comparative individual effectiveness studies we protocols, comparing the that conclude protocols for resuscitation can only setting septic shock and high-risk surgery appear to protocol. superior to no\n\n### RESEARCH RECOMMENDATIONS\n\nvs. colloid trials of isotonic crystalloid Randomized therapy for intravascular volume e expansion",
            " prevent or treat AKI should be conducted in a a variety of settings surgery, sepsis), including (critical illness, high-risk In particular, colloids subsets may improve patient fluid efficiency of but :(starch) also resuscitation some effects on the kidneys. If e concerns regarding carry some colloid results in overload, it less volume may lead to improved outcomes. of specific solutions, with specific electrolyte Comparisons composition or colloid type, for effectiveness in preventing AKI should be conducted. Specifically, there is a need to examine electrolyte solutions vs. saline. physiologic\n\nKidney International Supplements (2012) 2, 37-68\n\nStudies are needed that of compare different types. of AKI in vasopressors for prevention and treatment evidence unstable hemodynamically patients. Some suggests that certain vasopressors may preserve rena function better than others (e.g., vasopressin analogues vs, catecholamines) and studies are needed to compare them in this setting The choice of a target mean 1 arterial perfusion pressure range of 65-90 mm Hg as a component of resuscitation (perhaps in the context of age, chronic blood pressure, or other comorbidities) also needs further study The specific components of goal-directed therapy that accrue benefits for patients at risk for AKI need to be determined. Is it the timing of protocolized hemodynamic management that is beneficial: prophylactically in high risk surgical patients, or early in the course of severe sepsis? C or EGDT In contrast to the benefits of prophylactic protocolized use of inotropes to normalize mixed venous supranormalize oxygen delivery in oxygen saturation or : critical illness did not result in decreased AKI128 \"late\" 128,129 improved outcomes. Alternatively, is it attention monitoring, the protocol itself that to hemodynamic standardizes supportive care to achieve the stated goals, or a single or combination of the multiple possible interven- tions that improves outcome? Thus, further research specific components of goal- required to determine the directed therapy that accrue benefits for patients at risk for AKI, if such benefits actually occur.\n\n### SUPPLEMENTARY MATERIAL\n\nSupplementary Table 1: Summary table of RCTs examining the eeffect of starch for the prevention of AKI. Appendix D: Evaluation and General Management Guidelines for Patients with AKI of the paper at Supplementary material is linked to the online version http://www.kdigo.org/clinical_practice_quidelines/AKl.php\n\n© 2012 KDIGO\n\n## management of Chapter 3.2: General supportive AKI, including management of with patients complications\n\nwas discussed in the Supportive management prevent previous chapter and, for many patients, many of the supportive if AKI develops. will continue Furthermore therapies of AKI is to goal of early an important management ) prevent further injury and to facilitate recovery of renal function. These goals can often best be achieved by strict attention to supportive However, as renal function deteriorates, complications therapy. of these issues different management. Some arise that require been discussed in have Chapter 2.3 and several books have devoted, in of the been large part many management\n\nfrom AKI ; the reader is referred complications that arisef the these Particular attention should be given sources assessment of the circulating volume and fluid administration the prevention and/or treatment of hyperkalemia and metabolic the knowledge of the changes in pharmacokinetics of acidosis. drugs with discontinuation of all potentially nephrotoxic many and dose adaptation of drugs excreted by the kidneys drugs, the patient's renal function. Finally, many of the other chapters in this section of the guideline deal with supportive measures diuretics for fluid management). (e.g.,)\n\nKidney International Supplements (2012) 2, 37-68\n\n© 2012 KDIGO\n\n## Chapter 3.3: Glycemic control and nutritional support\n\nGLYCEMIC CONTROL L IN CRITICAL ILLNESS: RENAL EFFECTS AND OUTCOMES\n\n3.3.1: In critically suggest insulin patients, therapy glucose e 110-149 mg/d targeting plasma (6.1-8.3 mmol/1). (2C)\n\n### RATIONALE\n\nAs outlined in a recent review, stress nypergrycemia is distinctive clinical feature of critical illness., Stress mediators and central and peripheral insulin resistance appears pivotal to the occurrence hyperglycemia. Inflammatory stress and have been mediators counter-regulatory hormones shown to impede crucial of the insulin-signaling elements pathwav. Still, exogenous insulin administration o normalizes blood glucose levels in t this s setting Insulin treatment may counteract hepatic insulin resistance acute critical durings illness. Extensive"
        ],
        "ground_truth": "肾功能的恢复受到许多因素的影响，其中包括但不限于对循环容量的评估和液体管理，高钾血症和代谢性酸中毒的预防和/或治疗，了解药物的药代动力学变化以及调整由肾脏排泄的药物剂量，以及支持措施（例如利尿剂用于液体管理）。",
        "metadata": [
            {
                "filename": "Sievert-2013-Antimicrobial-resistant pathogens.pdf"
            },
            {
                "filename": "Sievert-2013-Antimicrobial-resistant pathogens.pdf"
            }
        ],
        "evolution_type": "reasoning"
    },
    {
        "id": 46,
        "question": "What's the percentage of alcoholism among patients, given its 7% prevalence in those over 90?",
        "answer": "The context provided doesn't give the specific percentage of alcoholism among patients. It only states that 1,334 (7.5%) out of the patients had alcoholism, but this is not related to the 7% prevalence among those over 90. Therefore, the answer is not present in the context.",
        "contexts": [
            "7% in those more than 90 years old (Fig.2).\n\nTABLE 1. Characteristics of Patients Without Infection, Patients With Nonseptic Infection, and Patients With Sepsis\n\n\n|    | 0                                           | 1             | 2            | 3            | 4                  |\n|---:|:--------------------------------------------|:--------------|:-------------|:-------------|:-------------------|\n|  0 | Characteristics                             | nan           | nan          | Infection    | nan                |\n|  1 | Characteristics                             | nan           | nan          | nan          | nan                |\n|  2 | nan                                         | 63 (49-78)    | 79(64-85)    | 79 (62-84)   | 80 (66-85)©        |\n|  3 | Male sex, n (%)                             | 7,545 (42.5)  | 1,886 (54.7) | 898 (51.8)   | 988 (57.6)         |\n|  4 | Smoking, n (%                               | 3,270 (18.4)  | 940 (273)    | 440 (25.4)   | 500 (29.1)         |\n|  5 | Alcoholism, n (%                            | 1,334 (7.5)   | 268 (78)     | 122 (7.0)    | 146 (8.5)          |\n|  6 | Tvpe of hospital admission. n (%            | nan           | nan          | nan          | nan                |\n|  7 | Medica                                      | 10.235 (577)  | 3,069 (89.0) | 1,516 (875)  | 1,553 (90.5)       |\n|  8 | Medica                                      | 7,269 (41.0)  | 314 (9.1)    | 186 (10.7)   | 128 (7.5)          |\n|  9 | Emergency surgery                           | 238 (1.3)     | 66 (1.9)     | 31 (1.8)  "
        ],
        "ground_truth": "酗酒在患者中的发病率是146 (8.5)%。",
        "metadata": [
            {
                "filename": "Zhou-Critical Care Medicine-2017.pdf"
            }
        ],
        "evolution_type": "reasoning"
    },
    {
        "id": 47,
        "question": "In severe infection cases, recommendations 13 and 14 suggest the application of BPS. Based on the mentioned Meta-analysis, combining Blood Purification Solution injections can improve inflammatory response and multi-organ dysfunction syndrome, reducing mortality in septic patients. Recommendation 13 indicates that after pathogen diagnosis or significant clinical symptom improvement, BPS is recommended. Recommendation 14 mentions that in sepsis or septic shock patients, antibiotic dose optimization should be based on pharmacokinetic/pharmacodynamic principles and drug characteristics. Therefore, for severe infection patients, when is it recommended to use BPS?",
        "answer": "1",
        "contexts": [
            "�持联合治疗的临床获益。\n已发表的 Meta 分析结果显示，在抗感染治疗的基础上联合使用血必净注射液，可降低 白细胞计数和过高的体温，控制炎症反应和多器官功能障碍综合征的发展，改善 APACHEⅡ 评分，降低脓毒症患者 28 d病死率。\n如有侵权请联系网站删除\n推荐意见 13：在病原学诊断及药敏结果明确或者临床症状充分改善后推荐进行降阶梯治 疗(BPS)。\n对绝大多数严重感染来说， 在确定致病菌的情况下， 应降阶梯至最窄谱抗菌药物治疗以 缩小覆盖范围。 Guo 等进行的一项纳入 99 项研究的 Meta 分析结果显示， 抗菌药物的降阶梯 治疗与持续应用广谱抗菌药物对患者的病死率差异无统计学意义。几项观察性研究结果显 示，抗菌药物的降阶梯治疗能降低病死率， 鉴于不必要的持续性抗菌药物的使用给社会和个 人带来的不良后果， 推荐抗菌药物降阶梯治疗。 当发现感染不存在时，应即将住手抗菌药物 的使用，以避免产生耐药及不良反应。\n推荐意见 14：在脓毒症或者脓毒性休克患者中，抗菌药物的剂量优化策略应基于目前 公认的药效学/药动学原则及药物的特性(BPS)。\n脓�"
        ],
        "ground_truth": "降阶梯治疗(BPS)对于严重感染患者的推荐意见是在确定致病菌的情况下，应降阶梯至最窄谱抗菌药物治疗以缩小覆盖范围。抗菌药物的降阶梯治疗能降低病死率，推荐抗菌药物降阶梯治疗。",
        "metadata": [
            {
                "filename": "(Word版)中国脓毒症／脓毒性休克急诊治疗指南(2022)培训资料.docx"
            }
        ],
        "evolution_type": "reasoning"
    },
    {
        "id": 48,
        "question": "How do hospital and ICU structures affect ICU patient outcomes in China using 2019 NCIS data?",
        "answer": "1",
        "contexts": [
            "### Association between hospital and ICU Ch up structural factors and patient outcomes in China: a secondary analysis of the National Clinical Improvement System Data in 2019\n\nZhen Lilfo,Xudong Ma2t . Sifa Gao2t Qi Li, Hongbo Luo , Jianhua Sun',Wei Du', Longxiang Su', Lu Wang Qing Zhang', Zunzhu Lil\"*, Xiang Zhou\" and Dawei Liu\" on behalf of China National Critical Care Quality Control Center Group\n\nBackground: Hospital and CU structural factors are key factors affecting the guality of care as well as CU patient outcomes. However, the data from China are scarce. This study was designed to investigate how differences in patient outcomes are associated with differences in hospital and ICU structure variables in China throughout 2019\n\nMethods: This was a multicenter observational study. Data from a total of 2820 hospitals were collected using the National Clinical lmprovement System Data that reports CU information in China. Data collection consisted of al information on the hospital and ICU structural factors, including the hospital type, number of beds, staffng, among others, and b) ICU patient outcomes, including the mortality rate as well as the incidence of ventilator-associated oneumonia (VAP). catheter-related bloodstream infections (CRBSls), and catheter-associated urinary tract infections (CAUTls), Generalized linear mixed models were used to analyse the association between hospital and ICU structura factors and patient outcomes Results: The median ICU patient mortality was 8.02%(3.78%, 14.35%), and the incidences of VAP CRBSL, and CAUT\n\npneumonia (VAP), catheter-related bloodstream infections (CRBSls), and catheter-associated urinary tract infections (CAUTls), Generalized linear mixed models were used to analyse the association between hospital and ICU structura factors and patient outcomes Results: The median ICU patient mortality was 8.02% (3.78%., 14.35%), and the incidences of VAP. CRBSL, and CAUT were 5.58 (1.55.11.67) per 1000 ventilator davs., 0.63 (0.2.01) per 1000 catheter davs,and 142 (0.37,3,40) per 1000 catheter davs, respectively. Mortality was sianificantly lower in public hospitals (B= -0.018(- 0031.- 0.005) p=0.006), hospitals with an ICU-to-hospital bed percentage of more than 2% (B= -0.027 (-0.034,-0.019)., p<0.001) and higber in hospitals with a bed-to-nurse ratio of more than 0 5:1 (B=0009 (0 001 0017) np=0 027) The incidence of VAP was lower in public hospitals (B= -0.036 (- 0.054.-0018), p<0.001). The incidence of CRBSls was lower in public hospitals (B= -0.008 (- 0.014,-0002), p=0.011) and hiaher in secondary hospitals (B=0.005 (0.001.,0.009) p= 0.010), while the incidence of CAUTls was higher in secondary hospitals (B=0.010 (0002. 0.018)., p= 0.015)\n\ndwliu98@163.com [Zhen Li, Xudong Ma and Sifa Gao contributed equally to this work 'Department of Critical Care Medicine. Peking Union Medical College Hospital, Pekina Union Medical College and Chinese Academy of Medica Sciences, Beijing 100730, China Full list of author information is available at the end of the article\n\n©The Author(s) 2022. corrected publication 2022 Open Access This article is licensed under a Creative Commons Attribution 40 Interational License, which permits use, sharing, adaptation, distribution and reproduction in any medium or format, as long as you give appropriate credit to the original author(s) and the source, provide a link to the Creative Commons licence, and indicate if changes were made The images or otber third party material in this article are indluded in the artice's Creative Commons llicence  unless indicated otherwise in a credit line to the material If material is not included in the article's Creative Commons licence and your intended use is not permitted by statutory requlation or exceeds the permitted use, you will need to obtain permission directly from the copyriaght holder. To view a copy of this licence visit http://creativecommonsora/licenses/by/40/ The Creative Commons Public Domain Dedication waive (http://creativecomm",
            "ons.org/publicdomain/zero/1.0/) applies to the data made available in this article,unless otherwise stated in a credit linetothe data\n\nConclusion: This study highlights the association between speciffic ICU structural factors and patient outcomes Modifying structural factors is a potential opportunity that could improve patient outcomes in ICUs\n\n### Background\n\ndelivery is challenging and I complex in the Healthcare intensive care unit. Several factors, including ICU struc ture, ICU organization and d the care process, can influ ence ICU 1 extensive performance 1-3]. Despite the ICUs, the the quality of care literature addressing impact of such factors remains controversial, and a dili. gent assessment of care components is required It is well known that ICU structural factors vary within and regions [4, 51. However, most different countries related conducted in Western studies have been coun- tries [6. 71. Little evidence regarding the structural factors of ICUs in China is available [81, China still faces chal lenges in providing optimal and equitable management strategies for ICU patients across the nation because its broad geography and unbalanced economic develop ment. A previous study described critical care resources in Guangdong Province 9. Another study evaluated the practices, outcomes, and costs related to mechanical ven: tilation within ICUs in Beijing [10]. Nonetheless, those studies were limited to the regions in which the surveys were administered and feature small e sizes: it is I sample also not clear whether those resources were e associated with ICU care provision, treatment patterns, and patient demands outcomes. Finally, increasing  and I rising costs significant challenges to the delivery of high-qual pose: ity and affordable critical care to a growing population of patients. Optimizing ICU organization is a potentia opportunity to improve patient outcomes and the use of resources. Therefore, the aim of this study was to investigate hos- pital and ICU structural factors and patient outcomes in China. Moreover, we aimed to identify the associa- tion between these variables and patient outcomes, with structural factors, including ICU a focus on potential structural resources and staffing levels. We hypothesized that patients admitted to hospitals that were government- funded, tertiary, well-equipped, and better-staffed woulc have a decreased risk of ICU mortality and occurrence of VAP, CRBSIs and CAUTIs after adjusting for region, dis ease severity, and other confounders.\n\nDesign This nationwide, database observational e study was a National Clinical 2019. The data the source was\n\nSystem (https://ncisdc.medidata.cn/login Improvement Qual- jsp), collected by the China-National Critical Care e (China-NCCQC), which is the official ity Control Centre regulates ICU quality control national department that China. The of Health of China Ministry approved that Peking Union Medical College Hospital establishes 2012. The China-NCCQC Quality Improvement China-NCCQC of Critical Care led by Program, was 2015. This initiated in study above pro- part obtained from the the data was gram. Permission to use China-NCCQC.\n\n### Study population and settings\n\nThe China-NCCOC. collected the relevant data regard. ing quality control indicators through the database the National Clinical Improvement System. Hospitals in China are classified in a 3-tier svstem (primary, second arvy or tertiary hospital) that recognizes a hospital's ability to provide medical care, medical education, and conduct medical research. Tertiary hospitals, similar to a tertiary referral hospital in the West, are usually comprehen- sive, referral, general hospitals responsible for provid- ing specialist health services, perform a larger role with 1 and scientific research regard to medical education and serve as medical hubs providing care to multiple regions Secondary hospitals, similar to : a regional hospital e district hospital in the West, tend to be affiliated with medium-sized city, county, or district and are responsible for providing comprehensive health services and medical education and conducting research on a regional basis. Ir contrast, primary hospitals are primary health care insti- tutions whose main function is to provide primary pre- vention directly to the population, however, they rarely admit and treat critically ill patients. Therefore, primary hospitals were not included in the scope of the study The enrolled tertiary and secondary hospitals voluntar- ily participated and were selected by the China-NCCOC The selection criteria were as follows. (1) The ICU had to have more than five beds. (2) The ICU had to have the ability to diagnose and treat the relevant medical dis- eases that were evaluated as quality control items (such catheter- ventilator-associated pneumonia (VAP), as related blood stream infections (CRBSIs), and catheter- associated urinary tract"
        ],
        "ground_truth": "这项研究表明了特定ICU结构因素与患者结果之间的关联。修改结构因素是改善ICU患者结果的潜在机会。",
        "metadata": [
            {
                "filename": "Association between hospital and ICU structural factors and patient outcomes in China a secondary analysis of the National Clinical Improvement System Data in 2019.pdf"
            },
            {
                "filename": "Association between hospital and ICU structural factors and patient outcomes in China a secondary analysis of the National Clinical Improvement System Data in 2019.pdf"
            }
        ],
        "evolution_type": "reasoning"
    },
    {
        "id": 49,
        "question": "连接隐球菌病和健康影响，是什么因素导致了致病菌易侵入人体并引发感染？",
        "answer": "机体抵抗力下降",
        "contexts": [
            "形态以及有性孢子的形态等进行种的鉴定。培养条件应 标准化,常用的培养基为察氏琼脂或察氏酵母浸膏琼脂。 曲霉孢子2~5um大小,易在空气中悬浮。吸人孢子后 可引起曲霉病,肺和鼻窦最易受累,依据宿主的免疫状态司 产生多种不同的临床类型。对免疫功能正常的个体,曲霉可 成为过敏原或引起肺或鼻窦的限局性感染:对免疫功能严重 受损者,曲霉可在肺或鼻窦处大量生长,然后播散至身体其 他器官。 3.致病性隐球菌.隐球菌属中新生隐球菌是最常见的致 病菌,它包括两个变种,即新生隐球菌新生变种和格特变种 前者广泛分布于世界各地常存在于鸽等鸟类的排泄物 中.几平所有的AIDS患者并发的隐球菌威染均是由该变利 引起:后者主要分布于热带、亚热带地区,可从梅树中分 离到。 新生隐球菌培养产生奶油色醯母样菌落显微镜下可见 球形或椭圆形酵母细胞,直径2~5um.第一代培养物有时 可见小的莱膜。脑脊液直接涂片可见隐球菌的酸母细胞有 较宽的英膜。 健康人对该菌有免疫力,只有当机体抵抗力下降时,病 原菌才易侵人人体致病。该菌最常侵犯中枢神经系统,也可 引起严重的肺部病变,其主要感染途径为呼吸道。隐球菌病 好发干AIDS、�"
        ],
        "ground_truth": "曲霉孢子2~5um大小,易在空气中悬浮。吸人孢子后 可引起曲霉病,肺和鼻窦最易受累,依据宿主的免疫状态司 产生多种不同的临床类型。对免疫功能正常的个体,曲霉可 成为过敏原或引起肺或鼻窦的限局性感染:对免疫功能严重 受损者,曲霉可在肺或鼻窦处大量生长,然后播散至身体其 他器官。",
        "metadata": [
            {
                "filename": "ICU 侵袭性真菌感染指南.pdf"
            }
        ],
        "evolution_type": "reasoning"
    },
    {
        "id": 50,
        "question": "What are the effects and outcomes of loop diuretics in acute kidney injury (AKI) treatment, particularly in terms of mortality and the need for renal replacement therapy (RRT), according to meta-analysis results? How does high-dose furosemide administration, including its potential ototoxicity, relate to these findings? Also, what evidence exists regarding the prophylactic use of diuretics to prevent AKI, especially in hemodynamically stable lung injury and ventilation strategies? Furthermore, could you discuss recent studies on furosemide administration in patients undergoing continuous veno-venous hemofiltration (CVVH)? Lastly, what is mannitol's role in AKI prevention, considering its historical use, potential benefits, limitations, including effects on urine flow, and exacerbation of radiocontrast-induced nephropathy?",
        "answer": "1",
        "contexts": [
            " except overload. (2C) the management of volume\n\n### RATIONALE\n\ne several effects that may protect against Loop diuretics have AKI. They may decrease oxygen consumption in the loop of Henle inhibiting sodium thus potentially 1 transport, lessening i Loop diuretics act at the luminal ischemic injury. surface of the thick ascending limb of the loop of Henle and 184,185 inhibit the Na-K-2Cl cotransporter in a loss resulting of the high and decreased ability medullary osmolality sodium reabsorb Inhibition 1 of active water. also 1 transport reduces tubular s rena , potentially consumption, oxygen damage of the vulnerable most decreasing i ischemic outer medullary tubular segments:183 therefore, furosemide might 186 Furosemide : also protect kidneys against ischemic injury. might hasten recovery of AKI by washing out necrotic debris blocking tubules, and by inhibiting prostaglandin dehydro- which reduces renovascular resistance and increases genase, 186,187 blood flow. Based on these renal properties, loop AKI diuretics might be expected ameliorate prevent However, there are only minimal data to support this theory, with loop and there of harm evidence some associated 188-191 prevent or treat AKI. Furosemide is the diuretic in the diuretic prescribed most commonly acute-care 183-185 setting of RCTs have whether number and tested\n\nfurosemide is beneficial for prevention or treatment of AKI be found to Specifically, prophvlactic furosemide was ineffective or harmful when used to prevent AKI after cardiag surgery, 189,190 and to increase the risk of AKI when given to prevent CI-AKI 191 Epidemiologic data have suggested that the use of loop diuretics may increase mortality in patients with critical illness and AKI 181 along with conflicting data that suggest no harm in AKT 182 Finally, furosemide therapy was also ineffective and possibly harmful when used to treat AKJ 188,192 There is no evidence that the use of diuretics reduces the incidence or severity of AKI. Ho et al 192,193 conducted two of the loop comprehensive systematic - reviews use or treat AKI diuretic frusemide (furosemide) to prevent Furosemide had no significant effect on in-hospital mortality risk for requiring RRT number of dialysis sessions, or ever the proportion of patients with persistent t oliguria, Result: from the most recent review193 are shown in Figure 9 and Figure 10. The primary prevention 1studies included patients who underwent cardiac surgery coronary angiography surgery, 194 In two of these and major or vascular general studies, all participants had mild pre-existing renal impair ment. Two of the three studies reported mortality in patients randomized to furosemide (n= 103) vs. placebo (n= 99) with a pooled RR of 2.67 (95% CI 0.75-7.25; P=0.15). Al three studies reported RRT incidence in patients randomized to furosemide (n= 128) vs, placebo (n= 127), with a poolec RR of 4.08 (95% CI 0.46-35.96; P=0.21). Thus, subanalysis to separate primary and secondary prevention trials did not alter the conclusion that, within the sample size limitations of this study, furosemide is not effective for r the preventior of AKI The systematic review and meta-analysis by Ho and Power193 x studies that used furosemide to also includec treat AKI, with doses from 600 ranging ) to 3400 mg/c Figure 9 and Figure 10).19 signifcant reduction was found for in-hospital mortality or for RRT requirement. The was furosemide for treating 1 AK largest single  study of: et al., 188 338 conducted Cantarovich included which patients with AKl requiring dialysis. Patients were randomly assigned to the administration of either furosemide (25 mg kg/d i.v. or 35 mg/kg/d orally) or placebo. Although time to reach 21/d of diuresis was shorter with furosemide (5.7 days than placebo (7.8 days, P=0.004), there was no difference in survival and number of dialysis: sessions. At t present, the current evidence does not suggest that furosemide can reduce mortality in patients with AKI ; however, be useful in achieving fluid Furosemide may, balance to facilitate mechanical ventilation according to the\n\n\n![这是图片](all_figs/6ED25B_Sievert-2013-Antimicrobial-resistant pathogens_p",
            "50_f0.png)\n\nFigure 9 Effect of furosemide ys, control on all-cause mortality, Reprinted from Ho KM. Power BM, Benefits and risks of furosemide in acute kidney injury. Anaesthesia 2010; 65: 283-293 with permission from John Wiley and Sons193; accessed http://onlinelibrary.wiley.com doi/10.1111/i.1365-2044.2009.06228.x/ful\n\n\n![这是图片](all_figs/6ED25B_Sievert-2013-Antimicrobial-resistant pathogens_p50_f1.png)\n\nFigure 10 Effect of furosemide vs. control on need for RRT. Reprinted from Ho KM, Power BM. Benefits and risks of furosemide in acute kidney injury. Anaesthesia 2010; 65: 283-293 with permission from John Wiley and Sons193; accessed http://onlinelibrary.wiley.com/doi 10.1111/i.1365-2044,2009.06228,x/ful\n\nstrategy in hemodynamically ventilation lung-protective the with other hand stable lung injury. Ont patients acute the that high-dose furosemide literature also suggests (>1 g/d) In the first meta-analysis may cause ototoxicity 192 Ho and Sheridan, high doses of furosemide e(range 1-3.4 g/d) caused deafness s or tinnitus more frequently than 6 CI 1.00-15.78; P=0.05). When the control (RR 3,.97; 95% continuous infusion a dose of 0.5 mg/kg administered hour was not  Taken together with ototoxicity. associated with small studies several that the prophylactic use  showing of diuretics to prevent AKI actually increased AKI incidence these data significant of loop concerns regarding use 1 raise diuretics to prevent or treat AKI in any setting. We s similarly\n\nevidence that there is e that the of loop conclude use diuretics reduces the  severity of AKI, or improves outcomes in this syndrome. Although the use of loop diuretics in 1 early of fluid balance, established AKI facilitates management hyperkalemia, and hypercalcemia, and is indicated for these e role in clinical the putative prevention purposes, amelioration of AKI course is unproven. Two whether the admin- recent studies have investigated istration of furosemide to patients treated with CVVH could the with be discontinuation associated rapid more dialysis der Voort observed therapy. expected, van volume and sodium excretion, but this an increased urinary) intervention did not lead to a shorter duration of renal failure\n\nKidney International Supplements (2012) 2, 37-68\n\n195 The second study by frequent renal recovery 196 Uchino et al., analyzed data from the B.E.S.T. kidney and found whc that, 1 from a total of 529 critically I patients survived during CRRT, 313 patients were removed success- 216 patients needed \"repeat RRT\"' fully while from CRRT after temporary discontinuation. Urine output (during the 24 hours before stopping CRRT)1 identified as a significant was but the predictive ability of predictor of successful cessation, of diuretics. affected by the use urine e output was negatively diuretics in Thus, a beneficial role for loop o facilitating discontinuation of RRT in AKI is not evident\n\nMannitol has been frequently used in the past for prevention the studies however, retrospective, most are studies did the the underpowered overall not and, meet criteria of the Work Group o be included in formulation of recommendations. Prophylactic mannitol has been promoted in While in of these patients most undergoing surgery. instances mannitol increases urine flow, it is highly probable that mannitol does not convey additional beneficial effects e of AKI hydration on the incidence beyond adequate In radiocontrast-induced diuretics loop nephropathy, and mannitol in study have been shown to exacerbate one ARE.' Weisberg al. under- et randomized patients receive saline on going contrast-medium investigations three vasodilator/diuretic drugs (dopamine rena one a one-half isotonic : saline ,mannitol [15 g/dl in a [2μg/kg/min], atrial 100 ml/h natriuretic peptide). solution given atrial and mannitol natriuretic peptide Dopamine, were associated with a much higher incidence of renal dysfunction in diabetic subjects compared to patients receiving saline alone. the often added the of Mannitol is to 2 fluid priming the incidence card"
        ],
        "ground_truth": "在急性肾损伤（AKI）治疗中，循环利尿剂的作用和效果尚未得到证实。虽然循环利尿剂在液体平衡调节、高钾血症和高钙血症管理方面可能有作用，并且在这些方面的临床应用是合适的，但对于减轻AKI的程度或改善其结局尚无证据。尽管循环利尿剂在早期液体平衡调节和已确立的AKI中有一定作用，但其在预防AKI方面的作用并不确定。一些研究表明，预防性使用利尿剂可能增加AKI发生率，这些数据引起了对在任何情况下使用循环利尿剂预防或治疗AKI的重要担忧。因此，目前的证据不支持循环利尿剂可以减少AKI患者的死亡率。然而，根据患者情况，循环利尿剂可能有助于实现液体平衡，以促进机械通气治疗。",
        "metadata": [
            {
                "filename": "Sievert-2013-Antimicrobial-resistant pathogens.pdf"
            },
            {
                "filename": "Sievert-2013-Antimicrobial-resistant pathogens.pdf"
            }
        ],
        "evolution_type": "reasoning"
    },
    {
        "id": 51,
        "question": "How can we assess the physiological significance of evaluating the trans-stenotic pressure gradient and fractional flow reserve (FFR) in narrow areas?",
        "answer": "The physiological significance of evaluating the trans-stenotic pressure gradient and fractional flow reserve (FFR) in narrow areas is assessed by measuring these parameters. FFR is a technique widely accepted and validated for determining the coronary circulation's function and determining the significance of a stenosis. By assessing these metrics, one can determine the blood flow and the need for further intervention in cases of potential renal artery stenosis.",
        "contexts": [
            "Some CT strategies in patients at risk of Cl-AK Perform CT, when possible, without contrast media: scrutinize the examination and discuss with the referral physician-surgeon before deciding or the need for contrast media Dosing per kiloaram body weight to reduce the amount of contrast media is needed in thin patients Adapt iniection duration to scan duration when performing CT-angiography, so that the injection is not still running when the scan is finished Use a saline chaser to decrease the amount of contrast media, by using the contrast medium that otherwise would remain in the dead space of the arm veins; this may save 10-20ml of contrast media Use 80kVp: contrast-medium dose may be reduced by a factor of 1 5-17 compared to the dose used at 120kVp since jodine attenuation increases and combine with increased tube loading (mAs) to maintain signal-to-noise ratio Further reduction of contrast media may be instituted in patients with known decreased cardiac output (not unusual in patients with rena impairment) undergoing CT-angiographic studies Some angiographic strategies in patients at risk of Cl-AK Use biplane when appropriate Avoid test iniections: the same amount may be enough for a diagnostic digital-subtraction angiography run Scrutinize each series before performing the next: avoid unnecessary proiections Decrease kilovoltage in a thin patient: a lower iodine concentration mav be used Assess the physiologic significance of a stenosis by measurement of translesional pressure gradient and fractional flow reserve, a technique wel accepted and validated for the coronary circulation, For different arterial beds, perform manometry of a guestionable stenosis instead of multiple projections Avoid ventriculography: echocardiography (and \"echo contrast\") is always a reasonable alternative Use plasma isotonic contrast-media concentrations for renal artery injections When renal artery stenosis is suspected, map Use biplane when appropriate                                                                                              \n                                                                                                                                                                                                                                                                                                                                                                                                                                                                                                                                                                                   | nan                                   |"
        ],
        "ground_truth": "Assess the physiologic significance of a stenosis by measurement of translesional pressure gradient and fractional flow reserve, a technique wel accepted and validated for the coronary circulation.",
        "metadata": [
            {
                "filename": "Sievert-2013-Antimicrobial-resistant pathogens.pdf"
            }
        ],
        "evolution_type": "counter_factual"
    },
    {
        "id": 52,
        "question": "低剂量的血管加压素在什么情况下不被推荐用于感染性休克的治疗？",
        "answer": "低剂量的血管加压素不推荐用于治疗首次由血管加压素诱导的严重低血压或心率低、心输出量高、血压低的患者时",
        "contexts": [
            "for the pulse pressure variation and the stroke volume variation respectively. Utility of pulse pressure variation and stroke e of atrial fibril- volume variation is limited in the e presence lation, spontaneous breathing, and low  suppord pressure breathing. These techniques generally require sedation.\n\n1. We recommend that vasopressor therapy initially tar- get a MAP of 65 mmHg (grade 1C).\n\nRationale. Vasopressor therapy is required t to sustain life and maintain perfusion in the face of life-threatening hypotension, even when hypovolemia has 1 not yet been a threshold MAP. Below resolved.) autoregulation in be critical vascular beds lost. and can perfusion can become on pressure. Thus, some linearly dependent achieve may require patients therapy vasopressor minimal perfusion n adequate flow and maintain 1 pressure [133. 134]. The titration of norepinephrine to a MAP as 65 mmHg has been shown low as 1 to preserve tissue 1 of that the consensus definition perfusion [134]. Note\n\nfrom the evidence-based target of 65 mmHg used in this recommendation. In any case, the optimal MAP should be individualized as it may be higher in patients with ath- erosclerosis and/or previous hypertension than in young comorbidity, For exam- patients without cardiovascular ple, a MAP of 65 mmHg might be too low in a patient with severe uncontrolled hypertension; in young, pre viously normotensive patient, a lower MAP might be adequate. Supplementing endpoints. such as blood pres- with assessment of regional and global perfusion, sure.: such skin perfusion blood lactate concentrations. status, and urine output. is important. Adequate mental fuid resuscitation is a fundamental aspect of the hemo- dynamic management of patients with septic shock and should ideally be achieved before vasopressors and ino- tropes are used; however, using vasopressors early as an with severe shock is fre in patients emergency measure : quently necessary, as when diastolic blood pressure When that occurs, great effort should be directed to weaning vasopressors with continuing fuid resuscitation We recommend norepinephrine as the first-choice vasopressor (grade 1B) epinephrine (added potentially We suggest substituted for additiona norepinephrine) when agent is needed to maintain adequate blood pressure (grade 2B). to 0.03 U/min) can 1 be added to 1 (up Vasopressin with the intent of raisina MAP to target noreninenbrine:\n\nMAP be viously normotensive patient, a lower might adequate. Supplementing e endpoints such 1 as blood pres- sure, with assessment of regional : and global perfusion. such as blood lactate concentrations. skir perfusion mental status. and urine output. is important. Adequate a is a fundamental aspect of the hemo- fuid resuscitation of patients with septic c shock and lvnamic management and ino- should ideally be : achieved before vasopressors tropes are used: however, using vasopressors early as severe shock is fre- emergency measure in patients with s when diastolic blood pressure quently necessary. as: When that be effort should occurs, great directed to with continuing fuid weaning vasopressors resuscitation 2. We recommend norepinephrine as the first-choice vasopressor (grade 1B) 3. We : epinephrine (added to and potentially suggest substituted for additional norepinephrine) when needed to maintain adequate blood pressure agent isi grade 2B). 1 (up to 0.03 U/min) can be added to Vasopressin with the intent of raising MAP to target norepinephrine or decreasing norepinephrine dosage (UG) I as the 5. Low-dose is not :recommended vasopressin of for treatment single initial sepsis- vasopressor induced higher hypotension, and vasopressin doses than 0.03-0.04 U/min s should be reserved for salvage therapy (failure to achieve a adequate MAP with agents) (UG) other vasopressor alternative vasopressor e suggest dopamine an in highly selected agentt norepinephrine only patients (e.g., patients with low risk o of tachyarrhyth: mias and absolute or relative bradycardia) (grade 2C) 7. Phenylephrine is not recommended in the treatment of septic shock except in the following circumstances norepinephrine is associated with serious arthyth mias, (b) cardiac output is known to be high and blood low, or (c) as pressure persistently salvage therapy and low- when combined d inotrope/vasop"
        ],
        "ground_truth": "低剂量的血管加压素不推荐用于治疗感染性休克，除非在以下情况下：(a) 血管加压素导致严重心律失常，(b) 已知心输出量高而血压低，或者(c) 持续低血压时与低心排血量组合的拯救疗法。",
        "metadata": [
            {
                "filename": "Dellinger-2013-Surviving Sepsis Cam.pdf"
            }
        ],
        "evolution_type": "counter_factual"
    },
    {
        "id": 53,
        "question": "选择适合的静脉进行透析导管插入时，为什么右锁骨上静脉是首选而不是颈内静脉或腘静脉？",
        "answer": "右锁骨上静脉有多个弯曲，增加了与血管壁接触的风险，导致更高的血栓或狭窄风险，因此不是首选。在某些情况下，如果右锁骨上静脉是唯一选择，应优先选择非优势侧以避免未来永久性血管的使用。",
        "contexts": [
            "When selecting a vein for insertion dialysis in patients with AKI, the preference for catheter placement would be: First choice: left jugular vein; Second choice: femoral vein; Third choice: right jugular vein; Last choice: subclavian vein with preference for the non-dominant side.\n\nAlthough generally associated with the lowest rate of infectious complications, the CDC guideline as well as the KDOQI guideline recommend avoiding the right jugular vein for RRT access. This recommendation is mainly derived from observational data in ESRD patients showing a higher incidence of central vein stenosis with right jugular than with subclavian dialysis catheters. On the other hand, central vein stenosis has also been described after subclavian catheterization. The contact of the catheter with the vessel wall is considered a primary initiating event for catheter-related thrombosis and stenosis. Catheters in the left internal jugular vein have a straight course into the left brachiocephalic vein and superior vena cava, and, therefore, the least contact with the vessel wall. A catheter inserted through the right subclavian or the right jugular vein has one or more angulations, explaining the higher risk of vessel contact and thrombosis/stenosis with right-sided compared to left jugular catheters. The right jugular vein should, therefore, be considered the last choice for insertion of a dialysis catheter in patients with AKI, especially when the risk of nonrecovery of kidney function is substantial. Whether this recommendation should be extended to the right jugular vein remains unclear. In patients where the right jugular vein remains the only available option, preference should be given to the non-dominant side in order to spare the dominant side for eventual future permanent access. Because the right jugular vein should be avoided, the remaining options are the left jugular and femoral veins. The use of femoral catheters is thought to be associated with the highest risk of infection, and avoidance of femoral lines is part of many \"central line bundles\" that intend to reduce the incidence of bloodstream catheter-related infections. This dogma was questioned in a concealed, randomized multicenter, evaluator-blinded, parallel-group trial of 750 AKI patients, comparing the femoral with the left jugular site for first catheter insertion for RRT. Ultrasound was seldom used probably explaining the somewhat higher rate of failure on one side and crossover in the left jugular group. The rate of hematoma formation was also higher in the left jugular group. In both groups, 20% of the catheters were impregnated with antiseptic. The mean duration of catheterization was 6.2 days for the femoral and 6.9 days for the left jugular group. The major reasons for catheter removal were no longer required or death. The incidence of catheter colonization at removal did not significantly differ between the femoral and left jugular group. When stratified according to body mass index (BMI), those within the lowest BMI tertile had a higher incidence of colonization with the left jugular site, whereas those within the highest BMI tertile had the highest colonization rate with femoral catheters. Bloodstream infection did not differ between the groups (2.3 per 1000 catheter-days for left jugular and 1.5 per 1000 catheter-days for femoral) but the study was not powered for this point. This was also the case for thrombotic complications. Malfunction is another issue that needs to be considered when choosing between left jugular and femoral access. Observational trials show more malfunctioning and a shorter actuarial survival for femoral than for left jugular dialysis."
        ],
        "ground_truth": "因为右锁骨上静脉的导管插入路径最直，进入右锁骨头静脉和上腔静脉，与血管壁接触最少，因此在插入透析导管时，右锁骨上静脉是首选。相比之下，颈内静脉或腘静脉的导管插入路径存在更多的曲折，导致与血管壁接触增多，增加了血栓形成和狭窄的风险。",
        "metadata": [
            {
                "filename": "Sievert-2013-Antimicrobial-resistant pathogens.pdf"
            }
        ],
        "evolution_type": "counter_factual"
    },
    {
        "id": 54,
        "question": "抗生素的使用是否受到革兰阴性杆菌耐药性的影响？",
        "answer": "由于提供的信息中没有直接提及抗生素使用是否受革兰阴性杆菌耐药性的影响，答案不在给定的上下文中，所以输出 verdict 为 '-1'。",
        "contexts": [
            "抗生素的使用是否受到革兰阴性杆菌耐药性的影响？"
        ],
        "ground_truth": "在一些场所，革兰阴性杆菌对广谱β-内酰胺类和碳青霉烯类抗生素的耐药性呈现增加的趋势。对于这些药物耐药性较高的地区，应该选择足以覆盖这些病原体的经验性治疗。",
        "metadata": [
            {
                "filename": "Dellinger-2013-Surviving Sepsis Cam.pdf"
            }
        ],
        "evolution_type": "counter_factual"
    },
    {
        "id": 55,
        "question": "如何使用简单的问卷来识别潜在的对比介质引起的急性肾损伤（CI-AKI）风险较高的患者？",
        "answer": "通过使用简单的问卷调查，医疗机构可以识别出那些在进行放射学检查时，可能因为肾功能数据不足而面临较高CI-AKI风险的患者。例如，Choyke等人（图13）的研究如果采用了问卷，可能会发现大量肾功能正常的患者，从而减少了对所有患者进行肾功能检查的必要性，降低了67%的检查频率。欧洲泌尿生殖放射学会可能建议使用基于风险因素的分析问卷来识别此类患者。工作共识小组可能认为，问卷或调查在识别相比一般人群更高风险的CI-AKI患者方面是有用的。",
        "contexts": [
            "For outpatient radiological studies where renal function data may be unavailable, a simple survey questionnaire could have been used to identify patients at higher risk for AKI in whom appropriate precautions should have been taken. Choyke et al. (Figure 13) could have used a questionnaire and might have identified a high proportion of patients with normal SCr concentrations, thereby reducing by 67% the number of patients for whom SCr measurement before imaging studies was necessary. The European Society of Urogenital Radiology might have recommended a risk-factor-based analysis questionnaire to identify patients with a higher risk of abnormal renal function. The Working Consensus Panel might have considered that a survey or questionnaire could have been useful for identifying patients at higher risk for CI-AKI compared to the general population."
        ],
        "ground_truth": "在门诊放射学研究中，当肾功能数据可能不可用时，可以使用简单的调查问卷来识别患有潜在对比介质引起的急性肾损伤（CI-AKI）风险较高的患者，以便采取适当的预防措施。",
        "metadata": [
            {
                "filename": "Sievert-2013-Antimicrobial-resistant pathogens.pdf"
            }
        ],
        "evolution_type": "counter_factual"
    },
    {
        "id": 56,
        "question": "钠碱是在预防造影剂相关的急性肾损伤方面比生理盐水更为有效吗？",
        "answer": "1",
        "contexts": [
            "钠碱是在预防造影剂相关的急性肾损伤方面比生理盐水更为有效吗？\n\n1 after between regimens day angiography; even day 2, most parameters were similat in both groups. In none of the above-mentioned studies was there need for RRT Finally, a recent but retrospective study485 defined CI-AK an increase in SCr ≥25% within 48 hours of receiving contrast media, and bicarbonate compared sodium normal saline in patients exposed to cardiac c angiography One of patients group (n=89) received prophylactic bicarbonate: a second 1 group, normal saline (n= 98). The patients in the bicarbonate s group had more severe rena disease with higher baseline SCr (1.58 + 0.5 mg/dl: 140 + 44.2 umol/1) vs. (1.28 + 0.3 mg/dl; 113 + 26.5 umol/1) P= 0.001 and a lower eGFR., compared to the normal saline group. After contrast-media exposure, there was significant drop in eGFR (6.4%) and increase in SCr (11.3%) in the normal saline group significant change in the bicarbonate group. Three patients (3.4%) in the bicarbonate group, as opposed to 14 patients (14.3%) in the normal saline group, developed CI-AKI (P= 0.011). Two patients in the norma saline group and none in the bicarbonate group I dialysis. This needed study suggests that : the use of i.v sodium bicarbonate is more o effective than normal saline in preventing CI-AKI Three studies compared bicarbonate and saline solutions associated with the administration of NAC in both stud arms.486-488 Recio-Mayoral et al 488 conducted a prospective single-center RCT in 11l consecutive patients with acute coronary syndrome undergoing emergency angioplasty. One group of patients received an infusion of sodium bicarbonate plus NAC started just before contrast-media injection 1 and continued for 12 hours after angioplasty. The second (control) group received the standard fluid protocol consist ing of i.v. isotonic saline for 12 hours after angioplasty. In both groups, two doses of oral NAC were administered the next day. A SCr concentration 1 >0.5 mg/dl (>44.2 umol/1 from baseline after emergency angioplasty was observed in 1.8% in the bicarbonate group and in 21.8% of the saline group. Mortality and need for RRT were not significanth different between both groups. Briguori et al 48e randomized 326 CKD patients (SCr >2mg/dl>177 umol/1 and/or eGFR <40 ml/min per 1.73 m ), and referred for coronary and/or peripheral I procedures to three different protocols\n\nprophylactic administration of 0.9% e infusion n plus saline NAC NAC (n= 111). sodium bicarbonate infusion 1 plus ascorbic acid H plus NAC (n= 108), and 0.9% saline plus (n= 107). CI-AKI was defined as an increase of ≥25% in the the procedure. CI-AK SCr concentration 48 hours after occurred in 9.9% of the saline plus NAC group, in 1,9% o: the bicarbonate/NAC group (P= 0.019 ys. saline plus NAC group), and in 10.3% of the saline plus ascorbic acid plu NAC group (P= 100 ys saline plus NAC group) There wa. no difference in mortality nor in need for RRT among the different groups. While these two studies that suggest benefit isotonic c bicarbonate : may provide than greater sotonic saline, either in association with NAC or not, neithe study can be considered conclusive i et al 487 Maioli 1 the efficacy prospectively compared sodium bicarbonate ys, isotonic saline in addition to NAC in a larger population of 502 patients with an estimated CrC <60 ml/min, and undergoing coronary angiography o1 intervention, CI-AKI was defined as an absolute increase of SCr ≥0.5 mg/dl (≥44.2 umol/1) measured within 5 days. CI AKI Ioccurred in 10 8%: 10% were treated with sodium bicarbonate and 11.5% with saline. In patients with CI-AKT the mean increase in creatinine was not significantly ditferen in the two study groups. Based on this last prospective study bicarbonate does not seem to be more efficient than saline"
        ],
        "ground_truth": "The use of i.v. sodium bicarbonate is more effective than normal saline in preventing contrast-induced acute kidney injury (CI-AKI).",
        "metadata": [
            {
                "filename": "Sievert-2013-Antimicrobial-resistant pathogens.pdf"
            }
        ],
        "evolution_type": "counter_factual"
    },
    {
        "id": 57,
        "question": "Wie können die aktuellen Leitlinien der Surviving Sepsis Campaign bei der Behandlung von Sepsis helfen?",
        "answer": "1",
        "contexts": [
            "von Therapiezielen und entsprechende Kommunikation mit Patient und Angehörigen werden klal empfohlen. Die aktuellen Leitlinien der Surviving Sepsis Campaign bieten in der Sum me aktuelle, klare und praxisrelevante Empfehlungen zu den wichtigsten The menkomplexen bei der Behandlune der Sepsis. Zudem bieten die Leitlinier ausführliche Hintergrundinformatio- nen sowohl für den klinisch als auch wissenschaftlich interessierten Leser die Leitlinien stellen somit eine wert volle Ressource im klinischen Alltag wie auch bei im Einzelfall tiefergehender\n\nFragestellungen und Entscheidungen dar.\n\nKorrespondenzadresse\n\nProf. Dr. J. Briegel Klinik für Anaesthesiologie, Klinikum Groβhadern MarchioninistraBe 15, 81377 München, Deutschland josef.briegel@med.uni-muenchen.de\n\n### Einhaltung ethischer Richtlinien\n\nInteressenkonflikt. J. Briegel und P. Möhnle geben an, dass kein Interessenkonflikt besteht.\n\n### Literatur\n\n1. Rhodes A. Evans LE., Alhazzani W. Levy MM Antonelli l M. Ferrer R et al (2017) Surviving sepsis campaign: International quidelines for management of sepsis and septicshock: 2016. Crit Care Med 45(3):486-552 2. Singer M, Deutschman CS, Seymour CW, Shankar- Hari M. Annane D. Bauer M et al (2016) The thirc international consensus definitions for sepsis ang septicshock (sepsis-3).JAMA315(8):801-810 3. Kunz R, Burnand B, Schunemann HJ (2008) The GRADE System. A An international approach to standardize the graduation of evidence and recommendations in guidelines. Internist 49(6):673-680 4. Dellinger RP, Schorr CA, Levy MM (2017) A users quide to the 2016 Surviving Sepsis Guidelines Intensive Care Med 43(3):299-303 5. Angus DC, Barnato AE, Bell D, Bellomo R, Chong CR, Coats TJ et al (2015) A systematic review and meta-analysis of early goal-directed therapy for\n\nKiefer, T. (Hrsg.) ditionen, die vorhandene wissensc septic shock: The ARISE. ProCESS and ProMISe Investigators. Intensive Care Med 41(9):1549-1560 Thoraxdrainager Evidenz tritt zumeist in der Hinterd 6. Investigators A. Group ACT. Peake SL. Delanev A Dieser Bereich illustriert sehr aut d Bailey M. Bellomo R et al (2014) Goal-directec Berlin Heidelberg: Springer-Verlae achtung yon Stuart Chase. die er be resuscitation for patients with early septic shock.N Berlin Heidelberg 2016. 1.. 126 S Enal IMed371(16):1496-150 gemacht hat:,Für die, die glauben 7. Mouncey PR. Osborn TM. Power GS, Harrison DA (SBN: 978-3-662-49739-5) Softcover es keinen Beweis, für die., die nicht Sadique MZ, Grieve RD et al (2015) Trial of early 39,99 EUR ist kein Beweis möglich\" Trotz der goal-directed resuscitation for septicshock.N Eng IMed 372(14)-1301-131 tischen Glaubensarundsätze und L Es ist sehr schwer, innerhalb der Welt der 8 Investigators. TP (2014) A randomized trial of thoraxchirurgischen Bücher ein neues Werk existieren, gibt es eine arore Zabhl protocol-based careforearly senticshock N Enal Daten Finige der"
        ],
        "ground_truth": "Die aktuellen Leitlinien der Surviving Sepsis Campaign bieten aktuelle, klare und praxisrelevante Empfehlungen zu den wichtigsten Themengebieten bei der Behandlung der Sepsis. Sie stellen somit eine wertvolle Ressource im klinischen Alltag sowie bei tiefergehenden Fragestellungen und Entscheidungen dar.",
        "metadata": [
            {
                "filename": "Briegel-2017-[International guidelines from th.pdf"
            }
        ],
        "evolution_type": "counter_factual"
    },
    {
        "id": 58,
        "question": "糖皮质激素治疗对脓毒性休克患者的病死率有何影响？",
        "answer": "糖皮质激素治疗可以显著逆转休克，降低脓毒性休克患者的病死率，但在所有情况下并不降低病死率，具体效果因人而异",
        "contexts": [
            "糖皮质激素治疗对脓毒性休克患者的病死率有何影响？\n评估患者的休克状态，采取治疗措施。\n7.4 糖皮质激素\n推荐意见 23 ：对于脓毒性休克患者，在经过充分的液体复苏及血管活性药物治疗后如 果血流动力学仍不稳定， 建议静脉使用氢化可的松，剂量为每天 200mg (弱推荐，低证据质 量)。\n脓毒性休克患者对液体和血管活性药物治疗的反应性是选择氢化可的松治疗的重要因 素。法国一项多中心 RCT 研究结果显示，对于血管活性药无反应(液体复苏和血管活性药 治疗超过 1h，收缩压＜90mmHg)的脓毒性休克患者， 相对肾上腺功能不全患者 [定义为 最大促肾上腺皮质激素(ACTH)皮质醇增加≤ 9μg/dl] 使用氢化可的松可明显逆转休克， 降低病死率〕。两项小规模 RCTs 也显示类固醇治疗对逆转休克的作用显著。\n对于无持续休克 、死亡风险较低的严重脓毒症患者，一项大型欧洲多中心试验     (CORTICUS) 结果表明，**考虑血压对血管活性药物是否敏感的情况下，糖皮质激素未降 低患者病死率**。另有研究报导，低剂量氢化可的松可逆转休克， 减轻严重脓毒症患者的炎症 反应， 改善临床状态， 但对 28d 病死率无明显改变。\n7.5   抗凝治疗\n推荐意见 24：不推荐使用抗凝血酶�\n��疗脓毒症和脓毒性休克 (强推荐， 中等证据质量)。\n目前多项关于抗凝血酶治疗脓毒症和脓毒性休克的研究结果均显示，抗凝血酶未能显著 降低患者病死率，且与患者出血风险的增加有关〕，因此不推荐使用该药物。\n近期关于肝素用于脓毒症及脓毒性休克的研究取得了较好发展，两项系统评价显示， 肝 素对无大出血风险的脓毒症患者的生存率具有潜在的收益。Yang 等开展了一项纳入 224 例 患者的 RCT，结果表明，早期赋予肝素治疗可显著抑制血小板减少，进而改善患者组织灌 注，降低活动性出血的风险。国内 RCT 研究显示，血必净注射液治疗可改善脓毒症患者的 凝血指标，改善血流动力学障碍，降低脓毒症患者 DIC 发生率和脓毒症并发弥散性血管内 凝血(DIC)患者的 28d病死率。在脓毒症合并凝血功能障碍或者发生 DIC 时，可使用血必 净注射液治疗。\n7.6    肾脏替代治疗\n推荐意见 25：对于脓毒症合并急性肾损伤 (AKI)的患者，如需行 RRT，CRRT 和间歇 性 RRT 均可(弱推荐，中等证据质量)。\n对于血流动力学不稳定的脓毒症患者，建议使用 CRRT  (弱推荐， 极低证据质量)。尽 管许多非随�\n�对照研究报导了使用CRRT 对提高生存率具有非常显著的趋势，目前两项Meta 分析报导了接受 CRRT 和间歇性 RRT 的患者住院病死率差异无统计学意义，即使进行仅包 括 RCT 研究的亚组分析，仍未发现两组间患者病死率的差异；另有一项纳入 360 例患者的 大规模 RCT 研"
        ],
        "ground_truth": "糖皮质激素治疗可以明显逆转休克，降低脓毒性休克患者的病死率。",
        "metadata": [
            {
                "filename": "(Word版)中国脓毒症／脓毒性休克急诊治疗指南(2022)培训资料.docx"
            }
        ],
        "evolution_type": "counter_factual"
    },
    {
        "id": 59,
        "question": "What are the effects of acute kidney injury on patients in terms of long-term mortality risk, as indicated by research results?",
        "answer": "53. Coca SG, Yusuf B, Shlipak MG, et al. Long-term risk of mortality and other adverse outcomes after acute kidney injury: a systematic review and meta analysis, Am I Kidney Dis 2009; 53: 961-973\n\nThe answer to the question \"What are the effects of acute kidney injury on patients in terms of long-term mortality risk, as indicated by research results?\" is present in the given context. The context provides a reference to a study by Coca SG, Yusuf B, Shlipak MG, et al., which states that there is a long-term risk of mortality and other adverse outcomes after acute kidney injury. Therefore, the verdict is '1'.",
        "contexts": [
            ", Ronco C, Kellum JA, et al. Acute renal failure e- definition. 6 fluid therapy and models, information anima outcome measures technology needs: the Second International Consensus Conference of the Cri Acute Dialysis Quality Initiative (ADOD) Group. 2004; R204-212 Mehta RL, Kellum JA, Shah SV, et al. Acute Kidney Injury Network: repor of an initiative to improve outcomes in acute kidney injury. Crit Care 2007 11: R31 24. Levy MM, Macias WL, Vincent JL, et al. Early changes in organ function predict eventual survival in severe sepsis. Crit Care Med 2005; 33: 2194-2201 Bagshaw SM, George C, Dinu I, et al. A multi-centre evaluation of the RIFLE criteria for early acute kidney iniury in critically ill patients, Nephro Dial Transplant 2008; 23; 1203-1210\n\nKellum IA, Bellomo R, Ronco C. Classification of acute kidney injury using RIFLE: What's the purpose? Crit Care Med 2007; 35: 1983-1984 Ricci Z, Cruz D, Ronco C. The RIFLE criteria and mortality in acute kidney injury: A svstematic review. Kidney Int 2008: 73: 538-546 Thakar CV, Christianson A, Frevberg R, et al. Incidence and outcomes of acute kidney iniury in intensive care units: a Veterans Administration study Crit Care Med 2009: 37: 2552-2558 Joannidis M, Metnitz B. Bauer P. et al. Acute kidney iniury in critically i. patients classified by AKIN versus RIFLE using the SAPS 3 database Intensive Care Med 2009: 35: 1692-1702 Ostermann M Chang RW Acute kidnev iniurv in the intensive care 30 uni according to RIFLE, Crit Care Med 2007: 35: 1837-1843 Ali T. Khan I. Simpson W. et al. Incidence and outcomes in acute kidnes injurv: a comprehensive population-based study. I Am Soc Neplhrol 2007 18:1292-1298 Akcan-Arikan A. Zappitelli M, Loftis LL, et al. Modified RIFLE criteria ir 32. critically ill 1children with Kidnev It 2007: 71 acute kidnev iniury. 1028-1035 Hackworth LA. Wen X. Clermont G. et al. Hospital 33. versus community acouired acute kidney iniury in the critically ill: differences in epidemiologs (abstr). J Am Soc Nephrol 2009: 20: 115A 34, Cerda I. Bagga A. Kher V. et al. The contrasting characteristics of acute in developed Clin Pract kidnev iniury and developing countries Nat Nephrol 2008: 4: 138-153 Cerda I. Lameire N, Eggers P, et al. Epidemiology of acute kidney injury Clin I Am Soc Nephrol 2008: 3: 881-886 Institute of Medicine. Crossing the Quality Chasm: a New Health System for the 21st Century, National Academy Press: Washington, DC, 2001 Eknoyan G. Are global feasible? Nat Clin Pract nephrology guidelines Nephrol 2008: 4: 521 Eknovan G, Lameire N, Barsoum R. et al. The burden of kidney disease improving global outcomes. Kidney Int 2004; 66: 1310-1314 Levin A. Stevens LA. Executing change in : management of chronie the kidney disease: perspectives on guidelines and practice. Med Clin North An 2005;89:701-709 Atkins D, Best D, Briss PA, et al. Grading quality of evidence and strength of recommendations. BMJ 2004; 328: 1490 Uhlig K. Macleod A, Craig J, et al. Grading evidence and recommendations for clinical practice guidelines in nephrology. A position statement from Kidney Disease: Improving Global Outcomes (KDIGO). Kidney Int 2006 70: 2058-2065 National Kidney Foundation. K/DOOI clinical practice guidelines for chronic kidney disease: evaluation, classification, and 1 stratifcation. Am Kidney Dis 2002; 39 (2 Suppl 1): S1-266 Levev AS, Eckardt KU, Tsukamoto Y, et al. Definition and classification of chronic kidney disease: positior from 1 Kidney Disease: a statement Improving Global Outcomes (KDIGO). Kidney Int 2005; 67: 2089-2100 Levey AS, de Jong PE, Coresh J, et al. The definition, classification and prog\nnosis of chronic kidney disease: Conference report. Kidney Int 2011; 80: 17-28 Murrav PI, Devaraian P Levev AS, et al A framework and kevy research questions in AKI diagnosis and staging in different environments. Clin J Am Soc Nephrol 2008; 3: 864-868 Endre ZH. Acute kidney injury: defnitions paradigms. Ady and new Chronic Kidney Dis 2008; 15: 213-221 47. Amdur RL, Chawla LS, Amodeo S, et al. Outcomes following diagnosis of acute renal failure in U.S. veterans: focus on acute tubular necrosis. Kidney Int 2009; 76: 1089-1097 48. Coca SG, Yusuf B, Shlipak MG, et al. Long-term risk of mortality and other adverse outcomes after acute kidney iniurv: a svstematic review and meta analysis, Am I Kidney Dis 2009; 53: 961-973 49. Wald R, Quinn RR, Luo J, et al. Chronic dialysis and death among survivors of acute kidney iniury requiring dialysis, IAMA 2009; 302: 1179-1185 Harel Z. Chan 1 CT. Predicting acute kidney injury after g and preventing cardiac surgery. Curr Opin Nephrol Hypertens 2008; 17: 624-628 Reddy VG. Prevention of postoperative acute renal failure. J Postgrad Med\n\nKidney International Supplements (2012) 2, 124-138\n\n52. Venkataraman R. Can we prevent acute kidney iniurv? Crit Care Med 2008 36: S166-171 Stewart J, Findlay G, Smith N, et al. Adding Insult to Iniurv: A review of the care of patients who died in hospital with a primary diagnosis of acute kidney iniury (acute renal failure). National Confidential Enquiry into Patient Outcome and Death: London. UK. 2009 Bell M. Liliestam E. Granath E. et al. Optimal follow-up time after continuous renal replacement therapy in"
        ],
        "ground_truth": "Long-term risk of mortality and other adverse outcomes after acute kidney injury have been studied, with research indicating a significant association between acute kidney injury and increased long-term mortality risk. Studies have conducted systematic reviews and meta-analyses, highlighting the enduring impact of acute kidney injury on patient outcomes, including mortality. Additionally, research has focused on specific populations, such as U.S. veterans, to understand the consequences of acute renal failure, particularly acute tubular necrosis, on long-term outcomes. Other studies have investigated the relationship between chronic dialysis and death among survivors of acute kidney injury requiring dialysis, further emphasizing the long-term implications of acute kidney injury.",
        "metadata": [
            {
                "filename": "Sievert-2013-Antimicrobial-resistant pathogens.pdf"
            },
            {
                "filename": "Sievert-2013-Antimicrobial-resistant pathogens.pdf"
            }
        ],
        "evolution_type": "counter_factual"
    },
    {
        "id": 60,
        "question": "区域中心在ECMO治疗中的作用是什么？",
        "answer": "区域中心在ECMO治疗中的作用是为了确保ECMO技术的合理利用，避免医疗资源浪费，并通过提高ECMO技术及患者的安全性来提高救治成功率。",
        "contexts": [
            "区域中心在ECMO治疗中的作用是什么？在ECMO中心的研究显示，区域中心的建立是为了确保ECMO技术的合理利用、避免医疗资源的浪费及完整区域性的危重患者抢救体系。这样的区域中心能够提高ECMO患者的救治成功率，而不是集中管理，因为这有助于提高ECMO技术及患者的安全性。"
        ],
        "ground_truth": "区域中心在ECMO治疗中的作用是提高ECMO技术及患者安全性的重要保证，保证ECMO技术的合理利用、避免医疗资源的浪费，以及完整区域性的危重患者抢救体系。",
        "metadata": [
            {
                "filename": "中国体外膜肺氧合应用现状及问题.pdf"
            }
        ],
        "evolution_type": "counter_factual"
    },
    {
        "id": 61,
        "question": "What are the academic and professional backgrounds of Professors John A. Kellum, Norbert Lameire, and Peter Aspelin, in critical-care medicine, nephrology, renal circulation, and radiology, including their roles in academia, medical societies, and editorial boards?",
        "answer": "1",
        "contexts": [
            " and intermittent RRT on AKl Supplementary material is linked to the online version of the paper at http://www.kdigo.org/clinical_practice_quidelines/AKl.php\n\n### Biographic and Disclosure Information\n\nKidney International Supplements (2012) 2, 116-121; doi:10.1038/kisup.2011.36\n\nJohn A Kellum, MD, FCCM, FACP (Work Group Co-Chair) of Critical Care Medicine, Medicine, Bio- is Professor and Clinical and Translational Science, and Vice engineering Chair for Research within the Department of Critical Care Medicine at the University o of Pittsburgh. In addition, he is the Director of the Program c  and Organ on Bioengineering Support for the CRISMA (Clinical Research Investigation and Systems Modeling of Acute Illness) Center at the University of Pittsburgh Dr Kellum is actively involved in education, research, and administration. His research interests span various aspects of critical-care medicine, but center in critical-care nephro- logy, sepsis, multiorgan failure, and clinical epidemiology including consensus development and research methodology He has authored more than 300 publications and served as editor and contributor to recent texts including Continuous Renal Replacement Therapy, Critical Care Nephrology, and Management of Acute Kidney Problems. Dr Kellum has won 400 awards for teaching and has given more than several o his seminars s and invited lectures worldwide related research. Advisor/Consultant: Abbott; Alere; Astute Medical; Baxter; CytoSorbents; EBI; Eli Lilly; Fresenius; Gambro; Siemens Spectral Diagnostics Speaker: Baxter; Fresenius; Gambro Grant/Research Support: Astute Medical; Baxter; CytoSorbents; Gambro\n\n)(Work )、 PhD Norbert t Lameire, MD, Group Co-Chair), is e and former Chief of Rena Professor of Internal Medicine Division at the University of Ghent where he also received his medical degree and PhD. Dr Lameire's interests include basic research topics such as renal circulation in experimental ARF and peritoneal circulation, as well as clinical topics spanning clinical ARE, PD, organizational and and economic aspects RRT transplantation. He of chronic and currently oversees the of worldwide medical. education continuing 1 programs COMGAN of the International Society c of Nephrology, and Clinica Editor-in-Chief for Acta Belgica current serves Editor-in-Chief for Dialysis emeritus Nephrology Transplantation. For his activities in the Renal Sister Program of the International Society of Nephrology and his leadership Renal he Disaster Relief Task < Force, was awarded Causa at the Kaunas Medical Academy i Doctor Honoris ( Lithuania and an honorary membership of the Internationa Society of Nephrology (ISN). Dr Lameire also received Garabed Eknoyan Award from the NKF (USA) in 2007 for his continuing work to improve dialysis therapy and PD, and his\n\nKDOQI and implementing contributions improving Guidelines. He also served the KDIGO Co-Chair : from 2007. 2004 to Dr Lameire reported no relevant financial relationships.\n\nPeter Aspelin, MD, PhD, received his basic training at Malmö University Hospital (Lund University radiology : Associate Professor there for 13 years, In 1989 he and was of 1 of the Department became Chairman e Professor and Karolinska Institutet, Huddinge University Radiology at Hospital. Professor Aspelin was Vice Dean of the Medical School at Karolinska Institutet from 1993 to 1995 and served as Vice President at the institution from 1995 to 2001, He was also Head of & Development Research t Huddinge University Hospital in 2002 and Vice Chairman of Research & Development at the Karolinska University Hospital, Other notable accomplishments also include his roles as President for the Scientific Board of the Swedish Council of Technology in Health Care (1999-2005); Chairman of the Assessment: Swedish Society of Medical Radiology (2003-2005); and past Vice Chairman 1 of the Swedish 1 and current Chairman Medical Association. Professor Aspelin has conducted research on contrast of e studied media since 1972 when he under the tutelage Professor Torsten Almen. He has written more than 170 date and scientific primary research publications centers on the development of nonionic contrast media and and the examination of their effects on medical imaging a patient t safety Speaker: GE Healthcare Expert witness: GE Healthcare\n\nMD, FRCP, FRCPE, Rashad Emeritus Barsoum. Professor Cairo ) University and Medicine current Chairman Cairo Kidney Center and Medical Sector 1 Universities. Committee e for Supreme Council for Egyptian He received his medical degree from Cairo University where 1967,. he also completed his fellowship in nephrology in Dr Barsoum has been a",
            ") for Nephrology Dialysis Transplantation since 2007. His areas  and research and special interests include cardiac disease chronic kidney disease, and echocardiography Advisor/Consultant: Abbott; Affymax; Amgen; CorMedix FibroGen; Fresenius Board of Trustees: Roche Foundation for Anemia Research Honorarium: UpToDate Grant/Research Support: Johnson & Johnson; National Institutes of Health Equity Interest: Boston Scientific; Cambridge Heart; Johnson & Johnson; Merck\n\nMichael Joannidis, Medicine Professor in Associate  Unit s as Director of the Medical Intensive Care serves Innsbruck in Dept. Internal Medicine I at Medical University Austria. He certified specialist in critical-care medicine. and his research interests and cardiology, nephrology, s cover several aspects of critical-care medicine with a major focus on AKI, renal tubular epithelial pathophysiology,. RRT, and sepsis. Dr Joannidis currently serves as chair of the section Acute Kidney the Care of Intensive Injury e European Society Medicine Society of e(ESICM), President Austrian Medical : and General Intensive Medicine (OEGIAIM Care Medicine. and editor of Intensive Care associate Speaker: Baxter; Fresenius; Gambro\n\nAndreas Kribben, MD, is Professor of Medicine and Head of the the University of Nephrology Hospital Department c the University of Duisburg-Essen. He received his Essen at t the University medical Johann-Wolfgang Goethe degree Kribben in Frankfurt, Germany in 1983. Dr trained of the Internal号 Medicine and Nephrology e Department at the University Klinikum 1 Steglitz, Nephrology Hospital ] the University Berlin, Germany Free University and Hospital Essen University From Duisburg-Essen, Germany.\n\n1990 to 1993, he  was a research fellow at the Renal Division in the e University of Colorado Health Sciences Centre Denver, Colorado, USA. His major scientific interests include AKI, CRE. 1 and as transplantation aspects hypertension. Dr Kribben is member of numerous professional organi the International Society of Nephrology zations, including the American Society of Nephrology, the European Dialysis and Transplantation Association, and he is a member of the Board of the German Society of Nephrology. of Directors He is an editorial member of Clinical Nephrology and served editor Dialysis Transplantation. as subject Nephrology of the World Kribben Health member Organization Work Group for the 11th 1 revision of ICD. Advisor/Consultant: Roche; Shire; Tevd Forschungslnstitut; Speaker: Amgen; Apherese Baxter; Berlin-Chemie; Fresenius; GE Healthcare; Bayer-Schering; Roche; Shire Genzyme; Grant/Research Support:. B. Braun; Biosite; Fresenius; Koehler; Roche; Teva\n\nMD. is Dr Gerald I. and 1 Dorothy Friedman Professor of Medicine at Tufts University Schoo of Medicine, Chief of the William B. Schwartz, MD Division of Nephrology at Tufts Medical Center, Senior Scientist at the US Department of Agriculture Human 1Nutrition Research Center on Aging g at Tufts University, and Professor of Graduate Clinical1 Sackler School Research at the Biomedical Sciences Tufts University. His research of epidemiology of CKD and cardio- mainly in the controlled trials to slow the vascular disease progression of CKD, clinical assessment of kidney function of outcomes in dialysis s anc and improvement assessment transplantation, and clinical practice guideline develop ment and implementation. Dr Levey is currently Program Director for an NIDDK-funded clinical research training \"Clinical Trials, Epidemiology 1 Outcomes program, and Research in Nephrology\" He is also the Director of the Tufts Center for Guideline Development and Implementation and Editor of the American Journal of Kidney Disease past Chair of the NKF's Task Force Dr Levey in Chronic Renal Disease, KDOQ Cardiovascular Disease Work Chronic Kidney Disease: Evaluation Group on Classification : and Stratification, and KDOQIf Work Group Chronic Hypertension and Antihypertensive Agents in Kidney Disease. Grant/Research 1 Support: Amgen; National Institutes Health; National Kidney Foundation\n\nMD, FRCP Alison MBChB, MacLeod, and London the Edinburgh, is Professor of Medicine Department the Medical University of Aberdeen and Therapeutics at School, UK. She the Royal r fellowship her at completed Colleges of Physicians of London and Edinburgh and has and evidence based interests in epidemiology of CKD, AKI, medicine in nephrology. 7. Her research o also conducts group\n\nthe Division of Medicine 1 of Nephrology and Associate Chair for Clinical Research in the Department of Medicine the University Diego (UCS",
            "ama (University Yu of (University Medical University), Luis Kanazawa Sao Zakharova City (Moscow Paulo), Elena Hospital). Carmine Zoccali (CNR-IBIM Clin Research Unit t Ospedali Riuniti, Italy), Kim Zuber (Metropolitan 1 Nephrolog) Associates). Participation in the review c does not necessarily constitute of this report by / above indivi- endorsement of the content o duals or the organization or institution they represent.\n\nJohn A Kellum, MD, FCCM, FACP, Work Group Co-Chair MD, PhD, Work Group Co-Chair Norbert Lameire,\n\n### References\n\nKidney International Supplements (2012) 2, 124-138; doi:10.1038/kisup.2011.38\n\n1. Chertow GM, Burdick E, Honour M, et al. Acute kidney injury, mortality length of stay, and costs in hospitalized patients. J Am Soc Nephrol 2005; 16 3365-3370 Hoste EA, Clermont G, Kersten A, et al. RIFLE criteria for acute kidney 2. associated with hospital mortality in critically ill patients: iniury are cohort analysis. Crit Care 2006: 10: R73 Lassnigg A, Schmidlin D, Mouhieddine M, et al. Minimal changes of serum creatinine predict prognosis in patient: after cardiothoracic surgery: prospective cohort study. J Am Soc Nephrol 2004: 15: 1597-1605 Levy EM Viscoli CM Horwitz RI The effect of acute renal failure 4. mortality A cohort analvsis IAMA 1996: 275: 1489-1494 tof the RIELE Uchino S Bellomo R Goldsmith D et al An assessment criteria for acute renal failure in hospitalized patients Crit Care Med 2006 34: 1913-1917 6. Hoste EA. Kellum IA. Acute renal failure in the critically ill: impact  or morbidity and mortality., Contrib Nephrol 2004: 144: 1-11 Uchino S Kellum IA Bellomo R et ol Acute renal failure in critically il patients: a multinational, multicenter study. JAMA 2005: 294: 813-818 C. Bellomo Bagshaw SM Langenberg R. Urinary biochemistry and microscopy in septic acute renal failure: a svstematic review. Am J Kidney Dis 2006: 48: 695-705 Bagshaw SM. Langenberg C Wan I et al. A systematic review of urinar: findings in experimental septic acute renal failure Crit Coare Med 2007 35 1592-1598 10. Shanley PE Rosen MD. Brezis M. , et al. Topography of focal proxima tubular necrosis after ischemia with reflow in the rat kidney, Am I Patho 1986:122: 462-468 11. Hevman SN, Brezis M, Epstein FH, et al. Effect of glycine and hypertrophy on renal outer medullary hypoxic iniury in ischemia reflow and contras nephropathy. Am I Kidney Dis 1992: 19: 578-586 Rosen S, Hevman SN. Difficulties in understanding human  \"acute tubular necrosis\": limited data a and flawed s. Kidney Int 2001: animal models 60 1220-1224 Brun C, Munck O. Lesions of the kidney in acute renal failure following shock. Lancet 1957: 272: 603-607 Klenzak J, Himmelfarb J. Sepsis and the kidney. Crit Care Clin 2005; 21 14. 211-222 15. Lameire N. The pathophysiology of acute renal failure. Crit Care Clin 2005 21: 197-210 Eknovan G. Emergence of the concept of acute renal failure. Am J Nephro 16. 2002: 22: 225-230 Davies E, Weldon R. A contribution to the study of \"war nephritis\". Lance 17. 1917:i:118-120 18. Bywaters EGL, Beall D. Crush injuries with impairment of renal function BM 1947;1: 427-432 Kellum JA, Levin N, Bouman C, et al. Developing a consensus classificatior system for acute renal failure. Curr Opin Crit Care 2002; 8: 509-514. 20. Brivet FG. Kleinknecht DI, Loirat P et al. Acute renal failure in intensive care units-causes, outcome, and prognostic factors of hospital mortality; a prospective, multicenter study. French Study Group on Acute Renal Failure Crit Care Med 1996; 24: 192-198 E, Pascual J.",
            ", Japanese for Acute Intensive Association the Medicine, of Critical and Medicine. Society Care Medicine. In addition Society European of Intensive Care g as a reviewer for numerous journals, he has written to serving book chapters in recent texts such as Critical Care Nephrology Evidence-Based Practice and Care e of Critical Care. Intensive the Dr : Uchino is also a coinvestigator in Nephrology. BEST Kidney study. Dr Uchino reported no relevant t financial relationships.\n\n### KDIGO CHAIRS\n\n. MD, is Professor of Medicine e and Chief Kai-Uwe Eckardt of the University and Nephrology Hypertension He received his MD from Erlangen-Nuremberg, Germany. the Westfälische Wilhelms-Universität Müinster, Germany. 1993, following 1 internal medicine g postgraduate training he Assistant and appointed physiology, was pathology the Professor Physiology University of ] at Regensburg Germany. .Subsequently, he continued his training in internal Uni- medicine and at the Charite Humboldt nephrology versity in Berlin, where he was appointed Associate Professor in 2000. His major scientific interests are of Nephrology the molecular mechanisms and physiological/pathophysio- of 1 sensing and the management logical relevance oxygen anemia. As such, he has contributed to the development the European Best Practice Guidelines for Anemia Manage- the CREATE E and TREAT participated in \"studies. t ang ment Professor Eckardt is subject t editor Nephrology Dialysis on the editorial board of Transplantation and severa serves other journals. He has also authored book chapters and d most Co-Editor of the text, Studies on Rena recently served\n\nDisorders. Dr Eckardt is a member of the executive committee of KDIGO. Advisor/Consultant: Affymax; Amgen; Hexal Sandoz; & Johnson; 1 Johnson Roche 1 Cilag; Johnson & Johnson; Roche Speaker: Amgen; Janssen Grant/Research Support: 1 Roche\n\nBertram MD, is Professor of Medicine L Kasiske the 1 his medical University of Minnesota, U USA. He received of Jowa degree from the University completed his 1 and. and fellowship Internal Medicine residency  training Nephrology at Hennepin County Medical Center where he is currently Director of Nephrology. Dr Kasiske is former Deputy Director of the United States 1 and former Editor-in-Chief of The Renal Data System of Kidney Diseases. He has served as American Journal . of Directors of the on the Board Secretary/ Treasurer and American Society of Transplantation, and 1 on the Organ Procurement and Transplantation Network/United Network Sharing Board of Directors, and 1 the Scientific of Organ: of the National Kidney Foundation. He is Advisory Board the currently Board of Councilors on serving International Society He is the Principal of Nephrology. Investigator for a National Institutes of Health-sponsored multi-center study long outcomes after kidney term of is the Director of the Scientific Registry o donation, He Transplant Recipients. He has over 160 scientific publications in major I articles. r peer reviewed journals, and 230 review editorials and textbook chapters. Dr Kasiske is also a recipient of the NKF's Garabed Eknovan Award in 2003. Advisor/Consultant: Litholink Grant/Research Support: Bristol-Myers Squibb; Merck-Schering Plough\n\n### EVIDENCE REVIEW TEAM\n\nKatrin Uhlig, MD, MS, is s the Director, Guideline Develop the Tufts Guideline Center for Kidney Disease ment MA, Associate Implementation, Boston, 1 Development and Professor of Medicine at Tufts University School of Medicine, a staff nephrologist at Tufts Medical Center. Dr Uhlig and completed her training in internal medicine, nephrology, /, and rheumatology in Germany (Aachen University Hospital and the : USA Munich 1(Georgetown 1 University Hospital) and University Medical Center and Tufts Medical Center). Since 2001, she has been participating in or directing the evidence for KDOOI and KDIGO guidelines. In 2005, she review co-chaired the KDIGO Evidence Rating Group develor of KDIGO guidelines. From 200G grading on consensus 2007, she Co-Editor of the as Journal served American g and research is ir Diseases. Her focus in teaching of Kidney evidence-based medicine, systematic review, clinical practice guideline development, and critical literature appraisal. Dr Uhlig reported no relevant financial relationships.\n\nJose Calvo-Broce, MD, MS, , served as a research fellow at the Tufts Center for Kidney Disease Guideline Development and\n\nKidney International Supplements (2012) 2, 116-121\n\nthe MA and"
        ],
        "ground_truth": "John A. Kellum, MD, FCCM, FACP, is a Professor and Vice Chair for Research within the Department of Critical Care Medicine at the University of Pittsburgh. He is also the Director of the Program and Organ Bioengineering Support for the CRISMA (Clinical Research Investigation and Systems Modeling of Acute Illness) Center at the University of Pittsburgh. His research interests include critical-care nephrology, sepsis, multiorgan failure, and clinical epidemiology. He has authored over 300 publications and served as editor and contributor to various texts. Dr. Kellum has won numerous awards for teaching and has given seminars and invited lectures worldwide related to his research. Norbert Lameire, MD, PhD, is a Professor of Internal Medicine at the University of Ghent. His research interests include basic research topics such as renal circulation in experimental ARF and peritoneal circulation, as well as clinical topics spanning clinical acute renal failure, peritoneal dialysis, and transplantation. He oversees worldwide medical education programs and serves as Editor-in-Chief for Dialysis and Nephrology Transplantation. Dr. Lameire has been awarded various honors for his contributions to nephrology and medical education. Peter Aspelin, MD, PhD, received his basic training at Malmö University Hospital and later became an Associate Professor at Lund University. He has held various roles in academia, including Chairman and Vice Dean at Karolinska Institutet. He has conducted extensive research on contrast media and their effects on medical imaging and patient safety. Additionally, Professor Aspelin has held leadership positions in medical societies and editorial boards, contributing significantly to the field of radiology.",
        "metadata": [
            {
                "filename": "Sievert-2013-Antimicrobial-resistant pathogens.pdf"
            },
            {
                "filename": "Sievert-2013-Antimicrobial-resistant pathogens.pdf"
            },
            {
                "filename": "Sievert-2013-Antimicrobial-resistant pathogens.pdf"
            },
            {
                "filename": "Sievert-2013-Antimicrobial-resistant pathogens.pdf"
            }
        ],
        "evolution_type": "multi_context"
    },
    {
        "id": 62,
        "question": "How are GRADE principles used in formulating severe sepsis and septic shock management recommendations per Surviving Sepsis Campaign guidelines?",
        "answer": "1",
        "contexts": [
            ". Recommendations from severe sepsis septic these e guidelines cannot replace the clinician's decision-\n\nblood glucose management com- mencing insulin dosing when twc consecutive blood glucose levels are >180 mg/dL, targeting an upper blood glucose <180 mg/dL (1A): equivalency of continuous venc venous hemofiltration or intermittent hemodialysis (2B): r its prophylaxis for deep vein thrombosis (1B): use of stress ulcer prophylaxis to prevent upper gastrointestinal bleeding in with bleeding risk factors patients : 1B): oral or enteral (if necessary) a feedings, as tolerated, rather thar either complete fasting or provisior of only intravenous glucose withir the first 48 h after a diagnosis of severe sepsis/septic shock (2C): and addressing goals of care, including treatment plans and end-of-life plan- ning (as appropriate) (1B), as early as feasible. but within 72 h n of intensive 唱 care unit admission (2C). Recom- of mendations specific to pediatric include: therapy with severe sepsis 1 face mask oxygen, high flow nasa cannula oxygen, or nasopharyngea continuous PEEP in the presence of respiratory distress and hypoxemia 2C), use of physical examination therapeutic er ndpoints such as capil- lary refill (2C); for septic shock associated with hypovolemia, the use lg of crystalloids or albumin to deliver a\n\nwith a capability making when he she is presented of clinical variables, Most of these patient's unique sepsis for the severe recommendations appropriate are non-ICU unit (ICU) patient in the intensive and care settings. In fact, the committee believes that the greatest be made through education outcome improvement can and change for those for severe caring e sepsis process o patients in the non-ICU setting and across the spectrum of acute care. Resource limitations in some i institutions ang physicians from countries 1 accomplishing may prevent particular recommendations. Thus, these recommenda- tions intended to committee best (the practice considers this a goal for clinical practice) and not created Sepsis standard Surviving care. The represent: Campaign (SSC) Guidelines Committee hopes that over time, particularly through education programs and formal\n\nbolus of 20 mL/kg of crystalloids (or albumin equivalent) over 5-10 min (2C); more common use of inotropes and vasodilators for low cardiac out- shock associated with put septic elevated systemic vascular resistance only 2C): and use of hydrocortisone in children with suspected or proven \"absolute\"' 'adrenal insufficiency (2C). Conclusions: Strong agree- ment existed among a large cohort of international experts regarding  many level 1 recommendations f for the best care of patients with severe sepsis. Although a significant number of weak of care have relatively aspectse support, evidence-based recommen- dations regarding the acute management of sepsis and septic shock are the foundation of improved outcomes for this important group of critically ill patients.\n\nKeywords Sepsis Severe sepsis . Septic shock Sepsis syndrome. Infection  Grading of Recommendations Assessment, Development and Evaluation criteria GRADE  Guidelines. Evidence-based medicine. Surviving Sepsis Campaign : bundles Sepsis\n\naudit and feedback performance improvement initiatives. practi- guidelines will influencel bedside the healthcare that will reduce the tioner behavior t sepsis burden worldwide.\n\n### Methodology\n\nDefinitions\n\nSepsis is defined as the presence e (probable or documented) of infection together with systemic manifestations of infec- tion. Severe sepsis is defined as sepsis plus sepsis-induced organ dysfunction or tissue hypoperfusion (Tables 1, 2) [6]. Throughout this manuscript and the performance improve- ment bundles, which are included. a distinction is made or thresholds. between definitions and therapeutic targets blood Sepsis-induced hypotension is defined as a systolic pressure (SBP) <90 mmHg or mean arterial pressure (MAP) <70 mmHg or a SBP decrease >40 mmHg or less than two standard deviations below normal for age in the absence of other causes of hypotension. An example of a therapeutic target or typical threshold for the reversal of hypotension is seen in the sepsis bundles for the use of vasopressors. In the bundles, the MAP threshold is >65 mmHg. The use of defi nition versus threshold will be evident throughout this article. Septic shock is defined as sepsis-induced hypotension per- despite adequate fuid resuscitation. Sepsis-induced sisting c tissue hyp",
            "operfusion is defined as n infection-induced hypo tension, elevated lactate, or oliguria.\n\nThese clinical practice guidelines are a revision of the 2008 SSCs sepsis and guidelines for the management of severe septic shock [71. The initial SSC guidelines were published in 2004 [8] and incorporated the evidence available through the end of 2003. The 2008 publication analyzed evidence available through the end of 2007. The most current iteration is based on updated literature search incorporated into the evolving manuscript through fall 2012.\n\nThe selection of committee members was based on interest and expertise in specific aspects of sepsis. Co-chairs and the executive committee appointed e members were Society of Critical Care Medicine and European Society of Intensive Care Medicine governing bodies. Each sponsor- ing organization appointed a representative who had sepsis expertise. Additional committee members were a appointed by the co-chairs and executive committee to create conti nuity with the previous committees' membership as well as\n\nto address content needs for the development process. Fou clinicians with experience in the GRADE process applica- tion (referred to in this document as GRADE group [EBM group) took part in the Evidence-Based Medicine guidelines development with The s began guidelines development process appointment of group heads and assignment of committee to groups according to their specific expertise members Each group was responsible for drafting the initial update to the 2008 edition in their assigned area (with major additional of information incorporated into the evolving elements e manuscript through year-end 2011 and early 2012). With input from the EBM group, an initial group meet- ing was held toestablish procedures for literaturereview and development of tables for evidence analysis. Committees work via phone and the and their subgroups continued Internet. Several subsequent meetings of subgroups and key individuals occurred major 1 international meetings nominal groups). with work continuing via teleconferences and electronic-based discussions among subgroups and members of the entire committee. Ultimately, a meeting of all group heads, executive committee members, and other key committee members was held to finalize the draft doc- ument for submission to reviewers.\n\n### Search techniques\n\nA separate literature search was performed for each clearly defined question. The committee chairs worked with sub. group heads to identify pertinent search terms that were to include, at a minimum, sepsis, severe s sepsis, septic shock and sepsis syndrome crossed against the subgroup's general topic area, as well as appropriate key words of the specific question posed. All questions used in the previous s guide lines publications were searched. as were pertinent new questions generated by general topic-related searches o recent trials. The authors were specifically asked to look for existing meta-analyses related to their question and search a general database (i.e.. MEDLINE. EM. minimum of one BASE) and the [both The Cochrane Cochrane Library Database of Systematic Reviews (CDSR) and Database of Abstracts of Reviews of Effectiveness (DARE). Other databases \"P Journal Club. Evidence- were optional (A Cochrane Registry of C ontrolled Based Medicine Journal. C Clinical Trials. International Standard Randomised Con- trolled Trial Registry (http://www.controlled-trials.com isrctn/) or metaRegister of C Controlled Trials (http://www. Where appropriate, available controlled-trials.com/mrct/). evidence was summarized in the form of evidence tables. Grading of recommendations We advised the authors to follow the principles of the GRADE system to guide assessment of quality of\n\nTable 1 Diagnostic criteria for sepsis\n\n\n|    | 0                                                                                                                                                                                                                                                                  ",
            ". Recommendations from severe sepsis septic these e guidelines cannot replace the clinician's decision-\n\nblood glucose management com- mencing insulin dosing when twc consecutive blood glucose levels are >180 mg/dL, targeting an upper blood glucose <180 mg/dL (1A): equivalency of continuous venc venous hemofiltration or intermittent hemodialysis (2B): r its prophylaxis for deep vein thrombosis (1B): use of stress ulcer prophylaxis to prevent upper gastrointestinal bleeding in with bleeding risk factors patients : 1B): oral or enteral (if necessary) a feedings, as tolerated, rather thar either complete fasting or provisior of only intravenous glucose withir the first 48 h after a diagnosis of severe sepsis/septic shock (2C): and addressing goals of care, including treatment plans and end-of-life plan- ning (as appropriate) (1B), as early as feasible. but within 72 h n of intensive 唱 care unit admission (2C). Recom- of mendations specific to pediatric include: therapy with severe sepsis 1 face mask oxygen, high flow nasa cannula oxygen, or nasopharyngea continuous PEEP in the presence of respiratory distress and hypoxemia 2C), use of physical examination therapeutic er ndpoints such as capil- lary refill (2C); for septic shock associated with hypovolemia, the use lg of crystalloids or albumin to deliver a\n\nwith a capability making when he she is presented of clinical variables, Most of these patient's unique sepsis for the severe recommendations appropriate are non-ICU unit (ICU) patient in the intensive and care settings. In fact, the committee believes that the greatest be made through education outcome improvement can and change for those for severe caring e sepsis process o patients in the non-ICU setting and across the spectrum of acute care. Resource limitations in some i institutions ang physicians from countries 1 accomplishing may prevent particular recommendations. Thus, these recommenda- tions intended to committee best (the practice considers this a goal for clinical practice) and not created Sepsis standard Surviving care. The represent: Campaign (SSC) Guidelines Committee hopes that over time, particularly through education programs and formal\n\nbolus of 20 mL/kg of crystalloids (or albumin equivalent) over 5-10 min (2C); more common use of inotropes and vasodilators for low cardiac out- shock associated with put septic elevated systemic vascular resistance only 2C): and use of hydrocortisone in children with suspected or proven \"absolute\"' 'adrenal insufficiency (2C). Conclusions: Strong agree- ment existed among a large cohort of international experts regarding  many level 1 recommendations f for the best care of patients with severe sepsis. Although a significant number of weak of care have relatively aspectse support, evidence-based recommen- dations regarding the acute management of sepsis and septic shock are the foundation of improved outcomes for this important group of critically ill patients.\n\nKeywords Sepsis Severe sepsis . Septic shock Sepsis syndrome. Infection  Grading of Recommendations Assessment, Development and Evaluation criteria GRADE  Guidelines. Evidence-based medicine. Surviving Sepsis Campaign : bundles Sepsis\n\naudit and feedback performance improvement initiatives. practi- guidelines will influencel bedside the healthcare that will reduce the tioner behavior t sepsis burden worldwide.\n\n### Methodology\n\nDefinitions\n\nSepsis is defined as the presence e (probable or documented) of infection together with systemic manifestations of infec- tion. Severe sepsis is defined as sepsis plus sepsis-induced organ dysfunction or tissue hypoperfusion (Tables 1, 2) [6]. Throughout this manuscript and the performance improve- ment bundles, which are included. a distinction is made or thresholds. between definitions and therapeutic targets blood Sepsis-induced hypotension is defined as a systolic pressure (SBP) <90 mmHg or mean arterial pressure (MAP) <70 mmHg or a SBP decrease >40 mmHg or less than two standard deviations below normal for age in the absence of other causes of hypotension. An example of a therapeutic target or typical threshold for the reversal of hypotension is seen in the sepsis bundles for the use of vasopressors. In the bundles, the MAP threshold is >65 mmHg. The use of defi nition versus threshold will be evident throughout this article. Septic shock is defined as sepsis-induced hypotension per- despite adequate fuid resuscitation. Sepsis-induced sisting c tissue hyp",
            " with categori zation previouslye described (Table as adapted from Ref. 3). The this e methods for document build on a 2001 publication spon- sored by the International Sepsis Forum and use the same method of grading recommen. dations (4). The supplement submission wil include background material, questions posed that led to the recommendation, and expanded rationale. This executive summary is targeted to be concise and user friendly for the bedside clinician, The 2001 publication that was s used as a starting point for current : process included a MEDLINE search for clinical trials in the preceding 10 vrs. supplemented by manual search of other relevant journals, Sub topics for each recommendation were cross referenced to sepsis, septic sepsis, severe shock. sepsis syndrome, and infection. The Surviving Sepsis Campaign guidelines consid ered the in the 2001 evidence 1 publication (through 1999) and repeated the process for 2000 through 2003. The committee process began in June 2003 with a meeting featuring the first presentations of data and recommen dations. Recommendations discussed were and critiqued. Each clinical trial used to sup port recommendations was graded based lor the methodology in Table 1 and included pres- ence or absence of important elements such as concealed randomization, blinded outcome adjudication, intention to treat analysis, and explicit definition of primary outcome. All ar- v reviewed ticles were initially based on sub- group assignments and d typically by  two on three participants. Survival (28-30 days) was the standard outcome measure used to assess outcome benefit, and when an alternative was used this is the rationale. Where $ stated in strong trial evidence existed for outcome ben- efit in critically ill populations known to con tain a larger number of sepsis patients, these trials were considered in determination of rec ommendation grading. A strict evidence-based methodology with a scoring system was\n\nused. The goal was total consensus, which wa: reached in all recommendations except two. In those circumstances (recommendations C3 ang H1), the solution was achieved with the inclu subrecommendations that expressed some difference in expert opinion, When there difference of opinion was 1about grading clinical trial, an outside epidemiologist was con sulted This occurred in one circumstance with resolution of differences. Each participant com pleted a conflict of interest form, and individual: were not assigned to a subgroup topic if they had a potential conflict of interest. A full listing of al potential conflicts of interest is included with this article. Following that meeting. the process continued with o further refinement t of recom mendations through electronic communicatior among committee members. A second meeting of core members of the committee occurred inr early October 2003. The document was finalized and approved by the consensus committee and by sponsoring organizations in December 2003 Evidence-based anproaches more readily applied to data from therapeutic trials 1 of diagnostic techniques is less Evaluation well suited to this approach. Readers will note that the maiority of the recommendations ar nof supported by high-level evidence. Most are supported by expert opinion only. In order fo a general recommendation to carry a higher level of evidence (grades A. B. C. or D). a supporting study or studies must have shown a clinical outcome difference. Studies showing physiologic changes that could be potential sur of clinical outcome benefit were rogates e not used by themselves as pivotal studies but were used to support the validity of studies showing an outcome in a clinically important variable such as survival or length of ICU stay. A grade o A, B, or C required randomized trials. Recom mendations are graded and followed with ratio nale. References are provided to support grades A-D. In the committee's deliberations, the grad i did not establish the ing of a recommendation level of priority or importance of a specific in tervention, only the degree of literature support Pediatric considerations are provided at the end of the document for aspects of management that differ from 1adults. Recommendations are grouped by category and not by hierarchy\n\n### A. Initial Resuscitation\n\n1. The resuscitation of a patient in severe sepsis or sepsis-induced tissuel hypoperfu lactic acidosis sion (hypotension or should begin as soon as the syndrome is should be not and delayed recognized pending ICU admission. An elevated se- concentration identifies tis- lactate rum sue hypoperfusion in patients at risk who are not hypotensive. During the first 6 hrs the goals of initial resus- of resuscitation, t citation of sepsis-induced hypoperfusion should include all of the following as one part of a treatment protocol:\n\nCentral venous pressure: 8-12 mm I Hg Mean arterial pressure ≥65 mm Hg Urine output ≥0.5 mL-kg .hr-1 Central venous (",
            "### Surviving Sepsis Campaign guidelines for management of severe sepsis and septic shock\n\nR. Phillip Dellinger, MD: Jean M. Carlet. MD: Henry Masur, MD: Herwig Gerlach. MD. PhD Thierry Calandra. MD: Jonathan Cohen, MD: Juan Gea-Banacloche. MD. PhD: Didier Keh. MD John C. Marshall, MD: Margaret M. Parker. MD: Graham Ramsay, MD: Janice L. Zimmerman, MD Jean-Louis Vincent. MD. PhD: Mitchell M. Levy, MD: for the Surviving Sepsis Campaign Management Guidelines Committee\n\nSponsoring Organizations: American Association of Critical-Care Nurses. American College of Chest Physicians. American College of Emergency Physicians, American Thoracic Society, Australian and New Zealand Intensive Care Society European Society of Clinical Microbiology and Infectious Diseases. European Society of Intensive Care Medicine. European Respiratory Society, International Sepsis Forum, Society of Critical Care Medicine. Surgical Infection Society\n\nsensus conference, several subsequent smaller meetings of sub- groups and key individuals, teleconferences, and electronic-based discussion among subgroups and among the entire committee. Methods: We used a modified Delphi methodology for grading recommendations. built on a 2001 publication sponsored by the International Sepsis Forum. We undertook a systematic review of the literature graded along five levels to create recommendation grades from A to E, with A being the highest grade. Pediatric considerations were provided to contrast adult and pediatric management.\n\nKey recommendations, listed by category and not by Results: K hierarchy, include early goal-directed resuscitation of the septic patient during the first 6 hrs after recognition; appropriate diagnostic studies to ascertain causative organisms before starting antibiotics: early administration of broad-spectrum antibiotic therapy: reassess ment of antibiotic therapy with microbiology and clinical data to a usual 7-10 days of antibiotic narrow coverage, when appropriate; therapy guided by clinical response; source control with attention to the method that balances risks and benefits: equivalence of crystal loid and colloid resuscitation; aggressive fluid challenge to restore mean circulating filling pressure; vasopressor preference for norepi- nephrine and dopamine; cautious use of vasopressin pending further studies: avoiding low-dose dopamine administration for renal protec- tion; consideration of dobutamine inotropic therapy in some clinical situations; avoidance of supranormal oxygen delivery as a goal of therapy; stress-dose steroid therapy for septic shock; use of recom- binant activated protein C in patients with severe sepsis and high risk\n\nfor death: with resolution of tissue hypoperfusion and in the absence of coronary artery disease or acute hemorrhage, targeting a hemoglobin of 7-9 a/dL: appropriate use of fresh frozen plasma and platelets; a low tidal volume and limitation of inspiratory plateau pressure strategy for acute lung injury and acute respiratory distress syndrome: application of ressure in acute lung a minimal amount of positive end-expiratory nr distress svndrome: a semirecumbent bed posi- iniurv/acute respiratory r tion unless contraindicated: protocols for weaning and sedation/analge sia. using either intermittent bolus sedation or continuous infusion dation with daily interruptions/lightening: avoidance of neuromuscular <150mg/dl blockers. if at all possible: maintenance of blood glucose after initial stabilization: equivalence of continuous veno-veno hemofil- tration and intermittent hemodialysis: lack of utility of bicarbonate use for pH ≥7.15: use of deep vein thrombosis/stress ulcer prophylaxis; and consideration of limitation of support where appropriate. Pediatric con- siderations included a more likely need for intubation due to low func tional residual capacity; more difficult intravenous access: fluid resus citation based on weight with 40-60 mL/kg or higher needed; decreased cardiac output and increased systemic vascular resistance as the most common hemodynamic profile; greater use of physical examination therapeutic end points: unsettled issue of high-dose steroids for therapy with aggressive of septic shock: and greater risk of hypoglycemia qlucose control. Conclusion: Evidence-based recommendations can be made re garding many aspects of the acute management of sepsis and septic shock that are hoped to translate into improved outcomes for critically ill patient. The impact of these quidelines will be formally tested and quidelines updated annually and d even more rapidly some important new knowledge becomes available. (Crit Care Med 2004:32:858-873 KEY WoRDs: sepsis; severe sepsis; septic c shock: sepsis  syndrome: infection: quidelines: evidence-"
        ],
        "ground_truth": "We used a modified Delphi methodology for grading recommendations, built on a 2001 publication sponsored by the International Sepsis Forum. We undertook a systematic review of the literature graded along five levels to create recommendation grades from A to E, with A being the highest grade.",
        "metadata": [
            {
                "filename": "Dellinger-2013-Surviving Sepsis Cam.pdf"
            },
            {
                "filename": "Dellinger-2013-Surviving Sepsis Cam.pdf"
            },
            {
                "filename": "Dellinger-2013-Surviving Sepsis Cam.pdf"
            },
            {
                "filename": "2004+SSC+严重脓毒症与脓毒性休克治疗国际指南.pdf"
            },
            {
                "filename": "2004+SSC+严重脓毒症与脓毒性休克治疗国际指南.pdf"
            }
        ],
        "evolution_type": "multi_context"
    },
    {
        "id": 63,
        "question": "How does protocolized sedation influence mechanical ventilation duration and hospital stay in sepsis patients? How does neuromuscular blockade usage impact this outcome, considering risks associated with prolonged blockade and the role of glycemic control in severe sepsis management?",
        "answer": "1. Protocolized sedation, when used in critically ill mechanically ventilated sepsis patients, has been shown to reduce the duration of mechanical ventilation and hospital stay. This is because sedation protocols often include specific titration endpoints and minimize the use of sedation, which can contribute to the shorter stays.\n\n2. The use of neuromuscular blockers (NMBAs) in septic patients is generally avoided due to the risk of prolonged neuromuscular blockade following discontinuation. If NMBAs are necessary, intermittent bolus administration or continuous infusion with train-of-four monitoring is recommended to minimize the risk and ensure reversal of the block.\n\n3. In the context of severe sepsis management, glycemic control is crucial. Maintaining blood glucose levels between 80-110 mg/dL (4.4-6.1 mmol/L) has been associated with improved survival, and a strategy that includes the enteral route for nutrition is preferred. While high glucose levels may reduce the risk of hypoglycemia, the control of blood glucose concentration appears to be more important than the amount of insulin, and frequent monitoring is necessary.\n\nThe combination of these factors can contribute to the patient's outcome by minimizing the impact of sedation and",
        "contexts": [
            "psis-induced Patients and develop increased vascular 1 permeability. Preclinical early clinical data suggest that β-adrenergic agonists may of al veolar e edema [300l. Two random- speed resorption zed clinical t trials studied the effect of B-agonists patients with ARDS [301, 3021. In o one. a comparison of aerosolized and placebo in 282 patients with albuterol ARDS. the trial stopped for futility [301l. Patients was receiving albuterol had higher heart rates on day 2, and a trend was detected toward decreased ventilator-free days off the ventilator). The rates e of death davs a alive and before g 23.0 % in the albuterol: discharge were group versus 17.7 % in placebo-treated patients. More than half of the patients enrolled in this trial hac pulmonary O1 EDS 301 nonpulmonary sepsis as the cause of the A the The use of 1 intravenous salbutamol was tested in BALTI-2 trial [302]. Three hundred twenty-six patients with ARDS, 251 of whom had pulmonary  or nonpulmo- cause. were randomized to intravenous nary sepsis salbutatmol, 15 ug/kg o of ideal body weight, or placebo with for up to 7 days. Patients t treated salbutamol hac increased 28-day mortality rates (34) vs. 23 %; RR, 1.4 95% CI. 1.03-2.08) leading to early termination of the trial [302] e specific indications, such β2-agonists have as s may the In of bronchospasm 1 and hyperkalemia. treatment absence of t the these conditions, we recommend against routine use of β-agonists, either in intravenous or aero- d form, for the treatment of patients with solized 1 sepsis induced ARDS\n\nP. Sedation, analgesia, neuromuscular blockade in sepsis 1. We recommend that either continuous or intermittent sedation be minimized in mechanically ventilated sepsis patients, targeting specific titration endpoints (grade 1B).\n\nA growing body evidence indicates that Rationale, o the use of sedatior limiting critically ill ventilated patients can reduce the duration of mechanical ventilatior and ICU and hospital lengths of stay [303-3051. While studies limiting sedation have been performed in a wide range of critically ill patients. there is little reason to assume that septic patients will not derive benefit from this approach [3051. The use of protocols for sedation is one method to limit sedation use. and a randomized controlled clinical trial found that protocolized sedatior compared with usual care reduced duration of mechanica ventilation, lengths of stay, and tracheostomy rates [3051 Avoidance of sedation  strategy. A another recen observational study of 250 critically ill patients suggests that deep sedation is common in mechanically ventilated patients [306]. A randomized. controlled clinical trial found that patients treated with intravenous morphine boluses preferentially, had significantly more davs with out ventilation. shorter stay in ICU and hospital. thar patients who received sedation (propofol and midazolam in addition to morphine 307 . However., agitated delirium was more frequently detected in the intervention group Although not specifically studied in patients with sepsis the administration of intermittent sedation, daily sedative interruption, and svstematic titration to a predefined endpoint have been demonstrated to decrease the duratior of mechanical ventilation [284. 305. 308. 3091. Patients receiving neuromuscular blocking agents (NMBAs) mus be individually assessed regarding discontinuation sedative drugs because the neuromuscular blockade must first be reversed. The use of intermittent vs, continuous methods for the delivery of il sedation in critically patients has been examined in an observational study of mechanically ventilated patients that showed that patient: receiving t continuous sedation had signiticantly longe: durations of mechanical ventilation and ICU and hospita lengths of stay 310 Clinical daily interruption trials have evaluated c continuous sedative infusions. A prospective. randomized controlled trial in 128  mechanically ventilated adults receiving continuous intravenous sedation demonstrated that a daily interruption in the continuous sedative infu sion until the patient was awake decreased the duration o. mechanical ventilation 1 and ICU length of stay 310] Although the patients e did receive  continuous sedative infusions in this study, the daily interruption and awak ening allowed for titration of sedation, in e effect making the dosing intermittent. In addition, a paired spontaneous awakening trial combined with a spontaneous breathing trial decreased the duration of mechanical ventilation length of ICU and hospital stay, and 1-year mortality 284 .",
            " More recently, a multicenter randomized tria compared protocolized sedation i with protocolized seda tion plus daily sedation interruption in 423 critically il and mechanically ventilated medica surgical patients in  no differences duration of [3111. There were\n\nmechanical ventilation or lengths of 1 the stay between groups; and daily interruption was associated with higher daily opioid and benzodiazepines doses, as well as higher workload. Additionally. a randomized prospective nurse blinded c observational study demonstrated that although myocardial ischemia is common in critically ill ventilated patients, daily sedative interruption is not associated with an increased e myocardial ischemia 1[312]. occurrence physical rehabili- Regardless of sedation approach, early1 tation should be a goal [313]. 2. We recommend that NMBAs be avoided if possiblei of e to the risk the septic patient without ARDS due discon- neuromuscular blockade following prolonged 1 tinuation. If] be maintained, either NMBAs must\n\ntation should be a goal [313]. 2. We recommend that NMBAs be avoided if possible in of patient without ARDS due to the risk the septic neuromuscular blockade following discon- prolonged be tinuation. If NMBAs must either maintained, intermittent bolus as required or continuous infusion with train-of-four monitoring of the depth of blockade should be used (grade 1C). 3. We an NMBA (<48 h) for course of short suggest early, sepsis-induced ARDS a patients with and PaO2/ 2C). FIO2<150 mm Hg (grade\n\nRationale. Although NMBAs are often administered to critically ill patients, their role in the ICUis not well defined evidence exists that neuromuscular blockade in this patient population reduces mortality or major morbidity. In o studies have been published that specifically addition. no address the use of NMBAs in septic patients The most common indication for NMBA use in the ICU is to facilitate mechanical ventilation [3141. When appropriately used, these agents may improve chest wall and compliance. prevent respirator dyssynchrony, reduce peak airway pressures [3151. Muscle paralysis ma: also reduce oxvgen consumption by decreasing the work muscle blood flow [3161 of breathing a and respiratory However, a randomized. placebo-controlled clinical trial in patients with severe sepsis demonstrated that oxygen delivery, oxygen consumption, and gastric intramucosa improved during deep neuromuscular blockade [317] of continuous A recent randomized clinical trial in patients with early ARDS infusions of cisatracurium and a PaO-/FiO2 <150 mm Hg showed improved adjus- ted survival and organ failure-free rates more davs without in t an increased risk CU-acquired weakness placebo-treated 318 . The compared with patients a high fixed dose of e investigators used cisatracurium without train-of-four monitoring, and half of the patients ose of in the placebo group received at least a single  NMBA. Whether another NMBA would have similar of the effects is unknown. Although patients many enrolled into this trial appeared to meet sepsis o criteria., it is not clear whether similar results would occur in sepsis GRADEpro of Evidence T Table patients. A Summary in ARDS appears in Supple- of NMBA regarding use mental Digital Content 5.\n\nAn association between NMBA use and myopathies and neuropathies has been suggested by case studies and observational studies in the critical prospective y which population [315, 319-322]. but the mechanisms by NMBAs I produce or contribute to mvopathies and neur- opathiesi in these patients are unknown, Although specific to the studies are septic patient population, it clinically prudent, based on existing knowledge seems that NMBAs not be administered unless there is. a clear indication for neuromuscular blockade that cannot safely achieved with appropriate sedation and analgesia [315]. Only one prospective RCT has compared peripheral nerve stimulation and standard clinical assessment in ICU patients [323]. Rudis et al. randomized 77 critically ill CU patients requiring neuromuscular blockade to receive dosing of vecuronium based on train-of-four stimulation clinical assessment (control group). The peripheral nerve stimulation group received less drug and recovered neuromuscular function and spontaneous ventilation fas- ter than the control group. Nonrandomized observationa studies have suggested that peripheral nerve monitoring effect clinical recovery from reduces or has no in the ICU [324, 325] NMBAs Benefits to neuromuscular monitoring, including faster recovery of neuromuscular function and shorter intuba- tion times, appear to exist. A A potential for cost savings reduced total dose of NMBAs and shorter intub",
